2022-09-12 23:16:21,忧郁的台湾乌龟,infp成长史,5,力荐,39,0.9859108458988416
2022-10-09 01:49:21,巫,怎么说呢，在里面隐隐感到了一种让我很恶心的东西：比如过渡时期经理看起来像个没受过教育的而且要很mean，比如裁员还能收获爱情，比如小人物最后有这样的高光，这些都离真实世界十万八千里，是另一种形式的chun药。让我觉得，生活都这么难了，我们粉饰我们的梦也就罢了，竟然还要粉饰血淋淋的现实，这让我无法接受。,3,还行,52,0.9999998273120562
2022-10-15 13:36:27,胡巴胡巴,我也幻想过《LIFE》最后一期的封面究竟有多美。看过火山喷发，攀登过喜马拉雅，在冰岛玩过滑板，在海里打过鲨鱼，还能有多美妙的风景。最后发现最美的是那个认真工作，奉献自己的你。,4,推荐,167,0.9999999591217108
2022-10-23 21:42:25,面片and七化,在看这部电影的过程中问了自己一个问题，我是从什么时候开始失去了对生活的热情。,5,力荐,30,0.9941196457138634
2022-11-25 23:56:18,啤老师,很老套的一个公路片，可是在这样一个日子我看得很开心，最后忍不住哭了~,4,推荐,4,0.9852063755825434
2023-01-04 00:34:41,猫咪军团,滑板冲刺那段真是帅炸了！让人向往的冰岛和美丽的风景！那个做着白日梦的人，却努力完成了这么极限的任务…最后一期的封面让人热泪盈眶,5,力荐,29,0.9999889373540648
2023-01-22 19:50:11,布浥薇斓,庸碌生活中的无名之辈，也配拥有白日梦想和高光一刻。他们本身就被爱所包围，有被搁置的兴趣爱好，有被赏识的专业特长，仅仅需要去启动勇气。,5,力荐,19,0.9999479856133464
2023-01-27 16:50:15,克雷貝爾,"沃特在看到以自己為封面的期刊時，沒有立刻付錢買下來收集。或許他不會再買了。因為他已經實現了自己的白日夢，鬥過鯊魚，逃過火山噴發，爬過雪山。他已經知道了生活的真諦。
“開拓視野，沖破艱險，洞悉所有，貼近生活，尋找真愛，感受彼此。”
他冒險回來之後，做白日夢的次數變少了，他開始貼近真實的生活，去和領導說曾經不敢說的話，和謝莉爾真誠得交流。他已經完成了蛻變，開始做腳踏實地的白日夢了。
“無論這里發生過多少腥風血雨，今天的我們也只能閑庭信步了。”
我們或許應該有面對真實的魄力，無論是追求遠方，還是專註於眼前，最重要的是去感受真實的生活，善待身邊的人。如果有夢，就去腳踏實地地追，把期盼變成行動。這才是生活。",5,力荐,41,9.57325299588696e-07
2023-07-02 23:06:28,阿吉,封面一出来眼泪就下来了，那是沃尔特作为籍籍无名的底层员工在工作时闪闪发光的样子，和他手中的照片一样闪光。,3,还行,61,0.9999936074053084
2023-07-07 10:29:43,藏在星辰之间,寻找自己的25号底片🎞️,4,推荐,26,0.792073552790932
2023-07-12 22:23:00,😄+💧=😅,不得不说豆瓣top250，水货真多，看了一下imdb评分才7.3，这才是真实的评分,3,还行,23,0.211109578560785
2023-07-12 22:23:00,😄+💧=😅,不得不说豆瓣top250，水货真多，看了一下imdb评分才7.3，这才是真实的评分,3,还行,23,0.211109578560785
2023-09-01 00:09:45,顾靳,没想到居然有这么无聊的公路片，而且怎么感觉有点像宅男的意淫爽文，特别是最后底片揭晓的那段，简直幻视在喜欢的人面前装了一波大逼的普男翻身打脸流，路明非看了都觉得诺诺在全班同学面前用迈巴赫接他的逼格太低,3,还行,49,0.4675365287176573
2023-11-02 12:31:03,谁高,真正美丽的东西从不刻意求关注。,3,还行,27,0.9926635270300228
2023-11-18 21:53:20,乃木坂少年,视野越多，幻想越少,4,推荐,42,0.9982663096015606
2024-01-15 20:30:40,电影中的骑行者,全程倒没什么感觉，但最后一刻瞬间想哭,4,推荐,23,0.9522102037373988
