2013-12-24 20:57:54,小晨,故事本身并没有亮点，Ben Stiller投机取巧，完全靠风景和Life杂志的精神遗产这一概念拉感情票。冰岛的风景在这部电影里就是花瓶的角色，一种被知识分子睡了还不能抗议的感觉。 角色过于自我中心，格陵兰、冰岛、喜马拉雅投影出的异国风情被利用了而已。另外格陵兰和喜马拉雅的部分都是冰岛取景。,3,还行,38,0.9999999976651236
2013-12-26 13:37:59,亵渎电影,本来是年度最期待，因为之前谈过一个类似的剧本，一个摄影师因为一个遗愿走遍世界各地，亲情一丝一缕的被维系，眼里是一片大陆的变迁。这片子的创意差不多，只是执行力太差，情节都是好莱坞这类电影中被用烂的陈词滥调，幸好还有剧本的那点想象力，主流的美式价值观注定也只能是心灵鸡汤了。★★★,3,还行,354,0.9999999996040294
2013-12-27 13:24:09,五色全味,動人的風景，尤其在大銀幕領略wide shot。世界真大，人真小,4,推荐,6,0.9867357914986856
2013-12-27 16:42:34,岛上的夏奈,"Stop Dreaming,Start Living. 电影院上映第二天就去看，看完只想说： Ben Stiller你这么帅，你妈知道吗？",5,力荐,6,0.7318654049597075
2013-12-29 16:59:38,焚紙樓,「環繞半個地球才學到的收穫就藏在家裡的錢包，只是你沒注意罷了。」一巴掌打爛所有自以為尋夢的造作人。,2,较差,86,4.8351202244889535e-05
2013-12-29 20:52:53,皮革业,Ben Stiller越来越小清新，这部已经开始治愈系了，背景竟然是传统媒体转型。 在影院里第一次听Space Oddity，大感动，加一颗星。,4,推荐,33,0.9944750644650991
2014-01-06 23:28:08,==,其实早就想到25号底片大概是什么了。预告片准确给到了全片精华，正片反而是收着来的，西恩·潘的点睛之笔看到热泪盈眶，可以说Ben作为导演不够商业甚至专业，但本片对生活本质的触碰却异常深刻，况且风景和原声也值回票价了……stop dreaming，start living，喊口号的有很多，能真正做到的又有多少呢,5,力荐,1951,0.9998878577263768
2014-01-07 23:44:33,憨大仁,是时候让梦想照进现实了,5,力荐,1299,0.8935360253326919
2014-01-12 13:39:22,lowdive,三星半。配乐和摄影很棒。多半颗给肖恩.潘的那句“Beautiful things do not ask for attentions”，与所有喜欢摄影的人共勉。,5,力荐,119,0.9991784104906796
2014-01-13 19:09:54,蜉蝣,全部都是陈旧伎俩超无聊。Ben Stiller是少数让我专注的讨厌了很多年的演员，没有为什么。,2,较差,8,0.9893587410994488
2014-01-13 22:22:07,私享史,"歌曲和原声俱佳，片头字幕有趣。特别喜欢肖恩潘的那句台词：“Sometimes I don't. If I like a moment, for me, personally, I don't like to have the distraction of the camera. I just want to stay in it.”送给所有在博物馆里只顾着拿长枪短炮咔嚓咔嚓而忘了用自己的眼睛去欣赏的人【UA太古城】",4,推荐,716,0.1656987900640153
2014-01-14 15:46:19,陈低调,意淫王，面瘫王。。。,2,较差,21,0.9035520433405396
2014-01-14 21:09:32,荔枝超人,不是心灵鸡汤，是我等老男人非常受用的心灵老鸭汤。,4,推荐,3402,0.9988938046840752
2014-01-15 23:27:23,Indecent time,治愈老鸭汤，在我们忙于事业等等看上去很重要的东西的时候，还记不记得心里有过一片属于自己的白日梦乐土？寻找遗失的底片的过程也是寻找遗失的美好的过程，看完全片好像听老朋友娓娓道来了一个平淡却动人的故事，看完也明白地心引力，少年派为什么要减少剧情，因为人生没有那么多drama，韦格好美！,4,推荐,296,0.9999999999999862
2014-01-19 00:35:48,仙剑风晨,在片中《LIFE》杂志闭刊号封面出现的那一刻，我完全被击穿了。,4,推荐,9636,0.9275793405697308
2014-01-25 22:12:13,我是大皮哥,喜剧片中将大自然风景拍得最美的、风景片中拍得最富喜剧感的、会拍风景的喜剧片中配乐最燃最激昂的、风景好配乐佳的喜剧片中预告片剪得最热血沸腾的。自导自演的本·斯蒂勒交出了一份令人满意的答卷，用标志性的冷面滑稽演绎了一部献给所有有过白日梦的观众的心灵鸡汤。Stop Dreaming & Start Living,4,推荐,3041,0.9999999999934216
2014-01-31 17:17:39,Ying,Remind me of a lot of beautiful things I haven't done... Thank you.,5,力荐,42,0.1352341326495507
2014-02-02 15:21:48,张小北,每个人都想突破自己的平淡生活，成就不凡冒险。不是每个人都有机会完成生命中的精彩，但有一种电影能让我们有那么片刻的怅然所失。,4,推荐,1129,0.9999998501246744
2014-02-06 22:34:15,喻鸣,平时特反感旅行鸡汤和心灵鸡汤，一放到电影里却非常受用。旅行和做梦虽然不能直接解决生活难题，却给予我们直面它的心情与勇气。就像微博鸡汤说的：不去旅行不去冒险不去尝试没试过的生活， 只每天挂QQ刷微博逛淘宝， 干着80岁都能做的事…要青春有毛用。故事有活力，歌曲好听。,4,推荐,82,0.9999996356979978
2014-02-09 21:31:31,握不住的灵魂,这部电影对我的影响已经超过电影本身内容了，而且是在没看之前。『開拓視野，看見世界，貼近彼此，感受生活，這就是生活的目的』,5,力荐,159,0.9995947160613216
2014-02-15 22:14:24,欢乐分裂,原声动听，风景优美，励志不流俗，虽拍得无甚大深意、大新意，但看得赏心悦目，白日梦想真是件奢侈的事~,4,推荐,11,0.9997617618651444
2014-02-22 15:06:36,艾小柯,虽然还是太过罐头励志，缺乏细节，不少片段还是优美感人的。,3,还行,85,0.9988094289266748
2014-03-22 14:07:13,Panda的影音,献给那些在生活中渴望一场“说走就走的旅行”却总是因为各种原因无法实现的朋友们。那些美丽的景色在美妙的音乐的衬托下，是如此让人陶醉，仿佛是人间仙境。于我，最喜欢也觉得最好看的或许就是那些天马行空的白日梦了，可惜心灵鸡汤似的故事于我不甚有趣，倒是那些文字特别的出现发现让我眼前一亮。,4,推荐,8,0.9999999999995292
2014-03-23 19:07:43,Ocap,本叔在烂仔帮积蓄多年的能量爆发了。无数亮点十足的广角镜头，配上春风化雨的励志配乐，真有点理查德·柯蒂斯的影子。片子并没有摆脱心灵鸡汤的框架，但仍能把那些无病呻吟的治愈系甩开十万条街。是的，只有跃过墨守成规的生活，你那多不胜数的意淫才会焕发触手可及的光彩。,4,推荐,13,0.9999964620923484
2014-03-26 06:16:16,桃桃林林,还是前部分更有趣，大玩脑内小剧场，估计很多爱做白日梦的人都有这种体验吧。不过这个主题最终转向了必须走出去，just do it这种。世界风景无限好，宅男啥也干不了。太鸡汤，也太浅了,3,还行,1217,0.999396031921417
2014-04-01 00:22:49,头就这么疼星人,"i know what you want to say, mr. stiller, o i really do, as someone's also closing to middle age and someone who still believes(wink wink).",3,还行,9,0.0230845298901337
2014-04-02 17:03:46,CharlesChou,一个巨长的尼康相机广告，风景无限好，视效无限好，原声无限好，但就像漂亮的旅行手记，读了再多也不是你的。何况对于旅行的定义有点功利了。和Frances Ha真是小清新深度定制下理想照进现实的两种极端啊，家长和孩子一人一部看着好极了。【Adam Scott这个小坏蛋好萌啊嘤嘤嘤,3,还行,12,0.9999999999843814
2014-04-04 17:16:49,徐若风,心灵鸡汤式风光喜剧。不知道为什么很感动却又想给低分...,3,还行,64,0.986637468133775
2014-04-05 17:07:06,苏乏,牛逼到爆的预告必然迎来其实一般的正片，故事跟我预想的有些差别，单一的表现手法到后来干脆讲别的去了，即便如此仍旧是很有诚意的，很年轻一部影片。,4,推荐,2,0.9410458022407162
2014-04-06 12:56:19,麻绳,好无聊好矫情的心灵鸡汤电影啊，剧情和人物从头到尾都说服不了我。,2,较差,44,0.9755224765161112
2014-04-07 10:47:09,汽车大师,白日梦电影，适合截图,3,还行,71,0.8685491968723108
2014-04-07 21:22:45,方枪枪,为了自己的生活而敢于坚持的人都是勇敢的。,3,还行,5,0.983226950152516
2014-04-08 12:14:57,乌鸦火堂,三星半，本斯蒂勒告诉我们，屌丝梦想那么远又这么近。电影描写正是小人物的白日梦状态，真实又搞笑，故事发展有些过于教科书式励志，但结尾足够震撼。“发现”是电影主题，很贴切，把一个说教的故事拍得不说教，这是优点,5,力荐,24,0.9999999666862972
2014-04-09 12:57:00,Mamula,"喜剧班子(Adam)加一星，原以为Stiller会拍出深刻转型之作，结果最后像是在说wanna have a life, the courage to diss your boss and the girl of your dreams? Go backpacking...谁没想过环游世界，但看世界和生活本身并无关系，不过我仍想去冰岛看火山，去挪威看峡湾，为一刻的惊异和自找的身体的痛苦",4,推荐,4,0.9999993290285542
2014-04-09 21:11:03,同志亦凡人中文站,只能看看风景，其他...就没有其他了。白日梦是噱头，到后面连噱头都省了！呸！,3,还行,187,0.8874348773978141
2014-04-10 00:20:43,黄青蕉,有没有十颗星可以给！本斯蒂勒都成精了，Space Oddity那段不知道为什么看一次哭一次，可能是卢瑟的脑波正好对上了的关系吧,5,力荐,770,0.9940420463910808
2014-04-11 23:42:56,A-sun*,好好看！电影从表面上来看，是对纸媒文化的衰败默哀，实则却是悼念着正在消失的记者精神。为了拍火山爆发而把双脚绑在飞机翼，为了拍雪豹而在雪山装成一块岩石…这些都是不复再的记者精神。年度五星推荐😭😭😭,5,力荐,1401,0.9999985922702196
2014-04-13 16:14:33,Granite_花花,原声好听，摄影很美，配上心灵鸡汤的故事，让人轻松自在。PS：本斯蒂勒的蓝眼睛好显眼~,4,推荐,4,0.9999947672467444
2014-04-13 23:37:41,Lycidas,"If I like a moment, I don't like to have the distraction of the camera. Just want to stay in it. 美的事物并不寻求关注。雪豹出现和Life Aquatic里所有人屏息注视豹纹鲨的感觉如出一辙。Space Oddity加分加到满！",5,力荐,24,0.0539832113805949
2014-04-21 19:57:05,心生,追梦需要动机，重要的还是过程，因为即便追到了，也有可能觉得“不过如此”。很棒的片子，荒诞离奇，又舒服温暖。音乐太赞！,4,推荐,8,0.9999928019174148
2014-04-22 11:21:38,CyberKnight电子骑士,很精致有趣的心灵鸡汤，尽管情节无甚新意，看起来还是很舒服的。有些小细节处理得很好；封面照片这个梗一直推动着故事发展，很吸引人；风景非常漂亮，蓝光版绝对是示范级的画质！好莱坞这样纯熟的制造能力还是很令人佩服的，如果国内一年能出三五部这样品质的鸡汤电影就很好啦。,4,推荐,12,0.9999999999992372
2014-04-25 15:33:33,陈哈,美好从来不主动寻求关注。,5,力荐,3390,0.9911322693378052
2014-04-26 23:53:02,SydneyCarton,这片简直是为豆瓣er订制的……,3,还行,72,0.3964808038428521
2014-05-01 09:02:36,自由极光,在香港看的，跟一个很喜欢的人，现在想起这个片子就很幸福。,5,力荐,1151,0.9995613067295362
2014-06-10 10:59:01,刘小黛,白日梦终是清柯一梦，拍成了旅游风光励志宣传片。,3,还行,3,0.6185380716293617
2014-06-17 23:43:35,囧叔,“I don have a wallet” 这种偷懒的台词写法来引出要描述的东西，片子里还有一些。实在牵强。比如刚好有个少年换滑板给他，好让他秀速降。@黄青蕉 老师说好的不推文艺片呢,3,还行,5,0.969891535738481
2014-06-19 01:23:54,shininglove,一碗标准的美式连锁快餐店心灵鸡汤，喝下去抵过五十个仁波切。缺乏生鲜口感，但却可迅速果腹。,3,还行,60,0.9921816869707862
2014-06-28 19:16:51,福娃迎迎,如果你见过格陵兰，喜马拉雅和冰岛的火山，就再不会被生活打败。,4,推荐,5591,0.9961145876049308
2014-07-01 21:04:48,巴喆,取悦众人难免刻意，独享是真的自在。西恩潘观看雪豹的时候，本斯蒂勒问他说为什么不拍？他说：“总有那么一个时刻，想自己去享受。不需要讲给谁，不需要观众，甚至不需要记录下来。就享受那一刻。”喜欢片中的风景。7.7,4,推荐,10,0.9999979236448188
2014-07-05 04:08:16,fomalhaut,本片其实讲的是一个胶片摄影师和底片处理师之间深厚的基情。,5,力荐,379,0.97750324432105
2014-07-28 22:28:40,张维托,看完想去冰岛玩滑板,4,推荐,933,0.7922614426153096
2014-07-28 23:48:11,余小岛,旅行宣传片吧。。等你自己出门了就知道根本不可能这么一帆风顺。。,3,还行,25,0.1592490279629299
2014-08-05 21:37:21,朝暮雪,梦想家是谁？林志颖吗？2014.8.5克拉斯诺亚尔斯克,4,推荐,45,0.9373419191270628
2014-08-15 00:55:01,恶魔的步调,现实与幻想转场一瞬间联想到今 敏,5,力荐,92,0.9991004044855124
2014-09-05 16:13:06,JulyChan,致所有生活的不如意者：我们靠白日梦借渡的只是挫败，脑洞里一千个绚烂的现在，也许都不如一个真实的千里之外。,5,力荐,13,0.9999256225361584
2014-09-16 23:39:32,内陆飞鱼,《白日梦想家》下了一直没动，今晚点开就停不下来了，原来这么好玩，傻乎乎，浪漫漫，具有公路电影痕迹的轻松小品，心态非常好，音乐美、风光美，越看越舒服，最喜冰岛那一段，爱看《科学睡眠》《大鱼》这类电影的人，都去看吧。啥时候我们才能拍出这种毫无心机，脑力激荡，纯玩纯幻想的片子。,4,推荐,191,0.999999999980968
2014-10-24 00:25:22,汪金卫,好莱坞心灵鸡汤片。感觉几个白日梦的桥段还不够YY不够癫狂。应该加大分量猜对。而且最终抛弃了白日梦。亮点都集中在配乐和摄影上了。剧本比较俗套，而且没把故事编圆。整体尚可一看,5,力荐,5,0.9999737875227092
2014-11-02 18:17:04,影志,“认识世界，克服困难。洞悉所有，贴近生活。寻找真爱，感受彼此。这就是生活的意义”、“美好的东西从来不会寻求关注”上一部本·斯蒂勒自导自演还是08年《热带惊雷》，没想这部竟来了个如此大的转变与惊喜，走走停停，简单生活。“如果我很喜欢某个瞬间，只想享受在那一刻。Stay in it. Right here”,4,推荐,1647,0.99999999999621
2014-11-10 23:33:45,方方土君,Beautiful things do not ask for attentions.  献给那些，成就伟大瞬间背后的每一个人。迄今为止，看过在摄影取景上最严谨的两部片子，一是《国王的演讲》，再就是这部《白日梦想家》。每一贞的镜头，单独截下来，都可以做标准的摄影示范！本斯蒂勒，这个逗比，没想到了做了导演竟然功力如此了得！,4,推荐,53,0.999999998582512
2014-11-21 21:42:43,杨迪,最近烂生活的阳光，相信生活相信勇气，爱这部！！！,5,力荐,135,0.9780639682075728
2014-12-20 01:59:48,翻滚吧！蛋堡,美国版《等风来》,3,还行,7,0.7850741650202051
2014-12-27 21:42:12,信心不逆熊先生,本片讲述了旅行和冒险的意义在于打发庸俗和乏味的中产阶级的生活，还有吸引异性和让自己的简历更好看。不过这个电影拍得非常美，很适合寒冷的夜里配合一杯热茶，想着该死的小心事。,3,还行,26,0.9995727516461274
2015-01-10 21:55:35,巴伐利亞酒神,给这片子挑毛病的话，那真是没法挑。因为到处是窟窿，到处都是硬伤，到处都是现实中几乎不可能发生的事情。但还是打五星因为喜欢啊，因为这就是表达内心任性的时刻嘛！画面好看，音乐好听，而且燃啊！真他妈的燃！PS：电影中出现的格陵兰冰岛喜马拉雅山竟然都是在冰岛取景的。,5,力荐,656,0.9999501858852228
2015-02-01 15:59:40,Sophie  Z,我猜到了杂志封面。【男主好像Seth Meyers啊分分钟走神。。。,4,推荐,4,0.4738321281775504
2015-02-03 12:33:25,Su,Beautiful thing don't ask for attraction.,4,推荐,54,0.4476784585098667
2015-02-26 23:36:23,奇拉,"TO SEE THE WORLD, THINGS DANGEROUS TO COME TO, TO SEE BEHIND WALLS, TO DRAW CLOSER, TO FIND EACH OTHER AND TO FEEL. THAT IS THE PURPOSE OF LIFE. 太燃了！！！！！",5,力荐,14,0.0059389420814586
2015-06-07 20:13:09,Chain,去还是不去的时候选去。,3,还行,15,0.4509585150939268
2015-08-29 19:05:19,荞麦,画面很美，虽然是一部鸡汤片，但因为致敬《生活》杂志，导致最后差点哭出来……啊，伟大的杂志结束了，一个美好时代结束了。,4,推荐,37,0.9999507432317336
2015-12-30 20:28:49,如小果,啊!结尾真的很get啊！,3,还行,5,0.9679313453009376
2016-01-17 19:25:16,撒旦的表妹,1月看到的最好的一部电影！其实不喜欢前半部分经常脱线的Walter，但是从他坐上飞机开始精彩值瞬间爆表！冰岛的景色美醉我！配乐赞的没谁了！25号底片又太煽情！💯,5,力荐,62,0.988306988127182
2016-02-15 06:49:57,铎奇,"boring shit. couldn't stand it and had to skip to the last minute after 10 minutes, and guess what, the ""last minute"" was boring as hell, too.",2,较差,76,0.1219526984746537
2016-02-24 11:51:07,车瑞茜,"被结尾那张照片击中泪目.. 这个故事对我更多的感触是, 更加赞同人生的意义在于走出去.. 路上发生的一切就好像一颗颗闪亮的星星, 再回首的时候会发现不知不觉的竟收集了漫天的繁星..",4,推荐,24,0.9997047137471666
2016-02-29 11:33:01,薇羅尼卡,处于低谷期需要强力鸡汤进补，但其实这个片子并不是鸡汤也没那么励志。倒是男主角的脑洞时常让我会心一笑，B站里面大家讨论的时候也都说，丫绝逼是个双鱼座吧~！哈哈哈，是的，脑洞让我们的生活变得有趣，有时也会陷入癫狂，accept and holding on~,4,推荐,7,0.9999994812469396
2016-08-20 22:50:31,希尼莫,20分钟，照片底片没了。随后各种满世界找，风景好棒，梦做的好好，路程坎坷…到了1小时20分，找到了。然后缓了30分钟，结束了…咱不带这么编剧的无聊的强加的做作的…,1,很差,60,0.811617136332964
2016-10-03 01:13:59,大島,只想要no25的原片,5,力荐,123,0.4161555759499014
2017-01-11 21:58:16,赫恩曼尼,"加缪说：“人生的意义，在于承担人生无意义的勇气。如果你一直在找人生的意义，你永远不会生活。”自勉。To see the world, things dangerous to come to. To see behind walls, to draw closer. To find each other and to feel. That is the purpose of life.",5,力荐,5916,0.999406050211028
2017-02-06 11:15:32,曼仔,看不到西恩潘出场就受不了了。。。鸡汤味儿重到我实在坚持不下去了 迄今为止 唯一一部鸡汤无比我还觉得可看的大概就是欧维去死那部了,2,较差,5,0.6415648031990971
2017-04-05 14:36:47,素年锦时,老男人也有梦想的春天。给力,4,推荐,10,0.9948293732658232
2017-04-27 22:02:07,小枫,全程几乎都是强逼着自己往下看，对于一部电影而言这种观影体验首先就输了。对男主完全喜欢不起来，因为父亲去世直接从莫西干男孩变成一个颓丧傻逼的中年人，这种诠释比海边的曼彻斯特不知差到十万八千里去了。所有白日梦的低幼剧情我都是快进的，实在看不下去。p.s.豆瓣星评都是屁~,4,推荐,18,0.9999857366360556
2017-09-12 01:36:09,晚不安,电影是造梦的机器——本·斯蒂勒深谙这句格言的精髓。是否每个优秀的喜剧演员都底色悲凉？景色、插曲、梦境，一切都恰到好处。它要讲的并不是“世界这么大，我想去看看”，而是“一个男人要走过多少路，才可以称他为男人”。它也无关中年危机、人生失意的救赎，只是一个耽于幻想的男人认识自我的旅途。,5,力荐,11,0.9999999999999964
2017-11-29 16:20:03,诸葛若见,白日梦爱好者经常的脑内小剧场,3,还行,6,0.6858932789024644
2018-02-14 18:48:25,思路乐,【B+】男主在冰岛玩滑板那一段的摄影、配乐和创意实在是太美太酷太炫了！！！喜剧片里最美的励志音乐片！！！,4,推荐,9,0.9976707322007964
2018-12-19 01:48:28,林西拿,老師叫我看。突然發覺，文化產品正在悄無聲息地塑造我們的人格。譬如這樣的電影看多了，你就會以為，自己是生活的主角，做什麼事情都是合理的。,4,推荐,10,0.0015494290484016
2019-05-30 23:19:20,paradoxe,除了摄影还有啥，晕。,2,较差,8,0.7591247427387477
2020-10-25 18:52:53,不懈不戒,决定照片好坏的因素有两个，一个是按下快门的瞬间，另一个是暗室里的操作技术，后者会直接影响作品的质感。很遗憾这部电影没有把视线留在那个狭促凌乱的工作仓库，而是拍成了从一个极端奔向另一个极端的意淫式鸡汤，那些极度夸张疯狂的经历，让最后刊登于杂志封面的那张平常照片显得「黯然失色」。,2,较差,28,0.9919628700912344
2021-05-05 12:55:38,茗政,这我看睡着了，谁敢信？说不出来就是喜欢不上来，很别扭。全程关注于男主的蓝色眼睛无法自拔，简直充满着吸力。脑海里的小剧场真的也超有趣，可不知道是什么疲劳了还是怎么了，这个早就猜到结局的俗套故事加上看似有心意的剧情让我觉得这真是个无聊的毒鸡汤电影。很不喜欢,3,还行,31,0.999628579044738
2021-08-10 22:01:01,女神的秋裤,少有的可以触动心灵的电影,4,推荐,6,0.9997466981054376
2021-08-25 06:35:32,结巴,这不是一部电影，这是一个苦闷灵魂的呐喊，一颗多彩心灵的七彩折射。,5,力荐,38,0.98616828185614
2021-09-05 21:30:37,Smile、,我有个朋友，小时候我们一起打游戏，每次打的如火如荼的时候，他突然就神游了，我们总是嘲笑他说他脑子出问题了，现在我才明白，原来是他脑子里有我们看不到的美异风景。,5,力荐,140,0.9986804572797612
2021-09-12 21:05:22,板烧鸡腿堡,倏然就理解了旅行的意义，出发就是最艰难的决定。,5,力荐,34,0.9865922298698936
2021-09-14 18:12:13,柴斯卡,“纸媒消逝”这个选题是非常好的 也很有情怀  如果纯讲精品杂志作为产品的消逝 配合片中极富魅力的摄影 会很吸引我 剧情上有些难受 可能因为我不会纠结那么久 所以对男主的思维活动不太能共情 大概因为这部电影精准为喜爱玩单反、徒步、净化心灵的中年群体策划 而我还没到那个阶段吧…,5,力荐,17,0.9999999999996904
2021-10-10 14:23:26,cheer,三颗星分别给iceland风景、greenland风景和最后的封面摄影。没啥剧情，台词和表演也挺雷的，但有些画面看着赏心悦目就差不多了,3,还行,18,0.9998859240083406
2022-01-06 00:01:36,君惜凉,"男主冒险的故事只值四星，反倒是他平平无奇默默奉献了16年的底片冲洗工作被Sean和其他人认可的情节值得五星，费力找寻的25号底片其实是自己认真的模样。表面上这是中年人热血一回的鸡汤，可实际上他的靠谱坚韧足以启迪所有年轻人：低头赶路，抬头便有月光。绝大多数人都只是再努力却没有noteworthy的人，无法像superhero一样解救他人甚至拯救不了自己的生活，但是平淡之中其实蕴含了非同小可的力量。搭上Greenland的渔船前往Iceland，从直升机跳进北海与sharks搏斗，和智利人抢自行车骑去一座火山，踏上滑板在蜿蜒曲折的山路里一路向前，一天之内在艾雅法拉火山喷发旁进行17km的铁人三项，在喜马拉雅山脊上等雪豹出现与曼巴哈人踢球。任何人都享有终极浪漫on the way的权利。",5,力荐,236,0.9999999999999952
2022-02-20 06:44:51,木由,一首纸媒时代的挽歌，和一封写给幕后工作者的情书。谁还不是魂中带着远方的风，谁又不是为了五斗米而案牍劳形。人生苦短，与其整日发梦还不如活在当下，赚钱之后多多出去玩。,3,还行,24,0.9994159058369328
2022-04-02 21:38:11,有心打扰,剧情轻松，人物喜感，音乐好听，风景怡人。,3,还行,2,0.9994619255944278
2022-05-04 04:40:45,马马,有非常好的理念 但导演把故事讲得一塌糊涂 从一开始男主就没立住 一路跌跌撞撞往前走剧情 各种递枕头金手指 本来是个寻找自我的故事却没有写清男主的成长 动机撑不起行动线 男主跟肖恩明明可以做的很动人的关系也只是个给了个皮毛  期待高失望大,2,较差,14,0.9999999711428896
2022-06-28 14:00:34,楚门的世界,愿你出走多天，归来不被裁员。,5,力荐,62,0.5032853040215427
2022-06-28 22:19:26,天气预报,全给你尬完了，多加一颗星是给space oddity的,3,还行,9,0.3048759729454096
2022-06-29 18:39:22,Henry Zhu,“我不喜欢为了拍照而拍照 我只想享受那一刻”,5,力荐,90,0.9165857003614506
2022-06-30 01:59:30,淡香味的圆珠笔,为啥我不是很懂表达的什么….,4,推荐,21,0.071688271950502
2022-08-11 15:59:21,公子政,"2022年6月9日，人生再次发生重大转折。2022年8月11日，沮丧的看了《白日梦想家》。从今天起，我选红色，后会有期，立此为据！",5,力荐,24,0.4303784823132066
