2017-05-13 15:49:22,汪金卫,【中国电影资料馆展映】黑色喜剧短片集。每集的主角都在压力下释放了自我，实施了一闪而过的犯罪念头。发泄了被压抑的情绪，让看客拍手称快。即是荒诞的闹剧，也是对社会种种现象的尖锐抨击。每个短片都很喜欢，大银幕观影尤其爽快，好看！//20220702资料馆二刷。 现在重温，比起那些煽情的或主旋的，更是当今中国极其需要拍出来并被看到的电影。至少能让人在银幕上发泄心中的不快，找到宣泄的出口。每一个故事仿佛都在喊出这样一句话：如果你不给我一个说法，我就给你一个说法。,5,力荐,27,0.9999999999982768
2017-05-23 19:24:20,影随茵动,脑洞够大，除了公路相杀那个故事略压抑，其他都还好。减掉一星因为是无关联的六个故事，如果设置个内在的联系会更NB。,4,推荐,10,0.977043815291537
2017-06-21 18:22:50,皮革业,果然是各国人民喜闻乐见的故事会格局。,4,推荐,13,0.846711673733917
2017-11-24 14:28:03,米粒,整个片设定确实比较像天注定，不过拍出来效果很不一样。竟然喜欢贾科长多一些，虽然两个片子都是展示暴力而已。追车二男有点像斯皮尔伯格《决斗》的另一种发展，那车祸公子哥故事应该就是阿根廷版的《孩童姿势》了。另外港译片名“无定向丧心病狂”好像是骂人的话...,3,还行,18,0.9999917744882458
2018-02-22 16:09:36,Mr. Infamous,居然是短片集，然而每个故事都像一包爆炸糖，劈里啪啦地，炸着人心中的压抑与愤慨——那么多似曾相识或大同小异的境遇，那种邪念被贯彻后真是何其解气。虽说暴力与蛮荒，但这种幻想的爆炸宣泄，恰恰剑指了官僚主义、贪腐、歧视以及不仁不义，太赞。黑色荒诞，肆无忌惮，爽，喜欢。四星半。,5,力荐,10,0.9999999997584336
2018-04-08 22:58:52,沈十六,最后一个婚礼的故事，我只想说：我去！我去！我去！爽到爆，感觉导演太牛了！,5,力荐,12,0.5821434273862148
2020-02-01 00:32:47,连城易脆,这种荒诞黑色风格的拼盘电影确实很容易收获好评和青睐，而且确实拍得还不错，只是很容易在这6个故事里看到其他故事的一些影子，比如第一个飞机复仇让人想到《东方快车谋杀案》，第三个路怒症则联想到《无人区》，第五个顶包案又有点像《全民目击》，整体风格又类似《天注定》，但是主题上又不算太一致，就是都比较野蛮而荒诞。对人性、社会、制度等各个方面也都涉及到了一定层次的批评和讽刺，总的来说看着是有较大的趣味性的，可以满足很多人内心对于复仇、对于暴力的想象。,5,力荐,18,0.9999999999999852
2020-04-09 01:48:22,起床，吃饭,拍得很棒，就是故事没有特别出乎意料，基本都能猜到大致结局。太狠了，拉美人民真有魔幻精神。,4,推荐,31,0.9999997748653314
2020-04-19 16:15:52,小米=qdmimi,开车扣满分别组织学习了，集体看看这个片吧，人生里的每个路怒症时刻就是生死攸关的拐点啊。,5,力荐,10,0.9867271007707046
2020-04-30 02:55:20,祐宜年,新仇旧恨一并断，一捧鼠药换心宽。狭路相逢皆归去，强权之下心不乱。权贵自有脱身路，情人成仇复返欢。,4,推荐,10,0.495242575496466
2020-05-28 11:24:04,451½°F™,以私人情绪化侵犯为缘由，最后以情绪化的方式达到宣泄，「蛮荒」的意义尽在于此，不过编导的立场还是暧昧而动摇的，对于这种「原始冲动」的归宿与评价一片模糊，也只适合同样毫无立场的观众口味。,3,还行,8,0.9999987715853338
2020-07-08 00:12:51,Pincent,7。六个复仇故事，Wild Tales重点在于wild，荒诞且每个故事都有暴力元素，有恶趣味，其实也是一种比较抖机灵、尬黑的社会泄愤爽片，蛮荒可以是混沌的借口，某种意义上来说这部片受到的待遇也可以分析为近十年某类短视频走红的理由之一。摄影机挂门上好像不一定是镜头设计成熟的体现吧。《天注定》跟这个也还是有着非常大的不同。,3,还行,2,0.9999999999144256
2020-07-08 00:12:51,Pincent,7。六个复仇故事，Wild Tales重点在于wild，荒诞且每个故事都有暴力元素，有恶趣味，其实也是一种比较抖机灵、尬黑的社会泄愤爽片，蛮荒可以是混沌的借口，某种意义上来说这部片受到的待遇也可以分析为近十年某类短视频走红的理由之一。摄影机挂门上好像不一定是镜头设计成熟的体现吧。《天注定》跟这个也还是有着非常大的不同。,3,还行,2,0.9999999999144256
2020-07-13 16:54:46,猪仔君,最喜欢最后一个故事，爱情是发现真相后的歇斯底里，是一片狼藉后的互相抚慰。,5,力荐,35,0.9678641885954083
2021-08-11 22:23:35,kookbug,看得爽爆了！为什么要忍耐假装？为什么要粉饰太平？为什么要扮演文明？爆发啊！撕扯啊！杀戮啊！玉石俱焚啊！鱼死网破啊！同归于尽啊！,5,力荐,340,0.7283437447126995
2021-10-20 04:55:44,雲水,同样是黑色幽默，这才是我喜欢的调调。拉美人民多奇志，活得精彩，死得戏剧，永远选在聒噪中爆发，绝不在沉默中灭亡。,5,力荐,38,0.9999766923406423
2022-07-02 13:52:39,神仙鱼,荒诞现实，且不觉得细节有多么夸张失真。和某国相比南美已不够魔幻，但仍存有尝试反击魔鬼的精神，这个电影拍成并上映本身就是例证。而且它并不止于故事层面，多处镜头也让人印象深刻，比如最后一镜。2>6>其他，2呈现了一个小小的恶是如何可以在短时间内不断升级最终成为巨大悲剧的，结尾的处理极好嘲讽了这种行为的可笑；6在残酷里添了一笔温柔浪漫，好似破镜重圆，但最后依然明确告诉你，过去不可追，这已经不是同一条河流了。7/10.,4,推荐,3,0.9999999999291852
2022-07-02 13:52:39,神仙鱼,荒诞现实，且不觉得细节有多么夸张失真。和某国相比南美已不够魔幻，但仍存有尝试反击魔鬼的精神，这个电影拍成并上映本身就是例证。而且它并不止于故事层面，多处镜头也让人印象深刻，比如最后一镜。2>6>其他，2呈现了一个小小的恶是如何可以在短时间内不断升级最终成为巨大悲剧的，结尾的处理极好嘲讽了这种行为的可笑；6在残酷里添了一笔温柔浪漫，好似破镜重圆，但最后依然明确告诉你，过去不可追，这已经不是同一条河流了。7/10.,4,推荐,3,0.9999999999291852
2022-12-03 15:55:32,偷南瓜的兔子,救命 这样的婚礼真的值回票价好吗,5,力荐,31,0.9810166410599628
