2010-11-27 00:54:12,于少,牛着逼！,5,力荐,3176,0.6923786120385603
2010-12-04 22:41:02,李咬金,我就不感冒！,1,很差,2194,0.1974993230332046
2010-12-05 01:10:40,猪头小队长,仍然有浪漫的想象、癫狂的审美、极致的表演，然而姜文这次说，他要让所有人都看懂，于是他不放过对任何细枝末节的解释。当彪悍的人生开始解释，所以，情怀没了，诗意没了，理所当然。难道所有导演的审美都要假装去迎合观众而连带着水准一起拉低？好吧，那市场胜利了，这下子都能看懂，都能笑了。,3,还行,1651,0.9997549789563928
2010-12-05 23:35:35,赵静静赵,什么都有，让票房在笑声中再飞一会儿吧，很黄很暴力，很妙很有瘾。,5,力荐,16,0.9974483177649164
2010-12-06 23:49:30,剑悬秋水,如果豆瓣能打六星，一定给！ ,4,推荐,15,0.807290542449936
2010-12-07 00:29:16,暗淡整个宇宙,近年来最有男人味的一部电影，节奏流畅，风格鲜明。姜文的英雄主义情结发挥到极致。,5,力荐,131,0.9999946580331358
2010-12-07 00:50:18,原来是西门大嫂,承认爆米花式的好看不行么？别分析政治隐喻了不如去分析下百年孤独更给力。这次是冯小刚式的姜文，不是国产大师不是救世主，他是凡客。。。,4,推荐,4500,0.9999984692429053
2010-12-07 01:21:51,cindy,今天看了香港的首映　好看極了！！！！,5,力荐,7,0.8897444041597751
2010-12-07 10:39:48,阿德,虽然定位是商业片，但骨子里仍透露着姜文的作者印记。不是姜文最好的作品，但绝对是今年最好看的国产片，没有之一！,4,推荐,16,0.9990765381414372
2010-12-07 16:14:37,deedee,节奏紧凑 台词机智幽默 包袱百出 起初以为是个英雄主义大片 没想搞笑贯穿始终 演员表演精准 画面唯美 动作打斗爆破都很精彩 竟然还有意外的情色戏 只是剧情没有多大推敲 但不妨碍完整性,5,力荐,5,0.9999999998316056
2010-12-08 13:48:45,Meow_Su,根本不够格叫电影，就是一长篇相声。啥人物啊啥情感啊，啥都没。不过还可乐点。,2,较差,525,0.9698749374914852
2010-12-09 00:02:19,网络流,@大光明。新意满分！笑点满分！镜头满分！台词满分！ 每一分钟都是高潮！ ,5,力荐,3,0.9998734710973698
2010-12-09 08:12:06,AG,"鸡血片,因为有姜文个优高级很多.但我一向不爱看发哥的喜剧表演,它这次戏份太多
",3,还行,41,0.9994676743301896
2010-12-10 12:23:32,tiankerr,以这种年代为背景拍片子就是最大的失败！！那些声响音效都没有了依归。这么烂的时代根本不值得大片去描写。前些日子也这样的烂片题材。,1,很差,136,0.9150017415047011
2010-12-16 02:41:24,鱼非鱼,"够牛逼，够嗨，够浓烈。现场多次大笑，鼓掌。很少在影院笑的这么放肆。
无论你是喜欢赵本山，宁浩，还是昆汀，你都会喜欢这部电影。
看好本片票房过4亿。",5,力荐,17,0.999997319529629
2010-12-16 03:19:43,大奇特(Grinch),开篇大四喜，尾声单钓将；麻筒子连七对，汤混子全不靠，四万字无番和；大三元影帝，清一色男配，花牌周韵，自摸姜文。,4,推荐,2964,0.9947712485643352
2010-12-16 03:29:20,[已注销],有点散架。8.5/10,4,推荐,15,0.1837233963534416
2010-12-16 03:55:58,愤怒的公牛,阿桑奇观看影片后，对自己身边的中国友人说。文姜是电影史上最伟大的导演没有之一！该片可申遗，并永久保存！！！              ,5,力荐,45,0.9793327756421129
2010-12-16 09:03:40,嘟嘟熊之父,自大狂和妄想症。,2,较差,24,0.7254346764395748
2010-12-16 11:13:13,掉线,这才是中国电影应该出现的所谓“大片”,5,力荐,25,0.838990039497539
2010-12-16 13:15:33,狂奔的蜗牛,V5,5,力荐,195,0.5
2010-12-16 13:59:13,豆豆龙,好在哪里？笑点没觉得可笑,1,很差,578,0.1710141856380227
2010-12-16 14:30:45,桃桃林林,姜文玩出来的电影，从头到尾都很放松，或者是太放松了，节奏总有点怪，有些情节也太儿戏。对白也不好，细节不如《鬼子来了》那么智慧，即便如此，这仍然是今年华语片最棒的。或者只能怪剩下那些太面货。请千万一定尽量降低期待。重看一遍，感觉这片舞台味真重啊。,3,还行,668,0.9935244097661566
2010-12-16 14:41:24,shawnj,并不是所说的那么出色，被过誉了。横向比很棒，纵向比是姜文几部作品中最差的,4,推荐,685,0.9924031090290962
2010-12-16 15:38:15,妖灵妖,国泰电影院早场「让子弹飞」全场爆笑四十多次，片尾观众自发鼓掌，这是姜文私版的「革命往事」，大家都让他站着把钱挣了吧，虽然影片有一些明显的问题,5,力荐,530,0.999969673684756
2010-12-16 15:52:14,seamouse,或许是期望太高，#让子弹飞#的确让我失望了。无节制说成话痨的对白充斥了2个多小时，严重削减了叙事节奏本应具备的酷劲；延续着“太阳升”配乐最重要的两段主题，却在你来我往神神叨叨摊明了的勾心斗角间，将自由辽阔的情绪彻底淹没；就连姜文电影里我颇为喜欢的升格窗帘浮动，也彻底成了cult片,3,还行,79,0.9975128702017372
2010-12-16 15:59:04,Bingo,也行是不对自己的口味吧，虽然好评如潮，但却觉得是一部过于残酷和真实的商业片。本为娱乐而去，可却让心中总是隐隐难受。另外节奏快是亮点，但全片快到尾却不禁还是让人觉得少了些什么。,3,还行,19,0.9997492378823284
2010-12-16 16:01:38,Q。,“走路不要太快，会扯着蛋。”这是一部溢满荷尔蒙的火药桶，这是一部会带来核动力反应的影片，震撼所有人，并且持续许久。130分钟的影片满是高潮，全场观众从头沸腾到结尾，不断的笑声、不断的掌声。无论哪个演员都表现的十分出彩，台词幽默精致，结构紧凑、首尾呼应，唯独缺少一丝控制。★★★★☆,4,推荐,399,0.9999999973905156
2010-12-16 17:15:11,Touma,拍个虎虎生风，拍个一日千里，拍个恍若隔世！,5,力荐,3752,0.7592926581480537
2010-12-16 20:56:49,有心打扰,看姜文、葛优、周润发三位演员飙戏还是挺过瘾的。初看真心觉得惊艳，后来再看，好像那种过瘾的劲就少了许多。,4,推荐,7,0.9999998340844938
2010-12-16 21:12:28,鸟人,真的只是还行,3,还行,26,0.7228956131895249
2010-12-16 21:31:07,像一把刀子,在一部极富期待的电影上映之前，我的渴望并在脑中构建的影像总和最后的真货大有出入。子弹看罢 有这种感觉。但是一定要肯定姜文带给我们的超然惊喜，枪震戈壁，血染黄沙 白银泻地金戈铁马一切压爆肾上腺的因素都汇集一起...但在一切都爽玩过后，我相信这会是姜文令人余味最少的一部作品。,4,推荐,10,0.9999991492831288
2010-12-16 21:56:27,方枪枪, 这是他妈的“让子弹飞”，是他妈的“姜文”作品，是他妈的黑色，也是他妈的犀利，是他妈的惊喜，一个接着一个的惊喜,5,力荐,23,0.9738974174267896
2010-12-16 21:56:27,方枪枪, 这是他妈的“让子弹飞”，是他妈的“姜文”作品，是他妈的黑色，也是他妈的犀利，是他妈的惊喜，一个接着一个的惊喜,5,力荐,23,0.9738974174267896
2010-12-16 22:00:39,同志亦凡人中文站,细节还差点儿 故事很给力～！,4,推荐,104,0.8211251128361126
2010-12-16 22:19:47,师太求点化,有些失落····,1,很差,43,0.9350851483655284
2010-12-16 22:20:48,btr,"""姜文的男性沙文主义把革命浪漫主义催化成一场自恋而空洞的闹剧；简单粗暴的革命幻想在漫画式演绎里沦为几无可信性且毫无深度的大纲式故事；冯氏笑料游离在电影的内在逻辑之外，成为段子级别的廉价调料。“全文：http://shanghaimonthly.info/blog/?p=2181",3,还行,114,0.9999999971926296
2010-12-16 22:32:26,Dick,上映前到处都是海报让我觉得又是部烂片，今天看了评论以为自己错了，看完我觉得确实是不烂片,2,较差,151,0.1921229630846095
2010-12-16 22:52:28,海晓,不让人惊喜，到让人意外。故事经不起推敲，人物塑造也不丰满，几个配角彻底沦为配角，所谓的笑点就和各种晚会上的小品一个水平。从里面还能看到《鬼子来了》的影子，但找不到那种惊艳。又在电影院里打瞌睡了。,4,推荐,97,0.9999578664879036
2010-12-16 23:22:40,苏苏段,不好看，没什么很好笑的，不理解之前网上那些捧的都是怎么回事。,3,还行,287,0.035317400426783
2010-12-16 23:46:56,Koji,我宁愿相信结尾那场高潮是因为电影局审片的老湿们没有看懂,2,较差,39,0.9974522064022344
2010-12-16 23:46:56,Koji,我宁愿相信结尾那场高潮是因为电影局审片的老湿们没有看懂,5,力荐,39,0.9974522064022344
2010-12-16 23:50:14,胤祥,三个男人相爱相杀什么的，最萌了。姜文什么的，最萌了，卖腐都卖的那么萌，萌死我算了……这就是非理性粉丝，虽然此片跟前三部相比最多四星，后期再次被中影数字基地糟蹋（内景还好，外景简直不能看，还有那些特效），但是能在大银幕上看姜文这种事儿毕竟不多……准备至少再看两遍,4,推荐,32,0.9989687364308664
2010-12-16 23:55:23,牛小七,太TM给力了,1,很差,35,0.5603257409986604
2010-12-17 00:45:08,Jason4,我看的是你们看的神作《让子弹飞》么?逻辑混乱不知所云笑不出来啊这个。,2,较差,68,0.1182950482908553
2010-12-17 01:24:03,小饼爱打咻咻拳,是不错 票价值了,5,力荐,6,0.7166276927943567
2010-12-17 01:31:37,车车,太牛逼了。。。GDZJ再次被爆菊,5,力荐,6,0.3640405281033484
2010-12-17 02:04:49,弗朗索瓦张。,说姜文用力过猛的  那只能说明您受功不够 受用不起！,5,力荐,7747,0.8836950468030177
2010-12-17 02:16:52,木之,最爷们，最热血 ,4,推荐,7,0.8422334496720554
2010-12-17 07:31:19,不穿袜子,没道理给五星，姜文这次成功的演绎了模仿秀。电影节奏太掉套路了，你说这电影导演，可以是盖里奇，可以是昆丁，还可以是宁浩，总之就是生意，票房第一。最后结尾又狗拉羊肠子，周润发搞的跟董存瑞似的，豆瓣上好评如潮啊，挺怪的。不过在这个烂片无数的年代，三星勉强给了。,3,还行,162,0.9894960379642084
2010-12-17 09:00:24,scaryzion,整片节奏混乱且冗长罗嗦，特技场面相当业余，出场人物宛如戴着面具般表情生硬，这是讲故事的电影不是大伙凑热闹的春晚，很多人物是可以删掉的。前半段笑果很明显，但后来越拍越乱，都快散架了，很多台词莫名其妙。如果可以剪到90分钟，应该会好很多。,3,还行,138,0.8446588962535893
2010-12-17 09:07:01,kiddy,看似有劲，其实没啥劲。发哥早已不是本色中的发哥，有形无神，这电影也像极了现时的发哥。文哥嘛，好像有点恋枪癖，除了场面之外，故事本身的意义何在呢？虽然借了民国的背景，但看起来更像过家家的闹剧，还有些童话级。主持公平？为谁？真能主持得了吗？当那个老百姓说，这俩椅子归我了，觉得很悲哀。,3,还行,21,0.997504815258975
2010-12-17 09:49:00,廖新,除了靠段子扯蛋逗乐，算个小品集合的贺岁片,1,很差,339,0.6759689220126218
2010-12-17 09:51:22,娄知县,《鬼子来了》之后，姜文就一直没有好本子，所以他的电影都是片段拼凑，没有完整，上一部登峰造极，这一部还是一样有这个毛病。当然我不反对你把它当一个四川话散打小品大荟萃看。,2,较差,68,0.9713035105838186
2010-12-17 11:20:48,A-sun*,唔係我嘅呔。,3,还行,14,0.8975067734120136
2010-12-17 12:06:22,RS,不得不给五星，对姜文的盲目崇拜又上升了一个高度。,5,力荐,9,0.8045604367143296
2010-12-17 13:38:14,青山藏在白云间,从未有过的电影院新体验！看完这个玩拳击，五分钟内绝对K.O对手；看完这个去群殴，绝对砍的一身是血；看完这个去喝酒，醉得肯定比以往快；看完这个去上床，啊，不好意思说了……,5,力荐,46,0.999464328375738
2010-12-17 14:27:49,皮肤干干大魔王,我觉得要把之前评过的电影降几个星，才能衬托出这个五星的牛逼了,5,力荐,5,0.6964859408288934
2010-12-17 15:21:42,蓬蓬,前大半段几乎没啥情节 看的我都看不下去 网上舆论造势太厉害 都是闹剧！,3,还行,9,0.8290358840345544
2010-12-17 16:24:26,shininglove,姜文树立了中国内地商业电影的新航标：疲惫生活的英雄梦想！,5,力荐,19,0.9999973078150534
2010-12-17 16:24:26,shininglove,姜文树立了中国内地商业电影的新航标：疲惫生活的英雄梦想！,5,力荐,19,0.9999973078150534
2010-12-17 17:08:18,|,不知道值不值九分 虽然CG差了点 但这绝对是这辈子看国产片从未有过的体验,4,推荐,3,0.06952491330409
2010-12-17 20:46:01,琦殿,行了，装逼一次，继段奕宏，姜文再一次满足了我对男人所有的幻想。操，嫉妒周韵。,5,力荐,2618,0.991190122005496
2010-12-17 22:27:27,芹泽虾饺菌,《新闻联播》主播郭志坚在博客评论《让子弹飞》：“情节不合逻辑拖沓冗长，让观众感觉极不舒服，青少年看了会给正在成长的身心注入一股非理性冲动。”对此姜文回应到：这也是我对《新闻联播》的看法《——冲着姜爷这句话，四星果断改成五星~,5,力荐,19,0.9999996251167572
2010-12-18 17:26:35,逆逆,据抖奶说给3星一下的都会被和谐，我试试,4,推荐,16,0.4184328815470638
2010-12-18 17:28:40,小飞儿,唉。。。很失望 看到一半 觉得很失望,1,很差,27,0.0576722819919072
2010-12-18 17:51:08,草威,很好看，但未及经典。如果是十分制我打八分，五颗星的话我就全给了。“让子弹飞一会儿”真是对革命最浪漫的隐喻了。,5,力荐,19,0.9999607160484564
2010-12-18 20:34:45,李小丢,很久没看到这么聪明的电影了。,5,力荐,28,0.8682450361132378
2010-12-18 22:27:51,亵渎电影,还好吧！我不是很喜欢，这类片子不是我的菜啊！不评论！,3,还行,62,0.6240172091529526
2010-12-19 00:24:37,某茶君,一场高速抽插的性爱...另外，那结尾是姜文为了证明《寻枪》其实是他搞的鬼嘛...,4,推荐,4,0.949805054641808
2010-12-19 12:53:17,xixi,一边看一边觉得没劲，虽然整个厅的人时不时的笑着，还是觉得很无趣。看过的人几乎都说好看，也许是不合我的口味吧。,5,力荐,15,0.0972764595850609
2010-12-19 14:44:30,眠去,重温一场英雄主义的旧梦,4,推荐,77,0.9306161840292312
2010-12-19 14:56:43,欢乐分裂,理想主义充满血性的草莽英雄们的狂欢，一定要演绎在貌似遥远的传奇年代，才能完成姜文野心，酣畅之劲较之前稍减，但看得十分过瘾。,4,推荐,20,0.9999949376300468
2010-12-19 22:15:06,亚比煞,银鞍照白马，飒沓如流星。十步杀一人，千里不留行。,4,推荐,55,0.9217345419488314
2010-12-20 01:25:13,就爱麦当劳,受不了姜文现在这么自恋.,1,很差,102,0.3022373071993922
2010-12-20 08:59:24,tomshiwo,好一个怪胎。,1,很差,126,0.4458317843722817
2010-12-20 09:37:38,六十六个猴,拖。,1,很差,7,0.2763157894736842
2010-12-20 12:55:47,米粒,跟想象的差太多了，但有些片段还是可以的。给姜文四星。,4,推荐,13,0.8599679824731336
2010-12-20 17:22:01,Cora,不知道想表达什么。无聊。,1,很差,10,0.1846822477722602
2010-12-20 22:48:00,坦克手贝吉塔,自恋狂姜文的撒癔症之作,3,还行,19,0.4056079585406296
2010-12-21 16:39:26,汪金卫,【20101221 长春万达欧亚店】【20180114 SAME法文中心胶片版】时隔七年再刷大银幕，依旧看得热血沸腾，无比爽快。剧情台词内涵之精妙，喜剧元素设计之精巧，至今看来仍拍案叫绝。好创意信手拈来，金句频出，还能演出精彩的政治寓言。不得不佩服姜文天才般的创作力。真是又高又硬！,5,力荐,16,0.9999999999989944
2010-12-21 17:04:13,恶魔的步调,这面煮得劲道！,5,力荐,17,0.3210862486761788
2010-12-23 20:37:56,w,大家都是给打了鸡血吗？,2,较差,7,0.525113168663767
2010-12-23 22:22:34,艾小柯,意图是宏大的，娱乐性十足；但影片的节奏与细节处理都十分毛躁，多处糙而欠缺章法，执行上眼高手低。3.5星。,3,还行,101,0.9893423991596902
2010-12-23 23:29:56,大头绿豆,草莽，野性，浓烈的雄性激素。一身戎装两脚马靴，几个基友兄弟和一骑大白马。爷们，纯的。,4,推荐,25,0.9317000201410668
2010-12-25 16:07:44,私享史,【三里屯美嘉】姜文当然要比中国绝大多数存世导演都更有才，但他的自负无疑又远高过他的才华。可自负不过黑泽明、才华不如伯格曼，也就只够当个土匪，会耍几个花枪就能混一辈子。普通话版咋样不晓得，这四川话版我觉着不如做成舞台话剧加装置秀，唯有山林那出算是电影。附会政治隐喻的影评不怕扯着蛋？,3,还行,33,0.9999905781852064
2010-12-27 15:19:15,萧湘,"很HIGH,但是有必要这么HIGH吗？片子里一个个跟打了激素似的，行事逻辑多有不能理解的地方。另外，从群众来到群众中去，才是搞革命的正途。高高在上的新人们创造出了革命，这种历史叙事我就非常讨厌。",3,还行,18,0.9996498360194837
2010-12-28 12:55:17,Alan Sleep,它过审了是个奇迹，真的,4,推荐,20,0.7195211914252606
2010-12-28 17:24:44,panpan,看来我水平不够，不懂欣赏= =,2,较差,12,0.5578023498734678
2010-12-28 23:37:45,CyberKnight电子骑士,算年度最好的大陆影片，但还真算不得神作。可以叫“时无英雄，使土匪成名”（LP语）。对我来说，看得不够high，听得不够乐。姜文亏就亏在他太聪明，以至讲故事说事儿总太跳跃，不能非常老实，将来如能返璞归真，那才是真飞起来。,4,推荐,28,0.9441711599939488
2010-12-29 22:33:22,伊谢尔伦的风,“麻匪帮开个牛郎团都够啦！”,5,力荐,128,0.8917176315806546
2011-01-03 23:00:27,[己注销],谢不杀之恩,4,推荐,12,0.7524460401522117
2011-01-25 22:54:05,秋叶,让你产生G点的基本是文戏，让你感觉到亮点的基本是武戏，让你看不懂晦点的基本是欲戏，果然是姜文，果然是日照大神级的人物，这电影是如何通过政审的呢？更离奇的是出品人居然是韩三平，还居然大夸这片子有看头，有说头，有想头，看来很多人也是身不由己啊。,5,力荐,28,0.9994910947430528
2011-01-25 22:54:05,秋叶,让你产生G点的基本是文戏，让你感觉到亮点的基本是武戏，让你看不懂晦点的基本是欲戏，果然是姜文，果然是日照大神级的人物，这电影是如何通过政审的呢？更离奇的是出品人居然是韩三平，还居然大夸这片子有看头，有说头，有想头，看来很多人也是身不由己啊。,5,力荐,28,0.9994910947430528
2011-02-01 11:19:59,曾于里,姜文的气场啊…,5,力荐,21,0.6633950469879726
2011-02-01 11:19:59,曾于里,姜文的气场啊…,5,力荐,21,0.6633950469879726
2011-02-09 23:52:22,沉歌,又黑色幽默又喜剧又文艺又动作又人性又剧情，姜导啊，你一部电影占了多少的类型？关键是还这么好看。,5,力荐,19,0.9995396556304512
2011-02-13 14:07:58,Luke,装傻充愣伪神片,3,还行,15,0.4494715139053319
2011-08-27 23:24:45,🌞娘卷卷🌙,我还是更喜欢周星驰,2,较差,8,0.7350820605128062
2012-05-23 13:05:10,啊啊啊啊洋,怎么说。。。还好吧~,5,力荐,1,0.5306037695873492
2012-05-25 20:11:34,子爵91,我想知道这事那个年代？有火车，有子弹，有知县。,4,推荐,5,0.6065572178772353
2012-05-25 20:33:32,李小炘,.......,3,还行,0,0.2972972972972975
2012-05-25 22:58:25,dear_安呆,让我飘一会儿~ 一小会儿~~,3,还行,1,0.0882033913398421
2012-05-26 05:08:56,叉叉xX,TT。。。,4,推荐,1,0.5
2012-05-28 15:50:00,你看起来很美味,这部片子看了三次，第一次是在电影院，第二次是老师放的，第三次是跟室友。直到第三次才把有些隐晦的情节完全看懂。这个片子，你看了就看了，当个喜剧片看了就对了。吃着火锅唱着歌继续看下一部，别想太多，想太多会累。,4,推荐,24,0.974428365149564
2012-05-28 15:50:00,你看起来很美味,这部片子看了三次，第一次是在电影院，第二次是老师放的，第三次是跟室友。直到第三次才把有些隐晦的情节完全看懂。这个片子，你看了就看了，当个喜剧片看了就对了。吃着火锅唱着歌继续看下一部，别想太多，想太多会累。,4,推荐,24,0.974428365149564
2012-06-06 02:31:15,桔子喵,四川话版是精华呀,4,推荐,0,0.3222009556555317
2012-06-17 12:58:54,绿酒,和班里同学一块看，不管看啥电影都是喜剧,4,推荐,1,0.9853273538036356
2012-06-17 13:51:02,wo是好学生,挺好看。,4,推荐,0,0.8609500529205288
2012-06-17 15:36:12,@six,慾語還休,4,推荐,0,0.3780725815057335
2012-06-17 15:43:38,自己染发真是挫,姜大爷万岁！,5,力荐,0,0.8097170892370886
2012-06-17 16:08:48,无话对你说,挺好的,5,力荐,0,0.8284246220999102
2012-06-17 16:54:43,一口闲钟,“飞”。,1,很差,0,0.5708970165467524
2012-06-17 18:37:26,春花,当初上映时，先是和室友们大半夜躲在床上一起看嗨了！然后，还是忍不住，又去电影院看了一遍。。真的很经典诶！,5,力荐,0,0.3920597524514303
2012-06-17 18:37:35,看电影的小丸子,还好。只是我对这种电影着实不感冒。题材很好，敢于说出别人不敢说的话，但总觉得缺了点点什么。,5,力荐,0,0.4320125395628819
2012-06-17 20:24:43,包子,影射的东西真的挺多的，逞强不是好办法，要多用脑子,5,力荐,0,0.6549937330902067
2012-06-17 21:52:48,Stacia,吃着火锅唱着歌,5,力荐,0,0.9441589574309186
2012-06-17 22:07:56,荼靡之外,飞起来,4,推荐,0,0.6129032258064517
2012-06-17 23:11:34,Nikki,看过之后，爱上了姜文的戏,4,推荐,0,0.9631565522069252
2012-06-17 23:49:19,dreamweiwei,Great laugh. Good movie.,5,力荐,1,0.421874597530976
2012-06-18 01:08:38,dann,演员演技没话说的 剧情好 除了海报傻逼抄袭,5,力荐,0,0.8668975328541496
2012-06-18 01:40:58,Edward Knight,考你政治和语文啦。,5,力荐,1,0.9983664049939552
2012-06-18 12:04:01,统统趴下,很好笑,4,推荐,6,0.4314738576667336
2012-06-19 15:32:34,威廉先生,喜欢,3,还行,1,0.6994590939824207
2012-06-19 16:10:06,幻海尘,说实话，看不出有多高的电影造诣～,3,还行,6,0.8536882413184904
2012-06-19 16:15:57,大腹便便花轮君,值得看了又看。。。据说四川话版本更为惊艳？,4,推荐,1,0.9808240064479656
2012-06-20 00:37:31,低调的神经质,没觉得这样的电影好看，看完完全不知道意义在哪里,3,还行,0,0.883122059181827
2012-06-20 01:25:42,有意义的名字,好惊喜的一部电影之我爱姜文,5,力荐,1,0.9982244069444562
2012-08-11 13:29:47,迷蒙的花樹,很過癮，雖然很刻意。,5,力荐,0,0.9329297340517392
2012-08-11 13:40:23,哒兜儿,音乐、画面、人物表演都很棒。没什么水平欣赏到电影的背后，但是看的时候很爽很享受,5,力荐,0,0.9999937595182712
2012-08-11 16:15:16,VANILLA,越看越想打麻将,5,力荐,0,0.2061167591212079
2012-08-11 17:11:49,番石榴,牛逼~,5,力荐,0,0.6923786120385603
2012-08-11 17:48:29,Eva见习质检员,永远也弄不懂姜文想干什么,5,力荐,0,0.0297661159725954
2012-08-11 18:12:51,sem,没看懂！,5,力荐,0,0.4094705022620487
2012-08-12 18:00:29,无意间已阵亡,经典的姜文式黑色幽默,4,推荐,2,0.8155623295734592
2012-08-12 23:06:23,朗立,2011年春节上映的，和赵孤一起，它却意想不到的取得了胜利。。。,4,推荐,1,0.9994890617565508
2012-08-13 11:03:47,朝暮雪,要是姜文拍完这部电影就宣布退休，他会被封神。,5,力荐,7733,0.9952849027025288
2012-09-03 11:07:02,慕语.MuYu,推荐,5,力荐,1,0.6325878594249201
2012-09-03 11:07:02,慕语.MuYu,推荐,5,力荐,1,0.6325878594249201
2012-09-04 01:40:43,-Hero,这就是一部牛逼的电影，而已！,5,力荐,3,0.9244506345410975
2012-09-04 01:40:43,-Hero,这就是一部牛逼的电影，而已！,5,力荐,3,0.9244506345410975
2012-12-01 02:37:12,下雨不打伞哦嘞,还记得是10几个人一起去看的,5,力荐,1,0.7596379995635054
2012-12-01 02:37:12,下雨不打伞哦嘞,还记得是10几个人一起去看的,5,力荐,1,0.7596379995635054
2013-08-21 22:42:57,西楼尘,噼里啪啦，酣畅淋漓。期待姜文，真正用心拍电影的导演，姜文李安守住最后的电影净土。,4,推荐,76,0.9999821963582234
2014-03-04 00:38:58,少数豪,又一遍，真过瘾。,3,还行,19,0.9706659150657232
2015-12-30 02:07:05,Leon Winters W,"神作！一般人要想想才能明白内涵，在姜文的世界观里，英雄是第一位的。英雄改变社会，英雄创造历史。最大的悲哀就是没有英雄。
所以张麻子拿了钱还不够，他还要除掉黄四郎，给百姓一个公平，给鹅城一个太平。你给我翻译翻译，神马叫惊喜！你给我翻译翻译，神马叫做TMD的惊喜！！！",5,力荐,125,0.9999999998383092
