2016-01-15 16:37:38,冰红深蓝,"男性色彩过于浓烈，女性全沦为扁平的符号。多处段落过于刻意，不加节制。舞台化气息太重，电影化手法较弱。所谓政治隐喻也欠缺力度。姜文由于[鬼子来了]输给[黑暗中的舞者]就对冯提尔怀恨在心,03戛纳利用评委身份公报私仇抵制[狗镇],斥其为""哗众取宠"",结果自己后来拍的片质量比之差远了。（6.5/10）",3,还行,488,0.9998551988952772
2016-11-06 17:10:09,股神看不懂,姜文的片子中最爱的一部，这片子真的隐射了太多东西了，葛大爷也演的很不错，经典，推荐大家去看看哦,4,推荐,20,0.9999934785918044
2016-11-11 11:59:42,不能·喵大妍儿,对老婆真的是真爱。拍得那么美。（我是不是重点错了）,4,推荐,21,0.9551186452579556
2016-11-29 22:35:20,娜莉梦游仙境,一堆大咖摆在一起也值四星了，演技真不是盖的，刘嘉玲的风情万种，葛优的狗腿形象，周润发的恶霸形象，都很深入人心！,5,力荐,16,0.9990042323849432
2016-12-20 02:14:44,焚紙樓,春晚怎麼還不找姜文姜老師餒？他這些年好努力的，拚了命拍《讓子彈飛》《一步之遙》這種片，就是為了證明自己可以當賀歲檔的操刀甚至主持阿。不是？那還能是什麼？,4,推荐,16,0.1214991752451404
2017-01-04 11:21:34,amelin,很多隐喻，看了影评仿佛跟自己看的不是一部《让子弹飞》[捂脸](*¯︶¯*),4,推荐,20,0.9648805146876326
2017-01-26 16:31:33,多看电影爱电影,一部充满黑色幽默的搞笑电影。,5,力荐,17,0.9103904267890172
2017-02-14 01:28:46,shield,老演员的演技就是没的说,4,推荐,18,0.9257519530317518
2017-03-14 08:25:36,梦梦梦梦,还不错，葛优挺搞笑，一直没等到2,4,推荐,21,0.996758595277082
2017-03-14 08:25:36,梦梦梦梦,还不错，葛优挺搞笑，一直没等到2,4,推荐,21,0.996758595277082
2017-04-15 23:19:22,X,欣赏不来,3,还行,8,0.6574894350528819
2017-04-29 22:06:02,茅十八*^_^*,电影就是造梦，姜文很懂如何把握,4,推荐,10,0.9968535626892268
2017-04-29 22:20:28,杨桃,姜文把一个成年人的幻梦做得如此天真烂漫、五彩斑斓，又如此一本正经、正气凛然。,4,推荐,13,0.9952789763547416
2017-06-06 01:00:25,Ocap,不是政治隐喻多和牛就是大师，我对南斯拉夫不了解，但《地下》能予我最深刻的感性认知，而姜文就不能。姜顶多算自恋的土匪，奈何他的魅力正好源于自恋，那没办法，只能服。鬼子来得太直，太阳绕了大半圈终于升起，不料却太安静。让子弹飞妥妥的又直回来了，只是这回多了个时间差，“飞一会儿”，赢了。,4,推荐,28,0.9999987231032554
2017-10-27 12:46:36,遇见彩虹🌈,"影片节奏紧凑，剧情也挺出乎意料，表现形式虽略夸张但吸引人。
让子弹飞一会儿吧。",4,推荐,99,0.9998830309438635
2018-01-24 18:08:53,接十分钟的吻,三四年前看的，只记得全班人一起笑得跟傻子一样，挺不错的电影,4,推荐,299,0.9866082413815372
2018-02-08 17:53:21,顾盼,姜文说，我想站着把钱挣了。他做到了。结尾处的那句 没有你，对我很重要。怎么解读都不为过。,5,力荐,4093,0.8851032723658693
2018-02-20 10:28:27,欣欣向荣,这个电影很好玩，重复看会发现很多隐藏线索，麻将面具也很有意思，最后还有惊喜，挺好看的,4,推荐,749,0.9999939991008748
2018-03-06 08:34:08,醉里挑灯看花,姜文这种黑色幽默式搞笑时不时会出现在他的作品中，这部尤甚。,5,力荐,1073,0.9959894381082354
2018-03-11 19:17:38,呆瓜,葛优的发型好酷啊，没怎么看,1,很差,34,0.9970745798054418
2018-03-29 19:42:14,快乐人生,剧情挺荒诞，也蛮搞笑，虽然看过很久啦，还能记住一些片段。,4,推荐,58,0.9947470097505798
2018-04-02 16:04:50,尽欢,不能再好的一部剧了。几大影帝齐聚，每一场都是戏。,5,力荐,124,0.7784831706861026
2018-05-07 10:37:06,青青蒹葭,一群马拉着火车在铁轨上奔驰，然后被一群头戴麻将面具的劫匪打劫……开头蛮搞笑的。,3,还行,18,0.8900574592299234
2018-05-07 15:21:12,爱看电影的少年,大哥你是了解我的，呵呵，太搞笑了,5,力荐,14,0.1659912788650532
2018-05-07 20:19:40,芊颖,葛大爷的片，天下无贼和这部让我印象最深了,4,推荐,29,0.9978826235011162
2018-05-07 22:54:34,七七,很早之前就看过，回来二刷，好看,4,推荐,11,0.426610388584854
2018-05-07 23:46:43,死鬼,光这张海报就值五星,5,力荐,66,0.0598492737001733
2018-05-08 06:44:13,媛媛,其实是一部很有内涵的片子，要细细品味！,5,力荐,15,0.9802590044167664
2018-05-08 08:19:52,IF,剧情有些荒诞，却讲出了很多道理，好经典，很好看,4,推荐,16,0.9978688131697846
2018-05-08 08:53:11,橘猫爱吃鱼,	整个电影幽默又不失机智 ，商业又不失艺术 ，故事处处充满惊喜  刺激。,5,力荐,76,0.9999996036056596
2018-05-08 08:53:47,哈哈哈啊啊啊,每个角色都那么恰到好处，剧情台词映射着现实，遮不住姜文的野心与自嘲，别急，先让子弹飞会，嗯，2018期待你的新作。,4,推荐,14,0.9999430861964952
2018-05-08 12:39:23,八贝勒爷,有的地方很搞笑，但不失头脑，看完有收获,4,推荐,16,0.992980714661158
2020-10-14 02:51:39,花继续开,“有人问中国最伟大的人是谁？人民说是他，他说是人民。正确答案是人民，但他若不曾出现，是不会有这个答案的。”,5,力荐,8086,0.9991695982128012
2020-12-11 16:07:30,number girl,张麻子，自认潇洒的国产油腻爹味中老年男子的自我映射,3,还行,26,0.249306544130576
2020-12-12 23:14:13,留白,一直都觉得《让子弹飞》是我懂事以来国内拍的最好的电影之一了。不想理解也能让你看的过瘾，想思考也有足够的东西去思考，这才是真正的电影。,5,力荐,295,0.9999979842202174
2021-01-28 23:48:17,混沌武士,这tmd不值五星？！我要站着，还要把钱给赚了。,5,力荐,59,0.0038581000856533
2021-01-28 23:55:02,淡墨文竹,看完后劲太大了 人民永远怀念您的伟大 教员千古,5,力荐,159,0.9673945033811264
2021-03-15 11:07:35,溴化雞,20210315改五星，当年是真的没看懂，很隐晦，现在回看越来越觉得我不适合生活在现在这社会上了。哦对，为什么回看？因为发现现在很多社会事件拿里面的对白都可以解释。。。。,5,力荐,1642,0.999427341005752
2021-04-23 09:30:50,臆想图志,为什么这不是一部好电影，因为它否定了诸众在社会革命中的贡献与牺牲，将社会革命胜利功劳锁定了少部分革命上层精英，诸众只是精明、自私、利己、怯懦的，所以社会革命成果不应该归功于诸众，融合伪装成精英主义的既得利益阶层视野，这是红二代既得利益阶层对人民革命否定的集大成，是红二代占领话语权，对既得利益的合理化辩解。,1,很差,82,1.0
2021-05-06 00:44:26,编剧陶思维,可以排进中国影史的影片你们打成了8.9？可笑可笑。全片充满了他娘的废话，却没有一句废话，情节跟台词是真他娘的带劲，整体看下来就是一个字，爽！如果有一天姜文拍不出来这样的作品了，不是有人让他闭嘴了，就是他彻底失望了。,5,力荐,91,0.3167320987019875
2021-07-19 01:20:50,此女名为吃货,后悔没早看，庆幸没早看。进入社会后看这部片子会懂很多，太多的东西对应过去又映射进如今现实，好的电影总不会被时代约束。对现今的想法如同电影的台词一样：让子弹飞一会儿吧,5,力荐,73,0.9999999724211333
2021-08-10 22:29:02,江湖在逃骗子,当年没看懂，现在懂了。,5,力荐,82,0.6301663679552244
2021-08-20 22:22:24,TropicalMalady,我们受邀得以一窥姜文的精神世界，发现里面什么也没有except一根勃起的阳具。,3,还行,93,0.9900078294973732
2021-09-22 18:16:43,火娃,7/10。重温数回仍能对影片本身的极尽媚俗感到不适，到高潮枪支铺垫整个广场，不经流露出姜文对毛时代煽动庸众的革命运动感到缅怀：武举人将小贩踢打到冤鼓上、鼔破，庸众看热闹，在发动群众那场戏，无辜的替身成为革命牺牲品、被张麻子斩首，庸众开始将革命权力合理化，群情激愤地抢夺胜利果实，连张麻子落座的椅子也急着要去。姜文狂想的革命不是重建，站在阶级的最高处拿着望远镜窥视的黄四郎最终被炸飞，但鹅城还是那个鹅城，姜文热衷的是阶级斗争那种强暴的美，因此仪式激烈的民女列队敲鼓、轿子里一顶帽子代表的架空权力、冤鼔爬满藤蔓隐喻的百年压迫、铁门上枪打的问号，严肃的讽喻又表现为影像狂欢的碎裂性和空虚性，正如张麻子强调公平、鸣枪叫人别跪，县衙外群众却依然跪下，伟人之所以伟大，是需要群众跪着，姜文之所以伟大，是因为观众跪着。,3,还行,33,0.9999999999999998
2022-01-20 16:51:25,大咸鱼福尔摩鹿,我觉得姜文是个名副其实的电影天才。,5,力荐,43,0.8742242478999069
2022-02-23 22:06:24,懒肥柴,这照片是你吗,5,力荐,49,0.4574468085106385
2022-03-19 19:06:05,Bravenough,谁赢他们帮谁，但是他们不明白，他们帮谁，谁就赢。人类不感谢罗辑，同样的，人民也不感激牧之。,5,力荐,1831,0.9996378158454732
2022-04-23 19:10:24,小王漂流历险记,张牧之为什么慢慢被叫成麻子，谁愿意相信一个麻匪的名字会如此浪漫，这是世人的偏见。,5,力荐,101,0.995468779129566
2022-05-31 15:49:48,木由,慷慨悲壮的《太阳照常升起》用来做姜导的战歌真是最合适不过了。 7年后回来再看突然发现从前没看懂。原来这讲的不是一群肝胆相照的英豪打败恶势力后各奔前程的光明故事，讲的是众叛亲离。屠龙勇士始终只有一位。汤师爷、三哥和花姐早就叛变了，小六和二哥一抔黄土埋忠骨，从前几位劫富济贫的兄弟最后成了“吃着火锅唱着歌”拿着委任状去捞钱的新一代恶龙，黄四郎金蝉脱壳甚至成了他们的师爷。新的循环开始了，凝视他们的只剩下大哥孤家寡人，他却还是选择了打马上前。乌合之众谁赢帮谁，贪得无厌，真的值得被解救吗？他不去想，他只去做，因为他不是张麻子，他叫张牧之。,5,力荐,227,0.9990329117154748
2022-06-15 08:26:59,不正常的网友,"补标。
就一个点：别跪着了，大清都亡了，这膝盖怎么就tm这么软呢你们，没人值得我们跪。
想起最近TS那事，这冤鼓一露出来，果然真是有天大的冤啊🚬",5,力荐,27,0.0225542758627451
2022-06-26 11:12:00,雪扬囧囧囧,多年之后的各种妖魔鬼怪证明，这是一部纪录片,5,力荐,68,0.996275835249996
2022-06-26 11:12:00,雪扬囧囧囧,多年之后的各种妖魔鬼怪证明，这是一部纪录片,5,力荐,68,0.996275835249996
2022-07-15 01:19:16,Kobe,影片反映了三个年代，1、影片背景的年代，2、影片拍摄的年代，3、以后的每个年代,5,力荐,358,0.1044758342991264
2022-07-16 09:16:02,roserosey,今时今日 尤为应景,5,力荐,204,0.9220066266987176
2022-08-05 16:41:26,Tea,《让子弹飞》是真的难看。像看了十几年前的我丝毫不会感兴趣的电视剧一样，感受了一下姜文非要乱加各种隐喻装逼来让粉丝跪舔，把厌女和低俗毫不掩饰地打到脸上。除了最后一路凯歌的胜利和悲惨的现实对比之外，实在不知道到底有什么好吹的。,3,还行,25,0.9998269270042272
2022-08-10 14:43:31,PRALINÉS,“皇上都没了，没人值得你们跪！”,5,力荐,39,0.7604133358384182
2022-09-06 18:47:26,Lintilai,姑娘，你这样拿枪的时候，更好看,5,力荐,25,0.9221653745407642
2022-10-05 01:53:01,坂本树一,这他妈他妈的才叫电影！,5,力荐,46,0.2796531963306908
2022-10-13 21:59:42,舒记,一堆批小将狂吹这电影，天天喊着要申遗。我到要来看看这电影做的到底有多么惊世骇俗。看完我想说，请问这是在干什么？我在看一群疯子吗？为了讽刺而讽刺，隐喻又显得那么刻意，搞笑拙劣的讽刺让人只觉得做作。就好像硬要拍成这似乎很高深又搞得好像蕴含着好大道理的模样，生怕你看懂。,4,推荐,54,0.9999890654360118
2022-11-26 09:55:07,墨墨看电影,"2022年11月25日再看这部电影，太应景了。12年前没看懂，再看懂已是片中人
“懂了，他们谁赢了跟谁！”",5,力荐,49,0.0737721910819978
2022-11-26 22:48:26,路过，嗑一口,虽然黄四郎是杀不完的，但是永远都会有张麻子出现，只是早或晚,5,力荐,29,0.2592000773455704
2022-11-26 22:52:09,是贝拉姐姐呀,多年后回顾，真是一部神奇预言片。片中的种种光怪陆离，在口罩年代不断重演。,5,力荐,20,0.999380153203218
2022-11-30 21:17:42,小熊软糖,"遗憾今天才看过。

今天长者逝世，再次提醒我，书要读。",5,力荐,56,0.9526497135946476
2022-11-30 21:53:34,woodward,在老七离去的夜晚，再看一遍他曾经探班过的杰作吧,5,力荐,62,0.9865199225507044
2022-12-21 18:06:03,杨柳千千wby,据说这部电影可以申遗了，此片的现实意义早已大过影片本身了。生活中谁还没有遇到过要让你证明吃几碗粉的恶毒呢？,5,力荐,36,0.998278298309042
2023-02-19 18:43:05,N..,男凝叙事 爹味重 佳作不代表需要全片故弄玄虚 看看b站评论区的狂欢就明白国民艺术欣赏水平的提高之路还要走很久,3,还行,28,0.999347882157598
2023-06-13 15:01:35,Lynn,比肩霸王别姬 中国电影的丰碑 匪气 义气 侠气 男人磅礴的江湖味儿 底层气息 根植在民族基因里的乡土味儿 恰到好处的野蛮与俗气 幽默与黑色幽默,5,力荐,19,0.9999910290462476
2023-09-01 00:26:55,老羊,当年看的时候，对“让子弹飞一会”理解不深！现在知道，这是“让事情发酵一会”、“让历史沉淀一会”、“让人物表演一会”,5,力荐,43,0.9853372249894804
