2018-01-25 22:33:53,Ecthelion,新年最甜片，看得心花怒放。感情展开不徐不疾、不动声色。光线摄影非常《周末时光》。罗马尼亚小哥真是个天使，晨雾中在两人面前展开的英格兰北部乡村风景把我看哭了。“就想和你在一起”，没别的废话了,4,推荐,2,0.9999999987334214
2018-01-25 23:11:06,sureyangx,哪里是什么断背山，这明明是英国乡村版Shelter啊～看主角在无望的生活中终于等到拯救，真心替他松口气。,4,推荐,1,0.9797118155922004
2018-01-25 23:53:00,雨夜飞行,完美结局版的《断背山》，搅基版的《万物有灵且美》，看完非常满足。拍的演的非常生活化。有的时候真的是，再勇敢一点，幸福就在不远处,5,力荐,15,0.9999999000560637
2018-01-26 01:11:54,season,甜到不行！！！！！！！,5,力荐,4,0.0543438568956229
2018-01-26 20:22:45,不良生,“海边的曼彻斯特”版《断背山》。阴郁、冷峻的云层天空下，却包裹着巧克力一样甜的结局。,4,推荐,72,0.9999859681901826
2018-01-27 00:00:59,蜩,抽掉移民和闭塞小镇的纸片儿背景，就是一个挺BL的纯爱故事，吉普赛小哥用高超的性技巧以及暖男人设感化了一个只会打炮不会爱的冷感动物，同志爱情的阻力也是隐隐存在又无关痛痒。影片最开始铺陈的男主人生选择的迷惘（是否离开小镇），以及父子矛盾最后都处理的很潦草，这一点本来还蛮有意思的。,3,还行,1,0.9999999999637104
2018-01-27 08:09:22,cafor,留点小胡子的小熊真是魅力难挡呀！,5,力荐,5,0.9968404958044832
2018-01-27 11:06:16,西楼尘,你知道如何套上羊皮把小羊救活，如何用茶杯布做奶酪和煎蛋，如何说罗马尼亚的农场绵羊和公鸡。在你面前我蠢得像头牛，不知道如何用唾液治愈伤口，如何用杀菌剂照顾羊群，也不知道如何去爱。这山下风景，萧条农场，酗酒人生，我也能活。但是没了愈合伤口的唾液、空心粉上的盐，没了万能的你，我不能活。,3,还行,1345,0.988517871555734
2018-01-27 20:28:16,Sabrina,知道李安有多强了吧！男人出轨跟一直吃中餐，今天想吃寿司了那么自然简单。感情修复也那么容易。是不是异性恋那么辛苦，是从小用爱情、一生一世、忠贞这些概念给女人洗脑有关啊？,3,还行,30,0.9999989806816348
2018-01-27 21:09:53,ChrisKirk,疯狂接近天的桃源，称为「上帝之国」，纸醉金迷在此有极大的包容价值，欲望的肆意游动不过只是玩乐时间的消遣，因为人人都能得到救赎；但当欲望一旦被贴上禁令的标签，神之人化的状态就相应成立，信仰随之变成一抔黄土，对生老病死产生自然排斥，对所爱之人如昔日言不由衷，而真话是「我想和你在一起」,4,推荐,1,0.9999448987784584
2018-01-28 00:16:41,五斤不过半顿,作为一个洁癖看到他们野战真的很担心且焦虑,3,还行,14,0.9598296102375952
2018-01-28 03:03:10,罚款时间y,虽然有点点复制粘贴断背山的感觉，但我就是喜欢这样的电影哈哈哈，男二实在是太讨喜了我都要爱上他了。,4,推荐,1,0.9820367338002012
2018-01-28 11:53:46,江声走,看到真实的生活困境和自我救赎的努力。,4,推荐,3,0.9995642594615772
2018-01-28 19:08:50,种桃仙子,目前最喜欢的同性恋题材一定是尽可能地剥去所有的社会影响，爱情不再是环境推着跑的副产品，仅仅是两个男人之间的化学反应物理较量。可能是时代的重量早就把人压变形了，如果突然把一切都剔除，只剩下原始的驱动，那么这部片不像断背山，更像CMBYN，只是一个是夏天，一个是春天降临前的冬天,5,力荐,58,0.999878060868114
2018-01-28 20:25:32,生人回避,友情提示：不要在吃饭时看此片……（别问我为什么知道）,3,还行,1,0.8992648956677907
2018-01-28 21:30:40,ANANSII,有些电影看十分钟就觉得是好片子，第五颗星给最后重逢时候男主的眼泪，打到我心里了。,5,力荐,3,0.8942159477914225
2018-01-28 21:55:37,歌辞,上帝之国还是上帝之乡？男主一副比窦娥还冤的鸟样。公举落难必须得有骑士拯救他于水生火热之中，于是胡子天使男二号出现了，他大概是我见到的最快乐的东欧移民。两个小哥都比海报上的样子耐看和讨人喜欢，在同性婚姻合法的年代，努力把老爹农场变成伊甸园吧~杰克苏小公举喝大了一定要管住自己的鸟啊。,4,推荐,5,0.9999987581048502
2018-01-28 22:00:06,发条橙,我抽烟、酗酒、彻夜泡吧滥交，其实过这种糜烂不堪，行尸走肉的生活也是异常痛苦，直到遇见了你，才终于知道我存在的意义以及内心真正的归宿。失去你之后的每一刻我寝食难安，痛苦又挣扎。而最后的我却只想安定。但对于我这样雷打不动的钢铁直男来说，看这样的片子内心是毫无波动的，就更别提共鸣了…,3,还行,3,0.999999774642664
2018-01-29 00:09:34,20个小明≯,全程高糖，暖心又治愈…卡斯选的好，男主把那种愣头愣脑地主家傻儿子别扭傲娇劲演的很到位，男二太帅温柔体贴又善良贤惠，世间怎能有如此可人的极品，羡慕傻里傻气总是犯错但也想变得更好的男主，命太好了！能遇到这么个人，即便生活遭遇变故，但有个人能陪你一起扛，事总能挨过去（现实可就残酷多了,4,推荐,9,0.9999999999738832
2018-01-30 13:33:12,Q·ian·Sivan,▤「I want you to come back. With me. And I want us to be together. I don't want to be a fuck-up anymore. I want to be with you. And that's what I needed to say.」【♫Patrick Wolf - The Days♫】,5,力荐,1,0.0004552157062689
2018-01-30 13:33:12,Q·ian·Sivan,▤「I want you to come back. With me. And I want us to be together. I don't want to be a fuck-up anymore. I want to be with you. And that's what I needed to say.」【♫Patrick Wolf - The Days♫】,5,力荐,1,0.0004552157062689
2018-01-30 15:24:12,固力果guriko,这是爱吗？这是稻草。,3,还行,5,0.8005971289098622
2018-01-30 17:07:37,南生817,BBM同人电影。圆梦成功！情感真挚，男主表演让人信服，胡须男很暖品格完美。现在，爱情片真的不好拍了，什么阻碍都没有了，结尾都可以不必回避的温存了，是几十年LGBT运动的成果，再也不用quit you 了。缺乏真危机稍有儿戏感。,3,还行,1,0.9999999933207622
2018-01-30 22:46:09,淋,看完这部电影，我学会了如何养羊。。。,5,力荐,432,0.9976697114745092
2018-02-01 22:18:38,sarah🇺🇦,太渣，一言不合就出軌，unforgivable。。。不喜歡這個結局。。(邊看邊吃bueno😨,2,较差,3,0.0636414679104969
2018-02-03 20:05:54,巴喆,爱·上吉普赛野马，何况家里还有这么大一片草原。真特么让人羡慕。7.7,4,推荐,55,0.9999881560494034
2018-02-03 22:27:30,墓岛GRAVELAND,"3.5，《上帝之国》欲重新完成一部政治正确的《断背山》，尽管其关于家庭关系的""心照不宣""处理等叙事较为东方色彩，但它令我们注意到二人之间私密的情感—影像与家庭叙事的背反。因此，影片最为精彩的部分则是模仿李安之外的诸如情愫的生成—动物，或所有爱情电影中心照不宣的""汝所何欲""",3,还行,1,0.9999999999999938
2018-02-04 23:34:29,心生,平庸,3,还行,8,0.2999999999999999
2018-02-05 09:05:34,敛月,男一演的不错，男二形象太完美有点不真实，五星给到HE,5,力荐,1,0.9506042344393856
2018-02-06 00:25:27,那片欢城,罗马尼亚大叔驯服小狼狗的故事,4,推荐,4,0.9872771654152662
2018-02-06 03:02:14,KD6-3.7,真的是低配版断背山；立意没那么高，约克郡拍的也很真实；今年3部lgbt电影：cmbyn很意大利&上帝之国拍的很英格兰&120bpm拍的很不法国…很难说更喜欢哪个…,5,力荐,2,0.992022833241555
2018-02-06 03:02:14,KD6-3.7,真的是低配版断背山；立意没那么高，约克郡拍的也很真实；今年3部lgbt电影：cmbyn很意大利&上帝之国拍的很英格兰&120bpm拍的很不法国…很难说更喜欢哪个…,5,力荐,2,0.992022833241555
2018-02-06 20:32:57,La~jum~bo,7.8 六年前，看中一件衬衫，没什么特别，黑色，纽扣是几粒有趣的石头，很喜欢，可最后还是犹豫了没买，直到现在还会时不时想起，不知道那件衣服现在穿还会不会好看，可是错过就是错过了。“I wanna you come back with me”，想要，想爱，就说出来，做下去。当然还有，学会珍惜。,4,推荐,1,0.9999965050216406
2018-02-08 10:58:50,雨宫萤,7分。某一天突然降临的聪慧贤淑能干的男妻改变了颓丧傲娇别扭受丈夫的人生的故事。,4,推荐,14,0.999722645497222
2018-02-08 22:18:51,BBQ,英国版断背山？除了两个男xxoo摩擦镜头（有点辣眼睛），其他像白开水 4.5分,2,较差,3,0.2364048030984362
2018-02-11 00:03:32,Hi Friday,"啊啊啊啊啊啊啊啊我真是好喜欢这个电影啊，有种立刻想写长篇影评的冲动。
打算明天二刷好好捋下那些很戳很戳我的小细节。
那份小甜蜜小温情淡淡地包裹着你温柔的心。",5,力荐,3,0.9999999939759684
2018-02-12 22:24:18,Aesthetic Mass,"2 out of 4: Ok, admit it，罗马尼亚男根本就不可能是重点。和父亲僵持多年的小屁孩在同性恋情中觉醒了与操蛋的命运，家族的印记，幼稚的倔脾气，还有同性恋本身和解的勇气。听上去可以很有意思，当然肯定要比我看到的这个更有意思。糖？不存在的。可不是有个HE就叫糖哦。",2,较差,2,0.9991721553170771
2018-02-13 21:28:16,威锐,很棒，没什么可挑的了,5,力荐,2,0.9355049691737392
2018-02-13 21:28:16,威锐,很棒，没什么可挑的了,5,力荐,2,0.9355049691737392
2018-02-16 16:53:40,匡轶歌,在我个人标准里，男主没有一毛钱值得爱的地方，但男二作为天使一枚，还是为他降临了，并且降临了两次，这可不就是片名所说的“上帝之国”嘛，在上帝没死，好好行使他的意志、认认真真管理的国度，爱情就是这么甜美的。而且LGBT片慢慢不再是一种独立的片型，因为管他同性异性，它讲的无外就是爱情。,4,推荐,230,0.9999999976258104
2018-02-17 00:06:55,shu,觉得将3星的剧本拍成了4.5星，作为处女作，导演功力已经相当值得称赞。可贵的是灵光不灭，罕有的爱和创造的能力得以续存。在整个queer 电影史里，我们太习惯了短暂的孕育，而后彻底毁灭。男一大概就是当前和旧世界的秩序和系统，男二则有着理想光芒，是温和的革新者。,4,推荐,11,0.9999991913495128
2018-02-18 11:04:21,无非,富农公子与长工的同性爱情故事。,4,推荐,35,0.9991058417659266
2018-02-21 12:22:17,恶隐息烙,他是最温柔耐心的老师，手把手教他做爱，也教会他爱、教会他与自我和解。整个故事很流畅（而且很容易移植到国内啊但还是不要了谢谢），但是节奏对我来说实在太慢了……整体上来说感觉看了一部消费升级的精神GV。,4,推荐,1,0.9999999838410334
2018-02-22 17:27:41,lucas流窜地球,于无声处听惊雷。。。一股浓浓的英国土味，看完感觉电脑上都一股牛屎味，然而又可以称之为，泥土的芬芳。,5,力荐,4,0.9695971468680236
2018-02-23 00:39:15,飞老湿,在此片之前论风光有《断臂山》、论文艺有《请以你的名字》，且都有很好的配乐、摄影。论暧昧，有《夏威夷》。但我还是会很推荐《上帝之国》的，因为最后几分钟还是把我打动了，虽然力道大概只是类似美剧《寻》第一季那样的，也还是小感动了一把。,4,推荐,2,0.9999999987769056
2018-02-24 00:08:12,小蝉子,纯净的爱情只存在文字工作者的编辑中，回归人性（兽性）的真实反而更好，至少不会误导我这等小白 人无完人，若能改之，善莫大焉,5,力荐,4,0.999999907756339
2018-02-24 11:50:07,冉笛,男主是有点像只小狼狗，俊美暴戾；男二如果单独一个人也就是普通的路人甲，但奇怪的是，只要和男主在一起眼神身体就会散发出一种感人的气息。看了访谈男二果然是男主与多名待选演员测试化学反应中选出来的。这一部是去年同类题材中最有男性荷尔蒙气息的一部，粗粝不平质地平凡，却有一种温暖持久的光辉,5,力荐,29,0.9999999999941998
2018-02-24 13:06:36,半个桃李林檎,去政治化的同志爱情故事，隔着屏幕也能感受到英国农村的阴冷、潮湿、泥泞和孤独。罗马尼亚小哥牧场活干得真溜，在护墙边一端瓷杯就活脱脱是《断背山》，但少了Wyoming的凛冽和古板；整体(粉红)基调和剧本工整度更像《当我们17岁》。最后，腐国小狼狗的眼神管理值得起立鼓掌。,5,力荐,3,0.9999998396382684
2018-02-25 21:09:10,春日迟,2018观影009，2月份的糖，比CMBYN甜多了。一个暴戾粗糙小狼狗在小鹿眼暖男的驯化下，学会爱与被爱，跟家人和解并找到生活方向的故事。剧中两人都寡言少语，肢体的互动透露出来的信息量比语言大得多，可谓是非常有男性荷尔蒙气息的一部片啦。PS：这是哪的口音，听得我好崩溃，几乎没有几个词能懂....,4,推荐,16,0.999999995644732
2018-02-27 12:07:57,Mr. Infamous,回头看片名，own有了种博大以及私有、私密的意味。粗犷、自然、野性，很少有的质感。广袤土地的寂寥，烧得感情迅猛勃发，而衣服的味道，引来另一重山的追忆。有人读出移民政治，那调转位置的光照，也许更有气度与温度。太年轻的J终归是匹小种马，还是G先生这种全能型选手更具魅力。No.3000。,5,力荐,8,0.9999992041448252
2018-03-02 02:38:27,Giacomolyu,这操蛋的口音,3,还行,4,0.8787812134250719
2018-03-04 23:11:12,齊克斯尼力佐飛,happy ending版断背山。,4,推荐,0,0.4302870876007725
2018-03-05 20:24:54,Jonathan,当他哽咽的说I want you to come back时我真的感动了。故事其实很简单也没有故意把剧情夸大和复杂化，就像英国空旷的乡下，安静又美丽。两个男主上演了剧情圆满的英式断背山，夹杂原始粗狂但真挚的性和冷淡似大不列颠海风却热情似火的爱。我相信某个木屋里就住着这样两个怪胎。,4,推荐,9,0.99999738580776
2018-03-08 16:45:06,RayonVert,一个长着浓密胡子的男人，他是一个尽职的牧羊人，他能让病弱的动物“起死回生”，他能用自己的舌头去治愈他人的伤口，他被背叛（出卖）但依旧选择宽恕………这么多宗教隐喻/对罗马尼亚男=耶稣的影射竟然没看到！难怪片名叫做上帝之国。,3,还行,6,0.9999972769144736
2018-03-15 14:06:14,诸葛福媛,最后的彩色光影让人想到麦田，一扫全片的阴冷，小哥去追回男朋友时勇敢又委屈的小样子真是惹人心动啊~,4,推荐,7,0.9990411009277111
2018-03-16 12:28:22,此号废弃,世界上的一切苦难，确实是更懂事的那个人承担得更多一点。好在最后温柔与懂得都用对了地方，好在孩子气的男人没有最终成为一个混蛋。你应该努力担当，配得上一个互相守望的家庭，配得上一份滋生力量的爱情。配得上你付出的，这才是成长的意义。,5,力荐,5,0.999999997128685
2018-03-20 13:27:32,杉爷,偶尔也在思考，如果说娱乐消遣已经不能满足，那么看电影的原因和意义在哪里？最近好像体会到了一点：一部分纯粹是美学上的体验，无需再放在任何语境里探讨；另一部分则是一种力量，无论是从正面的，还是反面的，在告诉我们，it gets better. Let us get better. ,4,推荐,16,0.999999457193022
2018-03-22 11:32:28,pat-paddy,台词不多，照样可以剧情充实情感饱满。既粗旷又可爱，既邋遢又细腻。罗马尼亚“小王子“双手抱着小羊羔难道不是天使下降来拯救另一只迷途的羔羊么。,4,推荐,5,0.9999928823271776
2018-03-29 10:10:31,ryan,85/7.7 如果armie这cmbyn里的表演能够像这片的两个男主就好了 这种亲密的化学反应成就了无声胜有声的影片。虽然很甜 但还是觉得渣男配不上那么温柔勤劳的胡子哥,4,推荐,4,0.999997403684322
2018-04-01 05:22:25,叶洲,畜牧业操作指南与粗糙性爱展示,2,较差,49,0.8942371870897425
2018-04-05 14:55:48,nikki,#1838#像男二这么好用的人请给我来一打,4,推荐,1,0.4020394456865728
2018-04-06 14:17:12,胡桃园咔嚓女王代表老柴咔了你,不愧腐国，真是不负我望，虽然起始线和背背山相似（羊倌爱上羊倌），但我最烦背背山那种调调，杀GAY不算（都什么年代了还来这招），拍肉还不敢拍，穿着牛仔裤顶来顶去有几个意思？这部一个不落地给我补成了完美，只差在男1是个不成熟的中二病，后面也被萌爆的男2给纠过来了。真佩服演员。,4,推荐,0,0.999309007147964
2018-04-09 12:52:34,MovieManic,前几天去@北京同志中心 观摩的一部影片。导演弗朗西斯·李和两位主演乔什·奥康纳、亚力克·塞克雷亚努对我来说完全都是新面孔。去除掉大城市的嘈杂和喧嚣，故事发生在寒冷刺骨的乡郊，情感的交融与世俗的诱惑无关，源于爱与寂寞、家庭与同情。,5,力荐,2,0.9999999990519236
2018-04-10 17:22:56,alan3396815,感觉1齁冷齁冷的，感觉2先做a后有感情，感觉3这么能干有爱的人，不管是同性还是异性，都是居家好男人。怀揣绵羊的镜头真是暖呀。,3,还行,2,0.999551825523278
2018-04-14 12:23:43,盔酱兮,可以说是渐入佳境了～最后连风景都明亮了起来,4,推荐,3,0.980229848871072
2018-04-15 19:26:49,欢乐分裂,3.5；Won't you meet me at the end of the days?甜美到近乎幻境的上帝之国，续写断背前缘，圆满了多少人的心愿；风物极美，自然主义的情欲流淌，不是每个人都有幸被原谅。,3,还行,9,0.9999989578535872
2018-04-21 23:29:10,最后一代,“You are a Freak”,4,推荐,1,0.3271990641764793
2018-04-25 21:36:49,介意,勞工之愛情！最珍惜接生和取羊皮的鏡頭，真的。,5,力荐,2,0.9985549760066702
2018-04-28 17:13:05,热心市民,4.5 男二好细心工作务实！然家人早已洞悉一切。。。男主踏上行程，我感动到哭崩。“总有一个人，在千山万水后向你走来，让你陷入巨大的沉默，无法动弹”(余秀华),4,推荐,4,0.9995507317056804
2018-05-02 20:21:09,裘笛,映前誤以為是苦戀，沒想到居然是甜到飛起的故事!,4,推荐,5,0.508641142418912
2018-05-05 03:23:33,德小科,三星到四星唯一理由就是HE了…老年人玻璃心真的再承担不起多一点的悲情。 190806 第三刷真的越看越觉得回味无穷爱到不行,4,推荐,5,0.5879333511533918
2018-05-13 23:23:37,mlamr,还是不怎么喜欢，和断背山比差太远了,2,较差,1,0.1076207290185466
2018-05-30 23:55:38,凹凸,一个Grindr资料写着Straight Acting/Pure Top/Looking for Fun的假1遇到了降伏他的男人,2,较差,80,0.2224491124900145
2018-06-14 10:30:28,姜小白,这部电影证明了：「外国人不仅穿秋裤，还是羊毛的」。没被爱过的人，容易自卑，能把性跟爱完全独立出去，以为满足性就够了。可一旦尝到爱情的滋味，本来醉生梦死的性欲体验也就一般般了，眼泪比兴奋要值钱的多。John跟爸爸修复关系蛮感人的，Gypsy小哥的那双短粗的手实在太丑了。,4,推荐,7,0.9999999687241332
2018-07-08 16:59:15,刘小黛,有说是低配版cmbyn，可是明明更好看。泥土的脏和羊的膻代表身体本身的原始生态，冰冷空旷的农场，一窝房车里的基情四射。男孩转攻为受的生理，逐渐承担家庭责任的心理，青春成长的痛和爱都成为美好的一部分。小农夫对牲畜的治愈，成熟道路上的催化剂，结局太暖。,4,推荐,6,0.9999999899618288
2018-07-16 04:53:44,冲刺,男二舔过男主手掌心的伤口时，男主的眼神就像被一辆卡车轰轰隆隆碾压过了心脏。“我想你和我回去，我想你和我在一起”，这两句动听过千千万万句我爱你。,5,力荐,6,0.9795531615008266
2018-08-08 06:06:40,桃叶渡,男二是怎么爱上男一的？还要拯救他两次？如果说CMBYN让我很气的是Oliver最后那么轻易的走掉，那么这片男二最后这么轻易的回来也让我感到别扭。（我可真难取悦。）就想问问导演是不是在致敬李安，给了另一个时代另一片土地上的故事一个Happy Ending。,3,还行,2,0.9988560597158062
2018-08-08 18:16:03,Skyscraper,节奏很平缓，但不拖沓，英国同性题材的电影总是不需要过多的配乐和台词就可以表达的很清晰，男二这么优雅又成熟的暖男怕是不多见。,4,推荐,1,0.9999970707892776
2018-08-28 09:21:10,以吾之名,上帝拥抱的国度，却有着无处不在的同性恋者，作品用一个个例展示不一样的爱情故事，这种情愫的出现，似乎很合乎情理，一个任性撒泼，一个稳重包容，刚好互相补充的特质，爱产生的根源来自于孤独，需要爱与被爱，父亲病后儿子触摸父亲的手、帮其洗澡，才初现端倪，原来父子间是如此的疏远，失去母亲的儿子，更渴望父亲的爱，但父亲的冷漠寡言却将彼此隔开，所以儿子更喜欢男人，类似一种父亲般感觉的男性的爱，罗马尼亚来的男子看的出符合这些特质，做事耐心、稳重、责任心...如此自然就相爱，而这种爱更像是一种依赖，彼此安慰孤独的灵魂。与其说同性电影更多的其实在描绘孤独与爱的关系。,5,力荐,3,1.0
2018-09-02 02:28:33,伏眠,最后一段还是有些触动的,4,推荐,2,0.964641026427246
2018-09-04 23:23:10,基尔,想抱男二这样的像大绵羊一样毛茸茸的男子睡到自然醒 男一就丑多了 （对 我就是爱胡子） 导演估计刷了130遍断背山 很多场景感觉都在致敬,4,推荐,3,0.8774146524865002
2018-10-05 17:39:27,五色石南叶,3.5/5 风景不错，男一长得实在是丑，性格又别扭，男二拯救整部片子的好感度...,4,推荐,2,0.9772663961311752
2018-10-18 00:33:14,偏时差,今天連看三部戲沒想到最喜歡這部，細節和情緒拍得很好，農場生活也還原的很細緻，唯一就是看到他們的激情戲我還是有點吃不消，怎麼搞的⋯⋯⋯⋯⋯😳😳😳罗马尼亚小哥又帅又温柔又会干活太完美了55555,4,推荐,1,0.0384869380182106
2018-10-25 02:33:50,未来派野郎,赤条条的肉体混着冬日农场的泥泞，空气中的冷冽还有嘴里哈出的白雾，碰撞着充满野性的荷尔蒙，真的是gay片最性感和有味道的地方了，断背山和上帝之国，前者着眼在大的，历史社会格局，美国电影的风格，后者更偏向个人成长，欧洲电影阴冷，克制又略带温情的诠释,4,推荐,2,0.999999999777371
2018-10-28 12:19:36,冰块队长,拍摄地点的选取以及养羊的过程挺有意思，但过长的床戏及露屌一幕破坏了原有的氛围，遗憾，3.0。,3,还行,2,0.9999745900015642
2018-11-11 11:20:28,萌发奇想,3.5星！英国版的断背山，但他给了一个很温馨甜美的结尾！,3,还行,0,0.9993585356879376
2018-11-13 21:49:44,mOco,其实最打动我的，是小天使男友在准备晚饭时放在餐桌上的一枝花。沉默却又细腻。,3,还行,81,0.9194009766421204
2018-12-01 18:25:12,肖浑,爱情让粗野闷骚汉变成柔情乖乖男，前面有多脏后面就有多甜，算是同志片里的脏脏包了吧（虽然我也没吃过）。故事特别简单套路，但是加上乡野风光以及直接展示各种牲畜的生老病死，人性和动物性相互一衬就动人起来了，俩男主演得都不错。,4,推荐,18,0.9999972344329192
2018-12-04 01:58:19,左胸上的吸盘,勉强及格。最近最好的gay片，这个英版《断背山》故事极简单，开场先展示一下男一的拔吊无情粗野范儿，继而罗马尼亚吉普赛短工来投，农活娴熟性格隐忍，爱上以后遭遇点纠葛再复合，发展都在预料中，这是部展示状态的电影，摄影师帮助很大，那些手持摄影像在二人中间但又不忍打扰，在山上牧羊的戏码也总能看见山下灯火。将死去的羔羊剥皮，再给没奶吃的小羊套上，如此羊妈就接纳了它，表面看是有趣的牧羊劳作，也是这类爱情关系的一点隐喻。比较遗憾的是，前半段两人恋上的部分对细节把握明显好一些，整个节奏也不紧不慢，而其后复合的部分，是在父亲中风、农场混乱的前提下，那男一的诉求显然有生活上的实际需求，如果说之前的吸引能用细节表现感情进退的微妙，那复合时基于生活需要就该偏向计算或思辨了——这一部分在电影里表现的就笨拙的多了,3,还行,4,1.0
2018-12-07 20:14:26,Clarke,"脑补了“伊朗放羊男子在甘肃牧场找到真爱并扎根创业”的致富经故事...""没落帝国年下与边缘区域年上攻受不明的故事""感觉完全可以写篇论文...",3,还行,0,0.9736210796471308
2018-12-25 14:02:51,瑶瑶,阴霾的天空好像没有晴朗的时候，谢谢你来过，将我变成更好的人。尽管是同性，我要求你忠贞，我要求一个名分，如果你做不到，我便离开。背背山变版，拍的不错，两位男主情，父子情，母子情。胡子大叔好有爱，孔武有力又温柔贤惠。,4,推荐,0,0.9999999673788312
