2019-01-02 11:37:33,张天翼,寡言少语的罗马尼亚天使带来秩序，带来治愈，带来盐的滋味。那眼珠从毛茸茸的眼皮下面翻起来看人真是太美了。“成长”部分有点套路，但演员之间的火花足以点亮一切平庸。记下了摄影师Joshua James Richards的名字，18年最喜欢的片子《骑士》也是他掌镜。,4,推荐,25,0.9999979176520534
2019-01-28 13:14:33,峰峰峰峰,两个男人上山放羊注定要出事，像呼啸的风，像乱蹿的火，化作最温柔缱绻的一个倚靠,3,还行,0,0.9614545707188908
2019-02-03 20:58:47,曼靑,「爱就像一道光照亮他的世界，哪怕这道光离开，他也会努力的把它追回来。」确实很像《断背山》。农场里的两个男人的故事，罗马尼亚男人的出身并不好，约克郡男人作为他的新雇主 开始的时候对他充满了不屑。感谢发酵的过程是他们单独在山上牧羊，朝夕相处之下产生的感情是最美妙的。那一段拍得很甜，约克男人还主动问罗马尼亚男人要泡面的调料包。,3,还行,0,0.9999999997948052
2019-04-28 20:37:40,Ann,"感谢编剧给了团圆的结局，不然我真的要哭死。
电影永远是电影，现实生活中搞砸了可能就真的不能再回头了。",4,推荐,1,0.9998707723884334
2019-05-16 01:03:59,抓住一只錫长安,救赎与被救赎一样，都是在不经意间发生。故事离开了都市，离开了艾滋病，舍弃了一个又一个我们熟知的LGBT影片的套路，回归了乡村的平凡。但与《断背山》相比，《上帝之国》还是逊色和收敛了很多。,4,推荐,1,0.9999999337000912
2019-06-26 11:55:10,滿神的異教徒,两个直男生搬硬凑演示腐国腐女眼中的耽美CP。,2,较差,1,0.8969683800638645
2019-07-19 18:11:09,深情的艾老师,他终于明白了什么是爱 但是教会他爱的那个人 已经离开了,5,力荐,2,0.970093051757092
2019-09-23 01:11:38,落北,啊，这幕天席地原始又狂野的性和爱！,4,推荐,2,0.854059631892119
2019-10-26 13:26:20,群魔將死於盛夏,我总算是明白了为什么萧哥总是：“我要看罗马尼亚小哥哥！！啊啊啊啊啊啊罗马尼亚小哥哥！！！”,4,推荐,5,0.9985531289236014
2019-10-27 01:38:23,nickshmurda,画面优美音乐很动人，两个沉默寡言的人在生活中找到了彼此的默契，结局的转变有些简单，但还是喜欢这个结局。,4,推荐,1,0.9999998478884842
2020-01-17 01:08:57,合纥,最后很温暖，前面很粗犷。,3,还行,0,0.9793860234236378
2020-01-24 04:34:46,荆棘,超爱罗马尼亚小哥在厨房做奶酪的镜头，静静的，甜甜的，和你在一起久一点再久一点。,4,推荐,3,0.9709100757581725
2020-02-26 23:47:50,祝新梨,真心感觉大家对gay片太宽容了，这么轻轻松松就是8.4，不至于觉得此片不好，但实在从讨论问题的深度、人设、现实性等各方面来说都不至于8.4，务农的部分倒还意外真实，比断背山好就真的不敢苟同了......,4,推荐,4,0.9989706756593756
2020-05-03 22:42:36,失语者,"“你就是一只嗷嗷待哺需要被照顾的小绵羊。”“你就是我的依靠我的力量。”
有几个细节把我磕到了。同吸一支烟。在客厅挑逗，胡子男的笑太诱惑了。给约翰的意面撒盐，还给他拌，还自己先替他尝尝味道！走了之后把自己毛衣留下，还给右手袖口剪了个洞！！（这让人怎能不想他！）结尾俩人一起进屋，胡子男开门，让约翰先进门！哇这几个细节我真的服，不刻意，让人一下就能明白，意味深长啊。
有时候我在想爱情真的很神奇，就单纯的产生于荷尔蒙，没有一点点杂念。然后才发现俩人是那么的契合，你做饭我吃饭，你干活我捣乱的。想他就去找他，爱他就去干他。。。这才是爱情该有的样子啊。
看过dbs之后来看的，让我一下心情大好。拍出了自己的特色，对细腻的情节没有一点抵抗力。
",5,力荐,19,0.999999980172232
2020-06-07 17:09:31,云间漫步,看着像牛粪，但是巧克力味的。,3,还行,2,0.8898129146377955
2020-11-09 00:13:53,llyylyy,我好爱这个电影啊，他教会他爱与责任，一点一点改变他,5,力荐,8,0.9957747350009006
2021-01-07 22:20:30,卡尺kachi,"I want to together with  you
大概只有失去了才懂得珍惜。真的好爱罗马尼亚的小哥哥，但是他那个不讲卫生我是真的接受不了。明天我也要去买一块巧克力吃😭😭😭😭甜到了",4,推荐,1,0.9785521299380278
2021-02-09 12:29:26,啊么吸溜,每个时代都有一座断背山，在眼前这个时代，山上开满了小花。PS：请所有钙片的情节发展参考这部佳作！不要洒狗血不要杰克苏！活好话少的暖男忠犬和千里追夫哭唧唧的小傲娇他不香吗！又PS：大哥气质好绝，不管演作家还是演农民都让人想夸他人间尤物，靠在男友肩上落泪的镜头美极了✔ d(๑´ڡ`๑) ,5,力荐,2,0.9999999999980664
2021-04-17 18:16:05,MichaelCera,挺好一小品，Josh长了一张会被情欲困住的脸。,4,推荐,3,0.8803723349470082
2021-05-05 21:49:00,阿默沫,英式乡村爱情，怎么这么有爱～,4,推荐,1,0.9561902041342756
2021-11-22 21:41:06,张苑希,英伦HE版断背山，由内而外散发着生猛且粗粝的美感。情欲在相顾无言中悄然滋长，原野草场山川河流皆是爱的见证，穷乡僻壤幻化旖旎上帝之国。不仅关于爱情，更关乎救赎与成长、自我剖析与人生双重困境的思量。能有内心坚定温柔强大的恋人无条件包容并常伴左右，人生夫复何求呐。,3,还行,1,0.9999999999999996
2022-01-23 12:03:32,吃太多,好难得是甜甜的HE，你的爱是天光，朋友都去大城市了，一成不变的乡村生活一个格格不入留下来的绝望沉默男孩，一个吉普赛人的到来改变了一切，叫吉普赛人就是约翰拙劣地想勾引他，不是真歧视，对比后面酒吧的英国土著，约翰一家还是很接纳照顾小卷毛的，暧昧推拉心照不宣，床戏拍的野生又带劲，农场生活拍的好真实，细腻的镜头语言能读懂所有的情绪变化，其实一见面就看上了吧！基佬从肉体吸引开始的爱情好脆弱哦～看小羊穿衣服开心到笑说对方台词互相骂玻璃fuck off其实是好投缘的一对不是吗？这个年代的断背山当然就要HE！从社会崆峒到两个人大方的提到结婚呜呜呜呜英国真好啊！这不比cmbyn好看多了！！！,5,力荐,4,1.0
2023-06-16 22:33:35,哈,有断背山的痕迹 让它完美的痕迹！抱歉我看过同类题材的只有它！孤独的人儿破烂的人生 人是恒温动物  总需要找点温暖。那只羊羊居然活过来了 太神奇！男二这样的人哪里找。。做奶酪煎蛋拯救动物做意大利面还要帮调味道。片尾仿佛纪录片,3,还行,1,0.9999947531936512
2023-07-04 03:14:50,我不是菜鸡,是我非常respect并且appreciate的同性感情了。场景非常小，祖孙三代，中风的父亲，年迈的奶奶，要承担起农场责任的年轻儿子，和一位短期雇佣工人之间的事情，结局是短期雇佣工和男孩拥有了一段稳定的感情，目测他们未来会一起打理农场。细节非常多，一方面我惊叹于这样就能撑起一部电影，一方面又能列出许多细节，觉得确实能撑起一部电影。围绕男孩成长，承担家庭责任，交叉和恋人的相识，不够珍惜和挽回。我似乎第一次看到两个男人之间的力量感，我觉得他们的撞击和互相珍惜第一次让我觉得这会比男主和一个农场女主人更搭。男人之间不需要太多话（我猜编剧是男性），有时候用身体，有时候用不搭理的眼神，我觉得挺爽的，我感受到强烈的身体力量作为一种表达方式。一些细节特别好，比如男主母亲角色的缺失，恋人做意面尝咸淡，做奶酪,5,力荐,1,1.0
