2014-05-26 20:17:43,雨二厶,3.5 果然最后一幕耳朵还是在整理卡片,3,还行,63,0.9370020894827296
2014-05-26 22:16:26,北辰元凰,gif都看哭了,5,力荐,0,0.7530671934829135
2014-05-27 00:09:43,Gintama,准备的纸巾都不知道擦哪里好。。。。,5,力荐,1950,0.0351339389159978
2014-05-27 00:23:48,二番煎じ,生肉看完4星奉上，一群基佬终于不用藏着掖着了！演自己的感觉一定特别爽！Mark叔人生赢家呵呵呵呵呵和孔雀滚床感觉不错吧啊呵呵呵呵。。。。。,4,推荐,1,0.9998694818158528
2014-05-27 00:51:29,六月物语。,以后不能直视绿巨人了。。。他是要和Loki。。。oh，no。。。,5,力荐,125,0.7321680555534986
2014-05-27 01:01:39,脱氧核糖十三,如果是為了看搞基來的還是收個截圖就撤了吧。沉重壓抑到最後結尾也沒有給出任何舒緩的餘地。抽屜里的名片只會愈來愈多而已，其實直到現在也沒有太多改觀不是嗎？,4,推荐,355,1.5586433288472534e-07
2014-05-27 01:17:24,MissDragon,舞台剧改编的确实很适合飚戏。茱莉亚罗伯茨人到中年以后很适合演冷酷大女人。,4,推荐,0,0.9718390761977644
2014-05-27 01:37:07,浓雾号角.,期望值过高了 全片三星 因为孔雀再加半星 略拖沓,3,还行,2,0.7127909064685469
2014-05-27 07:40:35,同志亦凡人中文站,看着孔雀在银幕上一点点枯萎是今年最让我心碎的电影场景。“同志不是生来不去爱的，他们只是学会了不去爱。”爱上便是飞蛾扑火，生死契阔...,5,力荐,997,0.9999975403365984
2014-05-27 08:53:16,瑾朵朵,CEO表示：无所谓，不吃醋，这就是我的日常！,3,还行,15,0.1501126115254357
2014-05-27 09:25:29,Iberian,"""You never know what is enough unless you know what is more than enough."" 在被摧泪的同时也很反感导演和作者后期强加的那些戏剧化的情节，本来同样的东西放到屏幕上就有放大夸张的功效，于是被大刀阔斧的改编之后整个故事成了一个巨大的emotional manipulator",5,力荐,2,0.9999425218393698
2014-05-27 09:32:54,牛腩羊耳朵,戏剧改编的结果就是数量颇多的对峙戏精彩异常，散落各处却没有很好的与人物发展以及大背景下的政治运动相契合，对于同志政治运动与族群的反思也只触及了表面。不过几位卡司表演实在太棒，绿巨人小细节抓的非常好，孔雀牺牲很大【看着实在折磨人】，谢耳朵本色出演。最重要的是哭点到！处！都！是！,4,推荐,10,0.999999999999714
2014-05-27 12:04:01,Swisspiie,看到异性恋大哥与同性恋猪脚弟弟在医院互抱痛哭的瞬间时我泪崩了,3,还行,35,0.781615089679754
2014-05-27 16:31:11,PPPPPPPPPPPP酱,片中的H堪比GV甚似GV，演员演得也很投入，但是但是仍然让我出戏，怎么看绿巨人叔怎么出戏，叔你以后还是好好演直男吧，后面争取权利那部分演的还是挺让人入戏的。感觉导演想表达的太多了，然后各方面就稍显不足了。违心给个五星，孔雀脑残粉没办法，太让人心痛了。还有说本色出演的我【—哔—】。。,5,力荐,115,0.9999999867171006
2014-05-27 17:18:16,亵渎电影,没料到瑞恩·墨菲这次在镜头上剪的这么碎，节奏上倒是明快起来了，有利自然也有弊，这本应该是沉下来的时代沧桑故事。剧本本身也存在问题，过于的舞台剧了，几乎每个主角都有一场重头的独角戏，反而一群美剧明星在表演上都欠缺了那种触动心灵的力量，不是全怪演技，怪摄影和剪辑。★★★,3,还行,106,0.9999999999947816
2014-05-27 17:34:10,黄青蕉,这种片子你萌也想要我吐槽！良心呢！（说实话故事拍得不算好……三星全给真实历史和演员表演和……孔雀の尺度）,3,还行,20,0.9999484061377256
2014-05-27 17:57:54,白太守,我過去從未過多考慮過我將來會如何死去 但死在我愛的人懷裡倒是一個不錯的選擇 如果再加上幾個不經意的吻 看到最後我整個人都不好了QAQ,4,推荐,0,0.0064305382386256
2014-05-27 22:07:16,今 敏,在众多基佬中演技爆发的居然是茱莉亚罗伯茨,4,推荐,945,0.9216889252412858
2014-05-27 23:27:59,𝙸𝚝𝚜𝚞𝚔𝚒,看的心情好沉重。。。,4,推荐,0,0.8848713052987885
2014-05-28 01:29:07,夺命老登,节奏很快，没有在该放缓节奏的时候去慢慢铺陈。大家都在吵，都在哭，都在挣扎。扔出了很多问题，却至今没有答案。,3,还行,294,0.9948563834363134
2014-05-28 02:17:31,Pius,最值得艾美的演出应该是Joe Mantello 在办公室的大暴发和Julia Roberts 跟卫生署官员的对质。,5,力荐,413,0.7360383384504101
2014-05-28 02:24:39,介意,Men do not naturally not love. They learn not to.用Alexander来做metaphor真是伤心。,4,推荐,2,0.451221940752222
2014-05-28 06:34:16,陀螺凡达可,索德伯格给HBO拍电视电影拍得跟电影一样；瑞恩·墨菲给HBO拍电视电影拍得跟电视剧一样。,3,还行,192,0.9944298105587466
2014-05-28 09:16:39,yutu713,最后病房里的宣誓实在太催泪了，大早上在办公室哭成傻逼。兄弟争吵那段、罗伯茨和卫生署官员对质那段也很震撼。嗯，可以存在电脑里的电影。,5,力荐,0,0.9969068539131948
2014-05-28 12:40:57,甜心老爺叔,不能因为是特殊题材就盲目给分，肉虽鲜嫩但是电影没有想象中那么好，说实话还是茱莉亚罗伯茨的表演在闪光。大嘴女神万岁。 当然你们表打我，我没有其他的意思。,3,还行,1,0.9897736400448706
2014-05-28 15:56:17,Pill,TAT,3,还行,0,0.5
2014-05-28 18:10:35,巽,有点散，舞台剧向电影语言的转换并不流畅，靠演员撑。一开始被误导以为是爱情剧没打算看，后来发现不是，看完发现是DBC基佬兄弟篇。,3,还行,3,0.999592212312584
2014-05-28 20:43:14,华盛顿樱桃树,思来想去还是给四星，是因为这是他们的事，也是我们的事，归根到底是人类的事。事件本身极具情感，而落实到剧本上的感情就有些想当然。政治和情感是两回事，就像现实和影片中，情感无法打动政治，政治也无法约束情感。但感情就是感情，有就是有，无关好坏。,4,推荐,22,0.9999999998525329
2014-05-28 22:04:23,陌生的天花板,导演把故事讲得太散！大嘴朱演技太厉害！不知道为什么找直男来演主角，用力过猛，不管是扮C还是吵架。孔雀的屁股真美～～～,3,还行,0,0.9448988437135666
2014-05-28 22:14:49,Sailor Meow,Dunno what the fuss is all about,4,推荐,1,0.4737672181921908
2014-05-28 22:38:26,熊能能脚不沾地,非常震撼。太好看了。~,5,力荐,0,0.9209967008140134
2014-05-28 22:50:18,又又,哪儿的politics都一样，gay politics也不例外。重要的是见到了孔雀君的美臀，还有正常的谢耳朵。还有，发型真的很重要啊，剃了头的孔雀一点都不好看了……,4,推荐,0,0.9988589743645196
2014-05-28 22:53:58,不良生,Love and Hiv，Bravery and Gay，Beauty and War.,5,力荐,117,0.421874597530976
2014-05-29 03:32:21,水墨川泽,感觉HBO把它拍成了电视剧,4,推荐,0,0.5874547301854296
2014-05-29 09:23:50,terf,看正片之前已经被weibo上的gif透的虐的差不多了，不过看到孔雀开始慢慢枯萎还是有点接受不了。。。但片子要讲的东西我怎么感觉还是有点弱，戳不到心里去。。。也可能是没字幕姐听力太搓了。。。,3,还行,0,0.5586389282191069
2014-05-29 10:49:30,撒拖,看之前基本被透完，观影过程很抽离。选角太显刻意，看演员就完全知道片子会有的效果，无提升感。相比暴怒，MR肢体动作细节表现得更好，并没有所谓的直男违和，而即使是舞台剧，吼叫也真的不是表现愤怒最好的方式，配上近景有点头晕。另外kill your darlings才是因为噱头和题材给4星，这个因为演员。,4,推荐,0,0.9999999687539546
2014-05-29 11:38:31,匡轶歌,总统顾问将门掩上偷偷问话的一场戏太有深意。若不是异性恋阴道性交也有感染艾滋的危机，恐怕同志们早已被“顺势”的清洗到灭绝。能拉到资金支持，展开研究，能进入政策讨论，还要看是否危及到了社会和权力金字塔的顶层：异性恋、白人、男性。So，无论女权群体，还是LGBT群体，大家仍要keep fighting。,4,推荐,1335,0.9999999113459592
2014-05-29 13:44:16,人造人,sheldon,2,较差,0,0.5
2014-05-29 13:44:16,人造人,sheldon,2,较差,0,0.5
2014-05-29 18:06:30,乐,想了半天我都不知道該說什麼。mark演得很好，沒有綠巨人上身，呵呵。一切苦難都會過去的。2014年度最佳电影之一。,5,力荐,0,0.9138795089039884
2014-05-29 18:59:49,大黑骡子,最后快死了结婚时候叫的那句alexander太戳泪点，为孔雀加一星！,4,推荐,1,0.874675927220628
2014-05-29 19:43:01,萨嘎摩多熊猫桑,那些我们并未经历过的他人的经历，那些我们并未感受过的他人的感受。那些你们并未在意过的我们的在意。,5,力荐,11,0.969740200777764
2014-05-29 21:53:30,Jin,剪得有点混乱，节奏也很怪。这个剧情很容易联想到 Milk，但是 Milk 太难被超越了。演得很激动或是减掉很多体重都不代表演技有多好……绿巨人真的是吵得要死……倒是 Taylor Kitsch 的这回演得有点惊人，论突破性还得算他。,3,还行,1,0.8473543504788965
2014-05-29 22:35:59,yolanta,大牌很多，演技有飙起来，但是故事可以讲的更好，中间有泪崩的片段，但总觉得还是少点什么,5,力荐,0,0.9996521157319956
2014-05-29 23:11:15,小本,555555,5,力荐,0,0.5
2014-05-30 09:12:41,野蓠芭,Gay片也看得津津有味，还被他们真挚的基情打动得掉眼泪，说明我正在向腐女转型了。,4,推荐,0,0.9999573288162892
2014-05-30 10:47:41,wuy,浩克战斗属性果然足,3,还行,1,0.7775782680167475
2014-05-30 12:07:27,aiaiaixiahe,本是冲着谢耳朵去看的。后来才知道是个配角。才明白这是艾滋出现的背景。这里面的同志之爱很让我感动,3,还行,1,0.9820914089747586
2014-05-30 13:38:58,李机器人,看到马克和哥哥跑完步之后的对话我特别想哭，马克那点不知道哪里，表现的特别好，看的我泪流满面都不自知。后面虐心虐的要命，孔雀越来越消瘦的身板以及不能自理的生活让人看的好想上去帮忙搭把手。反正，强推。,5,力荐,0,0.9998456457046556
2014-05-30 15:20:03,暗地妖娆,这个是根据舞台剧改编的吧？按时间年限和故事内容来算，可说是《达拉斯买家俱乐部》的前传呐。,3,还行,0,0.7276066110749602
2014-05-30 23:04:31,洛风城,他们都是普通人，和你我没什么不同，只是碰巧不是异性恋罢了。,4,推荐,168,0.7296966082020467
2014-05-30 23:06:58,豆瓣路人己,3.5分。整个节奏在剪辑上明显加快，可是就是因为奇怪的剪辑导致整个电影很片段，一直都不知道电视电影和电影、电视的区别在于什么。,3,还行,0,0.983874999862573
2014-05-30 23:17:42,Jaqen H'ghar,孔雀美到哭泣。是因为舞台剧改编的原因吗，大家有点用力过猛的感觉……孔雀还蛮自然【后期估计是实在没力气过猛了吧……alexander这个梗有点深了，其他还好。,3,还行,12,0.9999873072142909
2014-05-31 04:43:30,兮称,最大问题是编剧，台词俗套平庸，叙事毫无流畅感，演员都挺做作的，请那么多明星扎堆无非是为了博眼球，出来的效果如此违和，一点也不真诚。总之满是失望。像这样的电视电影即缺乏电影的艺术又缺乏剧集的耐心，两头不靠谱,2,较差,78,0.9999438294912844
2014-05-31 06:47:51,LORENZO 洛伦佐,还是拍失控了，前半段还杂乱，后半段的感情爆发又太急促，感觉没有交代完就已经高潮收尾结束，艾滋题材中中规中矩的一部。不过还是推荐大家去看，出柜的电视明星都来了，孔雀也挺催泪。我反而觉得浩克叔最帅，胜似克鲁尼。,2,较差,30,0.999999998819082
2014-05-31 10:42:42,wallace李,"Man do not naturally not love, they learn not to.",5,力荐,0,0.3964903656113859
2014-05-31 11:33:50,解夏。,很多话到了嘴边都不知道该说什么了。,4,推荐,0,0.7206069283799184
2014-05-31 15:24:07,粵語殘片,HBO的电影总能从一些独特的小视角切入，回归大主题。去年的《烛台背后》，今年的《平常的心》，都那么干净有力,4,推荐,0,0.9999969800148262
2014-05-31 15:24:07,粵語殘片,HBO的电影总能从一些独特的小视角切入，回归大主题。去年的《烛台背后》，今年的《平常的心》，都那么干净有力,4,推荐,0,0.9999969800148262
2014-05-31 16:47:01,掉线,【C+】电影太浮于表面了，一个严肃的题材却没能表现出它该有的沉重与情感厚度，无论是哪一方面都显的平庸又矫揉。故事讲得琐碎且没有个重点，节奏和表演更是被剪辑给毁了，瑞恩墨菲就是个不入流的导演，麻烦以后请将这样的故事交给别人拍，让他好好拍自己的美剧就行。,3,还行,41,0.9988225004543136
2014-05-31 17:05:34,卷心笋,大家都演的好棒,4,推荐,0,0.8630530555797126
2014-05-31 21:29:26,pandora刀刀,美的心醉到美的心碎 保持一份平常心 你会发现这不只是一部同志电影 无论社会定位如何 都能被碰触灵魂。关于爱和包容 不要让自己的心蒙尘 推开那些世俗 你会爱的更无畏。关于不平，恐怕这世上除了你自己以外没有人会为你的权益呼唤 所以呐喊吧 ,4,推荐,0,0.999999999246988
2014-05-31 22:16:30,Alex,演员用力过猛并不能震撼人心，另谢耳朵的肢体动作真的好出戏,4,推荐,0,0.9927788853572896
2014-05-31 22:16:30,Alex,演员用力过猛并不能震撼人心，另谢耳朵的肢体动作真的好出戏,4,推荐,0,0.9927788853572896
2014-05-31 23:52:43,\t^h/,政治正确和影片质量没关系，导演连Tom Hooper都不如，Hooper那好歹是有风格的电视剧。,2,较差,2,0.999455350259614
2014-06-01 01:59:39,L.L,想到费城故事·  · ·  却不如费城故事经典·,4,推荐,0,0.9920113085923272
2014-06-01 09:44:04,徐若风,剪辑和叙事都失控，演员拉回来。平常心不仅是社会的，更应是自我的。,4,推荐,5,0.9991938534538254
2014-06-01 10:25:26,荒人,想起一个画面 《荒人手记》里患爱滋躺在病床上阿尧对唠叨的母亲似听非听 伸手将窗外的樱花放到口里咀嚼 生命像沙漏眼看它流光。,3,还行,0,0.9999950766150812
2014-06-01 11:13:14,卡卡的动次动次,沉重,5,力荐,0,0.8085106382978724
2014-06-01 13:26:22,再见皮卡™,jim一出声一秒出戏,3,还行,0,0.7463391301742003
2014-06-01 13:38:41,阿拉斯加,剪辑是败笔，还有一切舞台剧改变成电影的通病，表演也没有特别出彩。,3,还行,0,0.994097141480179
2014-06-01 13:44:05,小周每天都很困,没觉得多好。。,3,还行,0,0.4353569559295878
2014-06-01 13:53:29,基瑞尔,Ryan Murphy这么多年来一直试图在公台借由自己的作品为平台表达自己的观感+说教，这一次他有了更开放的平台，也借用Mark Ruffalo一串串对白完成了这样一个目的。一圈男星中除去孔雀都难逃走马观花的观感，对谢耳朵也是更爱角色本身大于演员，这反倒衬出Julia的精彩表现。,3,还行,1,0.9999964362017344
2014-06-01 17:52:25,艾妮,Sheldon~,5,力荐,0,0.5
2014-06-01 17:56:18,Konec,这（。,3,还行,0,0.5
2014-06-01 21:01:33,zhang 2nd,GAY是当今被拿来开玩笑最多最过分的，这部片子很虐，看到帅气的准超人得病后瘦得不成样子，简直虐到冒冷汗，弱势和被歧视，向来是电影所力撑的,4,推荐,1,0.999990530062511
2014-06-01 21:40:34,呵呵好吗,从来没看过这么彻底的基佬片！,3,还行,0,0.2927961728936072
2014-06-01 22:49:01,朝阳区陆依萍,还是缺力量，没太多惊喜，一直在喊口号，由于是舞台剧改编，台词密度过高，留白太少，加上糟糕的剪辑，如果没有这帮好演员，谁会去看！关于艾滋病，无论谁对谁错，但确实有这样一群人，他们为此付出了惨痛的代价。但愿，一切会越来越好。,3,还行,0,0.9999423073579692
2014-06-01 23:56:58,路米內,"有时候愤怒和抗争的理由很简单，就是为了生离死别，甚至只是别人的生离死别。Why the emotion is so true, but some people just don't see it, feel it, think about it.",4,推荐,0,0.991366957316876
2014-06-01 23:56:58,路米內,"有时候愤怒和抗争的理由很简单，就是为了生离死别，甚至只是别人的生离死别。Why the emotion is so true, but some people just don't see it, feel it, think about it.",4,推荐,0,0.991366957316876
2014-06-02 01:09:21,唐那啥,说实话，演得太差,2,较差,0,0.0653899106627052
2014-06-02 02:33:55,費利,我觉得每个人都应该看一看。,4,推荐,0,0.7069910696508747
2014-06-02 07:43:36,feather,巨人桑演的有点过~~太刻意了~~孔雀好赞！！所以每个演hiv患者的都要瘦成排骨的路线么~~好忧桑~~shelton~~额，依旧强迫症收名片。最神奇的乱入是suv里面的心理医生~~黄医生，留意你很久了！！小短裤很赞哦~~依旧让人看得很绝望~~,4,推荐,0,0.9999990514435227
2014-06-02 10:27:05,冥王星的灯笼裤,人类是多么可怜可悲的生物，打四颗星并不是说有多么好看，而是这些刚经历过性解放的男男女女面临生死时的绝望和呐喊，不得不说演员表现超级棒，有好几个瞬间真是悲伤逆流成河。,4,推荐,0,0.9999999998600012
2014-06-02 11:02:10,困困,一般吧，过誉了。主要部分演员实在是演过头了,3,还行,0,0.8671285194827053
2014-06-02 13:23:14,辽西悍匪,AIDS,5,力荐,0,0.5
2014-06-02 14:40:59,f,绿巨人大赞！everyone deserves award,5,力荐,0,0.9498496491213156
2014-06-02 22:49:44,大星,有几段挺鼻酸的,3,还行,0,0.7403345001674191
2014-06-02 23:49:13,Fan要坚强,这些阴郁的电影啊真是让我越发情绪化。不喜欢Mark Ruffalo的台词语气，连声音都不喜欢。难道他不明白yelling at other is never a solution. 孔雀是真美好。Aunty Julia 大概是我最喜欢的角色了－>酷似犹太人的德国人。,4,推荐,3,0.999995366366943
2014-06-03 13:49:59,糊小宅,"Maybe I'm not one of them, but I do respect them and will always have their back.",5,力荐,0,0.3913225770604588
2014-06-03 14:38:24,JZ,Even love cannot defeat death. Let's take care of each other.,5,力荐,0,0.3474730362549653
2014-06-03 15:16:07,关倪㔻氏,"基佬们果然又来刷高分了
",2,较差,0,0.5110462647379074
2014-06-03 16:02:06,泰尼,"对HBO的电视电影一向期待，几个段落很有力。作品完成度三星，为这个电影的意义加一星。为直男马克·鲁弗洛的表现鼓掌。片名叫平常心，但其实是一颗斗士之心。Fight for your love, fight for your right.",4,推荐,0,0.999999780502436
2014-06-03 16:05:58,张天翼,本来是三星。台词和节奏似乎...差点事儿，那舞台剧式的超大段台词是怎么回事。但孔雀!!!!!!!!!!  哦我的心都要碎了.......,4,推荐,30,0.5732597301719632
2014-06-03 16:38:16,蟹老板,电影政治爱情两头抓 但是一到政治绿巨人就吵吵吵的有点烦 爱情的话是够戳心窝/ 开始以为男二是超人看半天不是 超人比他帅多啦~,4,推荐,0,0.9923459537579972
2014-06-03 22:04:20,阿拉神灯,来看朱丽娅•罗伯茨的，演的太好了，那些乱交滥交的Gay真的该把自己管好了。,5,力荐,0,0.2558528135829461
2014-06-03 22:46:42,可风,电影本身就还好，倒是有不少短评很精彩,3,还行,0,0.8819411295951555
2014-06-03 23:22:58,火包,瘟疫求生指南里的数据说 每分钟就有4个人因艾滋病无法得到有效救治而死亡 所以一点都不觉得男主激进,4,推荐,0,0.9386203542448908
2014-06-04 12:32:15,顺其自然,"Go to hell,fuckers!",1,很差,0,0.4737672181921908
2014-06-04 13:08:59,鴍諌🌈,够一般的，不平不淡不痛不痒，多线混乱。而每个人的表演都贼用力，耳朵母性光辉爆表、绿巨人怨妇附体、孔雀哥哥爱得深沉，估计艾美和金球能拿一堆提名吧,3,还行,2,0.8102282802824929
2014-06-04 17:03:14,frozenmoon,真的没那么好。表演用力过度，部分情节煽情过度。一场战斗的开始，但最终发现基本等于什么都没说。,3,还行,7,0.1644310229390018
2014-06-04 21:17:32,神仙鱼,在《瘟疫求生指南》知道了作家Kramer的这部作品。所以是个悲情的无疾而终的故事，因为写就时还是那个抗争的初始年代。平常的心，普通的心，和所有人一样的心，EQUAL。“可他们为何就看着我们死去”？女人的诉说，Tommy的悼词，N照顾F时的独白，都让人动容。看得很难受，但就像有人说的，更该看到希望。,4,推荐,1,0.9999999998886536
2014-06-05 09:11:35,Fitzzzzzz,有点杂乱。有几位本色演出...,4,推荐,1,0.7126008915783959
2014-06-05 16:44:23,想一口吃成胖子,帅gay爆棚,5,力荐,1,0.9190122987588
2014-06-05 19:21:47,MasterViVi,好题材、大卡司、高期待后的空荡荡。画面生猛、用力过猛、从头到尾的愤怒和压抑，难有余味和升华。马克这直男将gay演绎得真不错，但屡屡咆哮，总让人担心变绿胖；大嘴茱徒有演技角色太单；耳朵软萌到出戏；反而是孔雀做到了不止看脸，最动人柔软的戏份都在他。我还是归咎于导演了。,3,还行,1,0.9999998101992223
2014-06-05 23:15:46,zykmilan,"在抑郁边缘的时候我总喜欢推自己一把。于是我看了今年以来最压抑的一部电影。绝望、愤怒却不停止斗争，不过是为了一个所谓的“normal”。You cry and you cry until you tihnk you can't cry any more, and then you cry some more.",5,力荐,1,0.9020830184163408
2014-06-05 23:20:40,肖浑,三星半，不忍卒看。靠题材和演员支撑，剧情完全抓不住人啊。,3,还行,3,0.3381324027730286
2014-06-06 00:29:47,咯咯精,居然看哭了……,4,推荐,0,0.5538138980970714
2014-06-06 03:57:20,薄荷绿,久久无法释怀啊！！,5,力荐,0,0.4367529263386134
2014-06-06 13:54:37,21,好片，但看不进去,3,还行,0,0.2787901468803888
2014-06-06 14:02:57,LeungChanXXX,太过密集的情绪失控,3,还行,6,0.2897461656577355
2014-06-06 18:23:42,安短,同样是讲同性恋权益，手法就不如《米尔克》那么高明，可能这也是电视电影的弊端吧，大家看这里，更多的是想赚一把感动的泪水，不然何必？只不过需要政治来润色提味，但是不谈论政治,3,还行,0,0.9998704250965116
2014-06-06 21:58:01,拔刀诀,还好，但是还没有到米尔克那个级别。,4,推荐,0,0.6656327201604414
2014-06-07 00:09:08,Supreme小宇宇,电视剧一样的剪辑。很喜欢大嘴在里面的表演，非常精彩。美国在对于同志这个题材还是相当的开放。,4,推荐,0,0.9985212330333096
2014-06-07 01:53:30,NOODLE N NUTS,愤怒而悲伤的绿巨人。从达拉斯买家和平常心可以看出，美国还有很多需要进步的地方。里根，瞬间没了形象。从叙事的角度来看，这不是个好故事。电影一定要讲好故事吗？不一定，如果它能引起观影者的思考和对问题的注意，就够了。希望医学进步，早日攻克艾滋难题。,4,推荐,0,0.9999999078474762
2014-06-07 02:51:11,凛冽的阳光,着实被虐了一把,5,力荐,1,0.8761423299392529
2014-06-07 20:40:39,吸橙,最后太催泪。。。整体还是有缺陷,4,推荐,0,0.3677040558115642
2014-06-07 21:28:07,一蓝,《时代周刊》办公室的再次相遇，Felix回过头定定看着Ned那一眼，好像是在对Ned说：嘿，我等你好久了。。生病真的是一件沉重的事。爱要抵抗生死离别，我看哭了。,4,推荐,0,0.9995826961005844
2014-06-08 00:47:58,阿奇波尔德,前半小时的同志亦凡人电影版让人想走,3,还行,1,0.9305677040594178
2014-06-08 02:19:14,Vincent,全部流于表面 连一个像样的人物都没有,2,较差,0,0.1364206391132215
2014-06-08 02:19:14,Vincent,全部流于表面 连一个像样的人物都没有,2,较差,0,0.1364206391132215
2014-06-08 08:50:45,甲铁城的卡巴熊,T0T,5,力荐,0,0.5
2014-06-08 15:21:39,果樹,冷峻与温情并举。,4,推荐,0,0.8212069158761736
2014-06-08 20:55:28,圣无常,有几段很泪目，有几段很共鸣，感到愤怒和无奈。可是展现的点过多显得有些琐碎。,3,还行,0,0.9965105568603748
2014-06-09 19:09:29,老罗Lazzaro,为争取同志与常人同等权益搏政府一瞥，口号争吵大嚷倒是不少，说服力却是不强。不过这个题材要说好挺不容易，还行。,3,还行,0,0.9997197530934328
2014-06-10 18:03:48,林西拿,耶和华还管不管了！,3,还行,1,0.3406943939483067
2014-06-11 13:12:03,子夜奔腾,无聊,2,较差,0,0.2000000000000003
2014-06-12 15:38:33,插头,"拍的好长啊，瑞恩·墨菲是个神奇的导演,满屏幕的美剧角色啊",4,推荐,0,0.999875594432168
2014-06-13 18:51:02,arlmy,6.13 fight for love,4,推荐,0,0.4476784585098667
2014-06-17 16:20:39,岛上的夏奈,Ryan Murphy导的戏都有一个特点，虎头蛇尾，这部戏也一样，实际上故事在我觉得还没讲完的时候就乍然而止了。但这部戏的卡司实在太强，而且每个人都奉献了最精彩的演技，因此还是妥妥给了五星。,5,力荐,5,0.9646163734307897
