2014-06-17 22:33:13,胤祥,HBO这是每年一部大预算钙片电视电影的节奏么？明星云集，绿巨人的演技真是太棒了！孔雀这是奔着[达拉斯买家俱乐部]去啊，艾美奖认不认这个？总之跟[达拉斯]一样，骂政府很容易。而一部从头到尾人物一根筋，又这么多角色的剧，改成电影难免overact。,3,还行,12,0.9999858695427484
2014-06-20 21:03:38,已注萧,我们今天的自由和权力或许是前人耗费毕生努力争取来的，所以，努力为自己做点事吧，哪怕只是一点点。,5,力荐,0,0.9993411277874352
2014-07-03 11:09:31,米粒,这样一个题材本可以拍得很好，比如达拉斯，但这部显然乱太多了。大部分时间都在使劲煽情和咆哮，都不剩什么空间来把故事说好。当然演员牺牲很大。讲同时期历史的片子可以试试纪录片《瘟疫求生指南》,4,推荐,13,0.9999903244779562
2014-07-09 18:45:52,沉歌,出柜班底。每次看这种别人哭得死去活来的片子才能知道自己的泪点到底有多高。,4,推荐,15,0.9931704651251388
2014-07-11 15:53:13,小捌,Isn't it amazing that Larry Kramer lives to witness his work become a well-received film and people are celebrating what he's fought for all these years. Guess life does come full circle if you fight hard enough.,5,力荐,4,0.0144740959166183
2014-07-12 23:30:46,阿暖,讲的最多的其实是做少数派中的少数派到底多难，我相信电影中的美国对同志的宽容度多过今日中国，最后其实还是要先找到真爱的呵呵。,4,推荐,4,0.9996736270637816
2014-07-13 10:10:48,Morning,神烦男主角爱吵架爱强迫别人做事。谢尔顿的眼睛好亮啊，真是一位好演员。,3,还行,1,0.9979144162293342
2014-07-15 11:24:04,LoVe,本来挺期待的，可是看完觉得不好看。mark演的好。,3,还行,0,0.948181552518966
2014-07-23 15:22:22,砂丁,Too American.,3,还行,1,0.4737672181921908
2014-07-26 18:51:29,野猪佩琦,We can't stop fighting for the ones we love!!,4,推荐,2,0.4218745975309776
2014-07-27 19:24:42,影志,“人们本能地会去爱，是后天磨灭掉爱的本能” 最后半小时戳中5个泪点，年度最佳LGBT电影候选，罗伯茨的爆发戏、患病后的孔雀可载入年度演技。“为你爱的人，永远无法放手”,4,推荐,207,0.99999687649394
2014-07-28 19:03:27,未亚,当电影跳脱了艺术自身的局限而成为试图改善这个世界的某种力量的时候，我认为应当抛开那些形式和规矩，无条件地为其鼓掌。,5,力荐,3,0.9999999937478128
2015-02-01 16:24:20,齊克斯尼力佐飛,用熟脸孔来吸引注意力而已。拍得不好，演得也不好。,3,还行,2,0.4446487845741097
2015-02-11 20:51:10,昆汀的影子,这部电影有那么几场戏的表演是殿堂级别的。深度广度的不敢说有多么出类拔萃，但是严肃程度绝对首屈一指。这也是为什么当初如此喜欢PRIDE却依然只给了四星。在整体自我感觉良好的明知道是HE的励志故事里得不到更多。感觉这几年做同志片的人都特别认真特别花心思，每一部都有出其不意的惊喜之处。真好。,5,力荐,33,0.99999402581028
2015-12-30 01:04:19,Q这一切的一切,乱吼乱叫 用力过猛,3,还行,0,0.3094299027906896
2016-02-21 16:36:41,盔酱兮,看完觉得这是一个凄美的爱情故事，看到孔雀最后生病时绝望的双眼以及最后说I will take you as my true love泪水已经模糊我的双眼。但既然是依托一系列真实事件，我还是希望看到他们屡战屡败又屡败屡战取得的一系列阶段性胜利借此升华主题,4,推荐,1,0.9999995667313004
2017-08-18 17:39:49,托尼·王大拿,真的是没有重点啊，零敲碎打的，虽然表演确实好。,3,还行,10,0.9916179892575616
2017-09-03 12:37:19,抓住一只錫长安,一场比女权运动还为强烈的“男权运动”,4,推荐,2,0.6797669890127915
2017-11-19 20:02:43,山下猫,吵架戏多得堪比国产电视剧。男主角不太讨好。第一个发出警告的是瘫痪女医生，可这条线不太着力，想多看看罗伯茨。男主和伴侣生离死别处我旁边的男生拼命抽纸巾擦泪。我泪目的一幕是女志愿者说她最好的朋友死了，虽然les都说不需要男人，但是她不管，她的朋友死了，“请告诉我我可以帮上忙。”,3,还行,0,0.6697482271579621
2017-12-07 19:21:29,mOco,讲述AIDS曾经被称作Gay-Related Immune Deficiency的时代的故事，但太追求全面，缺乏重点，而且剪辑太碎，节奏迅猛（叙事量过大体量不足的缘故），实在不适合这种沉重的故事。可惜了一群好演员。,3,还行,0,0.9993122340792262
2017-12-20 17:40:34,Patrick方,我一直认为男主角存在表演用力过猛的问题，导致影片整体上不真实,2,较差,1,0.9803266615159124
2018-07-04 23:15:04,懒洋洋,要警惕，你觉得太苦情太煽情的唯一原因是你觉得这些事实，抗争和偏见让你不舒服。政治正确永远不是贬义词，矫枉过正是矫枉的唯一方式。（孔雀太美（爆哭了。,5,力荐,1,0.9999770082480622
2018-12-11 23:41:12,一贫,一切都是流于表面，没见到什么抗争，就看到一帮人在那里吵吵吵。全明星阵容现在看来也就是个噱头而已。。。,3,还行,0,0.3278875089696994
2019-05-05 05:19:42,狼矛,以前看过，记得故事不是拍的特别好，好像有点出戏？就是感觉不太对,4,推荐,1,0.8418119798731395
2020-08-01 18:23:18,浮游剑鱼,平权事业的推进太艰难了，这电影也只是展现了冰山的一小角。平权乃全人类的事业，没错，包括金字塔的顶端：异性恋，白人，男性。永远要铭记，永远不要置之事外。,4,推荐,2,0.9999951719396069
2022-05-21 20:46:45,胖丁桃,疯狂输出观点调动情绪加上丝滑的运镜和零碎的剪辑让观众完全沉浸在感动、愤怒和伤心之中，从而忘记本片其实几乎没怎么讲故事，事件只在争吵之中得意窥见一二，没有完整的拼图，没有线索的交代，更糟糕的是你会发现泰勒克奇和孔雀漂亮成那样却不会演戏。个人比较期待茱莉亚罗伯茨那条线，可惜着墨不多；第一个les姐姐来帮忙的时候是我唯一一个泪点。艾滋这个主题后来被瑞恩墨菲放到姿态里面又讲了一次，那要细腻得多。3.5.马克叔在当年艾美奖上输给本尼我个人不能理解。,3,还行,0,0.9999999999999962
