2006-01-08 05:39:45,影志,那点暧昧不清的缠绵悱恻。,5,力荐,461,0.7123388511779322
2006-01-08 15:33:36,老阿飞—故园,漫延着淡淡血腥气的优雅,5,力荐,515,0.9984018437365314
2006-03-25 18:35:26,nadja,没看完就看不下去了,4,推荐,127,0.4572930781631338
2006-10-07 10:50:19,Lan~die,这毫无疑问是最好的吸血鬼电影。看过本片你会明白为什么有那么那么多人痴迷于Brad Pitt和Tom Cruise。残酷而优雅的Cruise，精致而富有贵族气质Pitt，每个镜头都像一幅画，让人迷恋不已。在残暴和冷酷的世界中善良的路易一直努力寻找着什么，他是块不易褪色的宝石。莱斯塔特则容易汇入大流，深识时务随心所欲。内心深处我当然希望做路易，但理智时则希望莱斯塔特般，因为不朽是需要牺牲的。路易，路易，仍在哀泣... 善良的不和适宜就是这时代的特征，生命是一袭华美的长袍，上面爬满了虱子。,5,力荐,1579,1.0
2006-11-28 11:31:54,funny_vee,除了惊艳还是惊艳，不老而美丽，心中暗藏忧伤。,4,推荐,245,0.9998434330279052
2007-01-02 21:57:07,果酱☮,吸血鬼电影看来看去还是这部最经典，真期待日后有新片子可以超越它。,5,力荐,469,0.9999827329675816
2007-01-18 18:20:00,harumi,太扯了，两个男人，在一起生活了几百年，没有其他伴侣，竟然什么都没发生？,5,力荐,3527,0.6012107110378664
2007-08-23 00:45:58,青衿,我怎么喜欢里面的吸血鬼汤姆克鲁斯远过吸血鬼布拉德皮特呢？,4,推荐,3061,0.9996620822453022
2007-08-25 14:29:19,UrthónaD'Mors,我的最爱,4,推荐,7,0.7790473730968941
2007-09-14 19:23:05,Hey Johnny,整個世界像座墳墓，到處散落的雕像全是她的面容。,4,推荐,12,0.649796137155445
2007-09-19 22:47:41,文泽尔,片子其实是讲永生的，但你们三能不能不要帅成那个样子. 萝莉能不能不要那么萌. 皮特的问题是没学会瞬移和吸墙行走=。= 阿汤哥的问题是吃多了老鼠肉. 领袖安东尼的问题是你自己都不知道自己有什么问题,5,力荐,755,0.9887305847418631
2007-10-21 17:56:59,沉歌,皮特给汤叔提鞋吧,5,力荐,2061,0.4116744987757104
2008-02-05 04:33:23,王小邪,有空好好说道说道这片子,5,力荐,7,0.0692677941802017
2008-04-05 16:16:49,眠去,“郎艳独绝，惊情百年”,5,力荐,107,0.9985451716632924
2008-05-17 14:23:14,seeme | 北北,这个片的元素很时尚，Gay，Loli，歌特，死亡，以及永不休止的探索WhoamI。这部片消除了我对阿汤哥的偏见。他不止会顶个板寸耍帅跳大楼。也终于知道靓汤为什么叫靓汤了。他太美了，看着他对皮特说，you are beautiful，我其实很想告诉他，你的扮相比PITT更美艳。金发映衬下的白皙脸庞，高贵而孤傲。而皮特的脸部线条不够柔美，似乎现代剧更适合他。关于LOLI期的蜘蛛侠妞，比现在强点，但也好看不到哪去。到是演技不错，很抢眼。她卷发洋娃娃造型甚至让我想起了秀兰邓波。关于影片，无须我多说了，是个人都知道,5,力荐,70,1.0
2008-07-01 13:59:14,战国客,暴殄天物啊！攥着三个超级大帅哥就拍成了这样？看不懂~~,2,较差,464,0.4862199250520449
2008-08-16 18:48:21,尼桑，都是尼桑的错,邪魅的阿汤哥太性感啦~~温柔的皮特号美啊~~配上小小的尖牙~~怀念当年的两位美人~~暧昧大好~~,5,力荐,389,0.9999867327594018
2008-09-05 10:09:57,师诗尸,布拉德彼特和汤姆克鲁斯放在一起就足以成为看这部电影的充分理由，汤姆克鲁斯的莱斯特真是极品,3,还行,75,0.9940345001511204
2008-10-02 09:02:16,小耳朵图吗,tom cruise 帅呆,4,推荐,1159,0.932532342816112
2008-10-20 07:05:07,蕾蕾,夜访吸血鬼是通话电影版本里比较完整优秀的一部了,5,力荐,1,0.9997312261795036
2009-01-28 01:57:12,周鱼,好酷的TOM哥 好粉的小P 啊哈哈 有点儿对吸血鬼的思考 也就有点儿 算了算了 给个4,4,推荐,2,0.9995304131380236
2009-05-27 00:51:07,焦瑷,就是一部生死虐恋的基片，俩人孩子都领养了。（毕竟是教母自己都承认的官配）PS：赖斯看完打电话给克鲁斯道歉。说自己之前认为他不合适，这太武断了。,5,力荐,52,0.9268836698258716
2009-08-27 22:39:24,shu,同志片。哈哈，Marcel说但是他们没有make out 啊。,5,力荐,121,0.314678060170353
2009-11-10 21:19:22,方枪枪,比暮光系列更美丽，故事更离奇，情节更曲折，激情更持久，男人更暧昧。解决的确是一个惊喜，绝对让人意外，这个阴谋太可爱的，克鲁斯和皮特这俩人也太可爱，算是吸血鬼故事中最让我满意的一部。,4,推荐,9,0.9999999999727562
2010-02-18 21:05:36,撒旦的表妹,阿汤哥帅出一定境界了~~~情节so so，看帅哥来的~~,3,还行,100,0.9901774302313976
2010-04-22 14:05:36,yuci2,大家的评价都很高，可是我怎么看怎么都是一部真正的同性之爱的片子。关键的问题是拍得还不好！,4,推荐,765,0.9795269254423964
2010-05-06 10:52:22,Lady Raven,重温电影版，莱斯特找到路易就像原著里丹尼尔说的“他迫切需要你的金钱和你的房子，要么就是他和你一样害怕孤独”，不过迫切需要钱和房子的成分似乎大一点😂因为是两小时电影的缘故，在小克出现之前俩人矛盾出现的太快了，而莱斯特能上小克的当也有点降智,5,力荐,0,0.9999969363205664
2010-07-12 19:23:47,韦恩斯坦_李,应该翻译成“吸血鬼轶事”合适，剧情很不错，摄影、场景、配乐、表演等等都不错，几乎颠覆了吸血鬼的传统传说，演绎了一段令人难忘的吸血鬼的前尘往事。在血腥中带着优雅，黑暗的冷峻中又带有丝丝温暖的人情味，看后让人难以忘怀。,4,推荐,1,1.0
2010-11-10 21:49:34,披着人皮的鬼,你刚做吸血鬼的时候数学好么？我小时候数学很好的 日日日日,4,推荐,0,0.9999354822567
2011-01-04 05:31:26,Anni P,"""Do you still want death,or have you tasted it enough?""",5,力荐,0,0.421874597530976
2011-01-29 06:09:39,巨牛侠,的确美轮美奂，克鲁斯比皮特要淘人喜欢，比起皮特的自怜自哀，他的信仰更加的符合人类一贯的精神。,5,力荐,2,0.9999813357806048
2011-02-12 23:08:17,烟视媚行,看过起码两遍，却一直忘了标注。皮特，克鲁斯和邓斯特的成名作吧。当年的两只男人确实长相华美，演技一流。另外居然还有安东尼奥.班德拉斯，第一遍的时候甚至还不认识他。,5,力荐,1,0.9999449248310992
2011-03-31 19:37:05,猫龟🐌,第一次接触吸血鬼文学是在初中，就是靠这部电影成了血族狂热粉丝，现在重新看才发现是基佬恋上炼铜癖的故事。皮和汤所有电影中最帅的角色就是路易和莱斯特，尤其是阿汤，从此再也没那么美过。吸血鬼题材巅峰经典之作.(观影10佳排名NO.9）,5,力荐,0,0.9999999950264908
2011-06-21 23:19:05,豆友1889636,美艳到妖的王子都是死基佬！哼~（MB的汤姆克鲁斯你敢不敢再美艳些！MB的萝莉大叔恋+美艳死基佬+吸血鬼，你们是想活生生萌死妹纸吖~）,4,推荐,115,0.9999802540056034
2011-07-31 23:31:11,诸葛若见,原本以为是部吸血鬼片，没想到是部基片。汤姆克鲁斯看上皮特的美色，将其变成吸血鬼，不过皮特只中意小罗莉邓斯特，于是三只吸血鬼之中穿插着纠结的爱恨情仇，而其他吸血鬼都垂涎皮特美色不能自拔。本片名可叫“ 背背山下的吸血鬼 ”或者 “一代艳鬼皮特传”,4,推荐,78,0.9999999999999734
2011-08-11 21:16:34,流空破刃,阿汤哥是执着攻皮特是别扭受，两个吸血鬼的基情几百年。什么？邓斯特？人家couple收养个小孩不行啊！什么？班德拉斯？那种见色起心的人不要提他！,4,推荐,825,0.9800644556949816
2011-09-12 20:20:13,坦克手贝吉塔,真不知道他们活那么长时间是怎么躲掉人口普查的。。,3,还行,2747,0.2544294661129094
2011-09-18 22:54:59,Invoker,他们站在生与死的界线上，同时又被两者抛弃，世界对他们而言如墓地。而我们，又何尝不是呢？,5,力荐,2,0.9696274397485528
2011-12-26 11:44:28,###疼,"两位翩翩美男。Brad Pitt Tom Cruise 杀死多少女性啊！！！邓斯特当年还是小萝莉啊，有演技，但样貌不够惊艳@@~一个传奇的吸血鬼故事，承接着一个又一个,吸血鬼因为孤独渴望变回人，人却羡慕着吸血鬼的永生。人很多时候丧失了人性，吸血鬼反而还为了那一丝人性存留着。。。。。。",3,还行,2,0.9999999999999998
2012-01-07 17:16:32,微子,故事烂，汤同志三次诈尸尤其雷，即便有两男主HLL的基情也不能给它加分。不过此时靓汤的美貌正如日中天（瞬间把皮特比成了呆傻村夫），最后一笑更是倾国倾城级别的，加一星。,3,还行,43,0.9999807696651976
2012-02-15 19:25:23,芒果,看看演员阵容，难怪说吸血鬼都是帅哥。克尔斯滕·邓斯特12岁的时候就能表现的如此成熟，难怪看蜘蛛侠的时候老是觉得她不像80后。,4,推荐,6,0.999879769913438
2012-02-18 19:20:44,水湄物语,我着实中意这个结局，其实最快乐的还是阿汤哥 -- - -,5,力荐,161,0.99842741508469
2012-02-18 22:25:38,岸辺☆扑克,居然是基片!!!渣攻是个万人迷 一路其实都是靠看上他的基友拯救过来的 还是个双 洛丽塔情结严重 邓斯特我果然还是不喜欢你 既父女又情人的关系..看的我无法愉悦 其实谁比谁高尚 何必都把责任推贱受身上 结尾有点惊喜w 我对吸血鬼这种种族真是天生不来电 有皮特和靓汤都没法迷上 班德拉斯你不能没胡子,3,还行,12,0.9999999998694056
2012-03-10 03:32:00,白月光,我了个去太尼玛惊艳了无论是阿汤还是皮特md只能用惊艳来形容啊！而且这尼玛就是同志片吧就是阿汤你个渣攻一直在追皮特这善良温情受300年的故事啊！妹的大半夜看得我夜不能寐了啊！你们俩真的都美死了！,5,力荐,3,0.9979679153531372
2012-03-26 23:26:29,陆秋槎,小时候看过一部电影，主角是个基佬，基佬找了个男人，但那个男人是个罗莉控。他和萝莉暗算了基佬，就和萝莉在一起了。结果罗莉是个拉拉，喜欢熟女。后来罗莉和熟女一起被杀了，只剩罗莉控孤身一人……,3,还行,1400,0.9984410541191736
2012-05-17 18:59:43,托尼·王大拿,生命是一袭长袍，上面布满腐朽的尸骨；与一般吸血鬼电影不同的是，本片以一种前所未有的态度借以吸血鬼永生这一特质对永生进行了独特的解释，这种态度令人赞叹；阴郁的冷色调摄影，华丽的服饰和略带古典气息而不陈腐的台词所合力营造出的氛围十分出色；结尾的小反转很棒，一种无法抗拒的悲哀的宿命感。,4,推荐,384,0.9999999999999998
2012-05-31 17:17:39,你看起来很美味,对不起我给了这个片子两星，对不起当时苦口婆心劝我看的友邻们。除了最开始就跟郭敬明差不多的四十五度角仰望天空，悲伤的农场主，喝老鼠血的吸血鬼，难看的长发装扮，以及说不清道不明的恋童情节还有断背背，告诉我这个片儿有什么好看的？对吸血鬼题材本来就无感，现在更无感了。,2,较差,27,0.9933556850826296
2012-06-18 23:53:01,兮称,败就败在Brad Pitt的哀怨面瘫像（话说我从未对他有好感，更不承认他有演技），还有不给力的改编。克鲁斯还过得去，小说里我非常喜欢克萝迪娅的多面性格，没想到邓斯特也演得无比精彩，能把成人心理和表情变化演的那么完美的，我想除了她，还有孤儿怨里的那个小萝莉了,5,力荐,141,0.9999564163146816
2012-10-09 13:19:57,Panda的影音,2012.10.09：我猜想，这部电影之所以豆瓣会如此高分，有一部分原因是布拉德·皮特和汤姆·克鲁斯这两大帅男主演。—— 2023.11.11：八月末九月初，看了美剧《夜访吸血鬼 第一季》，了解相关信息，据说原著小说本就涉及同性恋，因此让我想重温十一年前看过、如今有所淡忘的电影《夜访吸血鬼》。一时没看，一拖再拖，考虑到本片1994-11-11上映，不想拖到明年三十周年，就选在双十一的晚上。虽然不像剧版大胆露骨直接，但重温影版的过程中也感受到了同性情愫。个人观感改善一些，三星改四星。P.S.：豆瓣 类型: 剧情 / 惊悚 / 奇幻，IMDb Genres: Drama · Fantasy · Horror！,4,推荐,1,1.0
2013-04-01 21:15:01,同志亦凡人中文站,美，各种美，美得惨绝人寰，好想吸血ing... 萝莉果然能毁灭世界。,4,推荐,160,0.9999922472358026
2013-10-26 22:54:07,欢乐分裂,形式美的极致啊！阴郁，华丽，幽冥，孤独，几大帅哥如大海般深邃的眼睛、苍白肤色下的青筋外绽、或忧郁或不羁的超脱神情，演绎着永远煎熬的痛楚传说； 皮特一般，阿汤哥最棒简直认不出来，邓斯特亦惊艳，班德拉斯才是最帅的！克里斯蒂安·史莱特乍看真像Depp！,4,推荐,113,0.9999999998411636
2014-07-24 12:53:17,木由,嫩嫩哒Brad Pitt完全被妖孽一样迷人的Tom Cruise抢戏了好嘛！初中看了安妮.赖斯的《夜访吸血鬼》，绝壁是恶魔小萝莉的启蒙读物诶！从前对Lestat完全没有感觉，看电影般最后那幕Lestat的华丽回归时心脏都要停跳了！帅呆！（ps：原著里的吸血鬼不是应该没有内脏吗？Louis砍鬼那一段不对劲啊，恶心死了）,4,推荐,34,0.9999999999124398
2014-12-31 13:54:22,DuoDuo🐿️,记得当年买VCD机用它试机器，惹得商场里一圈人围观阿汤吸人血  还被问这是啥片哪儿买的云云 @鸟鸟_carol [偷乐],5,力荐,14,0.995410205220234
2015-01-27 15:03:56,雾港,这世上一定有两个阿汤哥，一个是本片中乖戾华美的噬血犯，一个是摸爬滚打美国刘德华。前者惊鸿一瞥即成绝唱，只好让益发灰头土脸的后者成日霸占着头条了。,4,推荐,555,0.9999962067678304
2015-05-15 21:57:06,冰红深蓝,哥特式的气氛塑造得很有感觉，不过三大帅哥的表演中规中矩，没什么亮点。故事本身也漏洞百出，商业性过强，而且是看过就忘的那种。比科波拉《惊情四百年》差一点，和《唯爱永生》《生人勿进》不在一个水平。（7.5/10）,2,较差,23,0.9999999898417844
2016-11-18 14:35:22,张苑希,感情的世界是真的无法容下三个人滴~不能因为萝莉是个孩子而否认她是个小碧池的事实。其实路易沉迷痛苦百年孤寂也好，萝莉为爱丧命也罢，都不过是自己的选择而已。说到底，人也好，吸血鬼也好，都是无法抵挡漫漫时间长河和无穷无尽的寂寞的。PS.阿汤哥帅到天崩地裂惨绝人寰！！！,3,还行,38,0.9999999999882324
2017-02-01 02:01:04,十一,哎呀虽然到现在还看不习惯那个年代的服饰，但是两个男的都吼吼看呐！,5,力荐,5,0.9300599585577776
2017-03-12 18:09:01,石头星,汤姆克鲁斯美到极致。,5,力荐,67,0.9518064869767988
2017-03-17 14:58:44,元宝宝,我知道西方的吸血鬼都很帅，可是没想到可以帅成这个样子，真让人窒息，年轻时候的皮特和克鲁斯帅的简直不要不要滴。,3,还行,32,0.9995661656127204
2017-03-21 09:13:31,多看电影爱电影,永远的吸血鬼，永远的布拉德皮特！,3,还行,15,0.9903940329332356
2017-04-06 21:13:34,爱情海,皮特不同于其他吸血鬼丝毫不克制的放纵，他始终坚守着作为人的道德底线，一直寻找着亦师亦友的伴侣，以求能够共同生存下去。,4,推荐,36,0.9999644901841568
2017-04-09 11:59:39,请保持高冷,吸血鬼片中的经典之作。,5,力荐,12,0.991664027156958
2017-04-17 20:16:57,蓝色啄木鸟,经典吸血鬼之作，拍的很唯美。,4,推荐,10,0.9987702322063674
2017-06-27 21:06:49,少数派的报告,经典的吸血鬼题材电影，这之后衍生出了好多吸血鬼题材电影、电视剧！我喜欢这类题材,4,推荐,5,0.9999849258340884
2018-01-02 23:29:59,默,挺早的片了，但还是挺好看的，早期的吸血鬼电影还没有给吸血鬼过多的设定，还是有邪恶的一面的吸血鬼，但小女孩吸血鬼渴求长大也是心酸，最后因太阳灰飞烟灭，陪着她让另一个刚变成的女士一起，哎，那偏执的欲望。,4,推荐,141,0.9999999999552036
2018-01-18 20:26:54,皮皮,为了阿汤哥看了3遍，只能说三个男人都太帅了，感觉只有吸血鬼才能这么帅了，另一部可以媲美的吸血鬼电影只有《吸血僵尸惊情四百年》了。,4,推荐,106,0.9999987673216464
2018-02-05 19:42:22,ZWW,看着看着才猛然发现，这这这分明就是一部披着吸血鬼题材的基片！！！！！皮特为了小女孩可以二次背叛阿汤哥，但阿汤哥拼死活下来后再见皮特依旧还想拥有他！这这这……绝壁真爱了！！！好吧，一不小心又看了部基片……,4,推荐,871,0.9989530065876292
2018-02-26 17:06:05,Chloe🌲🔥,汤姆·克鲁斯实在是太！太！太！太！太！太帅了！吸血鬼的气质❤皮特的颜不太适合吸血鬼，克鲁斯的颜是支持我看到最后的动力，讨厌皮特和小女孩👌,3,还行,235,0.9927865277926664
2018-09-16 21:34:32,名字特别酷的人,没有阿汤的lestat，这片子就废了。btw，发现阿汤的微表情迷人到不行，每个眨眼、抬眉、咧嘴都在表达情绪。,4,推荐,44,0.9399723895649972
2019-06-17 02:35:35,Mr. Infamous,很多很多年前看《夜访吸血鬼》，开始迷上这种被推在欲望与人性前端的矛盾生物，也找到了喜爱三位主演的缘由。再往后，迷上班德拉斯是必然的事，20小时后，就要在同一地方看他新片《痛苦与荣耀》了。其实再看，那种打开一个新世界的惊颤淡化了许多，但自己长了十岁不止，总觉那些迷茫、伤痛、麻木，已用另一种形式叠加在心上。放他们越远，越觉得空空落落。离他们越近，越像把自个儿看得清透。@上影节，16日23点看到17日1点，挺有仪式感了。,5,力荐,6,0.999999999999948
2019-06-17 22:49:14,宽松睡裤又如何,很先锋，那么早就开始讨论同性伴侣领养孩子成立LGBT家庭的可能。,5,力荐,68,0.9986584795069546
2020-01-18 20:13:00,纽初阿白井,①当成吸血鬼片来看少了点魔幻，当成Gay片的话小女孩又很多余且可恶。喜欢结尾，为全片的沉闷增添了一丝乐趣。②一直以来都get不到Brad Pitt和Tom Cruise的颜，想不到这次却get到了前者。大概是被那股受了吧唧的反差气质给触到了吧，头发挡住腮骨咬肌之后就会发现那亮绿色虹膜的眼睛还挺好看的。,3,还行,4,0.999999994400306
2020-03-09 01:58:51,晚不安,"布拉德·皮特被设计为故事的讲述者、见证人、一把人性的善恶的标尺，从始至终在身份认同的问题里挣扎。小女孩似乎借鉴了黑色电影中蛇蝎美人的写法，在个体意识觉醒之后弑父，意外使其化作历史的幽灵。至于色厉内荏的班德拉斯，更像是一个功能性的钩子，为极度缺乏能动性的皮特霎时注入夸张的主体性。而阿汤哥，这个造物主，近乎纯粹邪恶的化身，象征着吸血鬼文化本身（而非若隐若现的同性情谊）——一度被排斥为他者，但在最后宿命式地（莫名其妙地）强势重回叙事之中。
《夜访吸血鬼》根本没能力消化自己放置的大量议题，只能用盛世美颜和锦衣华服去遮蔽，用一些耸动的情节去转移观众注意力。所以本片乍一看是鲜美的吸血鬼，但咬开脖子后没一会儿就变木乃伊了。这些本质机械的人物不能让我产生任何共情，还不如重看塔导那解构又有趣的《吸血鬼生活》呢",2,较差,15,1.0
2020-09-27 01:04:17,豆卷儿,10分全给阿汤哥的脸,5,力荐,26,0.1473560019897332
2022-05-15 19:23:56,Zoesun,有一个长线没看太懂，就是莱斯特是怎么复活的，复活之后为什么一直对路易念念不忘......但是，汤姆克鲁斯太帅了，一对比，布拉德皮特简直就是少年闰土.......（闰土对不起....）,5,力荐,26,0.9868909943287962
2022-12-17 11:34:56,卿如晤,"新奥尔良有着复杂的文化基因 — 西班牙法国海地印第安和保守的美国南方。而不知来自于哪一种基因的表达，这里的审美有一种对于鬼魂之类的阴森神秘力量的崇拜。密西西比河的泛滥，频繁的热带飓风，吞噬不速之客的沼泽地，这一切都成为了吸血鬼故事最好的土壤 — 那些对世界保有着渴望和眷恋却又无力承受现实环境的苦难的人们舍弃世俗的肉身和天日，换取了不老的容颜和精神上的永生。

吸血鬼和人之间的关系也启发我，假如把阶级斗争理解为“物种”之间物质交换好像就不会带有那么多仇恨 — 资本家“吸血”的本质原因和吸血鬼一样，是这个“物种”的生理需求而不是因为缺少道德和正义。这个类比可以有很多有意思的引申，只是这里没法展开了。",4,推荐,4,1.0
2022-12-29 07:52:32,生椰拿铁,其实故事还是好看的，就是看得我心理很不爽，不是很懂路易和克劳迪娅为什么那么恨莱斯特，你说你们不想变吸血鬼灭绝人性和无法长大，那你们自己去太阳底下暴晒一下die掉得了呗，不本来也是要死的，没有莱斯特哪里能再活这么多年还对着莱斯特唧唧歪歪啊，也没觉得你俩和莱斯特在一起他咋亏待你们了，总之你们不爽明明可以自己去死，却要祸害莱斯特这个大美人我真是恨你们！还有路易和克劳迪娅的感情我也不理解，可能是因为阿汤哥太貌美的原因，我反正全程没觉得他错，还超级心疼，你说你，咋就非缠着路易呢，我也没看出来他有个啥魅力，那个大方脸凸嘴唇真不好看，感觉演得也一般般，看不出啥情绪和深度，我觉得蛮拉胯的，小女孩虽然讨厌但长得真的可爱，多一星给阿汤哥的美貌吧，后面有一大段没有他的戏份真是可惜，最后在车里那个亮相超级惊艳！,4,推荐,13,0.9999985021346004
2023-01-02 16:05:36,DONT_BOTHER,阿汤哥太美艳了！！！作为吸血鬼获得了永生，对Lestat来说，永生的诅咒是孤独，所以他找到了Louis作为自己的陪伴。但对Louis来说，永生的诅咒是怜悯，他不想杀人吸血，所以他一直都是挣扎的。Lestat享受杀人的乐趣，接受自己的本性，自洽。两人之间也有爱吧，但无奈性格不合…,4,推荐,7,0.9999999972688822
