2021-08-08 02:10:56,汤吉,"太特别了，四重叙事空间，大量4:3的景框画幅，如同翻书一般的观感，书里插图是糖果配色加对称构图，像童话又像油画，引起强烈舒适。
节奏快又不失优雅的从容，就像古斯塔沃的逃亡之旅，该死的仪式感不能少，该喷的香水不能漏，该吟的诗也不能忘，实在没时间了也要记得下次接上。
这样幽默荒诞的外壳却包裹着一个痛苦严肃的故事。
喜剧的内核是悲剧，最后的结局是消亡与孤独。
我对这迷人的破败感真是欲罢不能。",5,力荐,90,0.9999999999999968
2021-12-21 11:00:21,DeckardYang,【5】更加极端的机械性调度从这一部开始彻底显现，他的电影中已然没有“表演”，在此不具备意义，为何要求所有电影必须写实或栩栩如生呢？这是个关于消逝的多重写作，那么看见一具华丽的尸体再适宜不过。,5,力荐,9,0.9996095333267544
2021-12-21 11:00:21,DeckardYang,【5】更加极端的机械性调度从这一部开始彻底显现，他的电影中已然没有“表演”，在此不具备意义，为何要求所有电影必须写实或栩栩如生呢？这是个关于消逝的多重写作，那么看见一具华丽的尸体再适宜不过。,5,力荐,9,0.9996095333267544
2022-01-08 21:34:05,momo,凭什么要人云亦云 我觉得是烂片就是烂片 故事都讲不清 垃圾,4,推荐,9,0.0994253383979415
2022-04-02 15:39:50,⊙,配色，布景和运镜非常奇特，仿佛在玩横卷轴游戏，又像是看一场荒诞的喜剧，不过故事本身真够晦涩的。,3,还行,5,0.9626052365676296
2022-04-05 15:23:16,段云飞走了,"
“在野蛮的屠宰场上，还是有文明的微光存在，那就是人性。”
“生存时仍不忘诗意”，那是那个时代最后坚持的绅士风度和人文情怀。
画面、色彩、构图、摄影、配乐、叙事手法无需再夸，顶礼膜拜!韦斯安德森美学!!!艺术也可以诙谐轻松妙趣横生!想要看重映，大荧幕的纯粹视觉享受。",5,力荐,64,0.9999999999999928
2022-07-05 18:43:27,本味何知,悲剧版虎口脱险，优雅必须写在脸上，靠关系不靠大义，朋友多了路好走。,2,较差,2,0.9968932636903828
2022-07-10 14:40:35,盏盏大人,像做了一个瑰丽精细荒诞喜剧的长梦，梦醒后是在检查站战乱被无人性的枪打死、庞大的财富收归国有、妻子皆失、故友离散，这样的现实。到头来真正属于自己的好像只有饭店里最开始住的那张狭窄的床。,5,力荐,153,0.9992729725399172
2022-07-21 02:48:08,呆呆的槑🐰,我看过画面最美的电影，跟《坠落》一样。三星全给画面，剧情太扯了。,3,还行,8,0.8852500476650857
2022-08-02 20:04:35,庭雲,4.3，故事并没有多吸引人，但是因为轻松欢快，色调优美，节奏感强，所以不知不觉也就看下来了，没有很沉重的感觉。好像是我第1次看韦斯安德森，没有多惊喜，但是确实也风格独树一帜。,1,很差,15,0.9999719118076752
2022-08-18 22:40:22,水瓶座女孩,告诉我！！！不是只有我一个人刷完全片就落得三个字：没看懂！！！,3,还行,41,0.0050252664407001
2022-08-19 00:06:09,杀不死____,导演个人风格极度浓烈的电影。此片就像一个盒装蛋糕，类似电影里的盒装蛋糕一样，非常的精致小巧，充满创意，好看但味道一般。,4,推荐,11,0.9999957975213322
2022-10-06 23:16:05,Chery,一头雾水,3,还行,2,0.988559240027305
2022-12-31 23:32:32,Cairo,“在野蛮的屠宰场上，还是有文明的微光存在，那就是人性。”向昨日的吟游诗人M.Gustave致意。,5,力荐,33,0.9996548264347944
2023-01-17 22:29:01,橘子和白开水,故事有一点黑色幽默，有点悬疑，血腥在的，但是构图和色彩真的超棒。电影的最后，我好像有点点体会到了zero的悲伤。,5,力荐,22,0.9999993031223842
2024-01-12 18:38:30,饿晕的肥鹤,堪称艺术品的电影，剪辑，配色，画面等都高级很多！那一句，无礼是恐惧的表现，记忆深刻！,5,力荐,9,0.999919731365671
