2017-02-08 17:44:38,别人老公,据说很好，虽然我没看懂，但也不敢给低分😂,4,推荐,71,0.1870726533706885
2017-02-11 18:18:16,倩倩啦啦啦,一个感人的黑色喜剧,5,力荐,62,0.967595185529308
2017-02-11 18:50:12,爱情海,"伟大的父爱
父爱重如山
温暖的亲情，令人动容。",5,力荐,53,0.999998391276142
2017-02-16 20:46:03,我lu不会飞,父爱如山，是沉重的，同时也是温暖细腻的。,5,力荐,22,0.9997094924699588
2017-02-17 21:30:23,斑斑点点,喜剧开头悲剧结尾，贯穿着满满的感动。,4,推荐,16,0.9999821066220724
2017-02-25 19:04:46,天然呆,看完以后久久不能平静，因为这部电影不仅仅是表达了父亲对儿子的爱，更让我感动的是父亲教会了儿子一个道理，就是不论在什么情况下，都要有一个乐观的心态，不放弃希望，幸福就会到来,5,力荐,10,0.9999999996754954
2017-03-09 19:28:47,石头星,类似的电影从来都不敢看第二遍，战争太残酷。本片加上亲情，有着表面的美好和幽默，根本承受不来。,5,力荐,128,0.9996242269310956
2017-03-21 21:57:38,艾伊达Ayda,有欢乐、爱、感动和坚持，可以理解为美丽谎言背后的真相，主角的扮演者演的很棒。,4,推荐,7,0.9999997475200616
2017-03-22 21:37:37,普罗旺斯,如果你是一个热爱生活的人，如果你是一个懂得珍爱的人，如果你是一个好父亲，那么这部影片你一定要看。,4,推荐,7,0.9986450577073404
2017-03-23 15:10:37,爱吃糖的猫,生动讲述了什么是父爱如山  片中爱情令人羡慕 希望有人将你当成他的公主,5,力荐,13,0.9997049192507464
2017-03-23 16:52:48,双叶杏子,父爱，感动，希望也会有个人每天每天快乐地叫我公主。类似的电影从来都不敢看第二遍，战争太残酷。😔,5,力荐,9,0.9999799761793244
2017-03-26 10:19:13,甜椒Oli,生活再艰难也要看你怎么过怎么活,4,推荐,25,0.9637186710395416
2017-03-27 09:33:03,仙仙美代子,美丽的谎言，伟大的父爱，很幸运我们生长在和平年代！一定要看，强推,5,力荐,7,0.999997488015274
2017-03-31 22:53:21,然悔悟,这是一位伟大的父亲，为孩子编织了美丽的谎言。为了不让孩子的童年留下阴影。,4,推荐,15,0.9999786790142846
2017-04-01 22:50:09,小痕呀,看的时候一会笑一会哭，善意的谎言真美好，被里面的父爱感动到了。,4,推荐,16,0.9991318654458714
2017-04-03 09:48:09,曜晶75,最让人心酸的喜剧，当厄运来临时你将如何面对。这是一种另类的集中营体验，苦中作乐为了孩子也为了希望。,5,力荐,7,0.9999973104084162
2017-04-06 10:36:26,卡比巴拉的海,最美的谎言,4,推荐,13,0.9699088183026924
2017-04-10 14:29:13,lichol,乐观的态度，持久的爱情，伟大的父爱，忘不了这犹太青年,5,力荐,7,0.9996528355784872
2017-04-10 14:59:36,新桥妖妖,在最深刻的悲痛里创造出人生的美丽片段，是喜剧亦是悲剧。,4,推荐,5,0.9999970937684064
2017-04-10 19:47:57,klzbyxg,在这么残忍艰难的环境下还能有如此乐观的态度，持久的爱情，伟大的父爱，难能可贵,4,推荐,10,0.9999837522110612
2017-04-11 21:45:48,落拓,年龄增长后再看一遍更加能体会到父爱的伟大。,4,推荐,9,0.9828984783916108
2017-04-12 21:36:36,shield,男主是个好丈夫好爸爸，牺牲了自己保护了儿子，非常感人了,4,推荐,21,0.99997487585804
2017-04-12 21:36:36,shield,男主是个好丈夫好爸爸，牺牲了自己保护了儿子，非常感人了,4,推荐,21,0.99997487585804
2017-04-12 21:41:38,花落  思量错,乱世中的父爱，凸显的更加伟大和温暖，偶然间翻来看的电影竟然让我痛哭一次，最善意的谎言正是他最温柔的爱。,4,推荐,10,0.9999980863596044
2017-04-14 17:21:01,炫3D,圭多那“早上好，公主”，小男孩看到坦克，开心的说”真的赢了坦克“，美国大兵站在坦克上对着小男孩说 “来，我抱你”小男孩活着父亲为他编织的游戏里，即使危险，他却开心的生活着，而当小男孩从邮筒的缝隙里看到父亲被纳粹押着赴刑场，却做着鬼脸和夸张的动作时，那双眼睛是那么的清澈。,4,推荐,762,0.9999999966541042
2017-05-03 12:44:24,人气甜辣炸鸡, 没有人的人生是完美的，但生命的每一刻都是美丽的。 无论什么样的灾难降临，只要生命还在，生活始终要继续。 活着，就是最美丽的事。,5,力荐,37,0.9999999960418364
2017-05-03 13:19:06,狗富贵,忘不了父亲被枪毙前的鬼脸。,5,力荐,57,0.8249104303724208
2017-05-04 15:00:06,太夜秋风,"美丽人生
这只是一场游戏。
游戏是会结束的，风雨过后，我们会见到彩虹。",5,力荐,10,0.9997438925312976
2017-05-07 13:12:15,原来是你,伟大的感情，我永远对于这种在令人绝望的逆境中能够保持自己不迷失且为了一个目标可以坚定到最后一刻的人抱有敬意！,4,推荐,5,0.9999575369565123
2017-05-08 23:10:43,穆青,乐观的活着,4,推荐,9,0.9613437649554192
2017-05-15 20:56:05,跬步山里,在这样一个惨绝人寡的历史背景下，这位妈妈勇敢的选择了被歧视的种族，这位爸爸在极度危险的环境里，想出了用游戏来保护孩子的办法，那么勇敢和智慧，让人对面对一切的磨难都充满了勇气！,5,力荐,3,0.9999999965780056
2017-05-27 23:47:48,随意,美丽人生是喜剧也是悲剧，是善意的谎言。,4,推荐,15,0.999641276290576
2017-06-10 10:17:52,不纠结不无聊,原来这种电影被称为喜剧。的确，看起来挺荒诞，全是漏洞，演技也挺差的，不过这个电影表达的情感，人物塑造都挺丰满。我爱那个爸爸，一堆废话的爸爸。还有那个小孩，他一辈子都将生活在爸爸的爱里。,5,力荐,3,0.9999999971823376
2017-06-11 19:21:33,茹影随形,美丽的人生是即使那么悲惨也要大声地笑，人生是笑了才美丽的。,5,力荐,5,0.9993891713257224
2017-06-13 21:57:14,瑷珺,这部电影里，感情能够使人变得这样勇敢，感情能够在泪水里开出光华夺目的花朵，举世无双，耀眼的让人不敢直视。感情，能够让我们，无畏无惧，放下所有。,4,推荐,5,0.9999990712970972
2017-07-03 15:27:30,橙曦羽潞,《美丽人生》 用黑色幽默的手法描述了圭多一家在纳粹集中营中的悲欢离合，展示了圭多对美丽人生的憧憬和在残酷环境中特有的乐观。,5,力荐,4,0.9999999980785186
2017-07-24 20:03:17,LEMON,喜欢影片里乐观的人生态度,4,推荐,18,0.9864358169463056
2017-07-24 20:03:17,LEMON,喜欢影片里乐观的人生态度,4,推荐,18,0.9864358169463056
2017-11-11 21:26:29,淡水无香,最真挚的爱情，有时候真不需要太多的言语，连执手相看都不需要，只是纵身一跃，跟去天涯海角。,4,推荐,8,0.9971621716903598
2017-11-17 00:02:45,長島冰茶,主角现实中也是夫妻真是件美丽的事,5,力荐,24,0.996387820233584
2018-01-08 17:13:10,已注销,父亲用温情淡化了被纳粹阴影笼罩的恐怖。人生在世，美好会永远存在于一个人的信仰和人生选择中…,5,力荐,58,0.9999993068512184
2018-01-20 16:50:01,波波维奇,被感动,5,力荐,44,0.8837920489296636
2018-01-21 11:27:34,蒹葭苍苍,那样的年代，活着已属不易，美丽人生美好愿望，愿世界永远和平❤️,5,力荐,19,0.9999969511373163
2018-01-26 14:32:08,顾盼,以为是喜剧，却看哭了好几次。想到了一个问题，如何做一个有趣的人，大概就是乐观的面对这世界，爱自己以及爱身边的人。,5,力荐,349,0.9999987011769124
2018-03-14 12:05:24,铃铛,没有人的人生是完美的，但生命的每一刻都是美丽的。,4,推荐,124,0.9998123056549956
2018-03-14 14:29:58,河堤上的貓,一般對這種有關戰爭納粹的都不感興趣，總覺得是太黑暗太沈重的歷史，然而這部片父親對兒子以詼諧幽默的方式表達感覺滿有趣的，後面很感人，希望不要再有戰爭發生了！世界和平～,5,力荐,118,0.9313127095836372
2018-04-15 00:34:34,Alain,《美丽人生》之谎言，犹如《沉静如海》之沉默，这未尝不也是一种戴着镣铐跳舞的绝美悲壮姿态；小男孩我见犹怜，但仍觉最后情绪递进仓促没有到位；可能是观前抱着超高期待，也可能是下午的《山椒大夫》花光了我所有的眼泪，这一部竟然成为了我私人观影史迄今为止第一部没有看哭我的二战电影。抱歉三星。,3,还行,30,0.9999999999999928
2018-04-20 17:45:26,尽欢,早安。我的公主。充满温情的一部电影。虽然世界是残酷的，但是还有那么多可爱的人。,5,力荐,24,0.9999653780392208
2018-05-21 22:41:03,小十三,世界再残酷，人生再不完美，总有人能活出精彩，废墟上的雏菊，一样坚强又美丽,5,力荐,42,0.9999998746469808
2018-05-22 07:51:56,橘猫爱吃鱼,父亲的牺牲换给了儿子对这个世界的美丽的期望，是伟大的父爱为儿子创造了美丽的人生。,5,力荐,116,0.999999632515756
2018-05-22 08:58:42,哈哈哈啊啊啊,用乐观积极的态度面对困境，或许结果并不美好，但你留下了希望。“早安，公主！”,4,推荐,25,0.999954599387113
2018-05-23 08:25:38,樱花飞舞时,乐观/生活,5,力荐,25,0.9836012390955656
2018-05-23 11:22:17,一蓑烟雨任平生,希望人们能记住现在的和平来之不易。,4,推荐,16,0.7497099750215445
2018-05-23 19:32:48,小晗要当锦鲤,为了看到阳光，我们来到了世上。为了成为阳光，我们存于世上。”,4,推荐,132,0.9945728033513822
2018-05-23 19:33:41,biang, 拒绝沉默。无数历史悲剧都源于集体沉默。还记得马丁尼莫拉那首诗：起初他们追杀共产主义者，我没有说话，因为我不是共产主义者；接着他们追杀犹太人，我没有说话，因为我不是犹太人；此后他们追杀…；最后他们奔我而来，那时已经没有人能为我说话了。 ,4,推荐,623,0.99999999975271
2018-05-23 20:33:20,快乐人生,"看得温暖而心酸，在纳粹如此残酷，死亡的阴影里，父亲用乐观开朗的生活态度，陪儿子度过童年。
",4,推荐,59,0.9999999959573254
2018-05-23 20:43:35,自由的玩,伟大的爱,5,力荐,24,0.7483050847457626
2018-05-24 00:11:33,grace-xhu,这样的爱情是令人向往的，也是让人忍俊不禁的,5,力荐,13,0.996968626358371
2018-05-24 10:59:28,翠蝶🌸羽生✨💫,不同于以往的二战题材的电影，本片采用了偏喜剧风格来叙述让人感到沉重压抑的故事情节充满了想象力的剧情让严肃沉重的纳粹题材变得明亮起来。,5,力荐,13,0.9999999612070054
2018-05-24 21:29:37,宁宁,没有人的人生是完美的，但生命的每一刻都是美丽的。,4,推荐,21,0.9998123056549956
2018-05-26 09:14:24,潇湘烟雨,很感动，父爱是伟大的，父亲用生命为儿子编织了美丽的谎言,5,力荐,14,0.999992020028516
2018-05-26 11:58:34,👹天神的审判,少爱往往都是平凡却伟大的。为了不给孩子留下心理阴影，他骗儿子说这只是一个游戏。多么坚强善良的父亲啊，用黑色幽默的手法描述了一家在纳粹集中营的悲欢离合，让影片更能抓住人心！,4,推荐,14,0.999999997303408
2018-05-26 11:58:34,👹天神的审判,少爱往往都是平凡却伟大的。为了不给孩子留下心理阴影，他骗儿子说这只是一个游戏。多么坚强善良的父亲啊，用黑色幽默的手法描述了一家在纳粹集中营的悲欢离合，让影片更能抓住人心！,4,推荐,14,0.999999997303408
2018-05-26 23:47:00,如是,沙漠里开出玫瑰，早安，我的公主，父亲的乐观幽默就像黑暗里微弱的星光，珍贵却照亮心灵。,5,力荐,15,0.9999998716075098
2018-05-27 23:59:23,南风,基度永远乐观而善良地解释一切恶意。当儿子问他，商店门口为何写着“犹太人与狗不得入内”，他回答说：也许因为他们不喜欢犹太人和狗，就像我不喜欢野蛮人，我们明天就在我们小书店窗户上写“野蛮人与蜘蛛不得入内”，因为你不喜欢蜘蛛。这是我见过的最平和最智慧的解释，他保护儿子的纯真。,5,力荐,17,0.9983421571471988
2018-10-01 14:56:53,曼仔,嗯。。像这个片儿和肖申克的救赎就真的被过誉了吧- -而且这片儿的结构非常奇怪，生子前后四舍五入算两个故事了。后半段也真的无聊，同样是拍集中营，辛德勒的名单震撼多了。,3,还行,55,0.7129830583125254
2018-12-28 09:20:39,做一头学问猫,悲剧是把有价值的东西撕碎给人看，喜剧是把无价值的东西撕碎给人看。这部电影既是伟大的喜剧，又是伟大的悲剧。纳粹的到来，撕碎了天真的爱情，平静的小幸福。纳粹集中营里，父亲撕开了纳粹疯子的本质，用死尸做肥皂，做纽扣，怎么可能呢？这不过是一场早晚都会结束的游戏！他们不会赢！,5,力荐,4,0.9999999999950908
2019-01-27 21:16:54,伍月,【B】优点和缺点都很明显。全片最大的缺点就是分裂，最明显的分裂就是前半部和后半部。前半部铺垫太过冗长和无趣，顶多算是一个低下的撩妹锦集；后半段编织的最美的谎言却是佳作。可惜的是单看后半段仍呈分裂感，每一幕之间很不连贯。不过人物塑造非常非常成功，那个鲜明而有趣的父亲在那个罪恶的年代，就更显他的伟大。最后的空镜头，什么都没有，只有传来几声枪响，却让我感觉像我自己中弹一般不由自主的浑身寒颤，接着就是一阵阵的痛心——虽然也曾无数次伤感电影的伤感，但这样戳心的观影经历，好像真的是第一次。,4,推荐,10,0.9999998571470436
2019-08-17 02:32:35,spz,片子的前半部分让我几度怀疑我是不是走错了地方…（好特别）  色调大胆但惊喜 和后面布满条纹(条纹睡衣后遗症了)的废墟形成了鲜明对比...     前面的可爱主线就是那一句句 “早安 公主”  无厘头的喜剧影子 在Maria梗的约会上达到了极致.   两处处理简约得很 Less is More  1. 时间的过渡转场（“哐当”一下 就长大了）  2. 转角 - 枪声 - 烟雾 - 渐渐走入废墟的人  有点念念不忘的配角安置：那位老人 x 那个女兵 …     男主的那种性子被一个个情节强化得很鲜明了 只不过前半部分是一直逗人发笑的效果 后半部分每出一次都是一个催泪弹 TT     女主虽然没什么塑造的情节 但是坚定地选择进入集中营就说明了一切 不是吗？   E：他终于迎来了父亲口中的坦克。  ,4,推荐,4,0.9999999999998336
2020-01-03 20:09:51,发条橙,大银幕重温。从今以后我不在的每个日子，都祝你早安、午安与晚安，我亲爱的的公主。再次感叹：罗伯托·贝尼尼真是一位伟大的喜剧演员！,4,推荐,6,0.9999969206460216
2020-01-03 20:38:02,欢乐分裂,"#重看#以意式夸张与写意手法书写一出伟大的父爱（究其真实度与可行性几无意义），以美丽的谎言反衬战争的残酷，在极端恶劣的生存环境中以绝大智慧和勇气营造出一片小小理想国，这个虚构的乌托邦建立于人性中对爱与希望永不枯竭的信仰，因为它们，人类才不至于在这个星球上灭绝。

从开场起就稳妥构筑的叙事细节点，一面迅速立起人物性格，另一面则有效散落于后文展开，并将逐渐沉重的政治气候嵌入其中。从街道上的大人物画像到店铺拒绝犹太人入内，从被涂上“犹太马”的侮辱到日益频繁的“请走一趟”，恐怖就是这样一步步渗入日常。

“早安，公主！”两次广播示爱，一场不再见的告别，用笑着的眼泪告诉你我爱你。“约书亚，这是一场梦。”夜雾中万人骸骨堆前真实的梦魇。",4,推荐,127,1.0
2020-01-03 21:01:41,what'swilliam,4.1星。悲喜交加的美丽谎言。1.喜剧开篇，悲剧收尾，又以喜剧延续，厉害。2.小男孩很灵，完全看不到演技也不需要看到，看到的是一种孩童的天真。相比之下，父亲的演技就显得很“多”。3.那个医生是一个值得讨论的复杂角色。4.我有一个很奇怪的泪点，在书店里小男孩叫的那声”外婆“。5.电影是不是有一个比较明显的缺憾？导演跳过了夫妻二人如何突破阻碍在一起的部分，导致电影被割裂成比较明显的两段，几乎没有过渡。这种多线主题和剧情的电影，比例拿捏最好，情感抒发最完全的，我投票给《西西里的美丽传说》，完美的三线并进。,4,推荐,1,1.0
2020-01-03 21:04:37,Orisonku,上一次看是应该在初一语文课上，当时也没有哭。如今再看，自第二幕伊始便鼻酸：父亲第一次大摆臂走路，儿子第一次躲入柜中，那命运早已埋下的一个个韵脚，仿似一颗颗炸药。纳粹在种族主义狂热的驱使下将“人”物化，而贝尼尼努力在历史悲愤的控诉间微缩小我的动情，从而找回属于有血有肉的个体的真实的感动。在第一幕与最终幕的悲喜潮涨之间，影片始终以诙谐荒诞的构建延伸，数次的虎口脱险与种种巧合为真相蒙上温柔的面纱，作为观众的我们正如被告知“游戏规则”的孩子，不曾直视惨痛的血流和非人的杀戮，只是躲在仅有一条细缝的柜子里窥探这个世界，去触碰那美丽的悲恸，浪漫的伤痕。然后才知道，原来欢笑下的泪水最疼痛。,5,力荐,5,1.0
2020-01-03 21:30:12,恶魔的步调,那红地毯台阶莫非是《海上钢琴师》同款台阶，那广播留声机莫非也是《肖申克的救赎》同款广播留声机……那同款做爱台词在电影院莫非茫然无存？是的。,4,推荐,37,0.9345044434589416
2020-01-03 21:56:16,不脱袜子同学,很多年前看过一次，好像是电影频道，跟文艺中年我妈一起看的，当时觉得很感人，现在更客观了，能看出里面的好来，简单朴实又反套路。,5,力荐,2,0.9999492455333444
2020-01-03 22:35:19,谢谢你们的鱼,被男主角密集的台词逼逼得脑壳疼，不管你们喜不喜欢，感不感动，我不喜欢，也不感动，一个假的要死的故事，配上前后脱节的结构，看的人昏昏欲睡。,3,还行,62,0.9915387570132768
2020-01-03 23:04:14,邓安庆,父亲为保护自己所做的一切努力，日后回想起来该有多痛啊。因为太温柔了，所以太残酷了。每想起一点儿，那痛楚就深一点儿。,5,力荐,42,0.998961584522629
2020-01-03 23:52:01,托尼·王大拿,大银幕重看所带来的情感冲击力远胜曾经的那个15英寸电脑屏幕，最后无法控制住泪腺。但这确实是部矛盾的电影，其中蕴含的简单、美好、残酷下的荒诞与温暖如此真切与强烈，会掩盖住本身的诸多缺点；但一旦意识到这些缺点，又很真心说出瑕不掩瑜并给予忽视。,4,推荐,23,0.9999999918484324
2020-01-04 00:21:34,阿卜,2020年第一部电影。整个在电影院哭成狗，大家哭的地方我在哭，不哭的地方我也哭。在雨中铺下红毯的那一场戏，甚至连老夫都有一种瞬间被击中的心情，真的被浪漫到了！即便隐去了最残忍的那一部分，但其实仍不失悲情，用喜剧的方式来讲述更让人唏嘘不已。,5,力荐,9,0.9999999999962544
2020-01-04 00:42:12,连城易脆,用这样一部浪漫温情的电影开启2020年真的很美丽人生了。任何一部位列口碑或者票房影史巅峰的电影都会被认为所谓【过誉】或者【不配】，其实无论是评分还是票房都是无数平凡的观众们一点一滴积累起来的，还是非常佩服贝尼尼能够想到这样一个极致温情的故事并亲自演绎了出来，两次正步走的画面都让我头皮发麻。映后互动真的挺不错的，大家都非常喜欢那份胶片书签啊，和电影一样浪漫美好。和《钢琴家》正面直接展现纳粹的冷酷不同，本片用最极致的温情去衬托出法西斯的可怕。即便在最残酷的年代经历最残酷的事情，有些美好和善良依然值得用一切甚至生命去守护！！！,5,力荐,43,1.0
2020-01-04 20:19:18,温岭阿浪,"十年前读过一篇短文：俩记者采访一个战后国家。一个记者说这个国家不会灭亡，另一个记者问为什么？对方回答“因为他们在黑暗的地下室生活，还不忘摆上鲜花。有鲜花的地方就有希望。
《美丽人生》这部电影就是如此，相比于多数二战电影的严肃性、批判性，该片一改消极沉闷，着重歌颂乐观积极的生活态度，鼓励人们即便在苦难中也要对未来怀揣希望。
从技术层面上看，该片的一大特色是以喜概悲：全片没有一个泪点，却让人笑着笑着就哭了。
此外，该片的叙事方式较为先锋，说它是古典主义吧，它却没有明确的三幕结构，也没有一处回忆、闪回和背景铺设，全凭时间顺序自然发展；说它是现实主义吧，它又充满夸张、闹剧等个人风格；说它是表现主义吧，它又没那么明显的炫技。淡化悲伤却使观众泪眼婆娑，淡化技巧却成为青史留名的口碑佳作。",5,力荐,7,1.0
2020-01-04 23:01:29,姜小白,大学思修老师放的时候哭倒一片，但没boarding school的背景缺乏同理心，哭完第二天就忘了。现在看像被锤击，前面恋爱的阶段真是太美好了，骑着绿马带爱人走的时候还有春风得意马蹄急的豪迈，因为爱跟被爱而骄傲。后面为了保护孩子策划出一个游戏出来，由衷的理解并佩服犹太人的群体观念，换某个民族早被同胞举报一百回了。参加朋友公司年会，带着几个不打麻将的朋友组队进电影院看的，从书店被打翻就开始哭，哭到后面变笑边哭，拍的太好了，男人最温柔的一面展示的特别好，广播给老婆报平安那幕差点哭晕过去了。虽然我是念的寄宿学校，但如果是被迫念寄宿学校的话我会疯掉。,5,力荐,12,0.9999999999999992
2020-01-05 00:26:39,Morning,和乔乔兔的做法一样，把世界上最重的题材，用最轻的方式处理了，后者运用童真，此作是滑稽表演，这部电影很厉害之处在于很多景是非常简陋的，很朴实的营造出一种小人物家庭喜剧的氛围，谁料到越走越开阔，最后将爱情、战争、父爱一网打尽。,4,推荐,8,0.9999999999999988
2020-01-05 09:35:40,沙鸥,"我不是很能接受严肃题材喜剧化的处理手法，我明白导演以喜剧写悲剧的意图，但我感受不到其中的力量。男主的话痨和只放不收的粗糙表演严重影响了我对故事的共情，后半段的有些所谓浪漫桥段简直是败笔。
给痛苦涂上一层所谓温暖仍不能改变其为痛苦的实质，有时反而会掉入自己编织的迷梦之中，我宁愿清醒而痛苦地走向毁灭也不愿带着不明不白的乐观迎接死亡。
这是我为数不多的无法认同的经典电影，可能以后会有新的感悟吧。",2,较差,110,0.9999999999999882
2020-01-05 09:56:16,斯 琰 🌈 🍭,小孩子身处人间地狱，却活在父爱的神迹中。以喜剧的手法来记录残忍的历史，不厚重也不轻浮，带着“美丽人生”必要的体面与风度，让人笑与哭。剧本极佳。,5,力荐,8,0.9999924839558688
2020-01-05 17:57:07,mOco,2020.01.03没想到还能在大银幕上看到4K修复版。还记得第一次看的时候，因为集中营的游戏，被父子情感动到不行。但这一次被前半段太过纯粹的浪漫给感动坏了，大雨中的红地毯，OMG，怎么可以这么浪漫。“早安，我的公主”！,5,力荐,4,0.999987803335821
2020-01-07 22:48:59,censored dump,3.5/5。一部歌剧电影，巨大的情感能量，浪漫化的故事，前后情绪转换但情节呼应（via奎多的喜剧本能），高光的咏叹调（也就真的用了奥芬巴赫的船歌），甚至是皇族意味的爱称。坦克的出现有着微妙的自反，不是童话战胜现实，而是幸存者的自我陈述。我有被煽到，但我认为，将已被全面研究的二战集中营，放入影片的基调，是很难平息质疑的，男主反复出格惹事从不交代后果（订婚那场突破了我对叙事逻辑的底线），摄影使用大量近景镜头和人造光源，过多的正反打对话，化妆基本不体现惨状，这几点削弱了故事背景的现实性，也就是残酷性，那种非人道灾难与人性光芒的反差，是不能与那几部严肃还原现实的电影相提并论的（可对比索尔之子）。说两个细节：1.老被偷换帽子商人的两个儿子叫贝尼托和阿道夫。2.只有督学吃饭时的一两处画面像是4K。,3,还行,7,1.0
2020-01-07 23:32:45,爱与污秽凄苦,悲剧的最高境界，就是喜剧，就是用戏谑来消解崇高的尘世感伤。圭多迈着搞笑的步子走向死亡的那几秒，是人类历史永恒的伤疤。那个佯装的笑容，撕碎了我们自以为建构起来的所有体面，但是这个世界的美好却被完好无损地保留给了那个孩子，连同1000分的游戏、和一架真正的坦克。,5,力荐,5,0.9999999999983408
2020-01-08 16:34:47,阿措,在电影院嚎啕成全场最惨的一个傻逼。,5,力荐,8,0.8371753982734578
