2020-01-08 19:03:03,关念ヅ,"怀疑最近重映豆瓣高分电影都和我八字不合.....其实不喜欢男主，喜剧小丑式的、一半get不到点的连珠炮般意大利语滑稽话听得我头晕、把孩子用连哄带骗方式隔绝在大人世界外，虽然是个好父亲、好丈夫甚至是伟大的人，但我真的不喜欢，所以连带着整个电影这种和男主一模一样的基调都不喜欢。比如男主编造着复述军官的话，其实是效果很好的，但我想的是“这样不就把不了解规矩的人害死了吗”，本冷酷无情现实主义者还是远离这种喜剧片吧....
ps：居然是97年的片子 比肖生克的救赎还晚三年 我以为至少70s的",3,还行,31,0.99992701371218
2020-01-10 14:41:40,塔塔君Minkun,卓别林式的浪满主义在残酷血淋淋的现实面前是否可以自洽？在我看来是不自然的。,3,还行,21,0.998751217754329
2020-01-11 23:59:02,TimberNord,哭点在广播喊话....,5,力荐,17,0.4062182579401838
2020-01-15 23:23:17,祝羽捷,喜剧的最高形式大概就是这样，一边笑一边哭，一边紧张一边松弛，最后看到了什么是真正的爱和顽强，也看到了丑陋和麻木。,5,力荐,8,0.9998016094122733
2020-04-11 21:27:14,阿七,太失望了。前面耍小聪明的戏精男主看得很不爽。唯一觉得是男主女主进入花房，小男孩从里面出来的转场很棒。男主可太吵了。以乐景写哀情，乐得有点过分了。不喜欢这种话剧电影。,2,较差,8,0.999958681957244
2020-07-08 20:45:59,Jayong,我知道这是一部理想化的喜剧，但我不知道这么理想化，不敢苟同。,3,还行,10,0.045674561763081
2020-07-12 21:36:20,高詩遠,看前半部分的时候以为是一部浪漫的爱情喜剧片，结果到后面被这位父亲的爱深深感动。如果爱是一种谎言那也很美丽，父亲直到战争结束也没有让孩子知道事情的真相。这部电影值一千分。,5,力荐,1,0.999999999930129
2020-09-20 10:49:17,CyberKnight电子骑士,三星半到四星犹豫中……前半段铺垫相当长，充满意大利喜剧的欢闹气氛。从叔叔的马被人写上侮辱犹太人的字迹开始，故事变得沉重。集中营的情节还是相当写意，并不现实化（藏孩子这事就很魔幻）。德国医生一条线极具讽刺性！（但也有些刻意）带娃吃饭一段既惊悚又搞笑。总的说来，底色充满人性，不乏灵光一闪的妙笔，却仍觉得有些轻飘飘。好在结尾一笔非常震撼人心，压住全片。贝尼尼的导演和表演风格显然不是我的菜。,4,推荐,5,0.9999999999999978
2020-12-31 00:16:49,超级英雄发骚友,恕我无法认同这样的所谓经典，我知道导演想用喜剧故事说悲剧的意图，电影结构上前半部分完全是喜剧处理，后半部分试图在如此沉重的历史背景下喜剧化处理就显得非常不妥当，感觉真的很不尊重历史，一想到这就完全无法代入人物情感，那段集中营的苦难史可不是你一个满嘴跑火车的小丑男能hold得住的，即使是喜剧你也不能把那些德军当猪去拍，积极的人生态度并不一定要用如此昧良心的假笑去衬托，否则只会变成廉价的童话故事，况且男主的表演确实不够收敛，用力过猛，完全无法跟周星驰的收放自如相比，周‘的喜剧电影到了结局不会执着于张狂浮夸的喜剧手法，会突然“严肃”起来，柳暗花明又一村，反而会出奇效。父亲给儿子编织的各种谎言，美其言美好，实则为一场走向毁灭的无限月读。,3,还行,8,1.0
2021-01-26 00:50:30,April's,电影前后的氛围对比真得犹如两个片子。乐观浪漫的基度，让我甚至不会去细想集中营有多么恐怖，也让他的离去只不过是犹如烟火绽放的两声枪声而已。影片最打动我的，就是在残酷的战争背景下对死亡和分离是如此看淡自然：基度摆摆手对叔叔大喊了一句“再见叔叔”；踩着滑稽欢快的步子去迎接死亡；甚至女主每次在得知可能发生的坏消息时，脸上除了隐约的担忧，仍有一份从容和坚定；最后妈妈和儿子重逢，儿子欢呼“我们赢了”，旁白音起，影片结束。没有痛哭，没有哀嚎，没有过度渲染时代的悲剧，脱衣，做工，搬铁，每个人都在有条不紊地进行着书写好的命运。那些陪着他在儿子面前演戏的人，同样很伟大。一个反应残酷战争的片子，却如此浪漫，回味无穷后劲十足。,5,力荐,95,1.0
2021-02-09 23:15:40,知足,男主在年轻的时候，给了女主一个美丽人生，在犹太人集中营的时候，给了儿子一个美丽人生。（PS：男女主现实生活中也是夫妻，圭多既是男主，也是导演）,5,力荐,56,0.9999999968205064
2021-02-19 11:10:30,Jasmine_长乐,很多人吐槽这片子不真实，其实这个世界不仅需要现实题材的电影，也需要如此浪漫主义的电影，正如这个世界需要更多男主这样能带给大家希望的人。可叹的是，永远乐观、善良的人，往往在默默独自承受着这个世界的丑陋和恶意，不会把这些宣泄给他爱的人。,5,力荐,74,0.999999999998719
2021-08-09 00:35:38,high -spirit龙,“记着要给爸爸报仇……”🆚“爸爸一直是爱着你们的”,5,力荐,24,0.9914120266506528
2021-08-17 22:20:12,消失,这是最伟大的反战电影 没有之一,5,力荐,32,0.8886539985957095
2021-08-19 23:26:33,今晚看电影,今晚电影不推荐《美丽人生》，前半段简直就是叽歪滑稽的白日梦人生，偷东西+诈骗+小聪明的主角光环？后半段也没有拍出时代背景下的反差效果，失望，非常失望，BTW话痨≠有趣。,2,较差,15,0.9827024110103042
2021-08-19 23:35:01,店长,前半段是美丽，后半段是人生,5,力荐,146,0.991635496268322
2021-09-25 14:42:21,色彩斑斓,男主神叨叨的表演看得我头疼.. 几度看不下去，故事太假了吧，高分到底怎么来的,1,很差,34,0.0943100449483113
2021-10-27 20:26:09,窃窃私语,因为看过钢琴家，所以即便知道这部片子的基调本身没那么沉重反而十分诙谐，我也觉得他能带着儿子活到最后十分的神奇。然而结局的那几声枪声却又让我不可置信，我所以为的巧合、算计、主角光环统统消失了，他在那一刻不再是神通广大、浪漫幽默的父亲、丈夫，而只是一个苦苦挣扎却没能见到黎明的犹太人。,5,力荐,230,0.999999999984228
2021-12-14 16:51:19,多餘的人,可以浪漫 可以温情 但不可以失真,3,还行,21,0.8076379761415875
2022-01-28 23:30:37,观影旅团,如果这是个真实的故事，我也许会给四星——问题是这不是啊！现实中哪有这样的美丽人生、坦克游戏，在二战中这样的犹太小孩根本不可能幸存，影片严重美化了战争，美化了种族主义和民族沙文主义。,2,较差,16,0.9999998186676318
2022-09-10 03:13:19,曌,看完之后热泪盈眶的一部剧，孩子的世界里父亲用爱的牺牲换来了一场1000分游戏的胜利 ,5,力荐,25,0.9999666365892872
2023-01-16 16:32:08,我以为,所有歌颂犹太人苦难的片子都应该拒绝,1,很差,46,0.988498011875789
2023-01-26 20:08:37,alasaka,我更感动的点是，她们戏外是真夫妻，一见钟情并且妻子主演了几乎所有导演导的电影。真宠妻狂魔。,5,力荐,16,0.9999999634932172
2023-07-05 18:05:05,厌火城主,这种当科幻片看就行，啥时候吹犹太人苦的时候都别忘了，鸦片战争就是这帮孙子往中国倾销的鸦片,1,很差,31,0.9982713942088584
2023-07-05 21:00:03,船头捞月亮,就连同在集中营的其他犹太人也在为乔舒亚编织美丽的谎言😭,5,力荐,31,0.9999425409203502
2023-07-24 17:07:50,风祭,前半段还觉得演的略浮夸，可是后半段真的只有这么乐观积极社牛的人才能营造出这么美丽的梦,5,力荐,40,0.9990460809093328
2023-10-13 19:01:39,豆友PNbPj5yJlI,犹太猪洗白片，果然有钱就可以为所欲为颠倒黑白👍👍👍,1,很差,56,0.7885194486946547
2023-10-18 13:22:04,momo,补。原来是洗白片，有钱有权就可以在全世界范围内为自己包装，想想我们自己，侵略国有照片还不承认历史呢，原来是因为我们老钟的铁拳不够重，抗日神剧能不能长点心，看看别人怎么拍片的,1,很差,25,0.4060554033766026
2023-10-20 16:03:23,海本,这只是一部假的电影，却是巴勒斯坦人真正的现实。很难过，愿加沙平安！,1,很差,19,0.8790194653186986
2023-10-20 18:56:27,开心最重要,但是我看了巴勒斯坦父子被以军击毙的视频，一个是真实的视频而这是一部电影，讽刺,1,很差,21,0.9979428166499532
2023-12-09 23:30:29,闹钟一响我就起,"学向日葵鞠躬，鞠得太低的向日葵会枯死。你是侍应不是下人，上帝为人服务，而上帝不是下人。
一部浪漫的童话，一场痴迷的梦境，每一声公主，都是我为你有预谋营造的情急生智
前一个小时是为妻子打造的美梦，后一个小时是为孩子打造的天堂",5,力荐,12,0.9998191077707924
2024-01-06 18:38:29,元气bear,最后一辆坦克从转角开出来 小孩漂亮眼睛里的惊喜简直溢出 大兵停下说hi boy  我的眼泪瞬间掉下来,5,力荐,17,0.9997484472412914
