2019-02-12 12:53:53,Elanor,"有人说《美国往事》是一部讲男人的电影，这样说还是片面了，那些兄弟情责任感其实每一个社会中的人所需要承担的社会期望都是相通的，只是男人女人承担的责任的表现形式和范围可能有所不同。
前些日子在同学朋友圈看到关于“侠”的定义，非常赞同，大概是说侠是一个人夹在人群中应该保有的气节和风骨。一开始所有人都想夹在人群中依然能站的笔直，一身正气两袖清风，人人起初都想成为Noodles，却越来越像Max，只是max太贪婪了。max和noodles以及他们的朋友们在纽约的艳阳下的感情是真实的，多年后在那间屋子相遇时他们的感情也是真实的，只是彼时两人早已不是一类人了，有的人重感情，有的人被利益诱惑，但你能说有绝对的好人和坏人吗，其实都没得选",5,力荐,40,0.9999999999985444
2019-06-03 05:40:00,大熊,最烦这种又是爱情又是友情又是黑帮又是人生，说了一大堆，然后没一个重点。剧情恶俗，除了脱裤子强暴性幻想，就是岁月不再往事如烟。喊着“史诗级大片”的口号，用着“史诗式”的布景，拖着冗长的时间线试图表达“史诗般”的时间长河，弄到最后还是逃脱不开少男们第二性征的萌芽，像极了辣鸡老板给画的饼。,2,较差,233,0.999411547057738
2019-06-25 08:11:01,LORENZO 洛伦佐,重看补标。配乐太多了，摄影中规中矩，叙事舒缓，最厉害的是化妆和布景......黄暴部分不喜欢。,4,推荐,14,0.9999255193942672
2019-07-26 20:59:08,思路乐,【Great】251分钟导演剪辑版，感叹莱昂内在多个维度上把电影拍到了极致：极致的影像感官调动，使其不仅仅局限于视觉与听觉；在缓慢有序的节奏下，一切往事回忆都被竭尽所能的还原并赋予生命，让其不再只是“回忆”；几乎不可能用理性思维去概括、论述或是总结的电影；而在感性上，这部电影所给你的直观感受也会随着岁月流逝而不断变化。综合来看，如果你想追求“电影感”的答案，那就去看《美国往事》，因为那里有你所想要的一切答案。,5,力荐,19,1.0
2019-10-31 13:29:27,Infinitezoe,两场强暴戏严重消化不良，“男人必看电影”学的是兄弟之间的友情衷心，绝不应该是所谓“偷窥”“深爱”，然后得不到就强行夺走。男人的成长难道就必定建立在木偶女性的牺牲上？,3,还行,70,0.9999999475365724
2020-02-24 15:25:38,火娃,8/10。重温。道具设计旨在传达内在情感：黛博拉鄙视卫生间偷窥的面条让他照照镜子，随后面条一伙照镜自视，转身又碰到镜子，隐喻情场碰壁，黛博拉面对镜中苍老的面条不停涂抹妆容，她无颜面对往事。面条和麦克在电梯外和解决定共赴海滩度假，看向二人的黑衣男子和祭奠禁酒令那夜棺木状的蛋糕，预言了麦大的阴谋和好友的死亡，麦大的怀表见证着纯真的毁灭，搅拌车化为黑暗中的两盏车灯代表了两位逝去的梦想。调换警长儿子的育婴室和面条约会黛博拉的海滨酒店，两处白色的场景既是对腐败警察的调戏，也映射了黛博拉诀别态度的清冷。视觉层面上大烟馆的皮影剧、储藏室的梦幻舞台、火车站的转场、街角弃置的汽车部件和绒毛厂的追杀，均给人留下浪漫怀旧的基调，但雄性气息的渲染（用枪管触碰女人的乳房、排队掏出下体让卡罗确认抢劫的人）在侮辱和物化女性。,5,力荐,10,1.0
2020-03-06 21:10:37,连城易脆,4个多小时的片长看完估计不少人血条都快空了，然而据说原片得有6个甚至10个小时，但坦率讲你并不觉得有多少冗余的内容，毕竟几乎是一个人的一生浓缩进几个小时内。导演通过1921年1933年1968年整整3条时间线交织用数个鲜活的角色将美国禁酒令那个黑帮风起云涌的枭雄年代描摹得跃然纸上，开头迟迟不间断的电话铃声直接贯穿三条时间线，极为牛逼的叙事操作。如果仔细回忆会发现主要几位女性角色都是先和Noodles发生关系后再和Max发生关系，可见Max一直以来都对Noodles心存嫉妒，可能街头斗殴时那里真的被弄伤了？留下影史惊鸿一瞥的康纳利所饰角色始终都是相对世俗的一方，而亲眼目睹伙伴死在自己怀中的Noodles则至始至终理想主义。国家不幸诗家幸，禁酒令是美国历史上一道沉重的伤疤，却对电影艺术多有滋养。,4,推荐,157,0.9999999999999892
2020-03-20 21:01:09,看桥的人,我偷盗，嫖娼，放火，杀人，强奸，调包婴儿，背叛好友，但我是好男人😊 @2019-06-26 21:18:03,1,很差,66,0.9332428211108896
2020-07-12 11:07:21,内陆飞鱼,人生太虚幻境，声色犬马皆无，一脚踏空，生死茫茫，多情应笑我，早生华发，一管鸦片消愁，明朝梦醒处，兰舟催发。,4,推荐,54,0.959564429113523
2020-07-23 00:03:16,初音求道大帝,"9.9分，教科书式完美的电影。在爱奇艺上观看4个小时的导演剪辑版，不知为何画质时好时差。除此之外各个方面都堪称优秀，而且没有任何缺点。
这是我标记的第2000部电影，至此，我也正式成为了一名刚入门的影迷。
竟然还有人说看不懂剧情，阿这…",5,力荐,9,0.9999307094424036
2020-07-27 16:00:52,沸海鲸歌,下次再见到标榜“男人必看的XXXX”我就该直接绕道走，何苦自讨没趣，两场强暴戏看得我极度反胃，完全没法和这群视女人为玩物的男主角们产生任何共情。,3,还行,298,0.0918452784963492
2020-09-12 20:15:22,去斯万家那边,终于断断续续地看完了。大量镜头都流露出一种无敌的臭男人露腋下式自恋感，长镜头不停地渲染和怀旧，节奏有问题，相当一部分冗长赘余，似乎完全放弃了剪辑，题材滥觞，窝实在不喜欢这套。其次，这个男主应该能入选我讨厌的主角类型top3，片中女性角色都是树立男主痴情、义气，惹人爱形象的工具，都这样了，实际树立起来的却都是这些形象的反面，尤其痴情，好多地方超级猥琐，男主强奸完女主后那一脸受伤的表情让我深深迷惑：好家伙人家求你住手的时候你没来深情不舍这套，完事来戏了？多年后相遇不道歉竟说：你戏演出名堂了吗？你的演技这么差。？强奸犯要当，艳遇绝不放过，痴情的名号你也要占。利益不放过，义气的名号你也要占。说男性必看，因为男的喜欢看男的陈述过去有多牛逼有过多少女人，装逼地黯然一笑表示老子一生虽精彩但也有遗憾吗？哈,4,推荐,110,0.9999999999999998
2020-11-28 17:31:22,武奕虹,"虽然因为跨度太长，诸多细节已记不清，但是我还是甘愿献上五星。
这电影太适合下午两点开始看了，入戏时阳光灿烂，落幕时夕阳沉沉。很多人说这是个黑帮故事，其实我感觉黑帮压根不是重点。这几个人可以换成各种职业，不变的是人心。
黛博拉这个人我实在不太喜欢，为了成为top进入上层社会，割裂了亲情和爱情。家里工作忙不愿意帮忙，哥哥潦倒不关心，嫌弃混混不能带给自己美好未来，最后还是倒在了权钱之下。试问，max和noddles，两人行为身份有何区别？max有多恶心是有目共睹。
为什么说本片是男人的电影，因为他完全是站在男人意识形态上的，女性朋友不用太愤懑，这是一个男人的梦。
再回首，只看见过去的自己注视着你，开口竟是无言。",5,力荐,61,0.999999999980692
2021-04-10 19:59:06,嵇澹,男性视角集大成者，大师级别的叙事手法将男子气概歌颂成神话，也无怪乎本片多年来常在男性圣经的经典中占据榜首。两场强奸戏，尤其是后者的观感令人窒息，并非出于女性主义立场就不能容忍强奸的存在，而是该情节纯粹为服务于塑造并美化男性有毒的爱而设置。在这样的基调之上，女主角甚至全片的女性角色都是功能化的工具，无一例外被用作性魅力的展示或性崇拜的他者。圣女和娼妓的两极在被物化的路径中殊途同归，都是女性被男性观看时焊死的面具。舞台妆面具的卸下是随着年华老去性价值的丧失，也是被迫刊落构想的身份后接受男主角怜悯的俯瞰。随着弥散的回忆碎片兄弟情的往事一幕幕拼回原貌，原来是疯狂的爱而不得，暗影对光明取而代之的病态占有欲。世界之巅的大宴宾客掩盖着将倾的索多玛城，流连回顾不会化作盐柱，却不再拥有对回忆的独家阐释。,3,还行,115,1.0
2021-08-11 01:14:20,弥呀,其实叙事风格很喜欢，但果然是史诗级直男癌，Noodles放火、抢劫、强奸、杀人，无恶不作，但到老了都觉得自己是个好男孩吧。,3,还行,53,0.9893612246823198
2021-09-22 08:28:11,猫某人,非常不理解为什么这种片和教父这种犯罪片会称为男性必看？？把女性仅视为欲望的对象 充满直男癌的幻想 无感。我不会喜欢一个喜欢这种片的男生,2,较差,138,0.999996350121852
2021-11-08 00:50:10,Carter,导演用了极具情绪化和个人化的手段想让观众与Noodles共情，可是两段强暴硬生生地把一大批观众抽离出所谓的“回忆的美好”。通篇我只看到一个烧杀抢掠的纽约青年，在做错了每一件事情后，仍就用那溢出屏幕的testosterone去假惺惺地忏悔。 两百多分钟只觉得是在对我处刑。,3,还行,27,0.9999999576209636
2021-12-19 20:54:45,中央空调,多年以后 当面条面对成为不可回收垃圾的麦大时 他将会想起在鸦片馆梦到自己和狄波拉在一起的那个下午,5,力荐,19,0.1099138272021535
2022-03-27 12:54:39,Kensnow,从教父到爱尔兰人到美国往事，美国黑帮片我从来都欣赏不来。感觉套路都是一样的：从小摸爬滚打一起长大的挚友最后背叛了自己。将近4个小时的片，要么节奏很慢，要么很黄很暴力。尤其是对女性的物化，让从不打拳的我都感到很不舒服。,3,还行,17,0.9999998121104304
2022-04-02 23:37:05,笑忘書,全片讲的其实是欲望的故事。你们也许真的很厉害，真的可以成为好莱坞影星，真的可以站在国家议会上大放阙词。你们有权有势，你们野心勃勃，你们翻手成云覆手成雨，但是我真的不喜欢。我只是最简单的noodles，一个无可救药的小混混，喜欢甩不掉的街头味，喜欢和兄弟一起游泳，喜欢开着车冲向大海。这一切让我舒坦，让我神清气爽。然后很自然的，公平的社会会让你们掠夺走我身边的一切。然而到了最后，当一切事态于岁月流逝中不可避免地破灭的时候，还是有一缕烟，能让我从斑驳的回忆里没有声音地笑出来。,5,力荐,131,0.99999998037848
2022-04-04 22:20:27,快乐小神仙,三十多年后的重逢，Noodles褪去了热忱，变得平静，Max依然还是那么功利，而在这场重逢里，Noodles始终没有叫过一声Max，一直尊称对方Mr Bailey，并告诉对方：It's just the way I see things. 其实Noodles也始终还是那个Noodles。另外，少女Deborah真是迷人。再另外，理想主义敌不过功利主义，但理想主义万岁。,5,力荐,18,0.3043798702884877
2022-04-04 22:20:27,快乐小神仙,三十多年后的重逢，Noodles褪去了热忱，变得平静，Max依然还是那么功利，而在这场重逢里，Noodles始终没有叫过一声Max，一直尊称对方Mr Bailey，并告诉对方：It's just the way I see things. 其实Noodles也始终还是那个Noodles。另外，少女Deborah真是迷人。再另外，理想主义敌不过功利主义，但理想主义万岁。,3,还行,18,0.3043798702884877
2022-05-28 23:32:02,09,突然想起了上野千鹤子老师讲的女性的分离支配：“圣女”和“娼妓”，只不过是一枚硬币的两面。这部片作为男性视角研究素材很恰当。,4,推荐,20,0.999999977372387
2022-10-04 16:34:47,해영이.,美国版东八区的先生们，唯一优点就是导演拍得好，简单来说就是一坨华丽的屎。这种片总会有放荡且无脑的女性，她们就像是一个物品，像挂件一样装饰男人们，而那些流氓一样的男性们成为了主角后，低俗就被换成了风流倜傥，就算代入到那个时代，身为女人我依旧觉得很抗拒。在剧情上，我看完只觉得很荒谬，四个小时的时间，友情和爱情、事业没有一个是完整地表述出来的，不是很理解为什么这种片子能有这么高的分数。,2,较差,41,0.9999999827905992
2023-01-14 23:14:21,废话运动员,"看完没有觉得这电影很牛很经典或者给我什么留下什么感觉/思考。也许是因为这是一部男频电影？而且我不懂为什么这是美国往事。刚看到影评说是改编自小说，是小说作者根据自己在禁酒令时期的故事写的名为《流氓》的小说，我感觉小说的名字更符合电影给我的感觉——混混们的一生。
感觉是因为中文名起的太宏大，电影的英文名叫once upon a time in America，就没有中文名给人的“美国的历史”的感觉，而是“美国曾经有一个这样的时期”（禁酒令时期的美国某个社会截面），就更为准确了。",3,还行,14,0.99999999999999
