2023-01-11 16:26:26,会花光的金子,小人物的荣耀时刻，真人真事改编，但感觉就像AI拍的流水账，工整而无趣，无时无刻都在突出的励志主题，看得人有点无感,3,还行,1,0.5346680022747073
2023-03-20 16:47:51,touya,哪怕一次就好，哪怕只有十几秒，实现理想那一瞬间什么都值得了。三星半,3,还行,0,0.9583212779201904
2023-03-25 11:01:05,好像一段呆木头,讲述了一个资质平平的普通人，坚守梦想进入儿时支持橄榄球队的故事。影片像童话一般，很多美国主旋律的片子，都有这样的观感，把个人的私事、经历、困惑、梦想抽出来提纯，让观众更直观地感受，更容易利用剧情来操控情绪，现在看起来比较糙，比如讲述鲁迪怎么努力学习，怎么努力进入球队，就是演出来的，观众只是get到他努力就行了，至于遇到什么困难，付出怎样的代价，学习到了什么，观众不会懂也不在意，他们只需要最简单的情绪宣泄就是了。话说回来，在这个叙事体系下，虽然有些地方理想化，比如队友们从反感到支持鲁迪，有些地方又很真实，一个陪练，上场就是胜利，不至于是一球成名那种片子。当时的主旋律还是不错的，现在的片子，一言难尽,4,推荐,0,1.0
2023-07-20 23:54:51,zsq777,只有卷王自己觉得还不够，旁边人已经被卷si几波了…在国内的话可能没人会帮卷王上场吧🥹 换一面说，一心一意，机会自己把握住，没有机会自己创造机会,4,推荐,1,0.9969214869409168
2023-09-14 01:25:56,Decadent,"补个标，，，
看了的励志片还是有不少，但说不上来，这一部是唯一让我感到很厌恶恶心的，，，从影片所呈现的来看，屁都没细讲清楚，也没什么主角努力的付出，更多的好像是在没头没脑地死皮赖脸地赖着，喊着口号“我要证明自己”，大哥你的努力过程呢？坚持梦想固然是可贵的，但努力是嘴上说说的吗？然后主角每当到偏离梦想的时候就开始经典的道德绑架别人，，，片尾还出奇的尬。
从头到尾，主角更像是一个不懂变通，成天喊口号，不懂得为人处世，情商极低，给自己塑造可怜又努力的人设的人。与其说是展现人努力的励志电影，倒不如说是在教人如何厚着脸皮的赖着，如何费劲口舌地恳请别人的怜悯。。。",1,很差,3,0.9999997949515332
2023-10-17 08:58:48,阿三,"1993年的体育励志片，属于比较少见的体育励志片。

男主没有任何成就却获得了广大赞誉，甚至人生唯一一次上场比赛也才27秒钟的垃圾时间。但恰恰这样的平凡人带给我们的感动更不可思议，为了一个卑微的小目标而不惜一切，每天而努力，哪怕早已有自知之明，但万一呢？有些努力注定徒劳无功，但还要往前冲，带给其他人以榜样。这是漫长的人生，全片过去一小时才开始涉及橄榄球。

有一点点煽情过度，但还算真实；电影本身其实还是典型美式主旋律励志片，不过这种色彩明亮温暖的片子依旧鼓舞人心。

尼采曾写道：只要我们有目标，一切皆有可能。

SJBD补标",4,推荐,0,0.999999999999917
2023-10-25 20:25:37,威猛先生,励志什么了，没有运动天赋非要去打球，能力不够怨教练不让你上场，不妥妥的道德绑架吗？不了解真人的实际情况是什么样的，既然是唯一一个被抬着出球场的人，肯定是为球队做出了一些贡献才能得到别人的认可的，电影完全没有表现出来。在球队坐了四板凳，莫名其妙结尾大家都高潮了，看的莫名其妙。,3,还行,1,0.9999693758807072
2023-11-09 11:04:48,Shane,6.6 不及期待，这种励志片虽然高分，但总觉得有点虚，偏重于喊口号打鸡血，给你灌输“只要相信自己，就会完成不可能的事”“ 只要努力坚持不放弃，最后一定会成功”的概念。本来Rudy这种小块头看起来就确实根本不适合打这种拼体型的运动 已经不太让人信服了 如果努力转变的过程再没有具体的细节支撑 ，那可信度就更大打折扣了。 而且并不太喜欢Rudy的人设，看起来并没做出什么努力，却总是莫名奇妙的迷之自信、一腔热情到偏执的地步、后来付出的努力也有点投机的感觉（软磨硬泡+另辟蹊径+企图蒙混过关），而且他的努力似乎只是机械性重复，先是失败几次然后继续坚持就成功了？那他后来成功是做对了什么，改善了哪些不足呢？这部分刻画比较欠缺，并没有表现出他为此做出了哪些针对性改善。最终也只是靠队友的同情才获得上场体验的机会,3,还行,1,0.9999999665830784
2023-11-23 21:40:26,Imp~,"这种电影就真的只适合出现在某音里的小美小帅3分钟精编里。根本没必要出127分钟又臭又长的导演剪辑版。可怕。
你这样的电影很容易让本来就没啥脑子的人自我感动觉得有志者真的事竟成。最后连个医保都混不上",1,很差,1,0.0627939593281325
2024-01-07 16:45:14,Abyss,又是这种看完之后会热血沸腾地打满分但过一段时间回想起来却什么都没有的运动鸡汤片。很白开水的一部片，平平无奇。讲为了进学校为了上球场有多努力，没讲上了球场之后事业的辉煌。老一辈的人很爱看这种，我妈会叫我早上比别的同事去早一小时打扫办公室，倒垃圾干杂活这类的人会特别喜欢看。,3,还行,1,0.9999995256343254
2024-01-18 11:52:30,阿凡思蜜达,看了感觉自己今天超幸运的那种电影，可以说是我最喜欢的一部励志片。描述了毫无天赋的普通人为了获得一个微小的成功，能够付出的所有努力：撕破脸皮、任人嘲讽，无视所有达成目标路上的阻碍，只是竭尽全力。身边的伯乐不会凭空惜才，朋友不会无故相助，只是因为他的努力感染了所有人。男主角一身质朴气但真演活了这种二话不说就是干的劲。,5,力荐,0,0.9999999999608606
