2012-12-01 22:09:12,幸福的泡泡@,in the life for catching ur dream so many people say no to stop to u then u can change them and let them say yes！,5,力荐,1,0.0666177467105532
2012-12-04 21:32:19,蓝毛水怪,"高一看过一次，最近科比facebook上推荐，又重看了一遍。""Having dreams is what makes life torlerable."" 六年以后再看这部片子，多了太多感慨，人老了，泪点会变低。(刚过22，到了Rudy的年纪，想想年轻时坚持过的执念，如今却越来越模糊。)",5,力荐,1,0.9998979839989444
2012-12-04 21:32:19,蓝毛水怪,"高一看过一次，最近科比facebook上推荐，又重看了一遍。""Having dreams is what makes life torlerable."" 六年以后再看这部片子，多了太多感慨，人老了，泪点会变低。(刚过22，到了Rudy的年纪，想想年轻时坚持过的执念，如今却越来越模糊。)",5,力荐,1,0.9998979839989444
2012-12-04 21:39:04,scenel,彻头彻尾里外通透的励志片，这种片子主角身边的每一个人都是励志家，励志讲演说来就来。8.7的评分太让我惊诧了！,3,还行,1,0.4560444569291707
2012-12-12 19:59:46,已注销,优秀的体育电影，看哭了呢。各种燃。,4,推荐,0,0.9891995145933702
2013-01-02 22:42:52,ReMinD,"大家一个个进教练办公室放下球衣要求rudy上场的时候太！棒！了！
全场欢呼rudy名字教练不让他上场球员们奋力为rudy争取时太！棒！了！
最后上场大家给他让路冲过去sack对方qb的时候 看台上爸爸高兴到满脸通红 大家抬着rudy出体育场 太！棒！了！",5,力荐,1,0.999778975185609
2013-01-02 22:42:52,ReMinD,"大家一个个进教练办公室放下球衣要求rudy上场的时候太！棒！了！
全场欢呼rudy名字教练不让他上场球员们奋力为rudy争取时太！棒！了！
最后上场大家给他让路冲过去sack对方qb的时候 看台上爸爸高兴到满脸通红 大家抬着rudy出体育场 太！棒！了！",5,力荐,1,0.999778975185609
2013-01-09 13:11:32,Clyde,与很多励志片不一样，本片的主人公并非一位功成名就的运动员，而是一名陪练，他以其百分百的投入和敬业，获得了队友们的认可。,4,推荐,1,0.8807745925282927
2013-01-10 15:57:29,易,我一直想提出的一个问题，即你不是个天才，你在你喜爱的这个事情上很平庸，你做了全部努力可能还是不如别人轻轻松松取得的成就，那么值得么？我想，梦想的真正价值就在这里，它让人有希望。,4,推荐,1,0.9997334853413706
2013-01-19 16:38:23,SweetJanuary,dream is beautiful,5,力荐,0,0.4737672181921908
2013-01-24 07:07:18,D-Boy1900,山姆加入魔界小分队之前的人生经历,4,推荐,0,0.9568405541125702
2013-02-21 02:13:11,摇滚玄奘,梦想让生活值得忍受。。。。,4,推荐,5,0.9513257987052288
2013-02-28 10:05:43,幽灵不会哭,平铺直叙毫无亮点的美式励志片，这也算是圣母大学的一部广告片吧，这种个人主义奋斗模式也许就在美帝国主义适用，本以为会有很多激烈的橄榄球赛的场面，结果没有，有一些失望。,3,还行,13,0.8944348030570244
2013-03-04 18:58:36,托尼·王大拿,或许我还是太现实，完全无法认同这种盲目的坚持；前半段铺垫也太长了，而且配乐一点都不热血，反倒有种催尿的感觉，断断续续才看完，好在最后的高潮段够煽情。,3,还行,63,0.9823746041400112
2013-03-08 20:23:11,披头,Having dreams is what makes life tolerable,5,力荐,0,0.3964903656113859
2013-03-10 16:03:12,暗。,梦想让生活难以忍受。一次次的热泪盈眶，为梦想。有时候我们看你，就是看到了我们自己。,5,力荐,0,0.9961127867188562
2013-03-12 20:06:14,黑骨精,在美国大批量体育类型和励志影片中，能够拍的最细腻的就是橄榄球电影了，像西部片一样，有固定套路和模式，但依然让人承受不住，泪点变低。,5,力荐,5,0.997864228769983
2013-03-23 16:45:10,李小坏,努力了不一定能成功，但是不努力一定不可能成功。,5,力荐,0,0.4847462901947685
2013-03-28 08:39:24,老虎,这个失眠的夜晚，为梦想，泪流满面。你可以没有天赋，但是不能没有梦想。一个为梦想愿意献出一切的人，能赢得每个人的尊重，全世界都会让你让路。,4,推荐,0,0.9999814909014516
2013-04-16 15:32:48,momoko,这不是我看过的最好的，却是最感动的励志电影。There is a God.,5,力荐,0,0.9526282532343608
2013-04-22 22:58:03,齊克斯尼力佐飛,矮子也有春天。努力不应该给别人看，而是给自己知道。,4,推荐,0,0.9787260823653156
2013-04-22 23:59:20,风凌羽,得到那二十几秒钟的辉煌，就已无憾。有这样的精神，他所获得的，又怎能仅仅限于球场上？PS：演Rudy的胖子助教朋友的那哥们居然是拍了《圣诞精灵》和《钢铁侠》的导演乔恩·费儒。。。,4,推荐,0,0.999680696010238
2013-05-26 23:25:03,无心为善,喜欢就是喜欢。美国梦是永远告诉你，有人不支持你，就有人在帮你，不要放弃自己。。,5,力荐,0,0.9235435905702598
2013-06-06 15:34:15,如晦不已,高中一资质平平的同学放弃所谓的一类本科录取执意复读考清华，结果未知。中清华毒不浅啊。这片子的煽情极不真诚，以当下的心态和电影审美，完全不对胃口。,3,还行,0,0.999343583257477
2013-06-15 22:16:52,MY BMM,梦想让生活得以忍受。“你这辈子不用对任何人证明什么，除了对你自己。在经历了这么多之后，如果现在还不能实现梦想，那么它永远都不会成为现实。”“为迎接此刻，我一生都时刻准备着。”,4,推荐,0,0.9999993491352333
2013-07-23 00:09:47,豆友48751083,鲁迪有两个朋友，唯一两个在别人认为他愚蠢时而相信他的人，一个丧生，一个坐了一辈子冷板凳，他们中肯的交谈与肯定让鲁迪成为all-star，他们都是鲁迪将衣服挂上高墙上的挂钩的小板凳。只要自己不看不起自己的梦想，在别人眼里显得愚蠢也在所不惜。,4,推荐,0,0.940359667437934
2013-08-03 14:22:15,布拉德痞特儿,小个子有大能量，梦想让你学会忍受生活，当你最后终于能够站在赛场上时，你会发现一切努力和辛酸都是值得的。,4,推荐,0,0.9931430827425722
2013-08-16 12:02:32,=_=秋叶,having dreams is what makes life tolerable。男主高中的老师说圣母大学是给那些有钱有天赋的小孩准备的，这句话真残忍又现实。男主8年的坚持换来半分钟的辉煌，足以荣耀一生,5,力荐,1,0.9999489254874532
2013-08-26 23:41:17,蓝格子,开头字幕提示真人真事，但总觉得有些假，学费、麻袋、校服都让人不信服，可看到最后还是哭了，一切都败给了那个牛逼闪闪的发光梦想。,4,推荐,0,0.9954402974605558
2013-11-12 23:33:47,老沙,Having dreams is what makes life tolerable.,5,力荐,0,0.3964903656113859
2013-11-17 23:24:53,戏如人生,the newsroom 里 will 的泪点真是太低太低了。。。,5,力荐,0,0.3364966887746173
2013-12-12 16:29:28,Limario🧸,可能你会不成功，可是你不能忘了你在追寻成功的路上早就获得了很多。,5,力荐,0,0.9475675139005092
2013-12-13 15:26:25,毛怪周,1993 大卫安斯鲍夫 啊和你一起看电影像在梦里一样。“梦让生活值得忍受” 热血的燃烧着的霍比特人！我的生活如此美好，更要努力呀！,5,力荐,0,0.9999707165572536
2013-12-13 21:08:56,疼酱,看的一身正能量！只要努力全世界都会帮你！,4,推荐,1,0.8937239966112337
2013-12-13 21:15:53,何碰碰,上去跑一跑就好,5,力荐,2,0.6448797376596146
2013-12-19 18:15:09,A。,“Having dreams is what makes life tolerable.”以梦为马。哪怕梦想无法以想象的方式实现。,4,推荐,0,0.9165390672275556
2013-12-21 15:58:41,Doreen,好感动！当你做梦都在为之努力奋斗的时候连老天也会帮你！没有钱不聪明也没有运动天赋的rudy却想进一个只收有钱或是聪明或是有运动天赋的大学，身边的人都认为不可能，可是他却做到了！！这部电影让我哭了好几次，都是感动而哭。配乐也很棒！不错的电影！,5,力荐,128,0.9999998866869316
2013-12-22 22:22:43,新世纪腐银战士,最后的27秒确实很感动，但是就是觉得没有天赋这种事情就是白扯！我很感动那个叫PETER的孩子，他为了RUDY付出了很多很多而且长得也巨帅~但影片是有正能量在的，也给我一个深刻的体会就是别轻易放弃，就是凡事都要自己争取，倘若RUDY不去争取免费劳动的机会，就永远不可能进橄榄球队的不是嘛？,3,还行,0,0.9999995671439345
2014-01-27 19:37:57,斜杠过多王静阁,"Since 1975, no other Notre Dame player has been carried off the field.",4,推荐,1,0.3474730362549653
2014-03-31 12:40:12,全金属外壳,“你毫无运动细胞却在橄榄球队呆了两年，并且将会拿到一张圣母大学的文凭。” 其实自己已经很不错了，只是想更好而已。最后10分钟铁定5星。,5,力荐,1,0.9835194909107858
2014-04-07 22:05:34,火狐狸,"1、不是所有付出都有回报（想要的那种回报）；
2、所有付出必有回报（任何回报）；
3、没有任何人的付出是丝毫不求任何回报的；
4、任何人的付出总会有人看在眼里……
明白以上，然后，好好爱惜自己的追梦赤子心……",5,力荐,0,0.9999989864357742
2014-05-18 00:01:34,七颗子弹,你不需要向任何人证明什么，除了你自己。,4,推荐,0,0.2955667224536386
2014-06-05 11:17:39,scstbupt,8年来所有的坚持，只为那27秒的高光！真实的鲁迪必定比我们看到的电影付出的更多，为真实的故事感动！,4,推荐,0,0.9997043569454456
2014-09-29 03:40:41,Panda的影音,虽然我们的身世同中有异，拥有的梦想也有点天差地别，但我还是在你的故事中看到了好多我自己的影子，为了梦想不顾他人的嘲笑，勇敢地坚持、不懈地奋斗，终于在最后的最后走上了梦寐以求的赛场，赢得了全场的欢呼。你不是最棒的，但你是最努力的。——你比我更在乎梦想的结果？而我真挺享受追梦的过程。,5,力荐,0,0.999999999981759
2015-02-21 14:38:53,vivi,想不起是不是上一季破产姐妹里Max和Caroline讨论此片看到哪里的时候哭了。前面大半段都好普通，Rudy更适合当解说员多过运动员，而且好几次被黑人哥哥提醒“我们是来工作的”。大家把球衣交给coach说要给Rudy的时候就开始哭了。最后升华时的配乐可真大路货色~ Sean Astin2.25生日算是加分了。,4,推荐,3,0.998007138353366
2015-10-08 21:34:19,мая,8，橄榄球史上最为人津津乐道的天道酬勤的故事，虽然这个故事的本质还是揭示了天赋胜过一切的道理（没天赋就只能是陪练，只能最后垃圾时间上去打几个play）。,5,力荐,0,0.9987341654621764
2015-12-12 10:34:38,梦里诗书,根据真实事件改编的《追梦赤子心》，光影中关乎梦想的印记是如此为人动容，丹尼尔· 鲁迪那8年的坚持，只为27秒的辉煌，让我们知道面对生活我们付出的努力或许不一定成功，但至少会得到人们的认可，即使梦想看起来那么愚蠢而遥不可及，但对于自已而言，永远不该放弃的是对希望的执念。,5,力荐,123,0.9999999999401454
2016-01-10 23:11:33,浑浑噩噩,"草根阶层孩子的追梦记,比较写实,特别是最后比赛的数秒出场,有点和洛奇1异曲同工,那份坚持,执着,永不放弃的精神已经盖过了比赛过程和结果了,凡夫俗子在世数十载,没什么比无悔二字更珍贵.中文译名特别赞,追梦,赤子心!",4,推荐,0,0.9999999999872682
2016-03-02 12:29:26,AilsonAir,我非常感恩，这电影至少证明了我还有力气去感动。生活一点点教会我衡量与妥协，我以为长大后的我已经没了最初怀揣梦想的赤诚和柔软，没想到我依然愿意为Rudy这样执拗的坚持而感动。对于认定的梦只要你足够坚持，全世界都会帮你。想到自己从未真正坚持过什么，永远第一个放弃自己，我已是泣不成声。,5,力荐,2,0.9999999999943934
2016-03-02 12:29:26,AilsonAir,我非常感恩，这电影至少证明了我还有力气去感动。生活一点点教会我衡量与妥协，我以为长大后的我已经没了最初怀揣梦想的赤诚和柔软，没想到我依然愿意为Rudy这样执拗的坚持而感动。对于认定的梦只要你足够坚持，全世界都会帮你。想到自己从未真正坚持过什么，永远第一个放弃自己，我已是泣不成声。,5,力荐,2,0.9999999999943934
2016-08-19 16:53:16,陆钓雪de飘飘,真tm激動，像是看到了從高中到大四的自己。當95個人說你在做夢，5個人說你能夠做到的時候，這已足矣，你不用再證明什麼了。接下來，你只需要證明給自己，你到底是差很遠，還是差一點，還是達到，還是超越了，那就可以了。標準似乎就在那，剩下的只是你的努力程度罷了，四年或十年又何彷，這可是人生啊,4,推荐,68,6.960719460658016e-05
2016-11-25 14:10:12,诸葛若见,很多人都是天赋平平，能有的只是比别人加倍努力。希望渺茫，大半辈子的拼命，最终只有27秒的赛场荣光。如果没有梦想，怎么度过这漫长的平凡岁月。大半夜的看到Rudy，感动成狗。,5,力荐,190,0.99995961264297
2017-01-07 21:48:43,mon babe,飞鹰艾迪的前辈。非要在不适合的领域拼搏，但至少赢得了尊重。圣母大学，我高中暗恋同学的大学，也是我第一次在电影里看到，很美。音乐堪比燃情岁月。整体较为平淡。所以，你不努力，你就会离你的梦想越来越远，无论是你喜欢的人，还是你喜欢的事业，甚至你的一切。try harder！,4,推荐,1,0.9999999999994084
2017-02-11 17:12:23,mOco,一出格外工整的励志剧。所有人都知道坚持才可能胜利，但“愚钝之人”更能坚持，或许这就是大智若愚？[补遗],4,推荐,1,0.9972523762690876
2017-02-13 01:16:58,光年‖影视歌三栖民工,1.相信自己，不要给自己设限；2.好心人的“劝诫”过后，你仍然要对自己的生活负责，所以不用听外人的；3.就算天资有限，在接近目标的过程中必然会提升自己；4.目标的性价比很关键，不要只满足于做24秒真男人,5,力荐,36,0.9999444731039172
2017-06-16 13:55:20,莫小巧,无才能+一根筋型人物励志故事的范本，欲望—障碍—行动 范式连套，极其单一。冲击力主要来自基于真实人物故事改编。按照如今的美学来看，并无任何出彩之处。从人物性格到故事曲线都极其相似的《飞鹰艾迪》则可视为佳作对照欣赏。,3,还行,1,0.9999999999960564
2017-06-26 10:53:16,__那个谁。,套用一句俗套的话，坚持，你未必会成功，但不坚持，你肯定输了。Rudy最后怎么样了？影片没有说，但我想，他或许成为不了职业橄榄球运动员，但不管在哪里，他都能活得很精彩。,5,力荐,4,0.9777536900688014
2017-10-12 22:52:46,海边的妖怪_,妈的真难看 完全没有get到high点 全程被一这个智障用“你的智商感动了我”的行为填满 哭泣 为主角的智商,1,很差,3,0.839511242482446
2017-12-31 23:12:46,左胸上的吸盘,勉强及格。从工厂出来考圣母大学、死皮赖脸表心迹、球队陪练好几年，全为上场几秒钟。这个故事在泛滥的美国橄榄球电影里倒是新鲜，主旨讲人怎样在自己不能胜任的领域里获赞赏，有点方法论的意思。好处是导演摄像的复古风贯彻的不错，男主角略木讷的演绎也抵消了这角色讨人嫌的地方。流程俗套也因此传奇,3,还行,1,0.999999999989835
2018-01-07 20:30:42,余思,精神心灵鸡汤。某种程度上，我们都是路第。上场最重要。,5,力荐,3,0.9919372463680792
2018-04-05 17:55:41,The 星星,一个执着的人，球队的吉祥物，却并不让我喜欢。他进圣母的唯一目的就是踢球，却口口声声说自己想上大学，这种人还是不要进顶级大学接受优质教育了吧,4,推荐,0,0.993362832620445
2018-10-12 11:04:15,夏一慕,喜欢这个影评：从理性的角度讲，因“自我认知”的偏差，为了要“证明”一项自己完全不具备的天赋，而不断和自己较劲的人，是多么愚蠢！然而更愚蠢的是，我们大多数人在一生里，却竟然就那么窝囊的接受了别人断定的“不可能”，甚至都没有给过自己一次和自己较劲的机会。作者：wesley,5,力荐,1,0.9894397014345186
2018-12-02 00:25:10,葡萄吃不吃,不知道为什么，社会越来越看不起一根筋为了梦想吃苦努力奋斗的人。但电影让我很不舒服的一点是，用努力的形象对他人进行道德绑架,3,还行,2,0.9999921137486806
2019-01-01 13:26:12,mills,4k修复导演剪辑版127分钟多了13分钟，8段新戏份涉及移民、女友分手和神父，最主要的还是大学里mary线，她直接升级成女主了，之前版本她的戏基本全被删了，但加上之后就存在时间上的bug。重看这部里的和洛奇很像的朴素质感依旧动人，最后比赛百看不厌，goldsmith配乐作用巨大,5,力荐,0,0.9999999984362054
2019-02-08 15:22:58,小悬子,"2019.02.08
Rudy并不是“合格”的英雄，他的追求很功利，他的视野很狭窄，他似乎只有一个优点，就是在球场上很拼命。这部电影最美好的地方，不是Rudy如何义无反顾地追求梦想，而是Rudy身边的人竟如此珍视“努力”的价值。",4,推荐,7,0.9999998649819244
2019-05-22 16:35:00,猫様,怎么觉得那么反智？只要你努力，像愚公一样努力，总有一天会感动所有人给你开绿色通道就为了给你一个happy end ？？,3,还行,3,0.6763804350395434
2019-06-09 14:35:13,冬季向日葵,至始至终他都不是适合打橄榄球的人，即使比所有人都拼命训练，最后能够上场也是因为他努力的精神感染到队友为他争取，是的，影片并没有神话他。但是这样一个天资平庸却无比纯粹拥有赤子之心为梦想拼到底的人，却让人流了一公斤眼泪。,5,力荐,0,0.999979883015938
2019-08-15 01:01:48,合纥,鲁迪是励志的，也是足够幸运的，不过人不需要为了别人而证明自己的人生是什么。对这类励志片到底不是特别的敏感。,3,还行,0,0.9935064930469454
2019-11-11 00:39:16,北,"我为了此刻一生都在准备着。This is what we stand for. I have always been ready, ready for that moment. We may never reach that high end, but every thing deseves, and all the efforts will be paid.",5,力荐,0,0.6533455706613969
2020-01-07 15:44:21,雨路,"很燃，也很American,很励志，我也超级佩服鲁迪这样的人，有梦想能数十年如一日的坚持追逐的人真的了不起。只是最后他实现梦想的方式就是上场27秒，这个从我这个旁观者角度来说是否值得实在有待商榷，但是是否值得也只有鲁迪有资格回答。但是现实中，人每个人除了梦想还背负太多的责任，孤注一掷的坚持一件事也是要付出很多其他的代价，片中的价值观是正面向上的没错，但是我不赞同适用于每个人的身上。甚至你怎么知道你走另一条路就不如坚持这条路会得到更好的结果呢？人生就一次，但是选择有多种。可能真的是老了，没有那么热血，有了更多的冷静和权衡。",3,还行,0,0.9999999999982904
2020-01-30 00:53:48,声色画报,属于比较少见的体育励志片，男主没有任何成就却获得了广大赞誉，甚至人生唯一一次上场比赛也才27秒钟的垃圾时间。但恰恰这样的平凡人带给我们的感动更不可思议，为了一个卑微的小目标而不惜一切，每天而努力，哪怕早已有自知之明，但万一呢？有些努力注定徒劳无功，但还要往前冲，带给其他人以榜样。这是漫长的人生，全片过去一小时才开始涉及橄榄球。,5,力荐,3,0.999999767599684
2020-05-21 22:51:03,硬搞,单从电影表述看：鲁迪是个热爱橄榄球且有些滑头的普通人，优点和缺点都很明显，这种为达目的不罢休的实干精神和不放过任何可能机遇的灵活头脑，放在任何一个社交群体里其实都能玩得开，能将不可能变成可能与其超乎常人的努力是分不开的，而这才是影片的主旨与内核，最后的出场与否倒显得没那么重要了，因为他改写了自己的命运，提升了自己的层次，赢得了队友们的尊重，同时也影响了身边的很多人。你可能不喜欢鲁迪这个人，但你还是会由衷地佩服他。,4,推荐,1,0.9999999107122916
2020-06-29 19:11:02,一只麦麦,比较传统规整的励志片，现在看有点老套了，哪里要有集体列队式煽情都能预感到。钢铁厂的唯一好友送了鲁迪一件淘来的诺特丹夹克，为他庆祝22岁生日，后来好友就在意外事故中去世了，这个地方有点感动。结尾也没有惊天动地的成就，就是最后几分钟替补终于上场，拦下一个球，就完事了。还是觉得飞鹰艾迪这种反套路的励志片比较好看,3,还行,3,0.999999908778838
2020-07-21 23:32:20,Balzac·ケイジ,头一次被“励志”恶心了，如果全身心的投入就换那几秒钟，这应该叫挥霍和浪费。根据真人真事改编，肯定是过于美化了，只有尼哥说的话有点道理,1,很差,2,0.003448340409576
2020-09-05 07:38:25,奔跑忘记忧伤,虽然人生不一定真的梦想成真，但这种故事总是能激励鼓舞人们为了梦想而拼搏,4,推荐,1,0.9962053953513692
2021-08-24 10:29:59,Midsummer,如果他成了正式球员，我大概会给3星，因为实力就是实力，这样真实得结局才是最好的,5,力荐,5,0.9997276572126778
2021-11-27 01:22:59,巴喆,4年蓝领打工+3年转学+3年陪练才求得一次正式出场，还是在垃圾时间的27秒！最让我感动的是那个当了两年陪练就轻易放弃的黑人的劝导（人不会因为失败而只会因为放弃而后悔），联想于己曾经还是放弃人生梦想，热泪盈眶！这个故事无法复制，但这碗鸡汤我还是服的。除此外，本片在技术使用上也非常成熟，横摇纵摇升降运动镜头非常到位，配乐也很棒。7.7,4,推荐,2,0.9997251781666956
2021-12-03 23:56:05,猫阿水,太正能量了～ 这就是向宇宙发射信号于是整个宇宙都在帮你实现愿望吧！！！我们小山姆从小就体现出这种超燃的意志品质，于是后来被选拔去护戒了！！！,5,力荐,0,0.999885740137566
2022-01-08 22:26:13,公子小七,的确很励志。片中最感动我的不是Rudy最终上场帮球队赢得比赛，而是队员们在教练面前放下球服为他争取上场机会的那一段。努力和坚持不一定帮我们最终实现梦想，但是你为此拼尽全力的姿态一定会感染别人，这也是很宝贵的收获。,4,推荐,6,0.9999998461615944
2022-03-25 17:41:08,GrantHoo,为了梦想，即使身处二流位置，也要十分地投入，坚持下去，最后终会受到老天的眷顾,4,推荐,0,0.9977325456853215
2022-06-30 04:35:45,豆友213246713,"有句很受欢迎的鸡汤文说“世上所有美好的东西都是免费的”。
我想告诉你，真正美好的东西不仅不会免费，而且还很贵。
比如你想去巴黎，坐在街边的咖啡店里，吃着牛角面包，翻阅
报纸，一待一上午；
想去塞纳河边，请街头画家给自己画一幅画像；
想去罗马，在许愿池里扔硬币；
想去凡尔赛宫，在镜厅里看无数个自己；
想去撒哈拉沙漠，和驼队一起走个三五天。
再或者，你希望有座大房子，有巨大的落地窗，有通顶的书橱，
有种满鲜花的阳台，有满墙的旅游照片。
可是我想提醒你的是，你想要的平淡里有花不完的钱，住着舒
服的大房子，有漂亮的衣服，有爱的人……可你凭什么轻而易举地
需要钱呢?
02-10
十关注
既然选择了远方，便只顾风雨兼程",5,力荐,0,0.9999999998717286
2022-06-30 23:37:46,爱尔兰的布莱克,最经典的台词截图原来早早地就出现在电影前二十分钟，并且紧接着说话者就去世了；电影它说过“梦想使生活得以忍受”，电影它也说过“追逐一个不切实际的梦想，只能使你和你周围的人心痛”；倒是那句“在我的一生中，大家一直在告诉我能做什么，不能做什么，我也一直听信他们的话，我再也不想这样了”很戳我；BGM很贴。,3,还行,0,0.9999998705715266
2022-09-23 01:58:13,Scott,讲述手法很有年代感，但仍激励人心。美国励志片很喜欢写小人物的胜利，追求意志的极致。 😌彩蛋：大学的胖子好朋友角色是漫威宇宙里的“哈皮”，同时也是钢铁侠1、2的导演，漫威宇宙的奠基导演！哇靠！牛了个大逼啊！,4,推荐,0,0.999999999998956
2022-12-26 11:21:11,ztlpoppy,并不适用于所有人的励志片，男主的那份不变的坚持纵然可贵，但是太多人有一样的坚持和梦想，却没有他这样的结果，他只占了千万分之一不到的比例我估计。。所以用这种故事来想说明问题着实毒鸡汤了一点。倒是比较感动他身边的每个朋友都很好，有那么多有善良肯帮他的人也算是幸运中的幸运了。。ps后来发现男主是生活大爆炸里要偷sheldon成果的那个教授。。,3,还行,0,0.9999980022290296
