2007-12-23 16:09:51,艾小柯,华丽的无病呻吟,3,还行,1718,0.1745097433152903
2008-01-02 00:26:02,absoluteyi,"没有想象中的好，觉得导演在时间上玩的flashback太花哨了...
完全冲着James去看的...他依然非常charming，没有让我失望...
Keira在里面穿的那条绿色长裙太美了...
由于太多抽烟的镜头，看完第一个反应就是want a smoke...",3,还行,138,0.1856467138403457
2008-01-03 21:16:56,影志,个人感觉情节故事都很一般，演员、摄影、配乐倒是眼前一亮，结局处理很喜欢……颁奖季所获奖项——【最佳新人演员Saoirse Ronan(2项)】拉斯维加斯/凤凰城影评人协会；【最佳改编剧本(2项)】金卫星、好莱坞电影节 ★圣地亚哥影评人协会 最佳剪辑 ★凤凰城影评人协会 最佳摄影、配乐 ★国家评论协会 年度,4,推荐,82,0.9999999999999998
2008-01-04 20:32:05,Bill,震撼的结尾 男主角没话说 小女孩和老妇的表演也非常优秀 小女孩和The Sixth Sense里面的小男孩真是有一拼 都是内心很复杂的角色 但都拿捏得非常到位 其实虚幻的结局又有怎样呢 痛苦的承受和煎熬在消逝后 幸福永远只能是迟到的 中间有个长镜头很棒 想起了Children of Men里也有风格类似的 不过略显有些突兀,5,力荐,0,0.9999999999999568
2008-01-07 17:26:33,hilly,俺偏执，俺觉得这个atonement该叫jealous……￥#最后Briony说她把事实写成小说，不是软弱也不是逃避，而是一种人性的关怀……俺姑且沉默好了。毕竟她也为此suffer了大半辈子。。的确需要对自己进行‘人性的关怀’……如果俺是cecilia，俺也至死不会原谅她。（记得那个拔光鸭子毛小偷的故事么……）,4,推荐,322,0.994025179981568
2008-01-08 02:29:31,让保罗切小田,這個導演喜歡清晨泛霧的草原 Knightley壓根就不算女主角好不好，要拿了金球就搞笑了,4,推荐,0,0.8865670502539204
2008-01-12 19:58:50,Max,有点看不懂,2,较差,2,0.4258138998314664
2008-01-15 20:13:48,薇啸,结尾比开头好看。风景如画。,3,还行,0,0.984688007390192
2008-01-16 03:27:54,无为啊,看了N遍 ost听了几百遍 只为了交片花作业,3,还行,0,0.9646964210334744
2008-01-19 11:55:01,funny_vee,美术摄影音乐剧情都很不错,4,推荐,62,0.9996611822339038
2008-01-23 13:03:38,Peter Cat,评分：B-,4,推荐,3,0.3524856271790713
2008-01-28 22:08:05,欢乐分裂,人性+战争+爱情+英国风情=无往不胜,4,推荐,82,0.9998982272303812
2008-01-31 19:36:11,眠去,始终喜欢前半部分，配乐一流！后半部分一泻千里,4,推荐,235,0.9865635213058812
2008-02-01 16:11:19,桃凉凉的鸡,有些话说了，其实你负不了责任,4,推荐,2964,0.0325695910078029
2008-02-03 15:45:58,勤劳的小蜜蜂,不够sexual的keira却也真实,4,推荐,0,0.7563604612395216
2008-02-09 13:08:59,思阳,片子不咋样，但是海滩那段将近5分钟的长镜头实在是行云流水极了 ,4,推荐,28,0.677807821088012
2008-02-18 00:07:05,皮革业,片子本身挺无聊的 追公车都用上了 敦科尔克的那个长镜头真的很卖弄 Saoirse Ronan也真的太萌了,4,推荐,4,0.6816215430911986
2008-02-19 12:17:30,荔枝超人,打字机声是亮点。,4,推荐,1629,0.1706757994221982
2008-02-19 12:42:54,宋阿慕,"看五遍还是不够的一部电影,少年时代部分的背景相当漂亮,奔跑也很好看",5,力荐,1234,0.9999957332811052
2008-02-19 16:38:32,木木示言,小女孩根本是个变态！比较无语．．,3,还行,924,0.2851724369562576
2008-02-23 11:44:32,Andy,这片说明了导演决定影片成败,4,推荐,1,0.9314325389443628
2008-02-24 22:51:28,Shy,一般般 救赎一直到很久才看出来,4,推荐,0,0.8998193230969237
2008-02-25 19:23:33,茶咚茶咚茶,电影院,3,还行,0,0.5
2008-03-01 16:16:57,Mr Lefty,小孩一旦因为无知而残忍，会让人心惊肉跳,5,力荐,6605,0.6476568142129381
2008-03-05 02:21:16,宅蘑菇Moku,Keira Knightley❤  顺序真的好忠实原著，如果不看书我会觉得有点莫名其妙……,4,推荐,131,0.2826456513087173
2008-03-18 14:32:35,xxhhcc,献给乔怀特.献给那最后的15分钟,4,推荐,0,0.9973579720453386
2008-03-19 19:48:54,Vincent,4*-,3,还行,0,0.5
2008-03-22 10:48:53,seeme | 北北,"我非常讨厌这种自以为是的小孩子 如果是我妹妹 我一辈子不会原谅她 因为她的虚伪懦弱自我 即使用一生来赎罪也换不来我的原谅 听到最后那句""i gave them happiness"" 彻底抓狂 好意思么 无语中……参入太多个人感情了- -",4,推荐,5293,0.4140241924023935
2008-03-22 20:55:40,Bigteeth,再次确认，一，我讨厌战争；二，我讨厌Briony类的早慧少女。,2,较差,1254,0.9799564621783124
2008-03-23 22:14:39,大头绿豆,摄影牛逼，尤其敦克尔克撤退那个长镜头。几个误会的场景巧妙。但我还是不喜欢Knightley的长相，尤其是嘴形。,3,还行,241,0.9999773641756832
2008-03-24 00:58:21,颜良辰,暮然回首，我们才发现那些藏在心里面的负罪感，是那么深刻。,4,推荐,2,0.9937350705805594
2008-04-04 18:00:56,Chris  一切由无聊开始,2008.4.4 看片名和海报还以为这是个大俗片。叙事手法值得研究。演得也好。四星半。不过罗比在战争中那段稍微有点过了吧。我觉得战争和叙事目的的关联并不很紧密。,4,推荐,0,0.9999970116522546
2008-04-11 18:20:43,minyee13,"故事讲得不错
就是Knightley始终像叛逆女青年",3,还行,0,0.9978132552575508
2008-04-16 22:29:06,某茶君,感觉有点盛名之下，其实难副。电影语言和剧本结构也没有太大的突破，甚至那个出名的长镜头，也只是为了眩技而已，和内容和节奏也都不贴。只有演员的表演还算出色。,3,还行,220,0.9999992297606084
2008-04-23 01:26:35,叶洲,剧情其实挺简单的，但发展有点支离破碎，有点突兀。亮点在于英国夏日的美景，不同视角的镜头切换剪辑，以及展现敦刻尔克大撤退的那个长达5分钟的长镜头。,3,还行,7,0.9999448150118914
2008-04-23 17:27:07,Freshcream,飞机上看的英文版 好片子,4,推荐,1,0.8331340709962265
2008-05-01 16:14:08,避开目光,"无法赎的罪
故事不错，但是弥补不了电影中的废话",3,还行,0,0.9784559651024484
2008-05-05 15:34:17,锴,喜欢那种夏天乡下的场景 剧情可以接受 影片镜头转换恰到好处 神了！,4,推荐,1,0.9383663383942724
2008-05-18 01:01:16,Q。,这美好这沉重这遗憾的一个世纪。★★★★,4,推荐,35,0.9766026385548257
2008-05-28 12:23:23,一片云,在短暂相爱中死去，还是在漫长时光中忏悔，我更同情后者。,4,推荐,0,0.9999730707111554
2008-06-06 20:07:14,大米粥,那哥们死的时候，我哭了。。。,4,推荐,1960,0.4295554477591057
2008-06-08 17:46:19,不良生,念大二这一年，赎罪、成为简奥斯汀，这两部电影开启了我对英国庄园电影的深爱。,5,力荐,622,0.999983536231943
2008-06-18 06:22:19,pinkjar,6.18一个小女孩一个谎言一场战争一次爱情。,4,推荐,0,0.9997403672029436
2008-06-19 20:58:11,红尘,“看它哪里都好，就是喜欢不起来，晕”，以上是2008年第一次看这部电影记下的，其实是那时我还看不懂情欲的矛盾与羞耻，也不懂，很轻的情爱和很重的人生,3,还行,19,0.9996062556688136
2008-06-28 12:38:44,Sophie  Z,“一个女孩子从卧室窗外看到了她不懂的东西，可是她以为自己很懂。”,5,力荐,4434,0.7621351424958204
2008-07-05 14:24:19,spielmann,给四星完全为了他们俩那个唯美的ml。,4,推荐,1285,0.715944914170099
2008-07-08 16:16:51,奔奔,和傲慢与偏见风格类似~,5,力荐,0,0.679853744828522
2008-07-23 17:10:17,abandon,还凑乎 没我想象中好 终究没一口气看完,3,还行,1,0.9289518035720636
2008-07-31 01:44:00,米苏尹,文艺女青年害死人,4,推荐,4051,0.6199002911849018
2008-08-03 01:13:01,息为,"和becoming jane一起看,会产生错觉.. 总觉得很像.  这个更好看一点.",5,力荐,0,0.8951201155572018
2008-08-03 19:34:59,Lavender,我喜欢那条绿色的裙子~,4,推荐,0,0.4595428761763446
2008-08-24 11:05:31,feather,配乐确实很强大,5,力荐,0,0.9256131550958256
2008-10-18 10:10:21,樹の海,"Dear Cecilia, the story can resume 。。。 I will return, find you, love you , marry you and live without shame. ",4,推荐,9,0.0189352541803212
2008-11-03 21:52:09,浪费好运听从心,烈性女,5,力荐,0,0.5795817880337516
2008-11-11 17:34:09,fingcat,受不了的是长镜头。,3,还行,0,0.4829698297598996
2008-11-16 03:21:21,铁皮骑士,矫情得痛,4,推荐,0,0.6871804626687372
2008-12-18 15:12:40,宋耗子,电影院看的，哭了,5,力荐,0,0.7339000629825573
2009-01-27 16:51:42,Cherry,直到最后一段独白真相，才觉得故事动人,4,推荐,1175,0.9958902953454224
2009-02-01 22:05:09,Sean,深刻的灵魂忏语,5,力荐,0,0.974153587819772
2009-03-03 00:56:16,süden,从头到尾流畅充满激情的表演，实在太感人了。思春期少女真可怕，兼具女人的嫉妒和儿童的残忍,5,力荐,4,0.9999996110774184
2009-03-26 15:58:41,lizzycoucou,战争割裂主题 乱七八糟 只能欣赏欣赏凯拉,3,还行,0,0.9119891450223254
2009-04-26 15:07:41,静@Einfühlung,BT,4,推荐,0,0.5
2009-05-11 14:52:01,南條艾草,不喜欢个小姑娘,3,还行,0,0.5049487581664452
2009-06-18 07:15:33,Charlene,这条深绿色的裙子，好喜欢,3,还行,0,0.8110439152667809
2009-06-28 00:13:15,miootree,"三个人的悲哀,压抑.",5,力荐,0,0.6403733316658089
2009-07-26 22:03:35,rico,手法很一般，场景倒是用了功夫，故事的情节背托的丰富......,4,推荐,0,0.9612834768581618
2009-08-05 22:35:28,#烧光光#,以打字机的音效作配乐，赞,5,力荐,0,0.9728604794472618
2009-08-08 11:12:01,sasasasa,虱子,4,推荐,0,0.5
2009-09-22 14:00:11,jagpumpkin,IanMcEwan狡猾世俗得很恶心，他总是选择敏感的G点题材，又把它们糟蹋得讨人厌！天雷KK以为说话快就是台词过硬，多动症就是青春逼人，JM缺乏层次，导演见没有人物可捕捉，只能文艺地玩长镜头自娱自乐。Bene的“Bite it”太诱惑了，鬼才相信他会要那个爆炸头！士兵之歌爽！,4,推荐,13,0.9662225164468036
2009-10-22 14:08:25,pu~,有屁用。,4,推荐,0,0.5
2009-10-29 13:41:10,积木,节奏缓缓~~无奈和沉重的调子~~吃不到葡萄说葡萄酸的少女的话不能信~,3,还行,0,0.9999564874933798
2009-10-31 16:12:55,扶栏者Y,谁能预计里面的猥琐胡子男是将来的夏洛克……,3,还行,30,0.4605315752400483
2009-12-02 05:05:03,扭腰客,好看个毛！当初谁推荐我看的我让你丫看CCTV一个月,3,还行,45,0.4409421766740162
2009-12-19 14:27:11,杨迪,比不上NEMO对它的热衷,4,推荐,14,0.7524460401522117
2010-02-21 13:35:34,卡塞尔少年,"james! im a fan of u, but for decribing beginning with a c for the film",2,较差,0,0.0475833922083155
2010-03-24 06:11:34,==,因为这片反感罗南，她后面的片子都没办法看。最后居然因小说给了二人美好结局而宽慰了自己，俩主角也是日了狗了,3,还行,21,0.9947216710707052
2010-05-12 22:10:05,eakon,"背负着狠、遗憾和忏悔的爱啊，真是沉重叫人透不过气来
原著可读性比电影强，不过电影也算不错！",4,推荐,0,0.996880563150147
2010-06-12 21:18:37,某J。624,才出来的时候跑去淘碟，被封面吸引买了回来，最后的部分难受。我以为结尾真的那样美好了，那么前面所有的苦难我都可以笑着接受。可镜头回转， 一切都不过是她赎罪心理下编造的美好。那个小屋那个阳光明媚的日子那样美好相拥的两个人都是虚幻，他们谁都没来得及重逢，爱情就葬送在战场。,4,推荐,2,0.9999999812853476
2010-07-16 23:10:41,BIGD,其实这是一部战争片，因为战争才是阻挠他们爱情的元凶,3,还行,1,0.9079737353548804
2010-08-01 01:21:46,D I D A,一段史诗般一镜到底的5分钟长镜头，两线人物无可盼望的战火消停和解时，那些暗恋、嫉妒、等待、坚持、煎熬、忏悔深埋了却来不及发芽。如果你来不及享受机位和摄影的变换，来不及欣赏美工和布景的诗意，那么至少可以花痴James McAvoy / Keira Knightley。,5,力荐,3814,0.9999987879540506
2010-09-13 06:07:56,猪大腿,84/100。与这部相比，我倒觉得《英国病人》才完全是华丽的无病呻吟。当然《赎罪》的叙事手法不排除炫技嫌疑(另外中间部分以Robbie作第一人称混乱之极)，不过结局依然震撼。自认为读懂了《赎罪》里的情感却不能完全领会《时时刻刻》的灵魂，多少有点遗憾吧。多一星给亲爱的罗南。,2,较差,7,0.99999490024056
2010-09-13 06:07:56,猪大腿,84/100。与这部相比，我倒觉得《英国病人》才完全是华丽的无病呻吟。当然《赎罪》的叙事手法不排除炫技嫌疑(另外中间部分以Robbie作第一人称混乱之极)，不过结局依然震撼。自认为读懂了《赎罪》里的情感却不能完全领会《时时刻刻》的灵魂，多少有点遗憾吧。多一星给亲爱的罗南。,5,力荐,7,0.99999490024056
2010-12-17 18:43:08,L I M O,無知也是一種罪。,4,推荐,2,0.2214676923754344
2011-01-02 20:16:46,赵阿蛮,我喜欢这个调调,5,力荐,0,0.2235067723542998
2011-01-22 17:14:21,卡卡洛特,事情改变人生,4,推荐,0,0.9542875581643884
2011-02-03 10:19:24,麦田守树者,"战争，爱欲，隐喻。
",3,还行,0,0.9996387744848731
2011-02-09 16:36:27,私房歌,摄影太牛逼了，尤其敦克尔克撤退那个长镜头。,4,推荐,0,0.8985929756227202
2011-02-09 21:36:09,不流ᝰ,可怕的萝莉。如果还有机会赎罪，那你的罪就还不够深刻，唯有你得不到你预想的救赎，赎罪才成为可能。音乐、剪辑、画面都不错，尤其给萝莉打的主题配乐很好，然而各方面也没有让人惊喜的表现，总而言之是一个值得看到片吧。,5,力荐,635,0.9999982538403104
2011-02-13 00:27:12,橙司徒,OST很赞，costume很赞，摄影很赞，美工和取景很赞。,4,推荐,0,0.9999989255151784
2011-02-13 10:57:13,kk,活生生的当着我的面，把美好撕碎！！我恨作者！我恨编剧！,4,推荐,2,0.3749574134053474
2011-02-13 11:19:07,骑士的蒙太奇,那个五分钟的长镜头,3,还行,0,0.4698239489747469
2011-02-15 17:37:22,亵渎电影,"Find you, love you, marry you and live without shame. ",5,力荐,8323,0.150743994364298
2011-02-17 04:45:38,游牧人·芳汀,西尔莎罗南的演技强过凯拉奈特莉！另外我现在才知道心爱的本尼迪克特在这里面出演强奸犯，囧rz,4,推荐,158,0.9508607190966802
2011-02-28 14:16:37,猫猫-,天那，直到现在我才开始怀疑，我迫切的希望那是真的,4,推荐,0,0.6688374874338888
2011-05-12 12:35:56,Leeyone.H,人 怎能懦弱的如此自私···诚实有多难～,4,推荐,0,0.4891244233152174
2011-06-27 19:50:50,十个斗的眼窝浅,我是慕着长镜头的名来看的。女孩都早熟，尤其是家境优越、天天写写画画、自认为看透世事的更早熟，13岁就好似31岁的自以为是，这样的孩纸犯的错，导致相爱的两人缔结阴亲，岂是写一本破小说在书中让两人幸福生活以求心理安慰就完得了事的？,4,推荐,1,0.9999999985042716
2011-07-29 23:34:09,A L E X,看一遍哭一遍怎么破,5,力荐,41,0.8614866323158008
2011-08-01 12:06:35,小伙锅,真难想象briony能从13岁到死都是这个蘑菇发型==,4,推荐,189,0.5230327609093209
2011-08-03 01:31:51,托腮,永远无法赎的罪,5,力荐,1,0.9362335150681996
2011-08-06 15:02:53,JK,五星不仅仅是因为James McAvoy,4,推荐,0,0.77276789354547
2011-08-17 15:34:43,可爱水果饼447,40,4,推荐,0,0.3000000000000002
2011-08-18 07:02:59,曾于里,太仓促了些 男女主角情感刻画不够,5,力荐,49,0.995444212290972
2011-08-25 20:07:54,宅拾叁,罗南在骨头中的好印象在这片里被导演的特写镜头败光了，我指长相。片子的配乐相当之棒，片子也在告诉我们，暗恋不是件好事情。BTW导演的剪辑我相当喜欢。,4,推荐,4,0.9971658795026168
2011-09-02 01:57:56,方方酱,长镜头,4,推荐,0,0.5473395977492972
2011-09-05 19:43:42,Marty McFly,最后那个美好的画面真令人心碎、心痛,4,推荐,0,0.9955046834844914
2011-09-16 19:43:02,芦哲峰,很好的题材，流于表面，人生深处的纠结完全没拍出来。,3,还行,70,0.9921595778077188
2011-09-21 18:20:19,荼笑,那个夏日的午后...,4,推荐,1,0.946986289550788
2011-10-15 20:22:30,握不住的灵魂,眩技而已,3,还行,9,0.931055858172417
2011-10-23 13:55:21,白日美人_S,其实一辈子良心上的折磨已经足够算得上惩罚。只是最终也没能live without shame。,5,力荐,99,0.7747364790361352
2011-10-26 22:16:08,托尼·王大拿,能把这个本来很苦情的故事讲的如此惊心动魄却又柔肠百转，乔·怀特确实已经具备了大师之相，这种英伦范十足的片子才是他的拿手戏；但太过于炫技其实不是个好事情，例如那个四分多钟的战场长镜，还有那些故意的虚焦等等；另外这片子的配乐很具创意，那些和打字机敲击的声音混杂在一起的旋律实在棒的很。,4,推荐,41,0.9999995520710452
2011-11-05 14:27:00,geek,一袭绿色长裙飘过,4,推荐,0,0.2996841962609169
2011-11-28 21:13:42,-VeronicaWooo-,赞！喜欢这样的风格，没有看过原著，但是能够理解这样的剧情。Keira Knightley的演绎是我喜欢的。Briony这个小女孩其实我能理解，但是无法原谅。尽管只有13岁，但是撒谎总是不对的。不能简单的解释为一种人性的关怀。@6#509 ECNU J With白,4,推荐,0,0.9999360179884764
2011-12-11 02:25:28,Q,在电影院看的，我姐都睡着了,5,力荐,0,0.6402377234785914
2011-12-15 04:15:25,可可爱爱郭麒麟,有这样的妹妹真应该给掐死啊。,2,较差,727,0.5125328926452968
2011-12-16 23:45:07,瓜爺,reverse editing.. 很炫 用来描写女孩的心理很不错.. 战争的长镜头很有feel 但总体有点头重脚轻 男女主角的情感戏偏弱 7.5星,3,还行,1,0.9999997101063984
2011-12-28 04:33:35,陀螺凡达可,太美了，虽然故事稍嫌刻意和做作。,5,力荐,112,0.9766632946326664
2012-02-01 23:41:57,有心打扰,画面唯美、各种蒙太奇、主题深刻...人的一生都在成长，而成长不外乎就是知道了越来越多以前不懂不知道的事情和道理以及不断的去正视、修正、弥补自己曾经犯过的错误。有一些错误是无法挽救的，你只能警惕自己不再重蹈覆辙。救赎之心，难能可贵！,3,还行,37,0.9999999854658466
2012-02-06 18:32:23,Morning,如果那一刻不被原谅，便永远不会被原谅。,4,推荐,130,0.4369767138782506
2012-02-24 18:44:35,大白臉WC15,女人一嫉妒失去理性太可怕了.做伪证不用坐牢么?,3,还行,0,0.8808853548128353
2012-03-13 04:07:39,🌙e-L°。,天人永隔   用一輩子贖罪還是無法償還,4,推荐,0,0.2596533385244892
2012-04-14 15:44:20,度過漫長歲月,之前写的太偏激了。。【又来？= =】是很虐的片子。。bad ending。但是。嗯。,3,还行,0,0.8469338220180505
2012-04-16 22:15:00,言午多多,赎罪本身是一种心灵的莫大痛苦煎熬，亦具宗教色彩，但导演明显用力不到位。倒是感觉华丽丽的打了个喷嚏。令人叹息的是明明相爱的两个人，却被一个13岁的自以为是、满腔嫉妒的小女孩，活生生地改写了人生，生命早早凋零。凯拉的绿裙子，我喜欢。,3,还行,0,0.9999999993569072
2012-05-05 23:10:29,Wingsu,今天麦克尤恩袭击侵入了我的心。,5,力荐,1,0.940735788976207
2012-05-24 11:26:39,pierrothsu,里面有对金发意大利双胞胎小男孩，一个名字叫Pierrot。我给自己的英文名字也取了这个，之前想模仿法国科学家皮埃尔.居里的，感觉熟悉些。,4,推荐,0,0.9976862871991274
2012-05-24 15:33:32,jakartax,ING,3,还行,0,0.5
2012-05-29 10:28:46,我还是我,X  75876,3,还行,0,0.5455370938053219
2012-06-16 21:33:07,康球儿,残酷美丽的结尾,4,推荐,0,0.997241344664844
2012-06-18 18:23:57,兜兜菇凉,为了bc,5,力荐,0,0.5
2012-06-30 11:43:59,LEO LIU 一舟,一次的罪过需要一辈子来偿还   对里面的一个长镜头印象深刻,4,推荐,1,0.9055476636282256
2012-07-14 17:41:38,孙道德,小麦死的时候我哭得好伤心啊,5,力荐,0,0.3107927583456359
2012-08-11 10:36:28,老泰瑞,古典味十足的英伦片。,4,推荐,0,0.7731665110253302
2012-08-28 07:24:28,井行,在谢菲尔德的旅馆里看的BBC,4,推荐,0,0.0404654386054632
2012-09-04 19:33:10,老清新s,桑心,4,推荐,2,0.5
2012-09-11 18:52:51,番薯鱼,好虐人的一个故事。,5,力荐,2,0.7999148915354992
2012-10-10 22:14:35,Yveline,看见卷福一惊，不过角色不怎么光彩啊~,4,推荐,0,0.8614230239882771
2012-10-20 19:06:25,凉公子,Briony做采访时最后说的那句话我要把幸福还给他们，还不如不说。。听着更加讨厌13岁时的她。尼玛的文艺气质+想象力害死人！,4,推荐,262,0.5492202769078963
2012-11-28 00:59:48,darkcat,我只看到男主了，男主的蓝色深邃的眼睛，怎么能这么好看啊长的,4,推荐,296,0.992513340550058
2013-01-14 15:00:43,黑骨精,依据普利策小说改编，每个场景构置都精心无比，可以看得出这是乔·怀特最用力冲击大奖的一部，但却惜败给了科恩兄弟。善拍英伦风味的乔·怀特，掌镜此片自然拿捏得到位。在敦刻尔克沙滩的一场戏里，一个长达五分钟的镜头足以撼动观众，而且对于导演的所有功力都是一次难以估摸的考验。,5,力荐,0,0.9999999999876088
2013-02-21 02:15:04,樹一,好美。尤其喜欢小Briony悄悄走进书房的那一段，摄影师对光线的运用真是绝了。对于一个十三岁的孩子，她在一天中所经历的一切足以让她震慑，换个角度想想，Briony自以为是的“伪证”何尝不是感知背叛和羞辱后的恼怒？却因为自己幼稚的猜测要背负一生的疚责，年少无知竟可受到如此沉重的惩罚。,4,推荐,198,0.9999999645666988
2013-03-21 16:18:10,CharlesChou,若不是太讨厌KK，就给五星了。,4,推荐,6,0.1624826185649245
2013-04-10 09:58:34,Maria,直到电影镜头给到了一个老人独白的时候，我还是哭了，罗比和塞西莉亚最美丽的结局就是两个人都不知道对方已经死去，他们都在满怀期待中死去。整部电影的伴奏，和“打字机”的声音很特别。悬疑感也很强，童年犯下的最永远都不能救赎。我希望世界和平，战争太残忍了。,5,力荐,371,0.9999999999959828
2013-05-29 22:39:04,临时昵称,麦克尤因有没有一篇小说是不涉及娈童的？……这是病，得治啊！,4,推荐,4,0.987158984511264
2013-05-31 15:05:44,舌在足矣,文青害死人,4,推荐,7,0.3573102218151875
2013-06-28 18:03:59,李九弟Jody,永远无法忘记凌晨四点看到结尾时的震撼。那一年我高三，观影量不足两百部。很多时候，人生的一个选择，就是一辈子的错过，一辈子的“赎罪”。I gave them their happiness. 你真的能给他们幸福吗？,4,推荐,5,0.9999943626882184
2013-07-05 02:31:38,小宇@白兰地,从自以为是的给人定罪，到自以为是的忏悔，永远自我中心扮演上帝的人究竟要向谁忏悔,3,还行,70,0.7626948909022595
2013-11-24 22:45:24,bird,在我未知时犯下的错，用什么方法解脱？,5,力荐,16,0.8885409634164719
2014-01-19 11:34:03,爱幻想的小孩,其实《赎罪》就是个蛮俗的《英国病人》一样的用战争来虐恋的故事。之所以拍的这么动人我把它归功于出色的摄影和音乐，使其拥有散文诗的特质。美则美矣，但还不够,4,推荐,79,0.999999984920822
2014-01-20 21:09:51,Jumpingtigger,毁人一生还上帝视角说要给人幸福？去尼玛的！另外一美幻觉的时候想的居然不是情人而是妈妈，真心虐。,3,还行,50,0.9994718492371846
2014-03-17 09:36:39,Lycidas,难看到无法直视的KK对比着好看到无法直视的一美+跳跃性极强、诗化且真假莫辨的剧情，真是要精分了。关于孩童的恶，各种作品阐述的其实很多，这里让我觉得难以接受的是这种自欺欺人，流于表面的“赎罪”，只靠脑补一个幸福结局就能自我安慰和满足，那人生未免太简单了。,3,还行,63,0.9999999365644516
2014-06-06 23:38:38,Paradox,天真引致的罪恶有时候是最可怕的。因为一己的猜测，导致三个人的生活被彻底颠覆。人生没有回头路，错了第一步，后面的一切都无法挽回，这是整部电影最让人难过的地方。最后虽然布里奥尼用自己的创作进行了赎罪，然而她自己清楚这一辈子的悔恨及一部小说的阐述都无法将最初童真的罪孽消除。,4,推荐,6,0.99999999206692
2014-08-31 14:25:51,shininglove,2008年暑假观摩，补遗。,4,推荐,2,0.8114164557391758
2014-09-09 15:23:35,HAIBARA,结局虐的我全身疼T T 你知不知道因为你的嫉妒与自以为是毁了两个人的一生？ 最后还说把幸福还给了他们？？最该死的是你（可是你凭什么还活得这么长....）【一美又美到我看不见女主的程度,4,推荐,11,0.9998787513114102
