2019-09-17 16:14:41,回忆与否之,算起来真的很久没看到这样的作品了，简单、纯粹，又柔暖，又美好，到点的时候也没忍住触泪一把。其实细田守不过讲了个挺老套的故事，比较瞩目的是，他依旧在以自己的方式讲，讲在那些视听的细节上，讲在那些人物的言行中。如果有人在人群中，迷失了那个夏日最美妙的短暂时刻，我会推荐她看这部片子。因为成长本身并不需要太多的代名词，当她发现时间不等任何人――无论是用走的，亦或用跑的――都追不回来的时候，她所能放眼的，就只有未来。而那些不再往返的旧日、以及总被忽视的此刻，或许正比前往路上的未来更具意义，因为那些无法改变、不可挽回的种种，更决定着人未来的方向。最后的最后总是让人不知所措，可能我们从未想过，要就此结束，因而我们也总是寄希望于未来。但未来是否有她的身影？没人知道。但如果你不曾遗忘，便总能在那个夏日中寻回她,5,力荐,17,1.0
2019-12-17 17:52:35,初音求道大帝,8分，挂着科幻片名头的爱情片，美工很出彩，但设定很强行。这货能进top250还是有些牵强，个人感觉《魔法少女小圆剧场版》等电影都比这个强的多。最后那女主哈哈哈的叫声简直像av女优的叫声，会引起周围不纯洁的人的误解的。,4,推荐,7,0.999999707163438
2020-04-25 22:45:35,连城易脆,因为几乎所有穿越类电影都无法解释【外祖父悖论】或者【双生子佯谬】，所以必须要有一个足够精彩的故事和特别的叙事方式来吸引观众的注意，避免去思考可能存在的各种BUG。显然日本这类动画片就像我们的国产职场剧是披着行业的外衣在讲爱情故事一样，是披着科幻的外衣在讲校园恋情，只是说日本在营造纯爱、浪漫、阳光等这类气氛的能力确实世界首屈一指，能俘获不少青少年观众。于我而言，女主如此莽撞冒失的性格真是让我相当讨厌的人设呢，这种一开始没有好好珍惜最后勇敢追求所爱的青涩恋情对我也越来越没有吸引力了，也许我真的老了吧。反而想说一下穿越时空，这是一个大多数人非常羡慕的能力，然而我却有个担心，倘若穿越回去后时间不能快进，岂不是一模一样的生活又得完全复制一遍，好比高三连续复读那种体验，岂不是要直接崩溃？,3,还行,21,1.0
2020-05-11 22:44:07,最后一代等秋叶,真是太不好意思了，流了好多眼泪，生了好多气，看完还想立刻再看一遍。,5,力荐,6,0.9491751000398724
2020-09-11 18:09:50,麦姆威,动画少女版时空恋旅人。都挺好，就是人物画得太糙，只要远看就没有眼睛。你说如果有小孩看了这片真信了，会不会为了穿越跑去跳楼？,4,推荐,3,0.9999639207052547
2020-11-02 22:07:35,OreoOlymLee,告别时真琴不断将千昭推出画框外，本来以为是「画框内才具备有效的空间」，千昭重新走回视野则成了「画框内外时间都将永恒地流动」。,4,推荐,2,0.9945820163022886
2021-01-24 01:22:19,寸薪,一条长下坡正对着一条铁轨，这是哪个天才设计出来的呦,4,推荐,563,0.0300989865555931
2021-02-02 11:02:13,伍月,【A－】前一小时对各种小心思和夏日环境捕捉铺开的多精准啊，后半小时非要玩什么反转煽情。。but不说剧本，新海诚要是能有这一半导演水平，《你的名字。》都会是超神作。（我在未来等你，呜呜，为什么这种中二台词总能被二刺螈搞的这么浪漫啊）,5,力荐,2,0.9997290795871568
2021-02-07 13:26:59,我们都在树上,"4.5。

一部科幻校园青春爱情的日本动画电影。

真的精彩与日本能做出这么好的动画；与科幻结合的恰到好处，情感上的共鸣也直击人心。
看评论说，女主的性格不是很讨喜；但我不这么觉得，女主本身就有这个年纪该有的活泼可爱，她自己也说了“虽然头脑没有那么聪明，但还不至于是笨蛋”。

时间穿越是本片的设定；对于千那个时代的描写不够详细，但是已经足够解答观众心中的疑惑了。
整部片子围绕的校园里面的几个主人公展开；场景很有限，人物形象并不单一。
我注意到，影片中女主跑在楼梯上的场景比较特殊；继续琢磨，原来是尝试性的动画改良，能理解。
女主确实跟两个男主走得太近；在我们中国，这种情况很少见，即使有也会被家长学校抹杀。
关于时空穿越的电影，就是围绕着几个特定场景来进行。
",4,推荐,1,1.0
2021-03-21 10:52:06,双晚,A-. 比《你的名字》格局更小，对校园气质的捕捉却动人得更感同身受。一去不复返却永远眷恋的夏天恰似《请以你的名字呼唤我》的酸甜回味。最有灵气的是“与时间赛跑”的长镜头：摄像机和人物相对构成时间流逝中的参照，真琴先被镜头甩开，却仍重新入镜，最终跑出画框，正是青春最义无反顾的追逐——“我在未来等你。”“马上去，跑着去。”在熊熊燃起的中二魂与少女心面前，一切世界观上的局限都可以被原谅。试问，谁不想要一个来自未来的男朋友？,4,推荐,3,1.0
2021-03-21 10:52:06,双晚,A-. 比《你的名字》格局更小，对校园气质的捕捉却动人得更感同身受。一去不复返却永远眷恋的夏天恰似《请以你的名字呼唤我》的酸甜回味。最有灵气的是“与时间赛跑”的长镜头：摄像机和人物相对构成时间流逝中的参照，真琴先被镜头甩开，却仍重新入镜，最终跑出画框，正是青春最义无反顾的追逐——“我在未来等你。”“马上去，跑着去。”在熊熊燃起的中二魂与少女心面前，一切世界观上的局限都可以被原谅。试问，谁不想要一个来自未来的男朋友？,4,推荐,3,1.0
2021-07-12 23:50:16,未注销,血压升高番 看得我头一次拿出了我珍藏多年的阴阳酱(　^ω^)拳头硬了 瞎用那么多次能力就为了让自己过得舒服的女主有什么资格跟男主说要在关键时刻用啊(　^ω^)人家用能力来救人你用能力吃布丁你好牛啊 女主每次目睹别人代替承受不幸毫无波澜也把我拳头看硬了 西八 为什么不在意识到的第一时间打电话(　^ω^)这种强行推动剧情发展的做法到底是觉得女主是啥比还是观众是啥比 一点高中生美好感情都没感受到光升血压了,1,很差,12,0.9999999938071602
2021-09-03 19:34:56,姜将姜奖酱,“因为某个笨蛋哇哇大哭觉得全是自己的错。”某个时间线中我逃避了你所说的喜欢，错过了让你留下的机会。而又有某个我不知道的时间线中你为我放弃了回家的机会，只为了让我不要哭泣。可是最后的这条时间线之中，我们都没能再有机会说喜欢，全是一点点错过，留在了各自不为人知的记忆里。,5,力荐,245,0.9999999940774468
2022-01-01 11:39:56,DeckardYang,【4】诚然剧作上有各种缺憾，穿越时空设定落到细节处也经不起推敲，若能搭建完整体系会更好。但整部作品由内而外散发的青春气息与绚烂夏日的“瞬间感”实在让人迷醉，主角在奔跑中出画、入画，何止是游历文本时空，更是在影像时空中飞舞。结构相当诱人，观看过程渐进式愉悦。结尾固然在煽情，但我还是不争气地流下了眼泪，那句“我在未来等你”+摸头杀太动人。,4,推荐,4,0.9999999999999998
2022-04-05 14:08:28,土卫儿六胶片厂,行吧，女主要去故宫修文物了,4,推荐,39,0.8745984623889762
2022-05-10 20:17:43,路人彦小二,"刚开始看着，画风不太喜欢的，不过后面剧情真好看，女主人设也很讨喜
一个获得穿越能力的女孩，只是穿越回去吃被妹妹偷吃的布丁、吃铁板烧、嗨唱10小时KTV、巧妙避免“nice日”的霉运、回避一些不想回答的问题，以及帮助撮合好朋友的恋情
开头的剧情有点懵，突然获得穿越能力的不知所措，后面恋情浮出水面，非常好看，又好笑又好看，真挚的少女情怀，青涩的爱情故事，不必日本两位动画大导的作品差
黑皮功介真好看呀，3人纯粹的友情真棒，没有狗血情节，女主遍体鳞伤要救功介那段真的好感动
有些事要面对，不然错过了，会后悔的
人物画面我不咋喜欢，但是环境画面真的超棒，镜头也超不错
细节处刻画得很好，青春校园气息爆棚
「-我在未来等你
-嗯 马上去 跑着去」
感觉这种穿越爱情故事，后面很多作品有借鉴的",4,推荐,0,1.0
2022-08-18 17:50:58,曼靑,time waits for no one，岁月不等人。居然是我很喜欢的动画片《狼的孩子雨和雪》的同款导演。2006年的穿越电影，电影结构还没有现在这么复杂，只是说了一个很简单的夏日青春故事。险些因为自行车刹车失灵而撞电车身亡的17岁少女真琴，却意外拥有了穿越时空回到过去的超能力。掌握了控制时间的法则之后，她却只是把这些宝贵的穿越机会用在了一些鸡毛算皮的生活小事上，逃避做家务、数学考100分、回去吃没过期的布丁、延长在KTV的唱歌时间——这可能就是青春的美好吧。她用最后一次时空穿越的机会，回去见了陪伴了他一整个夏天的男孩最后一面。原来，即便拥有了时光机，遗憾也难少半分。「我在未来等你。」「嗯，我现在就去，跑着去。」去年冬天去了汕头的一家书店，墙上写着「我在未来等你」几个字，原来出处居然是这部动画片。它好像一直冥冥之中在等我,3,还行,1,1.0
2022-11-07 22:24:35,冻感糕人,看完穿越时空的少女，我浪费了人生的一个半小时和收获了一肚子的气。真的受不了这种无脑大条永远在搞砸事情的玛丽苏女主人设以及空口画饼欺骗无知少女的古董贩子男主。假惺惺说句“我在未来等你”就像给一坨粪便添加了巧克力调味剂，用表面虚浮的口味来掩盖破烂腐臭的内在，需要滥用九十九次超能力，才能意识到这是有限制的能力。女主用超能力吃布丁、接棒球、吃自助餐、唱KTV、给好友乱点鸳鸯谱（也不管别人喜不喜欢），就是想不起来一个因为自己间接被校园暴力的可怜蛋，每次都被撞到毫无歉意的路人，上一秒还很在乎下一秒知道是最后一次就能对男主问为什么不用在更关键的时候，炮灰路人配角就是没有人权对吧。,1,很差,10,0.999999999998348
2023-01-07 15:03:04,Kiki,我在未来等你，所以错过也没关系，短暂的分别也没关系，这样不顾一切也要回到过去的你，一定会在未来再见面。好浪漫啊呜呜呜，文艺青年千昭さん。要珍惜时间啊，那些回不去的唯有一次的时间，那些话要认真听，那些人要认真珍惜。,4,推荐,4,0.9999998724487787
2023-01-07 15:03:04,Kiki,我在未来等你，所以错过也没关系，短暂的分别也没关系，这样不顾一切也要回到过去的你，一定会在未来再见面。好浪漫啊呜呜呜，文艺青年千昭さん。要珍惜时间啊，那些回不去的唯有一次的时间，那些话要认真听，那些人要认真珍惜。,4,推荐,4,0.9999998724487787
2023-03-26 13:57:11,予亡,大概是因为刚看了《重启人生》，当千昭说出真相和那个站不住脚的理由的时候我真的无语了……熬了前面那么久还以为反转会是什么令人感动的理由……加上莫名的“男女之间不能有纯洁的友情”的傻逼设定……我真的……我不理解为什么这部片子的评分这么高……你们二次元……呃……恐异性恋了（。）,4,推荐,8,0.9995405173540904
