2012-05-31 01:13:07,一事无成孟烦了,以我的智商 不太明白他俩的时间交接会变成怎样  那种悔恨的崩溃的流泪情形剧中出现两次 我很明白 实在痛心裂肺 以前初中时 来了一个转学生  漂亮女生  风云人物 感情生活被传言的异常精彩   本跟我这种对感情生活少根筋迟钝的人完全不搭边  可是她却异常喜欢我  经常夸赞我 给我的留言上写到 时间太早,3,还行,0,0.9999983376312466
2012-06-18 09:06:19,未命名,这是我除了宫崎骏的动画外，最喜欢的动画片类型，画面很漂亮，片尾曲很好听。。。,5,力荐,0,0.9991913854900116
2012-06-18 22:28:30,不平行,很早就知道泪点在哪里了。。。但还是没忍住泪啊,4,推荐,0,0.6831353280889253
2012-06-25 18:08:33,婴宁,总之就是傻逼，总的来说这个动画是挺好的，但是女主角也太傻逼了吧，把穿越时空的次数浪费在那些没有意义的东西上面，无语，我如果有一百次的话，肯定攒起来。 看的很生气，不懂为什么那么多人觉得好看还看了一遍又一遍的,1,很差,34,0.994076573514164
2012-07-05 23:35:37,Panda的影音,笑声不断，喜爱有加！—— 经历过才更加懂得，有些事情发生了，就没有挽回的余地了。我不是千昭，更不是真琴，没办法穿越时空，去改变过去，所以有些遗憾只能让它留在记忆里，在时光的流逝中缅怀，乃至用眼泪或笑声去惦念它曾经的存在。如今看来，我不也和真琴一样希望在故事的结尾能听到那句话？……,5,力荐,17,0.9999999995276858
2012-07-07 22:17:54,XA™,#Touch#2012年7月7日电影，主题：时光机~即便能任意穿越时空也不是万能的啊~ OL：http://v.youku.com/v_show/id_XMTUyOTI4NjUy.html,5,力荐,0,0.6002259326852946
2012-07-16 00:41:32,神山樹,睡不着 我又重新看了一遍 真琴和千昭互相对于彼此的意义 就是所有时空里最珍贵的悲伤 如果有这样一个橙毛少年站在我面前 我会选择像芳山和子一样告别深町一夫 而不是像真琴一样试图跨越未来,5,力荐,6,0.999992064074702
2012-08-07 19:19:26,马克兔温,应该是滚球吧！穿越少女！穿越动作太没溜儿了。我在未来等你。那我用跑的。,4,推荐,0,0.9943847057474204
2012-08-12 14:56:28,公园,有点死神来了+回到未来的意思，不过作为少女视角的动画，更加温情细腻一些。,4,推荐,0,0.9999978971489784
2012-08-12 23:46:22,Joyce,“Time waits for no one.” 时间可以过得很快，也可以过得很慢。等待，也如此。,4,推荐,0,0.4287450341370351
2012-08-15 00:06:21,UglY_MoNey,怎么可以那么好看！！！忍不住狂吼一声！！！细田守你太适合这种现实生活和科幻相结合的主题了！！！不同于真人版的是，细腻的感情一直窝在心头，冲也冲不出来～就像阿姨说的，不管我们改变未来的事小事大，牵涉的不止是自己。起初一直以为真琴会跟功介在一起，不过这MAMO类型的千昭真不是盖的煽情～,5,力荐,2,0.9999999081324116
2012-08-19 00:17:13,欧阳杼,故事非常喜欢，只是画风略差一些。失望中又有希望的作品。PS：真琴叫“隆平”的时候，为啥我一直在前面脑补一个“袁”字……,5,力荐,5,0.7402323330163364
2012-08-26 09:40:36,doherty,看在她是少女动画片的份上...就不追究她的有关穿越方面严谨性的问题了= =...这种关于青春的东西 真是 让人欲罢不能的呀 真是愈发期待今年的神作了,4,推荐,2,0.9999753755298338
2012-09-05 07:36:39,喜喜,年少时青涩的记忆 友情 爱情 无论再细碎甚至繁琐的事情 想来都变成温暖的片段 日本电影能在两小时以内的都是好的！,4,推荐,1,0.9999982400024432
2012-09-05 07:36:39,喜喜,年少时青涩的记忆 友情 爱情 无论再细碎甚至繁琐的事情 想来都变成温暖的片段 日本电影能在两小时以内的都是好的！,3,还行,1,0.9999982400024432
2012-09-30 23:37:04,Never-land,“我在未来等你。”“嗯，我马上去，我会用跑的。”←T^T,5,力荐,0,0.98990723278516
2012-10-20 23:46:18,阿曼达‖微微思想一下就卡壳了。,很感动。为了能够回溯的青春，打多少星都不为过。改变什么的，我不要，能随意改变的青春不珍贵。我只要认真体会曾经拥有的一切。对自己再好一些，对特别的人再多关注一些。再多笑一些。,5,力荐,0,0.9999999760623414
2012-10-28 19:15:29,约翰迈克莱恩,我也曾多么拼命地想去挽回一件事情，却让自己遍体鳞伤，是的，回不去了，即使我们是想让他过的好，但又怎么样呢？生命是不可逆的，是我们改变不了的，是现实的。,5,力荐,1,0.9977676700674027
2012-10-28 19:15:29,约翰迈克莱恩,我也曾多么拼命地想去挽回一件事情，却让自己遍体鳞伤，是的，回不去了，即使我们是想让他过的好，但又怎么样呢？生命是不可逆的，是我们改变不了的，是现实的。,5,力荐,1,0.9977676700674027
2012-12-05 03:11:29,外星纪--南庄座,2012/12/05 wed 日本动画版本的蝴蝶效应嘛~不是很有爱 各种莫名,3,还行,0,0.9967948779746614
2013-01-02 19:05:05,flyingzorro,"时间不停流逝，无法回到的过去，遥不可及的未来
Time waits for no one！",5,力荐,0,0.9651999084882408
2013-01-09 19:44:32,走走看看,虽然剧情真的很傻，但是偶就素很稀饭啦，初中的我肯定喜欢，高中的我也必然喜欢，大学的我绝对喜欢，现在的我还是很喜欢。千昭，你个笨蛋！真琴，我在未来等你。,5,力荐,0,0.9999579553861376
2013-01-12 14:38:02,drain,我这个年龄看这类动画居然能看我，我由衷的佩服我自己，难道我那颗小清新的心理还在欲动，omg！动画很细腻女主角刻画那是相当丰富，我不知道算不算写实风格动画，但画面很小资啊,4,推荐,0,0.9999522707153548
2013-02-11 23:11:56,白,如果你会穿越时空，你会滥用这项能力吗？真琴的性格有时候挺让人讨厌的，对喜欢自己的男生没有明确的态度，就算是怕说了做不成朋友，也不该这样，什么事情都从个自己的角度出发的人最让人不爽了。影片最大的亮点就是结局。,5,力荐,0,0.9999380757907124
2013-02-14 21:40:22,瑶瑶,值得珍藏的故事。在青春时代那些友情和爱情的懵懂，那些天真无知的可爱纯真多么让人缅怀。完全被千昭和真琴最后那两段分别的戏萌到，又悲伤又感动。画风配音清新舒爽，让人心胸辽阔，暖暖的温柔在内心涌动。,5,力荐,1,1.0
2013-02-24 21:27:01,欢乐分裂,假如让我说下去；倘若他日重来；年轻真好，未来总有一个人等你。,3,还行,34,0.9949069356222424
2013-03-04 15:09:48,䒳,最触动的不是时间跳跃，而是那些夏天我们一起无忧无虑讨论八卦的青春。太纯情得不真实，我在未来等着你。有时不要太纠结如果，顺其自然反而是最美好的。,4,推荐,1,0.999913348619652
2013-03-04 15:09:48,䒳,最触动的不是时间跳跃，而是那些夏天我们一起无忧无虑讨论八卦的青春。太纯情得不真实，我在未来等着你。有时不要太纠结如果，顺其自然反而是最美好的。,5,力荐,1,0.999913348619652
2013-03-10 21:06:14,汀,时间停下来那里完全是我印象中的细田守இдஇ真琴这孩子笑起来太路飞了0w0最后千昭那句【我在未来等你】(*/ω＼*)后期BGM超有推动力听了就觉得啊啦少女心粗线了0v0,5,力荐,1,0.9999997463969612
2013-03-10 21:06:14,汀,时间停下来那里完全是我印象中的细田守இдஇ真琴这孩子笑起来太路飞了0w0最后千昭那句【我在未来等你】(*/ω＼*)后期BGM超有推动力听了就觉得啊啦少女心粗线了0v0,4,推荐,1,0.9999997463969612
2013-03-29 06:28:49,Fermi.Paradox.,如果可以穿越时空 我会回到哪个时刻？ 想了很久 越想越往前 似乎有很多想要改变的。可一路上遇到的那些人呢 如果变了 他们还会在吗？舍不得。觉得明白了。有时往前看害怕会后悔的事不如往后回顾一下 如果那时的决定是继续 选择相遇 那未来也无需害怕了 知道自己不会后悔就够了。珍惜。,5,力荐,0,0.99999515387005
2013-03-31 20:41:35,仿真男孩哪吒,"就这样开始涉猎日本电影了呀 为了不要厌学 真不容易 一 一+
“不是来和你吻别 是在未来等你”",5,力荐,0,0.9989105914242136
2013-04-01 17:07:54,Anderson,用时空的契机诉说青春懵懂和害羞。'讨厌，明明很喜欢，为什么嘴上却说不呢'这是所有人在这时候的中心独白吧。话说回来，日本的女生其实是没有屁股的，他们的超短裙不管拉多高，都只能看到大腿。这让我想起一个童话，王子拿起电话打给女巫，你他妈的只给美人鱼一双腿！,4,推荐,0,0.9377428343779431
2013-05-02 20:59:49,风蚀蘑菇,特别夏天的电影，细田守作品里最喜欢的一部。爽快的节奏，细腻的情感刻画，有笑有泪的情节，结局想起时间旅行者的妻子，最后一跳和结局的慢镜头特别大气。除了逻辑性逊于石头门甚至凉宫春日的消失不太好。说起来，三个人的时光不比二人世界差。两男主设定得好校园偶像但还是帅到我了无可救药少女心啊,4,推荐,4,1.0
2013-05-18 01:51:17,阿联酋十四阿哥,虽然情节有些问题，尤其是后三分之一很无趣，但青春的情怀好棒，单纯的勇敢的心也好棒！想一直在一起的愿望也好棒（自己完全都没有了）。配乐好听。TIME WAITS FOR NO ONE,5,力荐,0,0.999999198082991
2013-08-11 16:16:49,菠萝蜜个隆冬强,"在没有准备的真相面前总是会留下遗憾。似乎是“罗拉快跑”和“大话西游""的结合体，只不过相比之下真琴只是一个天真而傻气的中学生，为了逃避爱而逃避友情，最后的大哭真是让人心揪。这个滚来滚去的女孩子只得到了一个来自未来的约定，没有喷涌而出的剧情和鲜明的角色塑造，简简单单的小清新完全俘虏你",5,力荐,0,0.9999999750914552
2013-09-28 20:27:13,远子,豆瓣电影T250里又少了一部……,3,还行,7,0.9820533126549666
2013-11-18 11:08:37,Azeril,我们努力奔跑 为了在未来相遇。,5,力荐,31,0.9927568801515108
2013-11-20 23:16:35,scofieldd,比之10年的真人版要强太多了，有着青春的质感和初恋的情怀，伤感而不矫情，新颖却不做作，没有真人版身世之谜那么多支线，显得干净和纯粹。真琴在不同的时空中不断的跳跃明显是在致敬千年女优，中间那段穿越戏更是有很强的既视感,4,推荐,1,0.999999999994698
2013-12-07 22:36:57,萌 . 李,不知道这片子好在哪，又臭又长，看得人心烦，女主完全是讨人厌的典型，周旋于两个男生之间，然后装作又傻又笨不知道两个人对自己的爱慕，被人告白还矫情的不听，最后发现人家不理自己之后又三番四次找人家，给人家添麻烦不说，最后告别的时候还必须让人家告白，不告白就哭，自己什么也不说，烦透了。,2,较差,370,4.515958637374418e-06
2013-12-25 01:45:42,硬搞,欠撞蠢少女穿越时空一厢情愿替人做媒的故事。,2,较差,11,0.720452883987889
2014-02-08 22:37:40,同志亦凡人中文站,少女因不知道如何面对告白，选择以时空跳跃的方式跳过。最后她才发现，那其实是她生命中最该珍惜的段落。看她大哭着跳跃着，拼命想追回擦肩而过的缘分时，我的少女心咯噔一下发作了。细田守讲了一个很戳人的初恋故事，跟这片一比，“时空恋旅人”简直是块莫名其妙的烂布...,4,推荐,1035,0.9999999957173732
2014-03-19 01:20:40,穆如初,再没有那样清爽无瑕的夏日了吧，畅快的过着属于自己的学生生活，因为一点点小事而欢腾雀跃，悸动，心酸，担忧，还有对时间毫不珍惜的挥霍。/1.时间2.没有我看不透的东西3.time waits for no one/你会等我多久？我整个未来都给你。/晚安【2】,3,还行,0,0.9999550240664696
2014-04-26 17:16:42,jagpumpkin,石田卓也的长相乡土健康淳朴帅气，声音温柔好听，真是一枚低调的好少年！千昭对真琴的告白太可爱了，就想告诉你就想告诉你就想告诉你就想告诉你！不太能理解霓虹以及当下的风潮，连纯爱都不会写了一定要穿越才能加料，不过笨蛋的浪费式穿越还是很青春质朴少年的，开头嫌浪费后来才觉时不我待就是如此。,3,还行,0,0.9999999999797696
2014-05-01 22:22:54,饿霸地煮,如此轻盈骨感的表现出时间不等人，以及错过的主题，相较下，《致青春》、《同桌你》动辄十年二十年，就显得太笨重了。,4,推荐,3,0.9999897331946026
2014-05-05 20:17:16,风悲画,【细田守】：成形于「穿越题材」不那么泛滥的年代，情节紧凑，设计巧妙，如同玩游戏各个结局走一遍，一遍一遍地推倒重来，但是……有次数限制的哦。青春是美好的诗，即便年轻人不能穿越时空、回到过去，他们还是有大把的时间，去改变未来。,4,推荐,0,0.9999999999997178
2014-05-05 20:17:16,风悲画,【细田守】：成形于「穿越题材」不那么泛滥的年代，情节紧凑，设计巧妙，如同玩游戏各个结局走一遍，一遍一遍地推倒重来，但是……有次数限制的哦。青春是美好的诗，即便年轻人不能穿越时空、回到过去，他们还是有大把的时间，去改变未来。,5,力荐,0,0.9999999999997178
2014-07-24 01:26:39,光年‖影视歌三栖民工,换了是我，每一次的穿越时空不会独自羞涩或是拒绝，而是为了不断重温和心爱的人在一起的甜蜜时光,4,推荐,4,0.9999926464052374
2014-08-08 15:18:15,萨罗迈拉,故事很棒，那幅画来得有些突兀，千昭从未来回来的理由应该和真琴有关，否则略有脱轨之感。情绪很对，不错的脚本。,4,推荐,2,0.9999955837480328
2014-09-26 16:48:52,shininglove,多盼能送君千里，直到山穷水尽，一生和你相依。,5,力荐,58,0.99517752816614
2014-12-27 21:42:04,软糖莫爷,不是有句话说少年时喜欢的东西会一辈子喜欢吗，第一次看这部片子时跟真琴差不多年纪，如今再看果然还是非常非常非常喜欢，片子里那种“气息”最棒，因此原谅了它所有的瑕疵。人生中尤其青春期一定做过遗憾后悔的事吧，但是我们都没办法像笨蛋真琴那样时空跳跃，所以当别人告白时，一定要认真听,5,力荐,1,0.999999859273198
2015-01-04 23:57:35,撒旦的表妹,女猪有点讨厌，但是最后那句“我在未来等你”还是戳中泪点了,4,推荐,27,0.931213086982532
2015-05-17 14:08:57,梦里诗书,穿越时空已然是一个老生常谈的话题，其或是穿越去往未来的科幻，亦或是穿越过往的荒诞，但鲜有一部电影能如《穿越时空的少女》这般，以科幻之名留存住一个近乎完美的青春之梦，在那清新的仲夏之日里，一名意外拥有穿越时空能力的少女献予了太多甜蜜的感动。,5,力荐,2,0.9999999999999998
2015-06-27 23:53:36,匡轶歌,画风蛮喜欢。不必去深究时间穿越这个设置背后凌乱的逻辑，片子其实只说了一件事：Time waits for no one ，做自己喜欢的事、爱自己所爱的人，都要现在就去，跑着去。倘若对方姗姗来迟，你就要跑着去迎接它。时不我待，只争朝夕。,3,还行,1171,0.9965998865922812
2015-07-08 19:55:40,sirius_flower,哈哈哈哈哈哈笑抽了都，太二了！配合哥变简直效果拔群！云画的很不错呢，特别喜欢那种在尴尬状态的静止镜头，终于明白日本天台周围的铁围栏了-防跳楼！还有，西瓜也不吃！！结尾奔跑的长镜头...所以这部片子是鼓励乃们赶紧去表白！time waits for no one！,5,力荐,2,0.9998447698559472
2015-07-11 10:53:03,CapyPOWER！,设定是在未来人们可以拥有回到过去的能力从而改变时间，然而讽刺的是，真琴回到过去那么多次，但是Time waits for no one. 很喜欢三人组，想到自己的小学初中，在三人组里度过了最快乐的时光。现在却不知道大家都去哪儿了在干什么,5,力荐,1,0.9999997027942856
2015-08-12 22:27:53,Doublebitch,還是覺得應該儘早把車閘修了啊喂,4,推荐,110,0.0432488056472889
2015-11-12 19:15:58,刘康康,科幻包装下的日式青春片，逻辑其实挺混乱和经不起推敲的，但这不重要，要的是青春期干净、明亮，却又略带忧伤、怅然若失的感觉。跟求婚大作战特别像，连奔跑的核心意象都一样（求婚是穿越后奔跑，少女是穿越前奔跑）。风格成熟度没有细田守后两部作品高，但依然有迷の感动。,3,还行,39,0.9999999999994
2016-02-24 13:37:15,sleepy Mia,"小情歌。
世界上最懂初恋的感觉的，应该是日本人吧，大概是因为这个民族的人，才一出生就已经老了，所以特别特别特别特别
的，在意“青春”。",4,推荐,20,0.9999988728211122
2016-02-28 01:11:44,Otocolobus,嗷嗷少女心爆棚的青春期配上软科幻，这个故事真是太美好了。很难不让人回忆自己的青春。我在未来等你。【很想问那趟四点钟经过的火车的心理阴影面积...,4,推荐,18,0.9999999838825048
2016-03-08 08:41:04,蜉蝣,年轻真好，再大的事情也只是这些小事。,4,推荐,59,0.8506287215960239
2016-03-19 13:16:02,想本雅明迟了迟,日系青春片就是不断提醒你：你也就能看看吧，你他妈已经不是高中生啦！,5,力荐,3,0.5305747201753264
2016-07-03 21:00:23,Coralineee,"Every ending leads to something new. Darling, it's alright. Time will wait for you.",3,还行,1,0.6833515746535977
2016-07-16 01:05:02,Lycidas,原来拥有时光机，遗憾也难少半分。,4,推荐,613,0.938895108676289
2016-07-16 18:07:13,冰红深蓝,"时空穿越的故事很难避免漏洞(如本源性的时间悖论)，本片亦然。但那份青涩懵懂的初恋之情被刻画得极为动人。奔跑穿越法活力四射，真琴遭摄影机甩脱后仍勉力加速，及至重新入镜，终而超越镜头，如此不羁而决绝的意志恰是青春的真谛。对画作的迷恋、滚式落地与""马上就去，跑着去""令人笑中带泪。（8.5/10）",3,还行,29,0.9999999999999996
2016-08-26 20:23:08,薄荷,虽然画风说不上很好但是剧情真的很好故事挺新颖的，最后的那句我在未来等你让人感到又伤感又充满了期待，未来，你们还会相遇吗？,5,力荐,40,0.9999999905995222
2016-09-24 15:02:16,Jumpingtigger,最后还是泪目了，想到有个这么好的人在未来等着，整个人生都有了奔头。,5,力荐,137,0.9969844857436628
2016-10-10 03:07:17,摇尾巴,「我在未来等你」「嗯，我马上去，跑着去」,4,推荐,100,0.6660539948180503
2016-10-30 22:16:58,瓶子不能倒,情节完整，没有太多bug。很暖很令人心动，这种少女式的情节，总是让人感怀学生年代的美好，我也沦陷其中。,4,推荐,6,0.9999959838472734
2016-11-13 21:44:36,叫她孙女凯拉走,有时空穿越这种能力竟然只用来对付日常琐事，看完电影觉得女主是个笨蛋，不过也得亏女主是个笨蛋。,1,很差,72,0.9999722183469656
2016-11-14 09:14:39,Sophie  Z,年轻真是无畏啊。可以一直那么用力地错过，最后会怀念一生的人。,4,推荐,175,0.9966897530989568
2016-12-07 00:37:24,来年樣,好想回去啊，那时候的一件小事，都是眼前的“灾难”，不会应对只能逃避，心里默念“快点过去吧快点过去吧”，就真的这样一下子过去很多年。再想回去，次数用完，谁都办不到了。,4,推荐,154,0.979859623777463
2016-12-27 19:52:48,momo,Time waits for no one.,1,很差,113,0.4476784585098667
2017-02-04 12:12:20,思路乐,【C+】原谅我有些看不懂-_-||（个人感觉细田守最被高估的一部作品，他个人生涯的剧本最佳发挥是《狼的孩子雨和雪》）,3,还行,2,0.9982593968473052
2017-02-22 19:21:53,玲自体,是这样的，我想这是很多女生的经历，被本来关系不错的男生告白以后，突然莫名反感然后躲避消失，最后只能在回忆时后知后觉了。我想不明白这是源于一种女性的什么情愫，第一次直面非亲情的爱都是回避状态。初中的时候伤害过两个男孩，其中一个后来听说因为我的拒绝变坏了（但愿不），后再想起只能无言。,4,推荐,11,0.9993148984775764
2017-03-23 22:56:31,请保持高冷,热血少女的穿越故事，创意挺不错的,4,推荐,5,0.9999775949901084
2017-03-25 21:12:08,小森林,女主有点作，心疼我男主,3,还行,56,0.8771332295545438
2017-04-17 09:16:36,朝暮雪,人生的魅力不是如愿以偿，而是阴差阳错。,4,推荐,97,0.9969480084484764
2017-06-04 18:29:45,Finn,原以為會落入俗套，結果還不錯。故事架構雖不脫老梗，但青春的細節刻劃能讓人產生代入感，有了那些情感交織，才會對後來女主穿越的種種心緒感到不捨。此外，有未來人的設定不錯，通常在其他片中，未來人都是回來改變未來的，但這裡不是，反而是約好相遇於未來，著重於改變了過去之人，而非過去的事實。,4,推荐,1,0.0235252881675555
2017-06-21 15:25:25,你不喜欢文渊吗,我会爱上你，现在的你，未来的你。,4,推荐,14,0.9830631652792372
2017-10-23 00:45:58,根,这样的夏天我也不想结束啊！但我们在这个夏天里的位置，最好也不过是女主的闺蜜吧,5,力荐,201,0.9814245417576674
2017-12-08 21:59:32,粟冰箱,时间凝固的夏天，少男少女隔着灰色的人群告别，拥抱过后，转头却消失了踪影，真的好美啊……,5,力荐,3,0.994469696625184
2018-04-24 09:26:52,般若儿,很清新的一部少女电影，将青春独有的气息描绘的很形象可爱。,4,推荐,24,0.9999999709396163
2018-04-25 08:20:45,一蓑烟雨任平生,这部影片有很多新奇的地方，也有很多让人感动的瞬间。女主人公一直在一个坡哪里穿越回过去，每一次下坡是遇到的情况都是不大相同的，但是很多次的结果却是相似的。当仅剩最后一次穿越机会的时候，女主把它用了，后来又通过使用最后一次，获得了再一次的穿越机会，其中的逻辑让人惊叹不已。,5,力荐,7,0.99999889582544
2018-06-10 19:53:30,一纸素言,真是充满了胶原蛋白的青春电影。高中的我们就是为了这些鸡毛蒜皮或开心，或失落，或不知所措。如果我们有了时间作弊器是不是为了规避哪怕扰乱他人命运的错误还是要回到最初的原点。最后一次奔跑，能让你回到你的世界，却永远都错过了当初避之不及，不知所措却也最真诚的告白。我会努力奔向未来的你。,4,推荐,7,0.999999999987958
2018-07-05 11:08:43,樂啊樂,利用科幻描绘一个高中少女的青春，十分有趣，后面部分也比较深刻，将珍惜感情与时间的主题突出的十分好。,4,推荐,4,0.9999999909360054
2019-01-16 23:00:20,张兮兮,“如果他迟到了，你也会跑着去接他吧。”原著的年代比较远，所以现在看来其实挺幼稚的。但这部动画的改编简直完美，留下穿越的设定，把内核改为难逃遗憾的青春。穿越时空，也改变不了错过的东西。那些遗憾，始终是遗憾。我再年轻几岁，应该会泪目吧,5,力荐,9,0.999999630556998
2019-02-06 02:33:11,囧之女神daisy,只有青春才能兼容轻盈和沉重。,4,推荐,170,0.9923895191263902
2019-02-16 19:43:23,Lu,3.5星吧，優點是作為線索的伏筆不少，但缺點是劇情上的邏輯漏洞也不少。還有，真琴是個蠢到會讓人拳頭很硬的女主角-.-可以為了雞毛蒜皮的一己私慾和逃避抉擇胡亂穿越，但是不會為了被真琴害到被霸凌的男同學穿越時空，也不會為了被滅火器砸傷肩膀的好友穿越時空。所以後面即使看到她在搓合功介和學妹的感情也不會讓我覺得她是個會為他人著想的人，說穿了就是以自我為優先的自私笨蛋罷了，很人性，但不是很討喜。再者，被阿姨提醒使用能力的話，有可能會讓他人代替承擔厄運，而班上男同學和好友也的確在她面前展現了是如何成為了代替者，而女主角卻渾然不知，直到最後引發功介和學妹被火車撞上的未來時才知道後悔。因為以上幾點，所以最後看到千昭與真琴的錯過，我也沒感覺太難過。,3,还行,2,4.5760615630108254e-08
2019-02-23 01:40:03,少侠霸霸,这部片子告诉我们，岛国牛逼，上学不仅仅可以拍爱情动作片，还可以拍爱情动画片。日本中学好幸福，学生上学不念书，整天琢磨谈恋爱，恋爱不如意了就穿越，一直穿越到满意为止。生在日本真的很幸福，不仅仅上学是为了谈恋爱服务，就连时间都在为谈恋爱服务。,1,很差,16,0.9999999999999992
2019-05-22 10:19:29,zykmilan,#亚洲电影展#真是又暖又甜又元气十足。少女心爆棚，一个披着时空穿越外衣的青春题材电影。少年时代可能会更吃这一套，上了年纪就无法不忽视其中的种种bug带来些许遗憾了。不过，也许，这遗憾感也如同电影内容一样，青春就算是再重来千百遍，怕是也免不了有遗憾吧，可那不正是青春的美之所在吗？,4,推荐,3,1.0
