2017-04-15 00:03:14,(๑⁼̴̀д⁼̴́๑),布恩从一开始遭到所有人的排斥到凭著自己的信念，并在比尔的的配合之下，将一群脾气恶劣、注意力不集中的孩子调教成了一支富有活力、专打胜仗的橄榄球队，成功地将这一只长败军的黑白混合美式足球队伍推至冠军宝座。自从黑白教头并肩作战后，胜利的消息便不断传回..,5,力荐,19,0.999550983206797
2017-04-15 18:16:13,我是谁你又是谁,音乐很赞，投射了美国最热门的两个主题，橄榄球和种族问题，很有心意，挺好的,4,推荐,35,0.9999878500436096
2017-04-16 00:48:12,liu—525,励志、热血、总的还不错,4,推荐,12,0.9749234496744712
2017-04-17 16:29:58,不侠与,伟大 热血励志充满希望的光辉岁月,5,力荐,9,0.9890590382197466
2017-04-17 17:44:54,天秤座的胖子莹,校园片的那份青春热血激情斗志是别的类型片无法代替的,5,力荐,68,0.9999785349532588
2017-04-17 21:25:00,潇潇暮雨,这类热血片即使看多一百遍也不厌烦，人生就需要这种激情活力,3,还行,35,0.999153258392776
2017-04-17 22:45:49,苏晓晓,励志，青春 ，热血,4,推荐,22,0.9959984504317766
2017-04-18 12:50:10,半城风月,光辉岁月，是没有种族歧视，一同热血成长的岁月。,4,推荐,36,0.999714586714615
2017-04-18 18:47:47,倩婧箐菁靓,看得热泪盈眶，体育精神是种族融合的强心剂，很热血沸腾的体育片,5,力荐,9,0.9985023376939164
2018-01-20 19:52:38,左胸上的吸盘,华盛顿最擅长的演讲大王类角色，此外四五个主要角色也各有面目。剧本很好，一上来就弄一个政治正确下的兢兢业业白教练当牺牲品（黑人遭歧视的剧情放到后面才安排），这样如何扭转黑人角色在剧本上压力明显，虽然全体角色都有理性擅沟通让难度降低，但细节和节奏安排值得注意。全片橄榄球场面完成一般,3,还行,1,0.9999999977426968
2018-05-27 11:28:48,荔枝超人,只有题材和串烧老歌是拿得出手，电影本身拍得也是各种难看。尤其是戏精小孩，blablabla的时候真想直接一把抓起扔出窗外。,2,较差,0,0.8636285922974037
2019-06-29 15:15:28,开了一朵花,体育电影真的太热血了😭 虽然完全看不懂橄榄树的比赛规则，但还是几度泪目。虽然细节略生硬，但瑕不掩瑜。黑人教练和球员在险峻的社会环境中捍卫尊严取得成就，可敬。但我认为更了不起的是那些选择放弃“特权”，反抗多数，主动融入，铤而走险的白人，这需要更大的勇气和决心，如果前者是为了生存而拼搏，那么后者就是为了公正而冒险。PS.队长格里就是真正体育精神的代言人。,5,力荐,0,0.9999999999726332
2019-07-29 21:13:57,超cute侠,拍得非常正统，以至于现在看有些无聊，用体育去讲种族融合，故事都是能猜得到的发展，热血到有些聒噪的地步，华盛顿演这种角色毫无挑战，亮点是看到了年轻时的高斯林。,3,还行,0,0.9999929066751856
2020-04-17 23:57:00,难,"真该把B站那些天天尼哥来尼哥去的小鬼捆起来，像《发条橙》里那样“精神治疗”（精神折磨），全天24小时播放这个电影。
9分",5,力荐,3,0.8206081242948197
2021-02-17 21:19:26,君心可晴,"经典影片之一，这个时候，还没有政治正确，没有功利性的电影，才是真正打动人，在特定的历史背景下，一个真人真事改编的励志片，真的非常好看。……“啦啦队长”海顿潘妮蒂尔才10岁，非常可爱，颜值超高“Save the cheerleader,save the world”。丹泽尔华盛顿后来在07年，自己导演了《伟大辩手》，是一部可以媲美本片的作品。",5,力荐,1,0.9999999946330782
2023-02-11 14:16:52,Panda的影音,1.曾经“走过”《光荣之路》，如今感受《光辉岁月》。2.先是 Norman Greenbaum《Spirit in the Sky》，再是 Marvin Gaye / Tammi Terrell《Ain't No Mountain High Enough》，听到这两首因为《银河护卫队》而喜欢上的歌曲真是让我惊喜；3.回想起来，我对橄榄球比赛的启蒙可能源自于《阿甘正传》；……,4,推荐,2,0.9999300446037338
2023-07-14 22:07:20,江湖郎中调研,"布恩的训练不仅开发了队员的全部潜力、拉近了队员彼此之间的距离，更重要的是为泰坦队留下了一种为了赢球永远团结为了团结永远赢球的精神！这种精神让盖瑞从一个倚仗MVP就耀武扬威的青年变成了残奥会的冠军，让泰坦队成了消除黑白种族隔壁的典范。
I m a winner ！",3,还行,0,0.9999813030135636
