2007-09-23 03:43:53,铁皮骑士,内歌可真经典，场面也不错，和决战星期天各有千秋。,4,推荐,0,0.9981316992832462
2007-10-02 20:32:43,Wayne,"很励志,Denzel Washington 2000年的片子,很不错,看得让人情绪激动,小女孩粉可爱,搞笑的镜头基本都是她的了",5,力荐,1,0.9999312110797258
2007-10-22 10:15:16,狐,咱们一起变老，咱们一起变胖……同样题材的片子，一而再，再而三地打动我。有时候，真的觉得自己适合打橄榄球，野蛮冲撞，爽！,4,推荐,0,0.9996561311918744
2007-10-27 12:08:31,bayer04,"awkward formular artificial & propaganda-like, 倒是CAST了几个之后大红的配角.",3,还行,9,0.8650379020689201
2008-01-15 11:09:42,hiphop,种族冲突 意识形态冲突 感情冲突都溶合在橄榄球比赛中 当时看得我热泪盈眶 ,5,力荐,0,0.9976852479475162
2008-01-26 21:13:56,蒜 | BOY A 🌈,2003.3.15 cctv6,5,力荐,0,0.4737672181921908
2008-02-25 16:46:05,傲慢与偏见,"是体育,让不同种族的人走到一起,并成为永远的朋友.",5,力荐,0,0.965833895715248
2008-08-28 02:49:34,九尾黑猫,励志片里的经典啦~,4,推荐,10,0.7366194479911016
2008-11-19 23:18:46,疾走,"Just love football for no reason. (Now I look back, yes, there is a reason. Ben. I didn't understand how much I liked him until later on. 8/10/2016.)",5,力荐,3,0.0012738866252308
2009-10-08 10:58:26,理想多钱一斤啊,Actions speak louder than words.,4,推荐,44,0.421874597530976
2009-11-20 18:17:59,kobie,的确让人热血沸腾。运动就像音乐可以超越国界、跨越种族,4,推荐,0,0.999680449247459
2009-11-28 12:13:44,醇脆,球场上都是近景快节奏完全看不出所以然，布阵也就假模假式，倏忽一下就出结果了，就算这不是重点也不能这样随便摆弄吧。音乐插的位置都对也不突兀，但这样营造的情绪起伏太生理了吧。,3,还行,0,0.7719799030107807
2009-12-26 22:55:54,怪兽,History is written by the winners,4,推荐,0,0.4476784585098667
2010-02-12 04:21:42,范比尼希,整体风格相对很轻松，感觉不太见血。但是砰砰的碰撞还是很热血。,4,推荐,1,0.9973398254648244
2010-03-03 05:09:58,牙齿冒汗,"连续看了两部关于种族歧视、融合的电影。 这部显然要积极、励志很多。
想象一下就在30年前，美国的种族歧视还是如此普遍和尖锐, but they still made it（至少看上去已经挺歌舞升平了）",4,推荐,3,0.9998673942115284
2010-03-07 16:26:50,米饭,总想说，丹尼尔的励志真的都能打动人心；而且，很经典的一句话，如果你想成功，就需要野心与决断，这才是领导者的气度,5,力荐,0,0.99698513894821
2010-03-11 17:58:07,平日,Hayden Panettiere的第一部电影，演技竟如此了得，天赋啊,5,力荐,2,0.7338603204745013
2010-04-22 17:31:37,ah1,知道这部电影是因为02世界杯时的中国主教练米卢...,5,力荐,0,0.6590210866229963
2010-05-31 21:11:20,Doublebitch,泰坦队的出场舞太有爱了啊啊啊啊啊！！,5,力荐,95,0.9087090853690708
2010-06-06 11:38:45,Cool老房,best foodball movie ever,5,力荐,0,0.7826653358894131
2010-06-22 11:24:56,豆腐KING,每次看这种电影，就幻想着自己有一个团队，有一个成就，可以让人回忆~,5,力荐,0,0.9999415885399644
2010-07-10 22:17:56,puma1020,感觉和其他同类体育励志片不太一样~~,5,力荐,0,0.3717207145027444
2010-08-18 01:16:03,.,爷们的电影，team building，team morale,5,力荐,0,0.7276462824374784
2010-08-18 18:30:44,韬子@Tower,很久没看到如此热血的影片了。以上。,5,力荐,0,0.7783437742738294
2010-08-21 15:41:37,翁小样,PPS 英文中字 1520 外公家 http://movie.douban.com/review/3578978/,3,还行,1,0.1752356918225717
2010-08-31 23:15:42,七喜,橄榄球，还是Kia kaha更有热血沸腾的感觉,5,力荐,0,0.842961330490988
2010-09-12 23:10:39,Gravity | 小牛牛,"电影不多说了，非常棒。
小女孩长大做了拉拉队长，发现自己是不死身...然后...",5,力荐,0,0.974552154104494
2010-09-23 01:27:26,歌尔德萌,作为我团队之道培训的课件之一,4,推荐,0,0.0636187534135548
2010-10-11 21:07:25,云景,初中时候班主任放给我们看的。,4,推荐,0,0.9253559644181574
2010-11-05 00:33:58,偏左,   种族冲突的根源还是在于双方不愿意踏出那关键性的一步，还得靠这些热血电影来加点融合的进程，作为体育类的加点政治色彩的片，各方面都还成，只是不算特别出彩。,4,推荐,0,0.9999996963210216
2010-11-11 18:32:20,memory,很喜欢这个电影，两种肤色的人成为好朋友~~运动改变了每个人，这个教练改变了很多人~~,4,推荐,0,0.9999306148749356
2010-11-12 16:10:57,Yuri,本想4星 但是华盛顿的影片 就要给5星。 没有弱点给力。,5,力荐,2,0.0329723255151795
2010-11-21 10:51:31,Ghost,种族问题的影片一向都是值得大书特书的题材，如果将这种“战争”再与同样充满对抗的体育所匹配，那无形中就将其主题升华。此外还有丹泽尔华盛顿满怀激情的出演，怪不得当年米卢选用此片让男足觉醒,5,力荐,6,0.9999727553273364
2010-11-21 20:09:00,Lopita,we r brothers no matter what color we r,5,力荐,0,0.0680310779184368
2010-12-02 15:53:06,major,连赢十三场就是比较难拍 因为每场都是客服困难胜利 观众看着实在是 正义终将胜利的感觉！这配音版也太不专业了 有一小部分还没配上,3,还行,0,0.8739269961809986
2010-12-02 20:32:26,伊蒂克,小学时看的，当时超喜欢,5,力荐,0,0.9116297421903202
2011-01-03 22:43:07,流浪忧伤,多好的片子，怎么看的人那么少啊,5,力荐,0,0.848871431527864
2011-01-18 22:20:11,小有™,同样是迪斯尼出品的体育电影，把那部《光荣之路》的历史背景，剧情架构照搬过来，把篮球换成橄榄球，就成了这部电影，应该是《光荣之路》炒了这部电影的冷饭。这部电影是不凡的，它有腕级偶像丹泽尔华盛顿，有美国70年代种族融合的大主题，有奋斗和荣誉，有情同手足惺惺相惜，是正常人都会被感动。,5,力荐,0,0.9999999999999944
2011-01-27 20:29:25,李若水,失落时，体育、打斗，这些原始力量是总是给我一针强心剂。我热爱体育！,5,力荐,0,0.9989695074177304
2011-02-06 15:14:56,DBDB,橄榄球对美国人真是一个神奇的存在，那么看似不可调和的矛盾会因为球赛开始有转机。DENZEL是一个有使命感的演员。,4,推荐,0,0.997390525955474
2011-02-07 23:53:20,daangel,赢得尊重的最好办法就是勇敢和坚强的回击，行胜于言。果然热血，体育是人与人之间最好的交流工具，也是最能看出人品的活动。球品即人品。怪不得米卢当年如此推崇此片：态度决定一切。话说里面还有如此青春的高斯林哦，帅呆了,5,力荐,0,0.99999994645215
2011-03-06 12:14:17,vivien,种族+体育的故事也是老生常谈但真正拍的好的却少之又少。。这部就很成功主要是演员出色。。俩大教练都是又称职又无私。。即使种族歧视在当时很严重但队友们都能团结一心逐渐磨合互补互助。。看橄榄球赛真激动呀。。黑白配。。Titans是种精神。。小女孩也老资格。。,4,推荐,3,0.999999967642208
2011-03-18 01:41:53,睁眼的天黑,最好最经典的体育电影 没有之一！两个男主角都是神演技啊··,5,力荐,0,0.9995153970538166
2011-03-23 10:30:24,生煎馄饨秃子,用运动解决种族问题的主旋律片，当矛盾僵化到不能再继续的地步时，总需要有那么几个人跨出那一步。PS：意外发现了青葱的Ryan Gosling，角色很绿叶很酱油，但表现欲好强啊！,4,推荐,0,0.9999993131849227
2011-03-26 12:19:44,板脸,Remember the Titans!,4,推荐,0,0.4737672181921908
2011-03-27 04:20:34,Recalculation,当从团队中剔除偏见和恐惧 就如同泰坦巨人般强大,5,力荐,0,0.9993222449396992
2011-03-30 21:47:43,洲之,为什么ＣＨＩＮＡ就是拍不出来这样经典的电影呢！,4,推荐,0,0.8201411317049482
2011-03-30 21:47:43,洲之,为什么ＣＨＩＮＡ就是拍不出来这样经典的电影呢！,4,推荐,0,0.8201411317049482
2011-04-02 06:09:03,飞刀员外,75同样讲男性荣誉，同样是丹泽尔·华盛顿主演，这片子比起《红潮风暴》差了一大截子。丹泽尔的人物塑造的不完整，训练营时还能看出人物个性，到了后段为了球队地位怀疑副手，编剧实在太琐碎了。片子出现一堆球员，好多开头做了铺垫的角色到结尾都是不了了之。而且球赛完全看不出应有的紧张刺激，失败,3,还行,1,0.9999499593792034
2011-04-14 10:26:07,Zola,这是一部励志片，是一部讲种族歧视的片，也是一部体育片，总之是一部主流电影，加上总不会让人失望的丹泽尔·华盛顿，可以说是一部好电影。音乐还可以，结局还挺感人。,4,推荐,0,0.9999992621619128
2011-05-26 23:37:57,紫领 爱, 痛是什么？痛快！累是什么？累赘！1971年佛吉尼亚，种族融合。我不管你们合不合得来，只要你们互相尊重！t73bcb4fdc ,4,推荐,0,0.9930990651504304
2011-06-01 20:56:41,atmosphere,时间隔得太远，虽然是“热血”沸腾的主题，可是仍然觉得就是那么回事，只是很久很久以前，黑人是那么不容易活着！,3,还行,0,0.4952286019326274
2011-06-24 01:16:15,人皮動物,看过，貌似是21世纪后体育类剧情片的热潮开辟者。,4,推荐,0,0.5999801904979836
2011-06-24 23:27:54,Dreamer-Echo,典型美式励志电影，反种族歧视 + 热血体育主题，角色配置很平均，两个阵营各自都有镜像。看到最后印象最深的反而是，那个早逝的白人，先是车祸残疾，然后车祸过世，人生是早有既定的命数了么。。。我是不是跑题了,4,推荐,1,0.9999985086742824
2011-06-26 22:22:33,夕阳gg,美国种族融合大时代背景下的煽情励志片。个性丹泽尔带领一批高中正太们征战橄榄球场，热血沸腾，激情四射，其实基情也四射。ps：真人真事改编，里面受伤半身瘫痪的Gerry Bertier，是现实中真正的励志帝！！ps2：白人教练家的辣椒小萝莉，爱死她了。,5,力荐,2,0.9999998645267162
2011-06-28 12:02:47,凤瞳,十二连胜的传奇 种族融合的胜利,3,还行,0,0.999837381729714
2011-07-08 13:53:01,只手撕天,那两小女孩太有意思了，对比那两个父亲角色，充满喜感。,4,推荐,0,0.999731120547637
2011-07-24 09:35:20,隐遁,最好的橄榄球电影！看得人血脉喷张！！！,5,力荐,0,0.0321518433905422
2011-08-18 10:47:08,小姓何送货的,好看的片子。好像在看过的所有美国片子里穿棒球夹克的强壮白人高中生绝大部分都是反面角色，这是唯一一个正面角色……结果依然残了…………,5,力荐,0,0.999990564708174
2011-08-19 00:22:29,南风吹梦,真正的和谐，不是河蟹。泰坦队的出场舞太有爱了.有点感动.配乐相当不错3.9,4,推荐,0,0.984757061757604
2011-08-23 21:42:09,LOU,融合了两个我很无感的题材：1.运动，2.种族歧视......结果依然很无感╮(╯-╰)╭ ,3,还行,0,0.977397368248861
2011-09-25 14:07:11,邦辰（SOLO中,看看人家这励志片拍的水平多高！看到结尾赢得冠军的时候我汗毛都竖起来了，我也激动了！这种感染才是励志片所需要达到的！,4,推荐,0,0.9988537078162492
2011-10-19 14:26:19,竹傲风,整体的通过合作获得成功，是再俗套不过的励志电影了，这种片子大量的出现并且赚到了泪水，可以不断地证明观众易引导性的存在。真要想看看什么是励志电影，看看《rocky》再说。对了，最早的那个合作，无非是Stockholm syndrome的一种表现罢了。,3,还行,1,0.9990120074607446
2011-10-20 11:47:01,黑骨精,向来以真实人物事件改编的电影都有很强的可看性，何况是一部以“种族隔离”下美国为背景的励志片？当肌肉和肌肉之间碰撞时发出雄性的刚强时，反倒是那种英雄们之间的惺惺相惜更能让人觉得感动。电影煽情但不做作，真实而传奇，其中文译名《光辉岁月》更是和Beyond的关爱黑人的歌曲联系起来，甚是精到。,4,推荐,1,0.9999999999999988
2011-10-30 06:27:20,伏羲伏羲,他们不能拥有退缩，他们必须铁石心肠，他们不能拥有柔情，他们一定得狠，狠狠得去斗争，狠狠得去比赛，狠狠得去赢得胜利,4,推荐,0,0.9493962551045644
2011-10-30 16:12:09,哈库纳玛塔塔,"Ryan 你好抢镜头

attitude reflects leadership.
Ha！",3,还行,0,0.4815770671017193
2011-10-31 21:18:26,Freggieg,超级热血 丹泽尔华盛顿最适合演这种片子了,5,力荐,0,0.9446235249408836
2011-11-12 20:09:58,王富贵,没有传说的那么好，线索比较乱，最后酝酿的高潮也是假装的,5,力荐,0,0.902227514350602
2011-11-21 10:34:28,拣尽寒枝,真的是把那些高中生当成是海军陆战队来训练啊。。很热血。。很感人。。看一部好电影让人感觉不到时间的流逝。。。,4,推荐,0,0.999997729138591
2011-11-27 15:32:59,慢点儿,16 内心和身体都要强壮。。。,4,推荐,0,0.972208133201662
2011-11-27 15:32:59,慢点儿,16 内心和身体都要强壮。。。,4,推荐,0,0.972208133201662
2011-12-04 00:02:56,受伤鸽子往南飞,橄榄球题材的片子最近看了好多，《加油马歇尔》虽然也很棒，但是里面的马修·麦克唐纳明显有野心超越这片子里丹泽尔·华盛顿的表现，但不得不说，影帝就是影帝~丹泽尔华盛顿完胜~,5,力荐,0,0.9999956979262796
2011-12-04 21:48:49,蜡笔小饺子,以小见大的片子，橄榄球部分比较重，整体还算不错，没有特别震撼，男主角我喜欢，有范,4,推荐,0,0.9988950119113542
2011-12-04 21:48:49,蜡笔小饺子,以小见大的片子，橄榄球部分比较重，整体还算不错，没有特别震撼，男主角我喜欢，有范,4,推荐,0,0.9988950119113542
2011-12-06 08:47:41,池鱼沐水,想起军训在新校区主动收盘子的人到了老校区就不收盘子了，环境的力量太过强大，能克服这种环境需要坚定不移的信念,4,推荐,0,0.9999254014007696
2011-12-16 23:09:42,皓宇,和《光荣之路》在很多方面很像，不过如果我先看了这部片子再看光荣之路的话，恐怕只会给光荣之路四星了……,5,力荐,0,0.994574862377401
2011-12-17 12:21:35,Giant,当然给五星，如此的激动人心，看得热血澎湃，一度眼泪汪汪的……经典，超好看……经典励志，运动，种族，剧情……在所有方面都堪称经典,5,力荐,0,0.9999994057485732
2012-01-07 17:34:59,我是来打工的,国外喜欢用真实事件改编成励志电影，我朝却唯独红蜘蛛（十个女人十个堕落的故事，很有吸引力啊）深受大家好评。,4,推荐,0,0.9999913314152666
2012-01-10 11:56:00,Ks,学了蛮多橄榄球的术语的 瑞恩那时候真的好萌啊 感觉不仅演的很带感 音乐也很好听！,3,还行,0,0.99983580596953
2012-01-14 22:37:31,摄狼影魔,有历史背景的影片总还是吸引人的~2000年的电影~恩~,3,还行,0,0.9973874615973688
2012-02-29 10:21:16,至尊寶『x_x』,撒子时候一起唱光辉岁月。@各位。,5,力荐,0,0.970834173322371
2012-03-06 23:48:54,我TM是党员,迪斯尼一贯的正能量片 近乎程式化的体育励志题材披上种族融合的外衣 但是拍的完全无爆点啊 我想找个刺激泪腺的点都没找着 相比之下《卡特教练》 更合口味,3,还行,0,0.9998922901000769
2012-04-03 10:43:52,庄晓渊,钟声响起归家的讯号 在他生命里彷佛带点唏嘘/黑色肌肤给他的意义 是一生奉献肤色斗争中/年月把拥有变做失去 疲倦的双眼带着期望/今天只有残留的躯壳 迎接光辉岁月 风雨中抱紧自由/一生经过彷徨的挣扎 自信可改变未来 问谁又能做到/可否不分肤色的界限 愿这土地里不分,5,力荐,0,0.9999999999999944
2012-04-18 14:33:53,烟视媚行,关于种族矛盾的励志片。中规中矩，丹泽尔华盛顿的演技发挥的一般，高斯林戏份极少。,3,还行,0,0.9999480244034804
2012-04-29 13:46:29,RIC,细节决定主旋律励志片的力度；OST用得恰到好处；暴力萝莉控忍不住多给了Hayden Panettiere半星~,5,力荐,3,0.9988145515519868
2012-06-03 18:47:52,法布街24号,很和谐非常励志，男女生都能看。Gosling早年不重要时期演一个乐呵呵没心眼的小青年，开始以为他是负责帅的，哪知中间杀出个男模级的sunshine,5,力荐,0,0.9981531545261426
2012-06-17 14:15:59,乾坤衍,Remember the Titans！热血沸腾,4,推荐,0,0.7848834423144085
2012-07-16 21:31:26,Sunshine,每个人都有生命中值得铭记的阶段吗?属于我们的光辉岁月是什么？一生中有这么一段让你全力以赴，热血沸腾的时光，就已是上天给你的最大的恩赐。不管这条路你是否会继续走下去，也不管你会不会继续这一段辉煌，不管将来你会变成怎样的人，有怎样的前途，以何种形式结束。你会铭记泰坦教给你的：团结、拼,4,推荐,1,0.9999999999660324
2012-08-02 17:01:10,邹逊,一部精彩的“菠菜”电影，就是那种并没太多技巧，纯粹励志的电影。影帝单泽尔华盛顿带着一帮小年轻打破种族歧视拿到橄榄球冠军的故事，虽然有些桥段装的有些矫情，但是这种热血片总能直接激起观众心中亢奋的活力,4,推荐,1,0.9999999556956368
2012-08-17 20:46:59,得一,类似的体育励志片不少，涉及种族歧视（丹泽尔·华盛顿所擅长），结尾还都交待队员的未来，但这部尤其摄入人心。白盖瑞像格里芬有没有？,5,力荐,2,0.999801335765122
2012-08-18 01:33:50,′,种族歧视的问题到后面就冲淡了，Gerry才是灵魂！还有他和另一黑人球员的友谊是最令人感动的！里面好多人都好喜欢，好的环境确实能影响一群人。,5,力荐,1,0.9995041406105792
2012-08-18 08:40:26,荷官,丹泽尔华盛顿的电影永远不会让人失望，又是一件真人真事改编的励志影片，喜欢这样的故事，让人热血沸腾让人充满希望让人感受到美好和伟大，运动精神，种族融合，友情、亲情。。。各种饱满的正能量。,5,力荐,2,0.9999999996165694
2012-08-23 15:03:34,Sean,除了剧情节奏稍显平淡外，一切看来都完美无瑕，对橄榄球迷来说是至尊神片,5,力荐,1,0.9998838488893648
2012-08-27 19:52:30,冬,在气势上和万夫莫敌差点，Washinton到底是不是个一流演员，两部电影都感觉烂的一逼，一点个人魅力都没有,3,还行,0,0.9998630401810068
2012-10-01 16:51:17,桃桃林林,很好的运动励志片。这种种族歧视相关的片子，彼此的尊重和团结总会让人感动，因为背后是人善良的一面。虽然有不少套路化的情节，但是不妨碍好看。好音乐真多，还有童星时期的啦啦队长以及瘦瘦的高司令。,4,推荐,66,0.9999276659756956
2012-10-29 08:49:20,失控的死胖子,好久没看这么热血又励志的了。football果然还蛮好看的。,5,力荐,0,0.9369219520695966
2012-12-05 01:58:04,是Queen妮呀,"you know what I want.
we'll get old and we'll get fat",5,力荐,2,0.149807528421448
2012-12-21 23:09:08,和风莫吉托,正能量来得过于猛烈有点招架不起。。。司令酱油打得从头到尾就没说上几句话，不过这红唇齿白的嫩的都可以捏出水来了（¯﹃¯）,3,还行,0,0.7525776679595686
2012-12-29 01:26:54,Raindog,社会应当期待通过体育得到什么？显然不是速朽的胜利，也远不止是所谓的强身健体，而是团队精神、纪律与意志。,5,力荐,2,0.997254996508182
2013-01-27 23:43:30,脑子白腔荡骨鹅,觉得节奏慢，不熟的运动血就热不起来┐（´ー）┌   一起演戏的红了好几只，长得比你们好学校比你们出名的耶鲁男模就只有后来在不三不四的b片里混到年老色衰……不过他不会演戏倒是真的。。。就是好可爱一只花瓶,3,还行,0,0.9787490204933152
2013-02-05 12:30:30,易,通俗电影容易引起人的共鸣，但要很好的做到这一点平不容易，你要把勇敢，种族平等等理念不突兀的放到橄榄球电影中，需要扎实的编剧技巧推进戏剧冲突。@神棍邓 @哀矜者福 你们俩看看，可能顺便还会喜欢上美式足球，昨天的超级碗可好看了。,5,力荐,1,0.9999999948275702
2013-02-08 20:26:41,Carl,尤思特教练的女儿最棒。后来在heroes里演cheerleader的，小时候就是小美女~,4,推荐,0,0.9994094734576938
2013-02-10 20:53:03,咸梅超人,反种族歧视+热血励志 海贼王般的催泪/soooooo cute的mini size Claire bear~~~~ 还有瘦嫩的高司令~/“钟声响起归家的讯号 在他生命里彷佛带点唏嘘”,5,力荐,0,0.9999489008477832
2013-02-13 22:58:43,圆_Lost,虽然这种励志片剧情都过于理想化还俗。。打各种球类运动比赛得冠军什么的。。反种族歧视，最后大融合，大家都成为了好朋友什么的。但就是喜欢看这种啊！！不唧唧歪歪的，不故弄玄虚，热血励志就是好看！好几次飙泪。。哭死了。。,5,力荐,0,0.8678668843115449
2013-04-01 08:31:54,大士かっこいい,海顿·潘妮蒂尔小时候真cute！  橄榄球+反种族主义..励志的1B,4,推荐,0,0.8050429367064907
2013-04-15 17:44:59,icecream dream,Don't you see the family resemblance? That's my brother.你看不出我们有多像吗？他是我兄弟。（橄榄球好残暴啊=.=#）,4,推荐,0,0.1653543611453082
2013-06-05 21:50:49,雨滴在心头,70年代，开始实行种族融合。黑白两族依然仇视下组建的美式足球队当然困难多多。电影中将这点叙述并不多，注墨在于球场上。虽然看不大懂，但美式足球真的很热血，是拿生命在玩。其实感觉助教跟牛逼些，好多布恩战术都被看破而改用比尔战术,4,推荐,0,0.9999998992114442
2013-06-17 14:00:16,南south,第一我爱看体育赛事，那种竞技精神很棒！！题材也很棒！！丹泽华盛顿太帅了！！！！！！！,4,推荐,0,0.6955919169964276
2013-06-30 01:39:07,三水采田.先生,"小时候印象就很深,这应该是所有橄榄球题材电影的标榜.热血、励志、感动、和谐、精彩.还有灵魂配乐和那些未出名青涩的好莱坞大明星真是大亮.",4,推荐,0,0.9999996440301984
2013-08-17 04:10:31,豆友1094556,作为种族片，体育其实相当弱化了。但是在种族，体育，挣扎和励志这四大卖点上其实都不敌FNL，给影帝塑造的这个教练形象也远不如FNL的Coach Taylor立体。当然拍的比FNL早，FNL有明显借鉴的痕迹啊。,4,推荐,0,0.999844397827992
2013-08-17 16:01:11,Riobluemoon,8分。让我想起了《光荣之路》，真人真事改编，都是体育化解歧视的励志片。不过相比《光荣》，我觉得本片里对黑白阵营的融合表现得更好，很多时候，未必只有白人表现出歧视，黑人自己何尝也不是竖起高墙？Denzel Washington本次表现并不是很出彩，看到年轻的高司令不禁让我有些出戏呢～～,5,力荐,13,0.9999999999533168
2013-08-23 11:47:56,疼酱,对这种好莱坞模式化电影完全无感。,2,较差,4,0.9270101344768116
2013-09-16 21:09:22,小灰烬,种族隔阂，橄榄球，两大元素构建的美国主旋律，“真人真事”有多真我们不知道，但那确是令人向往的光辉岁月（青春，运动），影片有趣也很燃，感觉是同类型影片中最好看的。高司令好嫩，sunshine好有亲和力w,5,力荐,0,0.9999999998239046
2013-09-19 11:58:57,入,太主旋律了，基本节奏就是：出现困境，某人出来说一段伟大的话，事件解决。里面的人物因为形象太完美而有点不真实。。尽管是真实事件改编。唯一的亮点是看到了年轻时候的高司令，挺帅啊小伙。,3,还行,1,0.9999770591917244
2013-10-01 14:32:18,旧日回忆的卤味,"Main stream, but meaningful. 2013/10/1 Assignment of Introduction to Western Culture.",3,还行,0,0.3240562043247552
2013-10-08 22:01:44,撒拖,传说中的主旋律 当然要抱着看萌货的心态去看！（不行最近有点high过头,4,推荐,0,0.8890098706728383
2014-04-13 14:10:49,愛摸愛摸,我第一次接触美帝的橄榄球电影就是这部，当初在CCAV6上看到就不换台了,5,力荐,0,0.858859559208747
2015-09-29 23:18:30,浑浑噩噩,对超级碗玩法不太熟悉，热血感一般，但是那种黑与白之间的冲击，不公，以及不一定是黑人就是罪犯，奴隶，白人就一定是阶级者，暴君，的演绎，还有，美式足球好象就只有美国人自己打，嘻嘻，有够粗暴的运动,5,力荐,0,0.9998959907881746
2016-05-15 12:47:15,会笑的昨天,布恩作为一个男人、教练和父亲，给人留下了深刻印象。,4,推荐,3,0.9949896701484344
2016-07-20 22:08:41,蕉,配乐10星啊，尼格兄弟通过唱歌和白人拉近距离。一个白胖子太有劲了，只是个长了白一点的黑人，应该去Stax啊打什么球！还有个rev，还会布道呢，正中下怀。如果这是鸡汤，请让我干了！,5,力荐,12,0.0025524665374903
2017-02-04 15:04:09,安蓝·怪伯爵𓆝𓆟𓆜,Goodbye Na Hey Him唱哭我~热血+感动！用了三张纸巾！ost大赞~,4,推荐,17,0.9909246206091088
