2006-01-02 21:16:52,traveler,"《哈利波特火盃的考驗》延續第三集《阿茲卡班的逃犯》故事，主角丹尼爾域基夫飾演的哈利波特，被神秘挑選參與著名的「巫師大賽」，他將要面對來自霍格華茲及兩大歐陸巫師學校的高材生挑戰。與此同時，邪惡的佛地魔終於現身，他的支持者於魁地奇大賽中發出Dark Mark訊號，預示了佛地魔黑暗力量將再次重臨，令魔法世界陷於一片惶恐之中。哈利波特既要面對這邪惡力量的挑戰，同時踏入青春期的他，還開始要為約會異性而煩惱。

導演 : 米克紐維爾演員 : 丹尼爾域基夫,魯拔格連特,愛瑪華生,賴夫費安尼斯,美蓮達李察遜",4,推荐,7,1.0
2006-05-17 15:59:44,Nakedself,英国人把冒傻气的哈四演绎成了绝妙的青春戏剧，三人组的吵架，亲密得让人不好意思起来。而我最喜欢纳威。,5,力荐,328,0.99999975135881
2006-07-19 15:06:38,鱼丸粗面,150分钟的片子还是感觉太仓促。一些场景、道具比想象中的要简陋。,3,还行,360,0.2308171877324468
2007-11-09 23:44:30,无敌的我 @ 头发快点长,完全不记得我看过这部，完全不记得嫩牛五方打过酱油= =这部剧情有点平淡，赫敏演技还是夸张派（但我喜欢这个聪明的学霸菇凉- -），哈利还是面瘫派，我最爱的还是ron的演技~看起来太舒胡太自然鸟~新的Dumbledore有点不是太慈祥= =老是有错觉是反派,4,推荐,13,0.9999989258679384
2007-12-16 18:24:42,451½°F™,位于「哈利波特宇宙」中段的第四部也是从儿童轻喜剧冒险类转向青年成长阵痛向的关键点，伏地魔回归 / 哈利波特首次面对关键角色死亡，都是下阶段的伏笔和引线，英国演员群贡献了惊人的龙套群——从大卫田纳西到青葱时代的帕丁森。,4,推荐,95,1.0
2009-06-18 11:35:24,仓郡,其实克鲁姆长得挺成熟的...20220816|北影节选择的第一部，因为场景够多够大！火焰杯也是全套里我最喜欢的一部，有学校的轻松也有成长的艰难，是转折是新的开始，当然还解锁了那么多新人物新地图，男主也只在半残的边缘，IMAX厅前排看“勇者斗恶龙”时还有点环球里“禁忌之旅”的感觉,4,推荐,3,0.999999994746032
2009-07-26 16:11:05,tavico,目前为止这部最好看，不过可以想象书应该更精彩，尤其是斗龙那里,5,力荐,271,0.9901905293704096
2009-08-03 12:35:01,彩戏师wala,不管是书还是电影，火焰杯都是最好看的,4,推荐,1861,0.983030263576836
2009-09-11 03:06:41,猫语猫寻,罗伯特帕丁森因此火了，哈利已经被拉下了神坛，最终长成了一幅没有存在感的眼镜儿。新八君还是回去银魂的世界吧，乖！但总体来说还是比后面的大卫叶茨的后面几部好很多。那些马车和船还有那些动物的造型都深得我心。,4,推荐,81,0.9999999997914546
2009-10-20 23:23:00,大宸,请告诉我Robert Pattinson哪里帅了？,2,较差,541,0.7531424953176233
2010-04-21 11:26:10,Griet,搞P啊！DT的戲份也太少了！,3,还行,165,0.2227012993298721
2010-07-27 21:46:55,vivien,第四部确实拍的不错哦。。内容范围都衍生许多。。虽然演员还有许多不尽如人意地方。。但赞。。,5,力荐,3,0.896853790830166
2010-11-24 22:05:26,stknight,初中看的“哈利·波特”系列小说也就看到了这第四部，而这部电影之前在Star Movies上看过一次，现在重新看发现了一些熟面孔，有罗伯特·帕丁森，还有拉尔夫·费因斯演的伏地魔，不过特效把他的脸弄得那么模糊，都认不出来了。片尾字幕才发现电影原声居然有Jarvis Cocker唱的歌,4,推荐,12,0.999843881845094
2011-03-15 23:46:15,和风莫吉托,感觉拍得最差的一部。初三在影院看完后你还找我借了书，记得不隔天上课时你捧着那本漂亮的绿皮书向后侧过身子指着描述穆迪假眼睛的那段对我笑得合不拢嘴。你让我多想亲你你知道不？,4,推荐,325,0.9378422899434056
2011-06-25 21:57:36,劳永逸,赫敏拨开帷幕冲过去抱住哈利的那一瞬是他们之间懵懂感情表现的极致。好美。,3,还行,133,0.9999971691563144
2011-07-19 13:45:44,Morning,这一部真心好，系列里最优的一部，人物之间的关系，角色的内心，大的场面都有了，而且做好了承前启后这一环，不像其他系列的中部，简直就是过渡段。,4,推荐,48,0.9999803334007168
2011-08-03 22:13:58,流空破刃,选角的糟糕抹杀掉了其他方面的所有努力。更何况……剧情推进太糟糕了，丢三落四紧赶慢赶要把一本书挤进一部电影里从此成为系列标配。,3,还行,235,0.8591027168632629
2011-08-07 23:13:33,汝就做吾的犬吧,剧情那个拖啊，基本就最后那20分钟有价值，剩余时间在讲一个纯粹为了娱乐大众的一不小心就会要小孩子命的毫无意义的比赛，最后那个破奖杯还是被施了咒了，然后一群人知道伏地魔回来了以后也完全不怕为学生草草开了个追悼会以后照样笑呵呵地过校园生活，演员也奇葩，硕大一个女校选出只恐龙来,3,还行,143,0.9999431845121668
2011-08-17 23:27:24,了不起的克莱德,整体还是比较流畅的，其实故事逻辑有几处比较生硬，但是不影响观影。这一部算是哈利波特世界的一个转折点，黑魔头复活，有人死了。14岁的哈利突然要被迫承担不属于他这个年纪的重担，整体节奏就开始走向阴郁的英伦风了。,5,力荐,10,0.9999999991732228
2011-09-02 00:34:53,樹一,舞会上赫敏出场那一瞬间太太太太惊艳了！！！三强争霸赛也有诸多亮点，虽然这是进入黑暗基调的起点..,5,力荐,194,0.9997622421421444
2012-02-11 00:53:22,CNBorn,每部电影都只能是原著的缩水版；这部电影的减法还是做得不够好，为了赶节奏砍掉不少内容，却又为了特效做了很水的斗龙戏。同样也不喜欢神经质的Dumbledore，以及所有Hagrid/Madame Maxime的戏份,2,较差,23,0.949646677340744
2012-05-06 20:48:50,Seamoon,我最喜欢的系列小说就是第四本，电影是第三部。和当初借我哈一到四看的张喆交流，他最喜欢的是前两本。童年回忆也是各有千秋。看第七部之前真应该把小说都看完，不过迟到的补救，总好过无动于衷。,5,力荐,15,0.9999988991426364
2012-07-20 19:52:58,同志亦凡人中文站,发型和服装交给演员自己乱搞的结果...,3,还行,403,0.1859603619201457
2013-10-01 21:24:16,信电影得永生,这一集真心不错，青春期对异性的朦胧感觉切入，男生女生之间微妙的心理变化。波特接受挑战，内心开始成长。伏地魔复活，黑暗来临。好戏刚刚开始。片子还是感觉长，但因比较细腻，所以没那么无聊，说实话比赛好没劲儿，还好又节省的部分，从第三个比赛才开始紧凑起来。三星半,4,推荐,372,0.9999999999993484
2014-06-11 23:01:25,全都是风,每次看到第二轮比赛的时候哈利的珍宝是罗恩都笑翻了过去！,4,推荐,208,0.9997606943071666
2014-08-13 06:56:19,徐若风,3.5  哈利·波特系列因导演不同，层次感和质量每部都大相径庭。这部的位置更偏向于承上启下，青春期的萌芽与伏地魔的重生，信息量很大，但缺乏出彩之处。罗伯特·帕丁森的亮相挺不错的。,3,还行,20,0.9999999999717152
2014-11-17 09:38:33,Neroat,哈利波特系列最喜欢的一部，剧情最吸引人的一部。另外，克鲁姆很迷人。一如既往地爱着罗恩。,5,力荐,530,0.9999983055077252
2014-12-30 19:17:26,后自愈,伏地魔终于复活了 祝大王万寿无疆 据说塞德里克死后变成一枚吸血鬼 和一名麻瓜谱写爱情传奇,3,还行,112,0.9999996874329908
2016-02-24 20:17:19,sleepy Mia,"电影里头，说起来我事实上最喜欢的是这一部，不管其它什么——就为了赫敏穿着粉色礼服从楼梯上走下来的那一瞬间。
so u， my little princess。",5,力荐,39,0.9998163286708912
2016-10-21 15:27:11,齐木楠雄,最喜欢这一集的魁地奇大赛,5,力荐,223,0.8828078855229502
2018-04-16 09:48:07,潇湘烟雨,看这部的时候还没有看过原著，觉得挺精彩的,5,力荐,89,0.9623752915263905
2018-05-19 22:42:55,花花,其实与原著相差挺大，但是记忆里第一次窝在被窝里看到赫敏走下台阶的那刻惊艳永远不忘。凭着这个都愿意给5星,5,力荐,868,0.994600443208668
2018-08-10 22:43:52,木由,"小的时候看伏地魔重生被吓到咬（表姐的）手，现在看只觉得伏地魔超萌的。活过来就一直没鼻子傻笑，坚持正面单挑。结果傻了吧，人家能场外求助。倒是哈利抱塞德里克.迪戈里尸体回来死不撒手地恸哭，迪戈里爸爸茫然地喊着“That’s my son, that’s my boy”骗了我好多眼泪。",4,推荐,64,0.9362505406941242
2018-12-19 09:56:29,Allen,在《哈利·波特与火焰杯》中，神秘和悬念与青春期的幽默和心碎交织在一起，除了要面对仇敌、竞赛、拆台和嘘声之外，哈利还要物色圣诞舞会上的舞伴，可是任何魔法都无法消减青春期的萌动。制作人海曼说：“这个故事中最精彩的一面就是哈利和他的伙伴们开始对异性产生兴趣，一系列尴尬也由此而来。迈克·内威尔具有着出色的幽默感，而且天生就能很好的把握喜剧时机，所以看到这些孩子努力互相交流真是让人觉得痛并快乐着。”,4,推荐,6,1.0
2019-01-16 12:14:52,Rábano,"7.3/10
这部全员颜值巅峰
书变厚了电影自然要对书中内容有适度删减。（感谢删了多比和软软）但是为啥魁地奇世界杯那段不留呢就来了个开场……省特效钱吗……三强争霸赛小说里感觉很酷但是不知道为什么看电影就有点索然无味了。穆迪这条线埋的挺好的，小克劳奇先生真好看。还有这部邓布利多人物拍崩了。
伏地魔竟然是拉尔夫演的好的爱了。卢爹真滴是我第二喜欢的男人了太好看了趴。这部大三角性格都很讨喜，OK能多爱一秒是一秒吧。金妮头发扎起来挺好看的，双子长头发太美了我爆哭。",4,推荐,3,0.999999994791246
2019-12-16 22:40:49,文泽尔,看过不知多少遍所以似乎没有标记的必要了,5,力荐,4,0.6587821529173961
2020-04-02 21:10:15,盔酱兮,不错～小时候看的书记忆里就是印象深刻～一边看一边还能想起不少名字～曾经万千宠爱的屈臣氏小姐如今演技被黑出翔了……现在的嫩牛五方原来一路走来tagged handsome。有些事情不需要较真，且看风云～,5,力荐,4,0.9999992142035664
2020-10-11 17:23:07,张咏轩Wayne®,私人最爱的一部，场面宏伟，情节曲折，竞技场充满了有趣的看点和耸动，这部电影开始死亡开始赤裸裸的在波特面前发生，心疼塞德里克，成了伏地魔又一次虚张声势的脚下亡魂…,5,力荐,47,0.9999999563953148
2021-10-13 18:06:05,M-Mary. Ravel,全员长发造型真是欣赏不来。哈利带着学长身体回来全场爆哭我也狠狠流泪。另外两个学校的出场太会了太会了。魔法部长儿子跟蛇一样吐信子笑死我啦,5,力荐,46,0.9999165326206304
2021-10-21 16:34:03,平坦,相较前几部，本部的特效和摄影可谓大升级。单场戏的戏眼和趣味也更为成熟丰富，符合当代观影习惯，有的莫名其妙的笑点设计，甚至几度笑出声来。最反差的是，邓布利多在这一部突变话痨不安综合征，那动作，那肢体，大起大落，大俯大仰，大开大合。刚看不习惯，看惯了才觉得以前的邓布利多太过紧绷，束之高阁了。有些改变，其实还蛮不错的。,4,推荐,7,0.9999999518596616
