2021-05-04 15:09:38,持人的摄影机,9.5/10。①卓别林著名的纳粹讽刺喜剧，全程笑点不断：炮弹旋转、手榴弹掉进衣袖、迷雾中误入敌军、飞机倒转、希克第一次演讲、女主楼上敲倒官兵和男主跳舞、防弹衣和降落伞实验、为希克画像雕塑、吃硬币、屋顶木板边的男主以及他掉进别人房子、希克撕宣战书、希克和拿波里尼的各种互动（敬礼、比椅子高、等等）、把希克当成男主抓错人、等等等。②传神的地球仪之舞和感人的结局演讲。③故事逻辑不太合理，把希特勒和他的信徒描绘的太弱智了，结局那个演讲能迅速赢得掌声尤其不符合逻辑。,5,力荐,2,0.9999999999996418
2021-05-29 16:09:15,乍暖,8/10。这是一部要结合时代背景评论的电影，卓别林借着电影之手讽刺希特勒，最后人类大爱的演讲不知道感染了当时多少人。大爱玩耍地球仪（气球）那段，十分俏皮。狸猫换太子有点突兀，不是卓别林最好的喜剧电影，但是最大胆的。,4,推荐,1,0.9999999999115968
2021-07-06 18:44:23,Jeffery,卓别林的首部有声电影，第一部有声片就将声乐运用得恰到好处。有声电影会更加关注于台词，本片的台词量随着时长的增长以及剧情的更宏大而较之以往增多不少，台词的深度以片尾演讲为主也向着追求人道主义的憧憬缓缓前进。音乐的使用上，最具特点的便是元首舞蹈把玩“地球”、片尾演讲结束后续的两个片段采取了相同的配乐，而且元首种族主义的和理发师人道主义的演讲结束后民众的反应也是别无二致地高亢。并非光明、黑暗是一体两面，而是群体具备这种能够被不论何种性质的言论煽动的本质；想起情绪的两因素理论，一切情绪都包含生理的唤醒，而究竟为种族主义还是人道主义的情感则依靠于唤醒的环境；由此，并不需要对常被煽动的群体有所谴责，他们固然会轻易走进深渊，但也容易重构希望，这只说明，我们的社会更加需要《大独裁者》这样的影片。,5,力荐,4,1.0
2021-08-27 19:15:56,葛明,"竟然有人觉得最后的演讲是败笔？
我觉得这是使影片的最妙的升华！
这演讲单独拿出来都是永不过时的经典！
艺术需要唤醒麻木！特别是当下！
不能一见到艺术和政治挂钩就反感，艺术可以和政治挂钩，为政治服务。
我们需要更多的这样的作品而不只是娱乐至死。",5,力荐,404,0.9999999995526496
2021-08-31 12:05:47,憨大仁,最后的演讲放到现在也丝毫不违和,5,力荐,4,0.8273443964559947
2021-09-19 12:22:45,姜博约,「BJIFF」今年北影节的第一部。别管什么犹太人、雅利安人，登了台都是众人簇拥，山呼万岁。铁拳来之前你甚至觉得冲锋队员也挺不错，结果挨了铁拳才意识到不对，可为时已晚。只有自由才是人类永恒的追求，而自由从来不是免费的。很遗憾，以上内容，我们时而清楚，时而糊涂。,5,力荐,15,0.999999921064803
2021-09-22 09:29:03,xixi嘻嘻,9-19	北影节#3，18号晚上搜闲鱼随便看到的，70元的只卖40，刚好时间够，早上10点，所以就买了。没想到这么好看，整体故事是完整有趣流畅，且充满了讽刺。卓别林的第一部有声片，看得出来他应该从小受艺术熏陶，会跳舞也会弹钢琴，里面有一段给人理发的默片表演用了古典音乐的片段。再就是最后那段演讲，放到1940年的那段日子，这部片子的历史意义又突显出来，真棒。,5,力荐,0,0.9999999991008371
2021-09-22 19:02:12,LEのn个晴天,#11th BJIFF No.2最后一段演讲是在眼泪模糊中看完的，太好太好了，真的是最后看得我泪流满面。第一次看卓别林的有声电影，第一次听到了卓别林的声音，被赋予了声音的卓别林这次用声音也震撼了我们。地质礼堂放映效果其实还不错，而且大家整个礼堂一起欢笑的气氛也是太好。匈牙利舞曲第五号配乐卡点刮胡子的那段可真是妙啊，再长一点我就要嗨起来了。“大独裁者”玩耍气球地球的一段配着那个音乐，又有着另类的一股浪漫，绝美。最后一段演讲也是，绝美。,5,力荐,0,0.9999999999997458
2021-09-30 18:04:26,西瓜大侠女,卓别林的第一部有声片。经典就是经典。要不然说卓别林全世界知名影史地位不可撼动呢！自有其无法比拟的魅力，大银幕才能更显著地凸显！大名鼎鼎的《大独裁者》，将纳粹的黑暗、荒唐、残暴及其追随者的狂热以喜剧的方式揭露出来，非常直白、讽刺。尽管名字（阿道诺·希克勒、纳帕里尼）、标识，甚至国名（托梅尼亚、拜大利）都改了，自己发明的托梅尼亚语很得德语精髓！扯意大利面那段太逗了哈哈哈！现场笑声不断。最后的演讲/表白，直击主题，不加任何掩饰！一直以为搞混之后俩角色要有一段儿交集呢但没有。宝莲·高黛此片中外形与角色一致舒服多了，很漂亮，某角度像费雯丽！那个老爷子和舒尔茨将军有范儿！天幕新彩云超级巨幕厅。六成多满。内嵌中字。北影节路灯旗今天东三环还有几面，北三环已撤了。11th BJIFF D14-26,4,推荐,1,0.9999999999999988
2021-10-11 21:31:45,芋头,虽然看过很多次玩转地球的片段，但在正片中看到还是极为震撼，这是什么神来之笔？！1940年，或许多数人还在后知后觉中浑浑噩噩，卓别林却早已通过电影来批判独裁主义了。最后的演讲，无论在当时还是在现在都是振聋发聩的。,4,推荐,3,0.999999986652504
2021-11-19 20:38:12,糖果悠唐,影片最后的演讲太棒了，点睛之笔。,5,力荐,2,0.9880875344663012
2021-12-01 20:50:26,NVHZ,四点五。在喜剧上，卓别林是人子（喜剧是伟大的艺术），而在关于自由、民主等话题上，人子仍是耶稣。结局是个败笔。耶稣，要是不遭背叛，就不可能是耶稣。耶稣，乃是“遭背叛者”的名字。,5,力荐,0,0.9999999838465758
2021-12-12 19:24:58,Tom,该片形成于法西斯还被认为是德意志民族希望之时，上映于法西斯如日中天之时。电影搭配英语和世界语两种语音。片尾的演讲可以被认为是新世纪自由宣言了。,5,力荐,4,0.9999989092127436
2021-12-16 18:59:17,坠落幻觉,比起艺术性，我觉得这部片更强的是社会意义，因为就电影本身来讲，我觉得不如他默片时代几部好看。但卓别林敢在纳粹统治正盛的时期拍这么一部电影，太勇敢了。虽然片中没有真的出现希特勒，但这一模一样的造型和只差几个字母的名字，已经是指着希特勒的脸在骂。最后一段演讲说话的人不是片中的希特勒，也不是模仿希特勒的犹太人，而是卓别林自己。虽然一下子跳出，但我想这正是卓别林拍这部电影的初衷。他直白且无畏地呼吁人们追求自由与民主，批判独裁专治，展现了强烈的人道主义精神，太伟大了。,4,推荐,3,0.9999999999808268
2022-03-17 17:12:16,你sha不sha,谁能想到2022年的时候看能这么fitting。卓设计的tramp形象其实一直有种人道主义的闪光。这片子可能就是让人知道坞里满级satire能到什么水平吧。如此轻又如此重的主题，还居然真的很好笑！玩地球那段太绝了。还要提一嘴的是作为第一部有声片就已经能想到用音效设计做段子，很厉害了。配合广播节奏和音量来玩身体喜剧真的很喜欢，也隐隐对上了了贯穿全片的-language as weapon的theme。barber在前期基本没有对话，到结尾的爆发才会那么有力。除了inspirational speech其实我最喜欢的是让Hannah抬头看天那段，因为她说power can't touch that。云朵太阳月亮还有星星，just look up and you'll see，浪漫到想掉泪。,4,推荐,4,0.9999999999991708
2022-04-03 16:08:08,中华解构大字典,无疑是一部伟大的作品，一部出生于连美国都还没有进入二战的作品。以前对这种丑化矮化洗头佬的演绎方法十分不屑，是因为总觉得这样做是想刻意掩饰一些什么不光彩但致命的东西。但现在理解了，这种在战时把一个dc者的可笑和荒谬非常夸张的展现了出来的做法。战时需要的是勇气，而不是反思。至于卓别林的表演，无疑是天才的，但我自己却没办法被逗乐,4,推荐,1,0.9999997818347522
2022-05-01 10:33:49,滑稽,这个时代，大独裁者依然存在。,5,力荐,11,0.857284191427949
2022-05-02 00:36:05,知北游,"在现代性最疯狂、最残暴的时代，用最现代性的艺术形式，以最现代性的理想，为现代性正本清源。
是时代的钟声和预言，但不是黑白对立的简单故事，电影并不避讳展示犹太人的懦弱、油滑、贪婪和推脱。也许全剧没有完美的人，现实的世界上也没有，但我们仍然值得一个更好的世界。
喜剧桥段细节饱满，构思巧妙，放到今天来说也毫不过时，其作用不仅在于滑稽，更在于解构和讽刺，希特勒和墨索里尼对戏的那一段尤其如此。用伪德语模仿希特勒演讲，伪德语的设计和卓别林的表演都是极为精妙的，能让观众识别出关键词汇，并强烈感受其情绪。对于音乐的运用有默片时代的遗风，比如踩匈牙利舞曲的点刮胡子那一段，也是才华横溢。",5,力荐,1,1.0
2022-05-31 20:06:37,白树,"“独裁者会死去，他们从人民手里夺去的权利即将归还人民。”

一部绝佳的政治讽刺喜剧片，其中在普通公众眼里就是这样啊，一群大人物为了一点小事就冲动的选择战争，或者说是为了自己那一点欲望，也冲动的选择战争。简直像是过家家，可问题最后受影响的还是普通人。
或许就应该像西线无战事说的，下次哪些政治家要开战就别麻烦人民了，你们自己打一架谁打赢算谁的。
归根结底还是因为贪婪。
总之，它的意义它的影响它的时代背景超越了电影本身",5,力荐,0,0.999999999999834
2022-06-22 12:32:32,500 miles,“只要人类不灭亡，自由就永不消失。”名垂影史的卓别林大师五分钟演讲无论何时都震撼人心。1940年二战希特勒正处于狂热阶段，大师第一部有声片便对纳粹作出铿锵有力的批判，并同时呼吁人们坚信希望就在前方。大师就是大师，永垂不朽！,5,力荐,1,0.999999999999647
2022-07-01 03:11:32,≌菩提风花,能凭一己之力把历史上蛊惑人心的一代枭雄的形象彻底扭转 卓别林还是有功的。但实际上还是前半部分更纯真更好笑 最动人的是在标满jew的街上跳舞 而不是冠冕堂皇的演讲。如果说表达对底层人民的人文关怀是卓别林的一贯愿望 那么显然关于工人、乞丐、残疾人和孤儿的故事更容易一边关怀一边精彩爆笑，可战争侵略这样的规模，这种历史悲惨事件就难把握多了,4,推荐,0,0.999999999999908
2022-08-25 13:50:33,Krizz觀影實錄,猶太人和希特勒長相相似這個點子本來是好的，也可以引出最後結局的演講，因為希特勒本身是肯定不會講出這樣的話的，所以讓有希特勒樣子的人說出不像是希特勒嘴裡會說出的話這個點子本身是高明的。問題是落在電影中就不那麼高明了，感覺猶太人的戲份有點過長也沒有太重要，知道是想展示當時猶太人的生活，但這又和希特勒那條線有一些差距，既然是大獨裁者了，肯定希望看到更多諷刺希特勒的橋段，這樣來回穿插感覺破壞了這整體對希特勒的諷刺度，甚至感覺就根本不夠看，沒幾場諷刺他的戲就結束了，有點意猶未盡。還有最後的演講，我是覺得，這個站在人與人的角度確實沒啥大錯，但是別忘了，人類沒有天敵，人類的天敵就是人類，如果人類只和平相處，不斷繁衍，難道就不走向滅亡了？站在人與自然的角度，那這段話就是屁話而已,4,推荐,0,2.2093438190040615e-13
2022-10-19 21:27:54,王友旭,独裁者在破坏人类的希望,5,力荐,13,0.9221214221660884
2022-10-22 08:09:53,何不秉烛游,卓别林的电影永远都不会过时,5,力荐,24,0.9167830823768672
2022-11-08 17:25:30,缘木,为自由,5,力荐,16,0.9416666666666664
2023-06-24 18:16:54,卡冈图雅,（不评分系列）1.身正不怕影子斜；2.条目没有剧照和讨论区；3.禁止恶意联想！,5,力荐,3,0.7854672137803567
2023-07-22 15:26:03,羽流焰,忍着大雨和腰痛来资料馆把这部看了，神奇的是结尾犹太理发师说出：“海伦，抬起头看看天，阴霾即将过去，阳光将会照耀”之后走出影院，发现天晴了，阳光普照。,5,力荐,5,0.9945947086249162
2023-07-22 15:55:51,徐若风,2023资料馆重温/ “地球气球舞”一段，证明了默片式呈现情境的高光时刻，出现在有声电影里能有多震撼。最后的演讲一段，则证明了电影艺术的勇气与社会责任，足以令听者落泪，感受影像中宣告与倾听的力量。影片对戈培尔的塑造甚过希特勒的出彩，是因为他作为纳粹文化宣传（尤其电影宣传）的真正「一号位」，是卓别林处于艺术家身份，所必须要对战的头号敌人。卓别林太过清楚纳粹控制民众精神背后的本质。,5,力荐,7,1.0
2023-07-22 15:58:29,囚鸟,勃拉姆斯理发那段真是绝了。进资料馆时在下雨，看完最后一段演讲出来以后雨停了太阳重又当头，这感觉，太难以形容了……,5,力荐,8,0.3721229424763672
2023-07-22 18:52:51,苍海王子,@M+ 太牛逼了。虽然最后的演讲有点出戏，但是这部80多年前的电影可谓全程高能，无论是笑点还是主题都是顶级。战争如果真能这样结束就好了。/看来人类老早就意识到了”guo境线”此物是阻碍人类进步的一大绊脚石，但是人类依然持续得犯着同一个错误，也许人类根本就不值得也不应该进步吧[呲牙]。（再次说明只有基础科学发展和外星人入侵才能拯救人类了。）/没想到从40年代开始希特拉就踏上被谐星的道路了。,5,力荐,1,0.9999999999969847
2023-07-22 20:01:42,假迷影真胖叔,3.0。资料馆1厅。1.卓别林第一部有声片，用力去模仿和嘲讽希特勒与墨索里尼，放在战争形势还不明朗的1940年足够的大胆。2.抖包袱的程度比不了卓别林之前的无声默片，最为经典的是关乎自由的演讲。拿到当下影史意义远大于影片意义。,5,力荐,0,0.9999996077728746
2023-07-22 21:11:48,touya,#常看常新#其实作为卓别林第一部有声片，它在拍摄和剪辑的某些地方还是带着默片感的，导致场景之间会有一些断续，但片尾那段著名的演说，其激励性和震撼度又绝对担得起卓别林开口说话这样的里程碑。也许这部电影的艺术性娱乐性不及卓别林默片，但这份在特殊时期直接将嘲讽糊到纳粹脸上的勇气又是何等的珍贵。拍摄此作的卓别林不再只局限于一个伟大的喜剧演员，也是一个怀着世间大爱的艺术家。,5,力荐,0,0.9999999999998476
2023-07-23 04:24:33,Luigi,编导演三个角色于一身，卓别林告诉我什么叫做讽刺喜剧的大师之作：典型默片时期依靠动作完成的喜剧风格（匈牙利舞曲第五号的配乐与理发剧情的完美配合），角色设定的反讽（独裁者的自恋与自卑、下属的奉承、党内混乱的岗位角色与职责），故事背景值得玩味的戏谑（谐音梗：戈培尔对垃圾Garbitsch、戈林对鲱鱼Herring、应该是萨尔兹堡Slzburg对应椒盐饼干堡Pretzelburg），剧情上的反转以及正向的价值输出（最后的身份互换和那段到现在依然振聋发聩的演讲）。,5,力荐,1,0.9999999999816254
2023-08-08 16:05:56,春天,"一直不感冒卓别林的电影
虽然他的《摩登时代》《城市之光》
在豆瓣和imdb排名都很靠前
直到看了本片
才意识到他被尊为大师
不是因为幽默的肢体语言
不是依靠巧妙的剧作设计
而是影迷们
出于对他深刻洞察的视角
敢于批判的气概 勇于发声的担当
而给予的由衷钦佩和褒扬

卓别林最后7分钟的演讲
慷慨激昂 义正言辞
催人振奋 发人深省
是他整个演艺生涯的高光时刻
影片拍摄于1940年
正值二战风云诡谲
在纳粹呼风唤雨 铁蹄贱踏下
片子还能上映可以算是一个奇迹





",5,力荐,1,0.9999999999944496
2023-09-10 00:15:18,楚子宙,一人分饰两角，卓别林演技当然没的说，世界第一流。然而太多碎片化的剪辑和毫无意义的双线叙事，严重损害了本片的节奏感。理发师的部分还是相当有趣的，不论情节安排、动作设计、就着音乐节奏理发、雅客先生院内院外的调度、房顶逃窜的戏码，都可圈可点。但全片政治意味太浓，严重削弱了艺术性。讽刺希特勒的内容过于多了，诸如办公、会客、签署命令、会见外宾，简直是为了黑而黑，为了丑化而丑化，把希特勒塑造成一个滑稽暴躁又神经质的蠢货，实在是没必要。双线交汇于最后一场演讲，可谓激情澎湃，看得出都是卓别林本人的心声。须知本片上映于1940年，彼时美国还未参战。卓别林是顶了多大的压力才在这个时候向全世界抒发胸中的一腔愤怒啊！最后值得一提的是，办公室玩气球那场戏，地球仪上的中国地图是中华民国海棠叶，非常完整，值得点赞。7分。,4,推荐,0,0.999999999934237
2023-10-24 06:25:44,没有昵称,卓别林的第一部有声电影。很多桥段还能看到那个默片里无与伦比的卓别林：开头荒谬的战争场景里晕头转向的士兵、跟着《匈牙利舞曲》的节奏给客人剃胡子的理发师（这段太精彩了，一个镜头完成的！）、捧着地球仪气球起舞的独裁者…剩下的时间里，卓别林用不着边际又像模像样的假德语狠狠地把希特勒涮了一番，墨索里尼也没有放过。今天看来，那些假德语的段落多到有些重复，结尾的演讲也是横空出世、不讲道理。但如果说《摩登时代》的卓别林已经是电影史上的伟人，那这部就确认了他在大历史上的地位。39年他完成剧本时二战在欧洲都还没开战，美国更是从上到下都还在孤立主义之中。朗还没拍《万里追凶》，刘别谦还没拍《你逃我也逃》。卓别林不顾外界压力拍出了这么一部立场如此犀利、摘下演员面具挺身而出径直向观众喊话的反纳粹电影，配得上伟大这个词。,4,推荐,0,1.0
