2008-12-11 00:37:36,外星纪--南庄座,惊悚和搞笑的绝品，结局很惊艳！可惜拍的略粗糙。毛展现自己神经质喜剧风格元素，风格奇特编剧强大，好好拍绝逼又是一部港产惊悚片经典啊！另外港剧一哥都给其义哥面子过来客串，阵容还是非常豪华的,4,推荐,1,0.9999999803156552
2009-08-09 14:10:56,正经出版不正经,结尾很反转，毛舜筠在里面依旧搞笑,3,还行,0,0.9403599885437208
2009-11-20 01:35:10,plumage,好像对毛舜筠第一次印象深刻的就是这部片子，情节都忘了可记得的感觉不像海报看着这么欢乐，只记得毛的脸，很正经严肃的脸，虽然之后看过她的大部分都是喜剧，无论再在哪看到都依然觉得，好犀利,3,还行,0,0.9995091329662064
2009-12-18 17:55:33,吴C~,多年前的电影台呵~~~09.12.30又看了一次，发现里面居然有欧阳震华和黄秋生。结局真反转。,4,推荐,0,0.9979513538121484
2010-12-29 18:20:05,康斯坦丁,"戚其义是很少拍电影的。。。
",3,还行,0,0.9431198015868644
2011-02-11 23:07:31,端舞,片子前面一直给人很潦草的感觉，但是结局加了分，很意外，很悬疑。,4,推荐,5,0.9999885143781972
2011-03-20 12:03:19,桃不碧,我在挖坟。毛舜筠演的好哇~~~,4,推荐,1,0.7126379995887919
2011-04-24 17:37:56,普渡众神花,這個故事完全脫胎於《兩公婆八輛心》里的張堅庭和葉童的那個故事！非常棒的結局！！！！  可惜沒有那個精彩！,3,还行,0,0.6934609550976863
2011-08-03 16:21:50,R.C,香港悬疑片很有点邯郸学步的样子……风格不统一很难让人想好要用什么情绪去对待,3,还行,0,0.99861243879113
2011-11-09 14:24:39,Zatoi Zha,结局有亮点但张坚庭原来是坏人的设定看起来很生硬而且无了个趣。,3,还行,0,0.9561209016812188
2011-12-26 13:43:56,黑桃生,最后十分钟。。太TM彪悍了。。。,3,还行,0,0.8381799422932541
2012-01-02 18:45:33,taming,结局非常出彩，原来这一切都是姐姐的阴谋。。。类似于《两公婆八条心》中的叶童的一部分，非常出彩~出人意料。,1,很差,1,0.9999952391458456
2012-01-08 21:37:03,邈邈,好精彩的一部戏哦！又抓人又好好笑，现在的喜剧学学人家怎么搞笑不生硬好么！而且剧情和节奏也都很好，并且太需要毛舜筠这种收放自如的好演员了。,2,较差,1,0.994351750884026
2012-02-05 14:06:58,不要君,黄秋生演的那个GAY，还有那个欧sir未婚妻的男盆友居然是欧阳震华....那个白白嫩嫩的是欧阳震华，果然岁月是把杀猪刀啊,3,还行,2,0.9786227026326932
2012-02-13 03:22:30,Lilac_,反转剧。。。,3,还行,0,0.4704051229696688
2012-02-18 13:57:48,KQ9527,喜剧，虽有悬疑元素和逆转，但稍显突兀。就像是吃宫保鸡丁吃出了狮子头，虽有惊喜，终归是坏了原味。,3,还行,2,0.9983919085590444
2012-05-22 06:08:53,悄悄,"好久以前看到前半段,这次终于看完整....结局挺意外的",4,推荐,0,0.9997935308113356
2012-06-06 19:40:00,空巢脑仁玥小饼,优酷删到剩79分钟，所有黄秋生的部分都删掉了,4,推荐,0,0.6471288865799165
2012-07-19 23:07:36,bbcat,结局还可以　前面太拖。,3,还行,0,0.9002628915009414
2012-08-28 17:26:39,达野风,"整体一般, 但结尾是亮点 >>>>>>>>>>",3,还行,0,0.9724803518970008
2012-08-29 09:03:53,Mian,打算找个喜剧看看结果被封面骗了，整部片子略粗糙但结尾是亮点,4,推荐,0,0.7783866424641418
2012-09-01 00:59:14,是你的益达,渐渐的，毛舜筠成为了我的梦中情人,4,推荐,3,0.8634509990759647
2012-12-21 18:31:26,李先生灬坏人,喜欢毛舜筠的任何角色，我技术她的脑残粉啊啊啊,5,力荐,0,0.978277432566972
2012-12-28 19:55:33,Vivien,很久以前看的老电影，但是一直觉得情节不错，全片氛围紧张，但偶尔又有一些笑点,3,还行,1,0.9991798108073052
2013-02-19 14:39:53,胖丁桃,事实证明有些人就适合去搞电视，比如戚其义。黄秋生那个娘gay超可爱，结尾的反转很不错，可惜处理得还是草率。,3,还行,3,0.9998343140655506
2013-03-02 17:24:55,爱电影,徐舜筠一人演两个角色狠有意思，张坚庭的主角没有他在其他片子里面的配角出彩!黄秋生的娘娘腔，陶大宇就走了个过场!剧情处处想搞笑可惜不好笑!,3,还行,0,0.996818350135142
2013-03-21 16:23:23,обломов,黄蜂尾后针一般的神片,4,推荐,8,0.3072683712220924
2013-04-13 12:11:44,假装没感觉_1,说它搞笑是搞笑，说它正经是正经，最后还反转了一把，最难忘是毛毛，美爆，谐星美女我的爱啊,3,还行,1,0.3155231407072703
2013-07-15 15:22:37,S@m,好看的老电影，可惜猜到了结局~,3,还行,0,0.9988452293289276
2013-08-29 23:00:03,微,虽然是九零年代的片子〜但是剧情略有反转可以再喜剧再悬疑一点就更好了〜难得是7大监的电影啊〜,4,推荐,0,0.9996544496099764
2013-10-13 19:57:08,...,结尾仓促，但是那场“毛舜筠打毛舜筠”的戏真的好神奇，导演和mo姐一定拍得很辛苦~~,3,还行,0,0.999959384446526
2013-11-09 18:42:54,糍毛团,前面差点放弃，就是结局很好,3,还行,0,0.9898142361593674
2014-03-25 21:29:59,一实,看评论说跟《黄蜂尾后针》相似，其实有段距离。还是黄蜂好看多了啦,3,还行,4,0.4635082513683992
2014-11-26 23:20:51,金骄乙,Momo好棒 ！爱死她了！,4,推荐,0,0.8747496617719807
2015-03-20 12:03:49,楚门,戚其义，陶大宇，欧阳震华，这是TVB三十年前的节奏么？,3,还行,0,0.9986615999392572
2015-05-15 21:48:28,申由己,确实，反转的有点跑题,3,还行,0,0.8596309322735297
2015-06-30 10:14:31,授授不轻,尽管毛毛很美，但也就值3星,4,推荐,0,0.7304152238015863
2015-07-03 08:11:12,froggie,小时候印象极深的一部电影，无意间重温，居然发现无数镜头，剧情都清清楚楚！,2,较差,0,0.998148074522037
2015-07-16 20:05:18,Tina Chow,主要是女主美，喜欢那些日本风格的设计,3,还行,0,0.9985279907100684
2015-12-06 21:14:55,Over5,秋生的嘴贴在张坚挺的裤裆上欲罢不能,3,还行,0,0.858041049926663
2016-03-13 13:22:50,瑶,那时的江华还是个愣头青呢。,2,较差,0,0.4669945828702831
2016-06-16 21:41:07,豆友96405042,有种阴郁的恐怖感，即使有搞笑的桥段也冲淡不了。结尾反转漏洞太大。 ,3,还行,1,0.830543347874332
2017-06-22 19:12:46,陳陽陽,没看懂结局是妹妹死了还是姐姐死了，之前演的是姐姐信耶稣啊，那么姐姐是坏，那么最后还是姐姐赢？结局十字街,4,推荐,0,0.999988144465236
2017-07-21 01:19:13,小灭灭灭,很厉害了，,3,还行,0,0.510271087048892
2017-07-21 01:19:13,小灭灭灭,很厉害了，,4,推荐,0,0.510271087048892
2017-07-21 22:21:52,致太二,充满层层反转，电影拍的不错，很紧凑，把人性的善与恶无情揭露了,5,力荐,0,0.99999833312197
2017-07-23 15:21:23,猛汉世雄,不可思议，最后居然还有个反转,2,较差,0,0.2061313517427789
2017-07-27 15:39:45,Sep Zhou,希望最后还是姐妹联手,3,还行,0,0.5439830563817911
2017-07-30 12:46:53,理想型男生,美女！！,5,力荐,0,0.1884376906471709
2017-07-31 01:20:29,兔兔,简短的剧情像儿时看过的「故事会」,3,还行,0,0.983527025731928
2017-09-12 21:13:16,衬衣洗不干净,可以好好看看毛毛的演技，她不光颜值能秒杀现在大片“当红小花”，演技也同样是秒杀。而且她很好的证明了自己不光是喜剧出名，各种类型的角色都可以拿捏得很好。,5,力荐,0,0.9999413415526528
2017-10-04 01:11:19,груша,戚其义不适合拍电影，毛毛很灵，两角完成度很高，好几年前看的了,3,还行,0,0.9391935501493144
2017-10-16 20:55:29,隐秘盛开,很好看。分数这么低。豆瓣打分也是很水。,4,推荐,0,0.9918025363714386
2017-12-09 12:27:34,炭烧冰粉,毛毛，演技和颜值兼备,3,还行,0,0.8324500300077637
2018-02-18 20:01:43,y蓝色的梦境,喜剧的外衣包裹一出惊悚剧，最后的反转有点猜到了，但还是很惊喜。,3,还行,0,0.99919875505475
2018-06-03 12:37:18,TENACIOUS,大半夜看的，毛舜筠好美，黄秋生gay得很有爱，一人分饰两角难得有点好玩,4,推荐,0,0.961913429088351
2018-06-19 14:25:30,杀死你偶像,以为是无厘头喜剧 原来是悬疑喜剧片,5,力荐,0,0.9831172191499068
2018-08-26 20:09:46,假面的自白,结局反转好评，但没看懂到底是姐姐死了还是妹妹死了?,3,还行,0,0.9478864299862734
2018-10-01 21:51:23,#黄袍魔王#,本来以为是个动作喜剧片，没想到结尾挺扎心。。,3,还行,0,0.8870884216543101
2018-10-09 17:01:51,Roger Federer,搞笑与悬疑齐飞  毛毛竞显端庄＆性感之美,4,推荐,4,0.9989025406179892
2018-10-24 22:28:59,麦兜约了麦当雄,是谁杀了谁？是我杀了我,4,推荐,0,0.4737672181921908
2018-12-31 21:50:37,tell him,3.5,3,还行,0,0.4166666666666664
2019-01-04 02:33:11,深海鱼男,黄秋生的演技杠杠的   ,4,推荐,0,0.5709409327351642
2019-03-10 00:45:16,水泽,整个电影的气氛十分欢乐，黄秋生过于搞笑。结局出人意料，但其实早有伏笔。毛舜筠真好看。,3,还行,0,0.9990131002385504
2019-07-23 02:40:31,一彦台北,毛毛真漂亮,4,推荐,0,0.8613560861824013
2019-09-10 17:19:20,青菜豆腐保平安,不太喜欢。,2,较差,0,0.3667384491288059
2019-09-16 10:02:38,HarperYug,GS2-09 本来很好的一个一人分饰双角的概念最终被拍成了喜剧，就算是喜剧也没有多大的笑点可谈。,2,较差,1,0.9400246859668606
2019-09-17 20:05:46,说明书,没有什么好说的＝＝,3,还行,0,0.4286529692992837
2019-10-26 16:49:49,莫莫,#2nd花月佳期港影节 6/10,3,还行,0,0.8947638313957508
2020-01-11 13:51:21,忆青,结尾有点刻意为之，但是从事实上有点说不通，除非警察糊涂。,3,还行,0,0.2727413300045737
2020-01-13 16:29:30,L.E,反转成就了这部电影,5,力荐,0,0.980379089207936
2020-01-26 00:08:05,风车车,赞镜头。,4,推荐,0,0.9096018490786376
2020-03-06 19:13:41,两株枣树,强行转折，割裂内容。黄生还蛮搞笑。,4,推荐,0,0.4457245511701955
2020-04-06 02:41:10,脆脆鲨,黄秋生演的真好。,4,推荐,0,0.5633128899416299
2020-04-20 22:21:32,Su.ndown.,还可以。就是有点太仓促了,5,力荐,0,0.1635705107441816
2020-05-03 18:35:08,LeighPeng,庸俗，低俗，媚俗，要不是最后的反转，也就两分,4,推荐,1,0.0036300270895893
2020-05-06 17:00:22,你好哇,结尾+1星。,4,推荐,0,0.9537280895899758
2020-05-06 17:00:22,你好哇,结尾+1星。,3,还行,0,0.9537280895899758
2020-05-06 19:28:59,kitty,不错,3,还行,0,0.8612132352941176
2020-05-14 07:00:03,球友基哥,冷门的港产电影，用喜剧的风格诠释犯罪题材！当年有很多雷人不着调的港片，此片亦是如此！毛舜筠颜值期，片中还有江华，张坚庭，黄秋生，欧阳震华，黄柏文。结局反转加一星，其余也没太多看点！,3,还行,0,0.9999993550060434
2020-06-21 20:49:30,我有一把小左轮,还好,3,还行,0,0.6986352350530262
2020-08-12 18:51:35,文思豆腐,前面就是一般的双生子剧情，倒是结局令人惊喜了一把。这片有打酱油的陶大宇，欧阳震华、江华。黄秋生演的gay蛮可爱的,3,还行,0,0.9999929323094128
2020-09-05 18:38:23,Chaall,凤凰卫视电影台……毛毛演双胞胎，童年阴影系列？原来是771导的哦，阴暗主题夹杂无厘头笑料，水壶煮面、咸湿陶大宇、爆乳黄秋生……阿辉真是有情有义啊。,3,还行,1,0.9846587455722166
2020-09-29 19:46:51,浪,笑死我了，太无厘头了吧,3,还行,0,0.5057812159574311
2020-10-01 10:54:41,爱比死更冷,"导演: 戚其义
编剧: 梁鸿华 / 冯瑞熊 / 郭伟钟
主演: 毛舜筠 / 张坚庭 / 黄秋生 / 鲍起静 / 陶大宇
类型: 喜剧 / 悬疑
制片国家/地区: 中国香港",4,推荐,0,0.9984516579283038
2020-10-04 18:43:47,z,最后够机智吧,3,还行,0,0.933847993183352
2020-10-25 14:02:29,梦之安魂曲,看得版本，剪辑的有问题。以后可能重看吧。,3,还行,0,0.544808685227938
2020-11-04 17:43:39,ReMinD,本来以为戚其义只适合拍细水长流的电视剧 没想到拍电影也做的不错。 短短的一个半小时还设置了一个悬念最后打开 挺有惊喜。 毛毛分饰两角 有说服力且漂亮。,3,还行,0,0.9997354738375528
2020-11-22 12:55:06,屁不会是香的,还行,3,还行,0,0.7194444444444446
2021-02-16 19:58:52,阿杰,"用孪生姐妹作文章的电影很多，本作也是之其一。
影片前半部分基本上属于波澜不惊，结尾反转也不算太意料之外，如果没有这个反转，本片就是绝对的平庸之作了。
毛舜筠的演技还算不错，本片她基本就是主力担当了。",3,还行,0,0.9995062973528622
2021-02-17 11:50:38,崔英道希,电影很棒啊！为什么评分这么低？比现在的电影构思不知道好多少倍！高水准的，结局也设计的很巧妙,5,力荐,0,0.9999986691147612
2021-02-18 00:13:49,朦胧之影,后半段有反转，使影片变得有意思。,3,还行,0,0.9451927941437356
2021-02-25 18:15:39,一碗濑粉,没想到，结尾还可以。女人狠心起来搞事业就是坠掂的！,3,还行,0,0.9700028835265352
2021-02-28 01:13:13,时间的玫瑰,发现江华在90年代愤怒刷脸了一大批电影，但是角色不太有发展空间……,4,推荐,1,0.8846545382591298
2021-03-07 12:45:06,小梨花與其他貓,其实还挺好笑的。。,3,还行,0,0.5084472864703735
2021-03-19 08:55:49,z803,不知所云,1,很差,0,0.1199999999999998
2021-03-28 22:55:42,行川野火,竟然是戚其义导演的，结尾有点意思。,2,较差,0,0.876916695984586
2021-04-04 12:50:08,K&L,毛舜筠，结局反转，姐姐没死,4,推荐,0,0.9448320562563756
2021-06-30 04:29:55,杜华（已坐牢）,这里有白白嫩嫩的欧阳震华？？？？,3,还行,0,0.7835663182257357
2021-07-15 15:59:03,心情,打卡,3,还行,0,0.5
2021-07-18 01:49:07,°ʚ ŦΛłЯЏ ɞ°,黄sir真的是没有你驾驭不了的角色，信手拈来，不过可惜的是我找不到粤语原声，想听听你捏着嗓子说话的声音,5,力荐,0,0.9742538883086184
2021-08-12 22:53:13,Piglette,看了一个瞎剪版。开头正常，然而进度条未过一半就结局了，中间的剧情接在片尾字幕后面… 更神奇的是这种打乱竟然保持了影片的悬念（或者说创造了新的悬念点）说明剧本的架构还是扎实的，只是过程太糊弄，典型几天拍成的快餐港片。毛舜筠穿和服真美，一人饰两角游刃有余；黄秋生则奉献演艺生涯最恐怖银幕形象。,3,还行,0,0.9999878255480208
2021-10-11 18:49:36,西门吹花,…………………………………………………,3,还行,0,0.5
2021-11-24 01:48:10,夜未央,毛毛饰演两角丝毫不感觉尴尬，但是没搞懂到底是姐姐死了还是妹妹死了,5,力荐,1,0.0626438339949394
2022-01-03 23:11:13,大桥未久,可以啊，最后还带反转的，双胞胎互换身份666,3,还行,0,0.9819583179585084
2022-01-29 23:07:40,山下猫,小时候看一个演员都不认识，一直以为第一次知道毛毛是《他来自江湖》。原来脚上套塑料袋的是江华，也不记得大黄的gay，还有陶大宇和欧阳震华。记得的都是动作细节：抽相片镜子玻璃落下烧电板，葡萄糖代替毒品。节奏真是快，前一秒还死人后一秒来笑点。后来有次看《神探亨特》里的麦考尔主演的一个电影《twin sisters》发现情节一模一样，果然上映早一年,3,还行,1,0.9999999998871834
2022-03-27 14:48:59,喷火国王小怪兽,"又搞笑又吓人  毛毛开煤气自杀那一段真不错
还种草了那套欧根纱的衣服",5,力荐,0,0.9804616668030564
2022-05-06 21:40:55,丨Chan,笑死我了哈哈哈哈哈哈，结尾有点像《两公婆八条心》！,4,推荐,0,0.9998487552892928
2022-05-18 12:20:28,YYYs,剧情如今看来没什么新意，很像黑白片时代的好莱坞故事，毛舜筠的美中带着一点神经质，黄秋生演gay都几靓仔。,4,推荐,0,0.9999981522131632
2022-06-10 16:33:28,momo,结尾加分,4,推荐,0,0.8664380793861252
2022-06-10 16:33:28,momo,结尾加分,5,力荐,0,0.8664380793861252
2022-08-07 13:42:53,鲸吞鲸吞,反转地球这么快就领便当了,2,较差,0,0.97558792200812
2022-12-15 20:38:48,Henry,1:30:07，西瓜🍉。毛毛一人饰双角，还不错哦,3,还行,0,0.2862476345379476
2023-01-13 23:28:53,断臂轩辕,中间一度无聊的想退出，幸亏看完了，结局神反转,4,推荐,0,0.9558928303688912
2023-03-03 18:09:45,RT,被片名和海报欺骗，还以为是喜剧或钕铜片。故事太匆忙，零分。明明俩亲姐妹的故事可以更好看。毛舜筠又靓又会演，一星给她。另一星给黄秋生演的可可爱爱但惨死的鸭。,4,推荐,0,0.9272984890204676
2023-03-26 03:36:53,书生意气2333,人性的丑恶阴谋故事,3,还行,0,0.9971462728311512
2023-05-04 02:58:25,不要伤害杰西卡,原本平淡的剧情因为最后的反转结局添色了不少，毛舜筠和张坚庭的搞笑功力并不低，黄秋生也是演嘛像嘛。,3,还行,0,0.9770940902957114
2023-05-19 01:22:11,秋山骏,不错,4,推荐,0,0.8612132352941176
2023-05-19 01:22:11,秋山骏,不错,3,还行,0,0.8612132352941176
2023-05-19 12:03:53,某骑士的鬼魂,imdb的4.4比较真实，开头就很多情节和对白莫名其妙，好像是在刻意搞笑？看了影片标签有喜剧才知道真的是为了搞笑，也太尴尬了，15分钟看不下去的烂片实属少见，狂扫港片时期下载的最后一个包袱,3,还行,0,0.8878744734573693
2023-05-24 21:49:49,甜味盐,后半段反转的挺精彩，里面竟然有江华和欧阳震华、陶大宇,2,较差,0,0.9932127795783584
2023-05-24 21:49:49,甜味盐,后半段反转的挺精彩，里面竟然有江华和欧阳震华、陶大宇,4,推荐,0,0.9932127795783584
2023-05-28 21:32:31,虞小北,很多年都还记得情节,3,还行,0,0.946797101213492
2023-07-28 05:42:41,_hoachio,真的不是喜剧吗 为什么没有四个人啃青瓜的截图啊 真的很可爱啊,4,推荐,0,0.9926498679236668
2023-08-04 22:05:48,叉刀,如果不是这个资源前半段后半段完全倒转的话观感应该会好很多。,3,还行,0,0.6468531566155596
2024-01-07 20:19:10,CyberCig,黄爹的角色是女主姐姐的gay蜜兼money boy？可惜没找到粤语源。,3,还行,0,0.9887541673804032
