2022-03-10 02:08:19,Shmily,我怀疑这是几个编剧一起吐槽编剧的故事，也是用了两天的时间写了136页的剧本……好了，上面是开玩笑的。这是一部关于电影创作的电影，也就是元电影。切换场景的手法确实是第一次看到，有点像摄影机开机的时候，挺让人眼前一亮的，这部电影就像是剧中所说一样“两个巨大且支取高额片酬的巨大头颅靠拢在在一起……赚取票房，吸引万千观众，畅销爆米花……”。但是有没有觉得这部电影好像也不只是在吐槽，其实更像是一种讽刺呢。编剧就花了两天的时间写出了一部电影剧本，或许这也可能是当时好莱坞的一个现象吧。,3,还行,0,0.9999998618196706
2022-03-13 10:30:11,呵呵,《23号公寓的坏女孩》+《蒂凡尼的早餐》之剧本创作番外篇，好莱坞自我审视片,4,推荐,0,0.995847023452571
2022-03-14 12:36:54,Covfefe,赫本作品，看过不是那么印象深刻的。,4,推荐,0,0.9657133771411056
2022-03-20 16:49:41,血浆爱好者,很有趣，像电影专业学生的毕业项目。是赫本最好看的一部片子了吧。,5,力荐,0,0.9996774786829942
2022-04-13 06:40:43,newlight,屏幕上热闹非凡，我却看得闷得不行,3,还行,0,0.3703958616901387
2022-05-03 15:03:10,27号侦探社探长,“两颗巨大的支取高额片酬的头颅靠拢在一起，迎接无可避免的最后一刻...赚得票房收入，吸引千万观众。”不得不说，看的还是很开心的，整个片子给人感觉也很swimmingly（很喜欢“如鱼得水”这个翻译,4,推荐,0,0.9999918236161992
2022-06-02 03:07:20,≌菩提风花,题材和形式都很有意思 self reference inside joke word play 还蛮妙。只是节奏有点乱 总体有点长。 这是我看过的奥黛丽赫本最讨喜的角色了,3,还行,0,0.9999964203495582
2022-06-11 22:46:03,小餐枱沙發雪櫃,两颗巨大及支取高额片酬的头颅靠拢在一起，迎接无可避免的最后一刻，就是那惊天动地 赚得票房收入，吸引万千观众，促销爆米花的 深情一吻（fade out ）,4,推荐,0,0.9999965575280532
2022-06-11 22:46:03,小餐枱沙發雪櫃,两颗巨大及支取高额片酬的头颅靠拢在一起，迎接无可避免的最后一刻，就是那惊天动地 赚得票房收入，吸引万千观众，促销爆米花的 深情一吻（fade out ）,4,推荐,0,0.9999965575280532
2022-06-17 14:28:34,Lefrançois,酒店春梦，美国人在巴黎，一方面刻板印象代入，法国人必须浪漫随性，爱显摆吹嘘，国庆日巴黎人只会吃喝跳舞吗？另一方面糟糕形象男女主，骨瘦嶙峋的赫本，更像老修女，演技做作，喜欢装嫩，黑脸中年大叔自恋狂，老充当什么英雄，感觉就是酒色之徒。呆在酒店意淫剧本，更像普罗斯特般畅想，剧情天马行空，却琐碎没多少关联。知名编剧勾搭小秘书套路。埃菲尔铁塔上派对无趣设定。偷走胶片与机场被截杀，剧情狗血。,4,推荐,1,0.9999999549232406
2022-07-02 23:54:38,Dorothea,赫本儿子对她的记述里写道：“我母亲曾认为，那是唯一一部不及她的其他作品的电影。”果不其然，表演夸张，情节和情感都来得莫名奇妙，纪梵希设计的戏服亮眼，三身绿橙粉套装，极致优雅。,4,推荐,0,0.9999999999996227
2022-07-31 19:17:19,烈焰红唇龙,揶揄了新浪潮的俗气爱情故事，赫本自言也不喜欢这次表现。,3,还行,0,0.9777553605708064
2022-08-01 22:06:49,江湖片子,电影中编电影桥段，编久了 就有点没趣了 勉强看完。,3,还行,0,0.8709539783371697
2022-11-01 12:12:04,华丽挚爱,少女被浪荡老男人迷住的狗血故事。,2,较差,0,0.9979289612824374
2023-05-18 11:20:24,Endtroducing,6分。一个套娃了各类好莱坞俗套故事的故事，但这个套娃了各类好莱坞俗套故事的故事最后也是个好莱坞俗套的爱情故事。,3,还行,0,0.9999996977198974
2023-05-19 20:17:10,流氓兔2024,奥黛丽赫本的服装是真靓丽,3,还行,0,0.9919164858589756
2023-10-21 13:26:59,不羁的風,"4-
剧情和节奏差点，但赫本养眼。",2,较差,0,0.6965387456657239
2023-11-30 15:36:49,千只鹤,两星半，看不懂这部电影，所谓的浪漫,3,还行,0,0.4861815344652368
2024-01-02 11:56:42,莱锦德锐,编剧是画饼大师，恰巧遇见爱电影又爱角色扮演的打字员，擦出爱情的火花在所难免。,3,还行,0,0.9999948539561974
2024-03-02 10:00:42,梦娜露琪可,赫本也是这类型爱情电影的鼻祖了,2,较差,0,0.9814849334091308
