2007-04-24 13:21:11,在他乡独居一角,w,4,推荐,0,0.5
2007-10-19 15:03:01,small脉望,新时期情感的回归从此开始。斯琴高娃的头角也从此初显。,4,推荐,7,0.9999959026527868
2007-12-28 04:03:24,[已注销],有什么，爱情，都不一样,4,推荐,0,0.807949774948636
2008-01-18 19:44:36,疏肝散,里面的主题曲直到现在依然喜欢。,4,推荐,0,0.7440429736970366
2008-01-24 17:12:13,kyarasama,看了一小时左右,3,还行,0,0.5597885089564532
2008-06-17 01:05:11,年年,shit out~~~~~~~,4,推荐,0,0.4737672181921908
2008-08-13 17:19:15,堅定de錫兵,那年月难得的革命+爱情电影。,4,推荐,0,0.9997876820086048
2008-09-13 01:30:04,sushi,雁南飞,4,推荐,1,0.9320943320508684
2009-01-06 15:05:43,毛线团,Parts..,3,还行,0,0.5
2009-03-18 12:07:35,francisca,weird hair style,5,力荐,0,0.4476784585098667
2009-05-03 18:44:24,Over5,千娇百媚的斯琴高娃 ！！！真牛逼～,3,还行,1,0.2820691168338179
2009-05-23 15:17:58,rcbbt,那一群蚊子在我身上吃饱了，不动，或许我还能挺住，你把他们轰走了，又来了一群蚊子，我就挺不住了。,3,还行,0,0.2992020837649639
2009-07-24 03:37:06,Jane,看惯了如今她飞扬跋扈的角色，忘了高娃也会抛媚眼。,4,推荐,1,0.9047837346401068
2009-07-25 21:09:45,pumpkin,"雁南飞，雁南飞，燕叫声声心欲碎。。。
斯琴高娃银幕处女作，但影片最让人难忘的还是这首凄婉的歌。。。",4,推荐,0,0.9999759664848004
2009-08-25 17:56:37,心之旋影,第四期 银幕玫瑰·电影中的女性形象,4,推荐,0,0.996492031836406
2009-12-14 19:00:54,呼噜斯基,斯琴高娃光彩照人啊,5,力荐,0,0.4476784585098667
2010-01-12 01:52:08,鹰头猫,大爪子，黑瞎子，小咬子。。。哈哈,5,力荐,1,0.4035369844826001
2010-01-30 19:19:35,香水瓶,东北的林子里真美啊,4,推荐,2,0.9592107586796425
2010-04-25 21:36:34,may-lynn,雁南飞雁南飞，雁叫声声心欲碎,4,推荐,1,0.9954235600185358
2010-05-19 14:43:14,donchen,雁南飞，人相守。。。,3,还行,0,0.993876292289782
2010-05-31 13:45:07,李哥,没看全……虎妞真粉嫩…,4,推荐,2,0.8890892667148524
2010-07-25 20:39:27,jagpumpkin,"“影片歌颂了主人公的思归之心，揭示出人物的心灵之美和革命理想。该片着力追求朴素、自然、真实，使造型处理和表演风格和谐统一，豪放中不失细腻，委婉中但见生动。片中细节的刻画较好地表现了人物性格，蕴含了很多用语言无法表达的人物内心的感情波澜。""写得很好，引用了——雁南飞……",4,推荐,1,1.0
2010-08-05 19:53:37,倾蕙宁,07年北电戏文复试片。,3,还行,1,0.6410510257384817
2011-01-23 22:48:35,mahuahuer,雁南飞,5,力荐,0,0.9320943320508684
2011-02-15 02:34:06,没穿裤子,从历史的角度来看还有意义,3,还行,0,0.9590871507512996
2011-03-19 23:04:41,李猴宝,有点拖沓，前50几分钟的内容跟后面的内容有点脱节。主题曲很好听，小男孩演得很好。,3,还行,0,0.6723837344651711
2011-04-11 00:43:22,高玉宝,斯琴高娃集中了北方女性的美，东北的深山老林里，秋阳洒在树叶上，闪着金光，照在她饱满莹润的脸上。。。,5,力荐,0,0.5360590566439141
2011-04-13 00:57:57,黄段无誉祸,雁南飞,3,还行,0,0.9320943320508684
2011-06-17 15:47:44,莱尼圆,斯琴高娃好大脸，雁南飞，雁南飞,3,还行,5,0.9921250422926796
2011-06-30 22:59:48,carol,为什么，我记得的电影，都跟插曲有很大关系？？可见那年代，歌曲的流行与电影密切相关，好的电影插曲随着电影而飞。喜欢《雁南飞》！2020.6.16重看,4,推荐,0,0.999994252954225
2011-07-27 21:21:02,WillGoWild,最喜欢的高娃角色,4,推荐,1,0.9437524709073264
2011-08-20 01:51:55,只爱这片土地！,雁南飞,4,推荐,0,0.9320943320508684
2011-09-06 10:39:20,滴滴答答,归，龟。,5,力荐,0,0.5
2011-09-10 19:02:47,lee,雁南飞..雁南飞........雁叫声声心欲碎...,3,还行,1,0.9198697647451678
2011-11-01 23:53:49,猴面包树种子,那个年代的爱情太过美好纯真...以至于有当代不如那个年代的幻觉...那首雁南飞听到我心碎...,4,推荐,3,0.999991742871948
2011-12-05 10:09:51,hungry,抗联的故事。斯琴高娃。老乡，但凡有点钱谁愿意捅这羊屁股。,4,推荐,1,0.03360342124683
2012-02-25 16:14:14,蚂蚁蚂蚁,没什么印象～ 只记得斯琴高娃当年很惊艳～,4,推荐,0,0.974274946055688
2012-02-26 22:23:20,落音吹羽,虽然斯琴高娃在影片演了一大半以后才闪亮登场，但其作用与渲染效果在整场戏中牵动着所有情绪，带着北国风貌的缠绵，更显大气。,4,推荐,0,0.9998589029986408
2012-03-11 20:08:53,狄恭至,对了，就是这部了。主题歌听得我热泪盈眶。,5,力荐,8,0.8021781041143174
2012-04-03 21:08:24,语然小语,绝美！,3,还行,2,0.8964478496456482
2012-08-02 00:13:59,仄平仄,雁南飞,4,推荐,0,0.9320943320508684
2012-10-07 18:30:12,小王子,李俊,4,推荐,0,0.7658055753638723
2013-01-04 11:39:04,小豆子,为什么片子最后不交代一下魏连长有没有回去找玉贞呢？片子一开头是从1979年倒叙回“四十年前”的1939年，那么显然彼时抗日战争、国共内战、各种运动什么的全都结束了，好歹告诉一下我们最后这两位主角的命运吧？,3,还行,0,0.9991174531217556
2013-05-04 18:13:00,飞阳123,"电影时长一小时38分。
女主角在一小时零五十多秒的时候才出现。
而前面的戏也并不沉闷，质朴而有风骨。
后面三十多分钟的情感戏拍得明艳动人，人物形象和情感都非常饱满。
饰演两个大爷的演员，形象气质都极佳。
一部精彩得超乎想象的电影。",5,力荐,8,0.999999999894575
2013-05-21 12:19:44,宝贝们茁壮成长,每一个时代都是最好的时代也是最坏的时代。该电影正是我党励精图治的年代。物质穷困国家动荡。但有的人就是能在这样一个惨淡灰暗的历史舞台上璀璨夺目。我想这就是人格的魅力吧，如同山林中清澈的泉水，昼夜无息滋养生灵。,4,推荐,5,0.999999998594115
2014-12-23 13:09:11,易老邪,毕竟是李俊出品。,4,推荐,1,0.9805560146492336
2015-01-05 02:37:03,科克托马斯,两段故事，画面颜色，情境对比悬殊，情感浓烈。,5,力荐,2,0.9994588234765652
2015-05-16 15:33:53,其燦如言,看了年轻时候的斯琴高娃，实在是不太符合我的审美观，感觉她的脸型还是年纪大了更显得有气势，作为一部刚刚进入改革开放新时代的大陆电影，在主人公一心报国的主旋律情节背后还穿插上了一段爱情故事在当年肯定是相当新颖的，只是这段爱情在全片结构中来得太晚了点，并没有完整地铺垫便让主人公坠入爱河,5,力荐,0,0.9999999999999314
2015-08-16 20:52:26,屎捞人,07年考试影片分析,3,还行,0,0.9846786938197488
2015-09-05 21:40:04,願爲冬日,国产电影里的佼佼者，堪称经典。力荐，编剧是李克异，姚依林的妹夫，著名作家。此电影我看了无数遍，音乐，场景，等等一切，绝了。现在很少能看到这样的电影了。,5,力荐,3,0.9999999384705822
2015-09-28 18:13:29,穿山,#资料馆#奥德赛之旅，吃过苦受过罪爱过妹，不改初心坚决向党，这种革命信念现在是拍不出来了，想到《柳堡的故事》；斯琴高娃的银盘大脸，东北的秋天真美，主题曲《雁南飞》经典啊。(以及革命小兵就这么做了叛徒？),4,推荐,0,0.9999960757008518
2015-12-09 19:11:59,旅行风景,好久了，久得都快忘记这个片子了。,2,较差,0,0.5946652838305955
2016-03-14 17:21:57,我生君已老,妻子送郎上战场,4,推荐,0,0.8421633476939097
2016-05-14 20:10:46,爱看电影的猫,斯琴高娃演得太好了。玉贞做老婆有什么不好？魏德胜太直男，玉贞说找不到队伍就回来，我们的魏连长说怎么会找不着？哄都不愿哄。《雁南飞》歌曲经典（补记）,4,推荐,5,0.9750214123735952
2016-05-20 01:39:22,咖啡也寂寞,喜欢这时期的高娃，温柔质朴坚韧，美。,3,还行,0,0.9999764304538687
2016-05-20 11:36:51,一只废喵、,爽朗正直的淘金客头领齐大爷将魏留在身边，更帮助他弄到宝贵的通行证。,5,力荐,0,0.98146193687892
2016-05-24 10:12:05,任陶用,雁南飞，雁南飞。,4,推荐,0,0.994139260284272
2016-06-14 15:21:17,pineapple,雁南飞 终归回,3,还行,0,0.8387427943895849
2016-06-19 11:17:02,杏花杨柳飘,经典国产老片！,4,推荐,0,0.7798565236088173
2016-08-18 17:17:13,书言,斯琴高娃真是戏霸，即使现在看依然会被里面的情感所打动，柔肠百转.可见当年的效应！,4,推荐,0,0.9983155340840102
2017-01-11 06:44:45,荷沐风,只记得好听的插曲,5,力荐,2,0.6448052074274645
2017-01-11 12:33:54,柳生烈堂,雁南飞,4,推荐,0,0.9320943320508684
2017-02-23 06:00:08,Paul,摄影不错。,4,推荐,0,0.9848890842893162
2017-03-22 15:18:38,坐看云起时,斯琴高娃，不美，但是演技不错。小时候经常听广播剧。,3,还行,0,0.999920141229598
2017-03-31 01:16:06,HH,小人书，雁南飞，其实当年没看懂,5,力荐,0,0.984468158330582
2017-04-23 10:31:35,米菲,这时候的斯庆高娃真漂亮,3,还行,0,0.4874236921507133
2017-06-01 02:03:39,Paylor,斯琴高娃老师的青涩表演,4,推荐,0,0.982820026424646
2017-06-22 13:12:00,半夏,雁归来 深情优美,4,推荐,0,0.991856566434946
2017-09-14 18:56:03,simon,国民手帐,5,力荐,1,0.3168794328541168
2017-09-30 00:23:29,不太明白,柔美、感动,4,推荐,1,0.953577004454864
2017-10-08 00:42:16,Bastogne,画面美，表演细腻，男主虽然说有点高大会显的有点假但瑕不掩瑜 那个年代难得的佳作！,2,较差,1,0.9999294753636828
2018-01-20 23:15:50,丰,斯琴高娃的表演真的是朴实真挚，歌曲早已是耳熟能详，赞,5,力荐,0,0.9999948370006356
2018-01-25 23:02:17,一只野鸡,斯琴高娃以29岁高龄拍的处女作，虽然皮肤紧绷，但脸真的好大。。男猪脚在东北野外颠沛流离+打黑工，历时大半年，有种《荒野生存》的感觉,4,推荐,1,0.9999764076768666
2018-04-22 00:05:03,修理工,生活写成的诗,5,力荐,1,0.9761905501150212
2018-05-29 20:05:47,天空没颜色,高娃年轻时候真漂亮,4,推荐,0,0.9773394933460134
2018-07-06 20:46:59,junsayhello,老电影，很有感觉。,4,推荐,1,0.8992423023192222
2018-08-22 00:22:27,咕噜咕噜丹er,斯琴高娃的脸真大，但是五官也是真的好看。,3,还行,0,0.611423354723712
2018-09-23 22:28:41,努力冲冲冲✨,晏凌老师课堂上放,5,力荐,0,0.973454628539383
2018-09-26 21:20:09,流金碎影,拍出了东北之美，茫茫雪原之美、红叶🍁烂漫之美、莽莽林海之美。东北有平原、有高山、有湖泊、有海洋……当然，东北的人更美，不仅是外形美，更有最淳朴的心。希望那些黑东北的地域黑们看看东北的风光，更看看东北的历史。看看我们东北人民是在怎样艰苦无援地抗日，看看东北人民的勤劳勇敢吧。,5,力荐,0,0.9999999999999638
2018-10-12 09:31:44,Humphrey,雁南飞。小时候听的“电影录音剪辑”。,3,还行,0,0.9998062213204326
2018-10-19 12:30:12,穆穆良朝,斯琴高娃很美。,3,还行,0,0.9007826817925842
2018-11-19 18:28:57,momo,经典老电影,3,还行,0,0.9264535599803696
2018-11-19 18:56:34,PUSSYCAT,妈呀，斯琴高娃这么年轻！,3,还行,0,0.8097683833352232
2018-11-19 18:56:34,PUSSYCAT,妈呀，斯琴高娃这么年轻！,3,还行,0,0.8097683833352232
2018-11-19 20:05:53,王盈,很老的片子，喜欢斯琴高娃的表演，喜欢那种含蓄的表白，山林里的秋天拍得太美了！,4,推荐,0,0.9996019693969126
2018-11-19 20:06:02,MG_and_Ll,雁南归，雁南归。雁叫声声心欲碎，不等今日去，已盼春来归，已盼春来归。今日去，原为春来归，盼归，莫把心揉碎，莫把心揉碎，且等春来归。,4,推荐,0,0.9989138370771322
2018-11-19 20:46:58,我舞影凌乱,斯琴高娃长相真不错。很自然真实,4,推荐,0,0.99585420114702
2018-11-19 20:48:34,十二月烟雨,老电影非常不错，体现了以前的民朴民风。比现在的电影好太多了,5,力荐,1,0.997602946815482
2018-11-20 08:38:14,朝花夕拾,看了一半，特殊情节,5,力荐,0,0.6608926513681713
2018-11-24 15:50:37,笑看思想,每一帧都油画一般，美。不只爱情,4,推荐,0,0.9859736790348096
2018-11-24 15:50:37,笑看思想,每一帧都油画一般，美。不只爱情,5,力荐,0,0.9859736790348096
2018-12-12 16:05:13,奥特曼·汪大仙,找部队历险记，半路捡个大媳妇儿,3,还行,0,0.7902782014911918
2018-12-23 08:40:18,jujuzhh,2018/12/23 艺术人文,2,较差,0,0.9904533752719598
2019-01-13 17:46:06,拓之空,大陆版《冷山》,3,还行,0,0.601068451508153
2019-01-13 17:46:06,拓之空,大陆版《冷山》,3,还行,0,0.601068451508153
2019-01-20 20:30:05,光阴盒,"自古英雄难过美人关，东北抗联除外。
一道道难关，包含最后boss关斯琴高娃，
挡不住回归部队打鬼子的信念。
主旋律电影，拍的意外好看，向先烈们致敬。
——哪里有什么岁月静好，
不过是有人替你负重前行！",4,推荐,0,0.9999999997947526
2019-02-03 20:53:15,小达尔,可能囿于年代原因，视听语言较差，跟电视剧似的。,5,力荐,0,0.4492411670478652
2019-02-18 16:09:50,丘戈,电影开始说人话,4,推荐,0,0.6785678851689042
2019-03-09 22:05:41,返璞归真,"雁南飞 雁南飞
雁叫声声心欲碎
不等今日去
已盼春来归 已盼春来归
今日去 愿为春来归
盼归
莫把心揉碎
莫把心揉碎 且等春来归",4,推荐,0,0.9999593881030768
2019-04-23 17:38:48,Crese_박,斯琴高娃，我滴ma，果然曾经也是大美女。为了写论文补老电影，一不小心就很入戏，果然我们回家的艺术八九十年代是最好的时候，大家都认真的拍电影啊。这一部虽然还是有英雄主义的叙事，但是人道主义精神已经充分融合在里面，人物完全是立体的，丰满的，再也不是董存瑞那种概念化的面容了。,4,推荐,0,0.9999996918803928
2019-05-09 17:43:56,冰澜,斯琴高娃电影处女作，在当时的年代，算得上一部艺术价值很高的电影…,3,还行,0,0.9995125837500146
2019-05-09 17:43:56,冰澜,斯琴高娃电影处女作，在当时的年代，算得上一部艺术价值很高的电影…,3,还行,0,0.9995125837500146
2019-06-12 13:30:06,怀旧经典,讲东北抗联的，赵尔康是好演员，可惜作品不多,3,还行,0,0.987670683122482
2019-06-12 20:23:20,皮皮虾,2008.01,4,推荐,0,0.5
2019-06-28 18:16:12,YiQiao,三星半//张骏祥在《用电影表现手段完成的文学——在一次导演总结会议上的发言》中着重表扬了影片《归心似箭》主题思想明确、典型形象塑造、文学表现手段借鉴和电影的民族形式树立等方面。//但是我不能完全认同他//从影片中可见的是一种复杂的情形 既有过往的意识形态表达又有略带新式的处理手法 光是强调片面的文学性或是戏剧性对于电影而言显然是不足够的 换个角度想 电影中的场景照搬到舞台上同样成立 那么看电影或是看戏剧有什么区别 观众能得到什么新鲜//或许要讨论电影创作问题 首先要确立起的观念是 “电影是一门拥有独特艺术表达形式的综合性艺术”,3,还行,8,1.0
2019-07-26 23:34:35,果樹,可能是我目前为止看过的最漂亮的斯琴高娃……,3,还行,0,0.9426501277633202
2019-08-01 18:09:50,疯狂神经,喜欢看的老电影（雁南飞～雁南飞）。,4,推荐,0,0.9994063968070446
2019-08-20 15:17:16,獨孤求敗,斯琴高娃好美........,5,力荐,3,0.4565115487590758
2019-08-24 20:13:13,wlhui,看了高娃出来后的部分，这个健康，有女性美，贤惠体贴的女性形象，尤其表现出女性的柔媚，似前所未见，在那个年代很不易，太有光彩了。,3,还行,0,0.9999987299173304
2019-09-14 22:23:54,木石子,后半段的爱情戏拍的挺好的，风景美、音乐美，就连一向不以颜值著称的斯琴高娃老师也娇艳似花。真的有被感动到！,4,推荐,12,0.99999987003067
2019-09-19 18:49:29,松树,整体观感挺不错的 尤其是色彩非常出众 后半段的爱情戏颜色搭配绚烂夺目 在画面构图上很讲究,4,推荐,1,0.9999998980614616
2020-01-09 18:22:12,四百击后八部半,前半段是男人戏，后半段突然出现了女性，女性在男性成长历程中起到救赎和抚慰作用，同时也为男性成长做了牺牲。斯琴高娃真是散发一种原始旺盛的生命力，美！,3,还行,0,0.9999999998162636
2020-02-03 23:59:24,静下心来,斯琴高娃老师年轻时真漂亮啊,4,推荐,1,0.9952566063059936
2020-02-04 21:33:41,五明子,上小学时学校组织看过首映，当时很多地方肯定是看不懂的，比如“国民手账”、“大爪子”什么的。。,5,力荐,0,0.9914953170736214
2020-02-18 11:05:33,天上大风,诗意。山林间的缤纷色彩真是美。,3,还行,0,0.9784450852650912
2020-02-20 23:37:43,季霖,#新时期中国电影Vol.1# 02：3.5/个别台词有点干和硬。人物关系编织得不错，将主角巧妙连结了起来。演员的表演都非常真挚，小男孩很灵，懂事又能干也能聊得来，真可爱；两场哭戏——魏得胜养伤时讲述自己多舛的命途和离别后玉贞的暗自伤心，情绪的酝酿很富层次感，令人真切地感到不忍。片尾同样经典的《雁南飞》想起，久久在耳畔回荡，想象着两人相见的那刻。,4,推荐,2,0.999999999999996
2020-04-26 20:15:13,好像好的好的,斯琴高娃老师颜值巅峰的一部戏，演得也很好，羞涩，情挑，完全不会觉得压迫对手演员。,4,推荐,0,0.9999730374208098
2020-06-21 23:39:59,小袁同学,鸿雁传书，归心似箭，虽然在细节上有些不妥，整体而言，是紧紧地扣着题。革命面取，艰难险阻扛的过，糖衣炮弹也扛得过，这才是真正的英雄好汉，这才是真正的抗联战士。看了李俊的三部电影，从文革时期到文革之后，李俊对共产党可真是真爱，褒扬与赞颂从镜头、台词的设计与感情剧情的推进细节，可以看出李俊真的是发自内心的歌颂。不像是中国第二代导演过渡到新中国后，虚伪的拍马屁。,4,推荐,1,0.9999999988523348
2020-07-09 16:04:03,劳根,不等今日去，只盼春来归。,4,推荐,0,0.554861568157155
2020-07-27 14:52:45,allfake,可以看见第三代导演，特别是八一集体下对当时党和国是真爱,3,还行,0,0.9953731565428324
2020-07-27 23:41:58,小清新,情节真好  那时候看的很好看,4,推荐,1,0.9520163008381032
2020-10-01 12:25:25,都市丽人舒绣文,真的可以再见面吗?,5,力荐,0,0.5245806122243047
2020-10-21 13:48:21,阿凉,还是老电影好看,4,推荐,0,0.9070772606424946
2020-12-05 20:10:03,林冲夜奔,新时期电影,3,还行,0,0.9643877193275084
2020-12-16 20:54:57,momo,三星半。新时期，人性与情感的复归。,3,还行,0,0.9860148899121046
2020-12-16 23:53:24,chameleon,雁南飞,4,推荐,0,0.9320943320508684
2021-01-07 01:07:48,仙女苦鸲鹆,2018-11-04，遇党前尽遭磨折，遇党后逢凶化吉各样巧合。遇小寡妇前是虎头，遇小寡妇后是蛇尾，雁南飞，雁南飞～只好歌来凑了,4,推荐,0,0.9884191013592064
2021-01-28 00:17:53,Ion,"剧本很好，四段故事前后不是割裂的，而是环环相扣，第二段故事中齐大爷在送男主角走时送的棉袄里偷偷塞的金子在第三段中救了他一命，而第四段中的玉贞又是第三段中齐大爷的女儿。
其实有着50-70年代旧题材的延续，男主角的家庭也是被压迫阶级，父母都被压迫致死后，成为孤儿的男主角被共产党人所拯救，加入抗联，加入“革命大家庭”，找到归属。同时，受伤后被玉贞所救助，也是50-70年代子弟兵与人民、军民鱼水情的依存关系的表述的延续。但是，虽然依托于50-70年代旧有的叙事模式，这部1979年新时期开启时刻的影片的价值体系却已经悄然发生反转，一个不幸脱离军队的战士要归队的故事已经转移为归家的故事，结尾战士要继续去找部队战斗，是为了回来能与爱人团聚。正如影片著名的主题曲《雁南飞》所唱的那样：不等今日去，已盼春来归",5,力荐,0,1.0
2021-02-03 11:21:56,路人丁,那时候的斯琴高娃真的很漂亮很有气质。,3,还行,0,0.9823802782472886
2021-02-21 21:15:31,ajiang8081,看过留痕,3,还行,0,0.3184761389212583
2021-03-04 20:22:23,果汁阳台,"白桦林，真美！

斯琴高娃满满的胶原蛋白！！",4,推荐,0,0.325977837848198
2021-04-03 18:26:39,独自芳菲,虽然归于战争片，但是影片的基调非常质朴美好。我认为是斯琴高娃的代表作，她后面的作品普遍有些用力过度。,3,还行,0,0.999524557905956
2021-04-04 00:44:33,alb007,一听到<雁南飞>，就想起赵尔康和斯琴高娃,3,还行,0,0.9256833968994196
2021-04-23 10:46:30,小蘑菇爱七菜,因为雁南飞这首歌看的这部电影，斯琴高娃那时候好年轻啊，淳朴的年代。,3,还行,0,0.9997497265259838
2021-04-23 10:46:30,小蘑菇爱七菜,因为雁南飞这首歌看的这部电影，斯琴高娃那时候好年轻啊，淳朴的年代。,3,还行,0,0.9997497265259838
2021-04-24 14:35:57,乧牖zumio,八一电影制片厂出品，解冻时期文艺作品代表，斯琴高娃的电影处女作。人性复归，情感细腻，影片风格质朴、自然、明媚、诗意。,4,推荐,2,0.9999997620897672
2021-05-03 19:41:13,小时同学,斯琴高娃老师年轻时很水灵,4,推荐,0,0.9771021515781116
2021-05-14 00:23:34,豆友63024954,主题曲好听，有公路片的味道了。,3,还行,0,0.1314045540119898
2021-06-13 15:51:23,lyckligdag,《第十放映室》。,4,推荐,0,0.208822881600645
2021-06-20 13:10:47,蒙太太太奇,"影片中的两段落故事分别是在两种截然不同的场景中进行的。前段的冰天雪地，色彩灰白，主人公也处处遭受着苦难。后段被女人解救后突然进入了一个世外桃源般的仙境，流水人家，红叶斜阳，全然诗画的场景更契合主人公内心的写照，因为在这里出现了全片唯一一个女性角色。爱情也在这种诗情画意里铺展开来。
影片的结尾通过象征意义的大雁结束，给观众留下了值得回味的空白和合乎主题的表达",3,还行,1,0.9999999999998824
2021-06-25 08:02:00,海纳百川,认识了斯琴高娃,4,推荐,0,0.4737672181921908
2021-06-30 03:54:03,何达平,纯情年代,5,力荐,0,0.8573859700660589
2021-06-30 14:38:28,斜阳生暖笑,东北的山林真美。斯琴高娃，年轻漂亮。,5,力荐,0,0.9994008483973108
2021-07-04 08:54:44,向阳花开,李俊,4,推荐,0,0.7658055753638723
2021-07-04 09:38:47,小灰27,茫茫雪原，淘金客，矿山逃亡，和一个叫玉珍的女人说说“一辈子”，在漫山红叶的村庄里，讲讲自己不堪回首的童年，离开去找自己的队伍，天边飞过一行大雁，响起那千回百转的旋律……主旋律电影里，最浪漫的存在，真是太美好了。,4,推荐,6,0.9997087548163156
2021-07-09 17:50:13,星辰,歌好听，人好美，很喜欢,4,推荐,0,0.9807349482080544
2021-08-06 23:55:26,云中雨阳,插曲雁南飞很有意境，魏得胜重伤之后还能不忘抗日初心重归部队不易呐，斯琴高娃竟然为这部电影打胎真是惨绝人寰。,3,还行,0,0.9999548321555894
2021-08-08 03:46:27,gfjdwsg,斯琴高娃老师那会儿真好看…… 主题歌好听,4,推荐,0,0.8951864935883842
2021-08-14 22:06:48,真理洒落,明白优点，但看不进去,3,还行,0,0.2315849472445047
2021-09-17 21:31:04,Morning,过于强调电影的文学性了，于是显得很死板，没有流动性，魏得胜在电影里显得像个圣人，基于电影非常相似唐僧取经的结构，每一段落都是为了留住主角。这个电影又显得很样板片，最后一段是情字关，以现在的衡量来看，斯琴高娃生活气息太重，很难留住人，这一段有一处大穿帮，齐大爷自怨自艾的奔走的同时，魏得胜的头发大长，前后不连戏，这个穿帮很致命，因为魏得胜的表演，他的语音语调也不连戏，明明一个很好的表达心境的重头戏，就这样毁掉。,2,较差,0,0.9999999999982664
2021-09-22 15:56:40,吃货天堂,归心似箭里还有陈佩斯？只记得斯琴高娃了。,4,推荐,0,0.9493307176106426
2021-09-25 08:28:35,叶落时分,盼归，莫把心揉碎，且等春来归。诗意的是表象，情感的是内核，最后的分别直击人心，切身地感受到了那种浓厚的情感。,2,较差,0,0.9999996769810762
2021-10-20 23:54:43,看不懂瞎看,79年第一次创新浪潮,4,推荐,0,0.7345493354791406
2021-11-07 10:55:42,Hangain,经典的国产电影,3,还行,0,0.9350907912526945
2021-12-14 23:28:24,古月今尘,居然有陈佩斯,5,力荐,0,0.3647480830228734
2022-02-28 06:58:56,禾禾,读初中的时候偷偷跑到电影院看，真的好看，当时就学会了歌曲“雁南飞，雁南飞，雁叫声声心欲碎，不等今日去，已盼春来归，已盼春来归，今日去愿为春来归，盼归莫把心揉碎，莫把心揉碎，且等春来归”,3,还行,0,0.9999999788986212
