2020-02-14 16:04:50,如意萬重,对比1995年的攻壳这部作品就没那么好看了，场景衔接突兀，故事交代不够顺畅，过于追求视觉特效真实与虚幻的交织桥段让情节弱化。巴特越来越像上一集的素子，迷失是容易的，堕入无限虚幻的网络只是时间问题，有完整的家庭妻子女儿的搭档似乎成了映照日趋冷酷巴特的一面镜子。素子遇到了2501，与之结合让素子拥有了独立GHOST，能穿梭网络世界不迷失。在充满工业化气息和雾霾的城市里，人们创造出各式各样新神灵娱神娱己，可活动一结束人们便将“神灵”们焚烧而尽，未来义体化的世界，人们失去了GHOST，失去了信仰，古老的神和宗教已经无法再滋养这个世界。高高在教堂上矗立的关二爷不再是代表仁义的善神，更像是维护阴暗角落势力的护法。在混乱世界里维持正义的巴特，养一只没有义体化的小狗终于让他感到被需要和被爱的幸福。,4,推荐,2,1.0
2020-04-01 17:19:58,Pyako,"       就是那种看完之后打了5星想把之前的5星都改成3星的片子。就是看完之后除却巫山不是云了，进你个人影史十佳了，有的片子你给他打5星是因为他值5星，有的片子打5星是因为满分只有五颗星。
        每个分镜都是教科书级别，场景，机械设定全部下足功夫，人物站位和机位都精心布置，打光和镜头运动“语不惊人死不休”。川井宪次的音乐插入得恰到好处，全程寒毛直竖。名人名言串烧的对话模式符合“随时联网检索语言”的赛博格设定，草薙素子进入的时机毫无违和感。新的赛博格机械设定美到眼睛发直。用20分钟讲了盗梦空间，20分钟讲了香港黑帮，20分钟讲了意识与脑的关系，20分钟探讨了机器人和人类的区别。反正就是绝了，太绝了。",5,力荐,3,0.9882817799351512
2020-05-07 18:29:49,拔剑四顾心茫然,只有灵魂被记忆放逐，才能逃避思考肢体的归属。只有自我被金属加冕，才能暂时获得内心的牢固。行为异于规范形态，是对个人意志和群体文明的终极拷问。生命脱离常识定义，是种凌驾科技并超越信仰的绝对虚无。更可怕的是，我们以为自己正在看着镜子，却没有办法证明镜子中的自己，是不是正在被自己凝视。押井守在第二部彻底放飞自我，向着“生命的真实”全面开炮，用壮丽而炫美的视效，空灵又哀婉的配乐，把关于生命的存在与虚无这一主题，推向了一个新的巅峰。当人类需要创造另一个自己来证明自己，取悦自己之时，这是妄想成神的恐怖，也是迈向灭亡的开端。将有寿命更迭的意识镶嵌到具有超越时空界限的机器中去，更是一种自我怀疑与否定。如果真实是一切存在的终极前提，一切都将失去意义。生死去来，棚头傀儡，一线断时，落落磊磊。一部需要缓很久的片。,5,力荐,5,1.0
2020-05-14 22:00:08,Whisper_,"华丽，诡谲，孤独。
“悲于鸟血，而不悲于鱼血，有声者幸也”，直到这句话出现，才慢慢理解此刻感受到巴特微妙的冷血。最后一幕意味深长，回想起之前哈拉威的那段话，又有些悲伤。

ps.画面转场演出真的太好了，如梦如幻。",5,力荐,1,0.9999999999983712
2020-06-13 16:55:06,Tatjana,"“他们好像秋天的叶子一样群起群落 狂乱了的混沌呐喊中结束” / “鸟血惹人怜，鱼伤无人问”
人类层面依然讨论精神体独立于肉体的存在问题，赛博格突然显露的机体暗示被放弃本体论意义上的人类身份。离体性和再定义的生命概念令玩偶与虚无神明的主体性无限增强，认知场内有的人类害怕自身被简单还原，有的人类对不同机体的罪恶无限悲悯。旁征博引从她口中说出总像是念诗。欢喜那句“深深的无意识的欢喜”，像是欢喜可以发生在本就或许无意识的机体之内。不同建筑审美之间的个中差异管窥不同场域、不同人与非人的关系，如复古未来式灰暗基调霓虹点缀的生活场所，黑客家中极尽繁复瑰丽的万花筒世界以及纯粹机械化的工厂要塞。宣判：无罪。",5,力荐,2,1.0
2020-06-27 03:44:26,醉梦·聊生,少佐失联，巴特携陀古萨挑起大梁，两人乱射黑帮，闯入邪魅的浮屠塔群，随着怪异如经文轻柔入耳的片头曲响起，影片的氛围阴阳不定，巴特脑波异常，陀古萨恍如梦幻，汉字大行其道蕴意非常，少佐以人偶现身救人偶之魂。,4,推荐,0,0.9999999994418628
2020-07-28 10:17:56,遮天的花,"相比第一部变迷惘了，但最后那种义无反顾撞击命运的决绝没变。从哲学、DNA、信息等角度思考了一圈何为生命，却没涉及几十年前就提出的“生命以负熵为生”...有点遗憾。
处处引用警句，有亮点也有堆砌，例如论语那几句着实别扭。“一线断时，落落磊磊”，诶，若悟得“无我”，也就看透生死了。
关于存在与意识的问题，个人相信“时间是熵增，生命为对抗时间，意识（求美）是意义本身”是更简洁的理解线索——DNA、有性繁殖、神经元细胞的出现都是为了对抗时间，明白这一点，才会理解生命为何会死亡，为何会需要多样性，大脑创造力和艺术感从何而来。其实从神经科学可证明，越是借助技术（经验）辅助大脑，越会削弱其感知力，从而影响大脑对未知的洞察和对美的直觉，人就越容易被操控。所以使用技术辅助大脑之前，先弄明白活着到底为何会不会好一些？:)",5,力荐,5,1.0
2020-11-29 00:09:24,鸟鸟弗斯,5.8 这个故事也太可怕了吧！！！全片古诗词背诵大会？？？好喜欢“鸟血有人怜，鱼伤无人问”，因为我对植物也持有同样的态度。,5,力荐,1,0.9844225960862482
2020-11-29 00:09:24,鸟鸟弗斯,5.8 这个故事也太可怕了吧！！！全片古诗词背诵大会？？？好喜欢“鸟血有人怜，鱼伤无人问”，因为我对植物也持有同样的态度。,5,力荐,1,0.9844225960862482
2021-01-31 13:29:32,沙力兔,富丽堂皇 名句环绕 但剧情不大是我的菜 不带劲（尤其是刚看完回忆三部曲……）画风略显夹生 不够饱满 喜欢那句 无欲无求 林中大象,5,力荐,0,0.999993810337721
2021-05-22 20:48:59,消亡之人,"乍看是悲观的，把人类这个概念彻底打散，告诉我们，要么成为赛博格，要么去做猪狗，要么，孩童就和人偶没有什么本质区别，成人则是一种罪恶的形式。
但是，巴特为少佐披上衣服的时候，为那个只有部分意识的载体人偶，披上衣服的时候，很难不相信ghost的存在。
其中也有某种自反性。超然万物的赛博格少佐，又到底是出于什么，在一直关注巴特呢？联系、羁绊，情感、欲望，都只会使她超越人类的存在形式有失公正。
于是赛博格终究不是神，而是某种强大的人。

太喜欢那段八音盒的配乐了，无需人演奏的、纯粹机械性的，然而又清澈纯粹如童音，与主题形成了完美的契合。
难怪那么多恐怖片喜欢用。

哲学思辨更多应用语言，但中哲相关元素的应用增强其神秘性，也挺好。
而且“能发声者有人问”，这种深度，实在难以用语言以外的形式表现。",5,力荐,12,1.0
2021-09-01 10:26:27,粉粿症候群,重看一次发现真的是一封又落寞又浪漫的情书啊...你离弃了实存过的证据，渗透进这个时空的每一个角落，就像从未存在过一般，投入到那无边无际的网路矩阵里，你变成了rhizome，变成像素点，变成全息影像，变成城市的钢筋水泥，变成信息流闪烁瞬间的光....变成一个谎言，溶在我的血液中。但你又会在无人知晓之处忽然出现，大声宣读那些只有你我才能解码的秘语...可是我知道，一切已经不一样了，在你义无反顾地奔向失落的客体的那一瞬间，玫瑰或许就已经不再是玫瑰本身了，而异化成了我渐渐死去的知觉，或许仅此而已...,5,力荐,7,0.9999806800609606
2021-09-20 14:23:30,初音求道大帝,8分，第二部明显扯远了，不是现在的人类应该思考与理解的问题，就好比一只狗，它整天思考着自己在天上飞会不会被黑洞吸走，在天上飞被黑洞吸走了拍出来画面虽然华丽，看起来也牛逼像是在警示着什么，但真的有内涵吗？导演滥用大量名言警句更像是做贼心虚来掩饰主题的空洞。,5,力荐,2,0.9997668913573856
2022-04-03 13:52:46,地铁里的季风,强制将少女的灵魂转入傀儡。说实话不太懂这么做的意义。有的人或许希望如此逃避衰老和死亡，但大多人还是不愿意的吧 | 大量的中国元素，但一开头建筑上的禄，狗文字和劳吉斯城塔楼上的关公像实在让人有点着摸不到头脑和尬。虽说是日本拍的片，起码汉字是啥意思还是懂的吧。引入了许多3D场景，然而效果并不好 | 伴随着《傀儡谣》进入漫天金屑和飞鹤盘旋的劳吉斯城，看着巨型大象花船和满城带着如万圣节面具奔跑嘻嘻的小孩，很有点恍惚感。|《傀儡谣》的音乐很有特色，让我想起广西那边的一种民歌，就是让歌声模仿蝉鸣，聒噪，清亮，富有金属感,3,还行,0,1.0
2022-04-09 00:01:36,ᵀ ᴬ ᴺ ᵀ ᴬ ᴺ,好神，很深奥的哲学思考，在第一部的主题上再次升华。画面精致了许多，港风背景好漂亮好细致，中间的游行太华丽了疯狂心动，再配上谣的神曲太绝了。进入城堡时三次反复循环紧张刺激，忍不住倒回去又看了一遍。一开始看觉得和第一部关系不太大，但是细细回想跟第一部很多细节都对应上了，能跟巴特搭档的只有少佐，巴特说他的守护天使给他的提醒是见面代号，你不怕你的老婆孩子都是假的吗，跟素子一样喜欢潜水也被一样告诫小心。第一部着迷素子的魅力，第二部对巴特的魅力后知后觉，柔情铁汉的温柔每次都为素子披上衣服遮挡身体，两人的关系也值得琢磨胜于亲密战友，素子说只要联网就能再见到我。里面几段关于生与死的思考，关于人类和人偶的哲理值得深思，能体会到巴特的孤独了。对话引用了好多名言有些难懂，最后粤语背景音更有氛围，看完准备看看2.0,5,力荐,0,1.0
2022-05-15 23:31:20,萤,【文化】2022年的人类社会并没有出现押井守的担忧，甚至还没有解决掉人类内部的矛盾比如经济贸易、失业问题、恐怖主义和病毒的威胁。押井守把科技具化为机器人，在现在我们能看到科技更多表现为数据等常人不可触摸的状态。押井守担忧的信仰、道德伦理或许还要五十年才会出现问题。【视听】极其割裂，庙会绝美，对话就简单的固定长镜头灌台词。【主题】人类试图取代上帝成为造物主，制造机器人并主导他们，机器人与被意识形态化的婴幼儿、玩偶是一样的。上帝不存在，地狱也就不存在了，人将何去何存。人变得均质化，那些拥有情感、个体思想的人是偏差。城市是人类记忆的外部空间。,4,推荐,0,1.0
2022-05-20 22:02:02,孑然殇逝,9年后的第二部，在画面效果来看明显是进步了，剧情方面我相信这9年时间押井守肯定也没闲着，100分钟内信息量极大，就“生死去来，棚头傀儡，一线断时，落落磊磊”这一句话就值得细细品味一阵了。,5,力荐,0,0.9989518295206532
2022-05-21 00:24:45,451½°F™,首部讨论的是机器的「灵魂」，续部则是「死亡」与人类的变异；对于机器而言，更加二律背反的是「人是机器」的命题，如果存在「自由意识」，那么机器人就会认为自己是二重的被剥削者，当人类津津乐道于AI时，机器的反抗可能更加是「不成为人」，于是从这个意义上说，Ghost in the Shell的讨论已经超越的人/机器的二元论，而上升到更高的哲（神）学层次——虚无和狂妄。,4,推荐,1,0.999999953313896
2022-05-21 00:24:45,451½°F™,首部讨论的是机器的「灵魂」，续部则是「死亡」与人类的变异；对于机器而言，更加二律背反的是「人是机器」的命题，如果存在「自由意识」，那么机器人就会认为自己是二重的被剥削者，当人类津津乐道于AI时，机器的反抗可能更加是「不成为人」，于是从这个意义上说，Ghost in the Shell的讨论已经超越的人/机器的二元论，而上升到更高的哲（神）学层次——虚无和狂妄。,4,推荐,1,0.999999953313896
2022-05-26 14:47:57,嗦罗蜜,个人觉得比1更好，豆瓣打分也略高一点，应该主要是针对美术及画质技术层面的迭代。哲学层面上延续了1对于人与义体（半机械及电子脑）以及智能人偶的定义的讨论。本集最打动人心的是，以巴特这个少女心的冷酷大叔的心路和视角为主线，副线加入了个副手陀古萨，陀古萨代表了未经改造的纯粹人格，虽然自己也曾疑惑何为真实何为信息造假的现实，但还是坚定不移的家庭观念维护者，结尾小女儿的出场以及洋娃娃的人偶隐喻既有坚定的温情也有挥之不去的主题魅惑。巴特的感情线颇值得玩味，他对素子的怀念依赖爱慕，尽管缱绻复杂悲情，但当素子危难时候现身的时候，镜头处理极度利落。即刻还原为战斗拍档，冷静克制，而心潮汹涌，非常高级。生死来去，棚顶傀儡，一旦断线，落落磊磊。中文非常泛滥，反派的粤语，后半段极度华丽的东方庙宇宗教，品质超一流。,5,力荐,0,1.0
2022-06-07 02:56:18,Kevin,充满了箴言和警句的电影还是第一次看呢：“自己脸歪，就不要怪镜子。柿子成熟前，乌鸦都不碰，现在都凑过来了。要理解凯撒不一定要成为凯撒。个体制作的东西与个体相同都是基因的体现。驴子就算出去旅行，也不会变成马回来。越是等着想骗人的家伙越好骗。雀伤有人怜，鱼血无人问，有声者之幸。”期待了许久的少校居然一直始终没有以原形象露面，果真是融入信息流了吧。有被缓慢的节奏感到无聊，有被故作高深的bgm感到聒噪，有被泛流瑰炫的CG感到晕摇。至于那些大谈存在与意志的哲学探讨，自我与个体，人类与玩偶的进化之路，在浅酌小饮后也大概遗忘。也许走向神性免不了要以泯灭人性为代价。,4,推荐,1,0.9999999999999998
2022-11-03 20:10:28,薛同,"如果说第一部我会觉得略虚，这一部我想跪下。再一次经略到动漫制作比真人拍摄更具有想象发挥空间的意义，意思来源于今敏，原话不记得了。
提出了太多问题，辩证的过程也极具厚度，似乎感觉到了什么，又似乎什么都没抓到，真的消化不动，我跪了，跪的特别服气。
重刷是必要的。",5,力荐,0,0.9999296534414938
2022-11-07 01:58:51,生人回避,灵魂、情感与意识形态，在借鉴和致敬攻壳的大量文学载体中，大部分都只行于表的挪用了赛博朋克元素和后现代混乱背景，但鲜少有关注到其深刻的精神内涵，我愿称押井守为穿越者。,4,推荐,0,0.9999999045615546
2023-03-10 06:13:03,顗礼,大银幕看效果好到差点哭出来（少佐登场的时候确实哭了一下下）。回答“我是谁”之前，要明确我首先是“我”，即便无处不在或心意相通，“我”与“ta者”也不可互相代替彼此的感知，无论是物理层面还是心里层面，人与机器与任何一种生命体在这一点上并无不同。也正因此，永恒的孤独之中闪现出的幻光便如同打破镜面的子弹，或许意味着破灭与伤害，又或许意味着温暖与陪伴，而二者代指的刺痛与抚慰皆代表真实，所以开枪吧，“我会陪在你的身边。”,5,力荐,0,1.0
2023-04-28 19:38:57,KayCorleone,"层层递进
【个体创造的东西，具有该个体相同的遗传因素的表现形态（生物）】
【如果说生命的本质是通过基因传播资讯，那么社会和文化也不过是庞大的记忆系统，城市则是其巨大的外部记忆装置】
【浮生空自哀。未知生，焉知死】它居然达到中西哲学的统一点，从信达雅的角度看，在意境上获得一致。
【人类认知能力上的缺陷，导致了其现实的不完全】
【真正参透死亡的人极少，多数人只是靠愚钝和习惯忍耐罢了】可以说叫做不知道为什么活着，但也舍不得死。
【人类机械论，人类的存在是否本来就是虚无】
最后回到永恒的话题 ghost
…
在学习中的小孩到底算不算人类呢？他们又并没有完全的自主意识？如果说他们算人类，那么AI为什么不算人类呢？
城市空境太绝了，赛博中华，台湾文化更多一点……怎么还有一堆张飞站在楼顶",3,还行,2,1.0
2023-07-16 18:33:48,稚龙初醒,虽然是20年前的片子，但画质极佳。世界架构宏大。,4,推荐,0,0.9991117206645552
2023-09-16 11:20:04,小张,攻壳机动队2：无罪 攻殻機動隊2 イノセンス (2004),5,力荐,0,0.0540133268996919
2023-10-02 21:02:02,一杯柠檬茶,2020看了第一部，2023，三年后看这第二部，视觉效果，分镜，音乐各个方面都已经做到了无可挑剔的水准。只是主线剧情没有第一部顺畅，对人类机器人的讨论类似《西部世界》中的思辨，每个人物都像是大哲学家，每一句话都有原著出处的。真的要如此掉书袋吗？评分：7.0/10。,3,还行,0,0.9999999925032612
2023-10-14 13:23:31,托尼·王大拿,赛博嫖宿幼女事件，华美与哲思依旧，但CG和过分掉书袋有点碍眼。,4,推荐,6,0.7792543863605834
2023-11-10 07:39:43,霧鸢野荻,太crafted的一部押井守，也因此失掉了言说的力量。《滕王阁序》一定是无端生成的，不可能被发明炮制。先讲好话：中文考据足够扎实；“东北一绝郭记烧烤”是《银翼杀手》远力所不能及的对中国观众的拉拢。看片尾字幕，押井的确找了华人顾问满足他的需求。甚至中国符号堆叠太多，几乎显出一种颇东方主义的物恋，无怪映前主持人打趣说西方观众往往觉得此片极具日本风味——岂知那些日本味大多是中国味（或其他亚洲国家味）。被广泛诟病的掉书袋情节，倒其实符合角色义体化的设定，然而仍旧造作到令人厌烦——穆尔维所谓“引用的织物”，绝不仅仅指向台词层面对其它文本的粗暴转述，但《无罪》似乎只热衷此道，将[看似]繁冗的信息铺张为对观众的卖弄与奇观轰炸。而更“奇观”的，是那些诡异的3D的人与物。今天再看，押井对新技术的尝试可谓十分失败。,3,还行,1,1.0
2024-02-22 17:23:16,📽Anakin🏂💨,"押井守的攻壳里充满了神秘诡谲的气质与真·赛博朋克的瑰丽美学，加上文本里极具特色的大量的哲思对话，让人看了要么看不懂，要么沉浸得无法自拔。
巴特几乎苦闷了一整集，最后少佐出现的时候看得我也好激动😭。",5,力荐,1,0.9999999217765422
