2014-12-28 00:35:40,qw0aszx,画面实在是太精致细腻了，炸裂无比的作画，整部片子精致的就像一个虚无的梦境，正契合片中所传达出的那种虚无缥缈之感。看完后被强烈的虚无感和孤独感所包围。不过还是觉得片子引据太过了，还有我真的不是很喜欢这种CG虚无感，还是更倾向第一部的那种有机质感。 8.1分★★★★,5,力荐,39,0.9999999999951183
2015-01-18 23:43:33,门柱,音乐仍然10分，大片感更重，傀儡谣II、III配的绮丽世界和战斗场面两个片段是能进历史博物馆级的。整体看，打磨感略重，故作深沉处较多，引语实在太太太太太多了，虽没有I那么浑然天成和自然，但作为续作绝对是一流,4,推荐,3,0.99977978650673
2015-01-22 00:40:44,超cute侠,押井守风格的集大成之作，掉书袋的台词，波云诡谲的氛围，完美的配乐，最后巴特与素子的重逢透露出无限感伤。,5,力荐,5,0.9999996825989408
2015-01-25 12:59:01,米粒,了不起！相比还比较让观众易于接受的第一集，第二部开始疯狂掉书袋、阐释机器人和人类之间的世界观了... （这一点和黑客帝国三部曲的发展有点像）概念如此高的情况下，在有限的时间和画面里我觉得押井守做到了，不过真是意犹未尽啊,4,推荐,17,0.9999999998548306
2015-02-16 21:37:56,老罗Lazzaro,概念好高，引用很多，哲理不浅，看懂一些。这部动画效果要好得多，还有不少中国元素。,4,推荐,0,0.999979144022349
2015-06-25 16:29:04,墓岛GRAVELAND,押井守保持了前一部的水准，不过画面进行了革新，三维动画以及光影效果大赞，全片气氛依旧阴冷，神秘，仍旧是关于存在主义的探讨。主题曲以及片尾曲仍旧非常动听，尤其是主题曲，在片中多次出现，空灵，大气，犹如宗教圣歌一般。本片东方元素实在是不少，50分钟左右的那个蒸汽朋克关帝庙十分惊艳,5,力荐,3,0.9999999999851824
2015-07-26 19:23:50,䒳,作画美得吓人。满脑的傀儡谣挥不去。少女心巴特一出场就是满脸的少佐失踪第n天，想你想你想你。书袋掉得也太多了。机械，哥特，南洋风,5,力荐,101,0.4389158017487224
2015-09-25 23:40:47,sirius_flower,互文稍微有点过了跟滕王阁序似的更像在写一篇课程论文满满地乱引用..ww狗狗任性的自然态 狗成为商标广告；教堂面前塑四大金刚 时间-记忆的城堡-像致幻剂 日式人偶命题+机器 现实与幻觉的循环老梗了 系列都预设了具身认知的可超越性而将存在信息化，也即机器无需拟人而要成为超人的途径，同超验骇客,5,力荐,13,0.9813178494506242
2015-09-27 14:30:12,旧书君,果然得在1与两部TVA的补完之后再来看这部无罪。好到每一帧都想尖叫。本以为素子化为真名实姓邮件人之后、GIS的世界核心已经穷尽了想象力的可能，但GIS又一次展现了在合理框架中荒诞不经又尖锐讽刺的可见未来。告诉你科幻作品足以优秀到何种程度。,5,力荐,4,0.9999971755748868
2015-11-10 09:31:38,离净语,感觉电影和评论都还是抒情性稍多啊。另外CG真的不会跟射击游戏太像了吗,5,力荐,2,0.8099107089779992
2015-12-02 19:46:52,高尔吉亚,你现在感到幸福么？巴特，不要忘记：只要你联网，我就在你的身边。,5,力荐,114,0.9702245252819328
2016-02-07 05:47:20,Michael JZ,神作 动作戏不是太多但是很精彩 有了更多哲学的思考 虽然一直美到跪 进入小岛后真是全面爆炸 使用了更多3D 虽然3D效果过时很快 但是本作伟大就伟大在把3D运用得就和2D一样：看着不是太真实却让其拥有独特的质感和美感 看一遍真不够,4,推荐,1,0.9999999690184072
2016-03-04 21:55:34,武侠小王子,悲气太重，一幅末日景象。,5,力荐,8,0.3539956271703512
2016-03-06 18:24:41,荞麦,还是很厉害，尤其是虚假记忆那段非常华丽……名人名言也实在用得太多了……不过用得很厉害。也能理解，毕竟大脑是联网的……,5,力荐,14,0.4379534608682683
2016-03-09 13:19:28,picnic,人类从未停止过对自己的模仿。又暴露了不玩游戏，看什么画面都啊啊好惊艳。又暴露了读书少，引经据典什么的比剧情还烧脑。总的来说就是智商拖了人类后腿～,5,力荐,4,0.9990557592598814
2016-03-13 01:52:51,囧之女神daisy,上一部是讲“生命的定义是什么”，主题很明显。这一部主题比较晦涩，但应该是讲“生命是如何传承下去”。层次丰富，结构复杂，制作精良。简直叹服得不行了。难怪作为动画片，差点拿了金棕榈。,5,力荐,168,0.9999587493605946
2016-03-16 22:28:11,栗,看了多少遍。男性魅力不需要眼神啊，两个瓶盖就够了。,5,力荐,1437,0.9823584071837128
2016-04-27 11:13:32,上林苑,原来这么牛逼的东西也要装逼,4,推荐,13,0.6020941421609743
2016-04-28 16:56:25,橘 きよあき,2011-08-31 灵魂。人类机械论的复兴。文明不过是基因的载体。一只眼睛凝视过去，一只眺望未来。「生死去来，棚头傀儡，一线断时，落落磊磊。」总体不如GIS。,4,推荐,4,0.999992766813003
2016-05-02 11:52:14,Amino,素子的理智冷静干练对比巴特的温柔，到底哪个承载了更多的人性？,4,推荐,2,0.99998833063075
2016-07-25 20:43:04,有只骗子,如果说第一部还有叙事逻辑，第二部就是随心所欲爆炸意识流，肆意反向探索机械的“存在”，一言不合就三五个哲学家甩脸上。看着一边觉得别扭的3D加2D，一边又觉得中国背景的赛博朋克太爽。就是少佐戏太少，虽然你是在我心里，但是我也想你多亮相几秒。,4,推荐,1,0.967858876310986
2016-08-26 16:59:29,马盼盼,配乐作画美出新高度，相比第一部更加晦涩大量quote的存在显得庞杂脉络模糊。单独刻画巴特一人一狗的独居生活片段和北方城市里电子纷飞气氛静默的狂欢游行堪称全片最高！素子通过“玩偶”形象出场具象化了片子的潜在探讨——“生命”的“存在”形态和“存在”的“生命”意义。,5,力荐,2,0.9999999999996834
2016-09-18 14:06:06,同志亦凡人中文站,华丽，奇诡，哲理，作为续集电影没有固步自封，反而开启了更加深刻的新世界——隐约感受到了玛丽·雪莱在写下全世界第一篇科幻小说时的心情。作为日本人押井守对中国文化的熟谙足以让99%的国人都自惭形秽啊...,5,力荐,392,0.9999999888865396
2016-10-11 07:51:28,Helicopter,电影毕竟不是文本性的哲学讨论，从这点来讲，很多重要的point透过对白叙述道出，似乎就有一点弱。虽然不如95版震撼但也是很伟大的作品了。,4,推荐,4,0.9999026041032278
2016-11-26 01:28:26,D I D A,95版的GIS给我的震撼太大了，士郎正宗让弹雨斑驳的世界树上降下天使，就已经完成了成神的步骤，8年后的无罪更像是描述被在困在人间的巴特的浑噩人生。丧失优雅吵杂透顶的背景音乐、廉价畸形毫无节制的意识流CG，仿佛都在展现巴特的痛苦，而结局失去素子坍塌的人偶，比虚假的数据或梦更加残酷……,3,还行,10,0.9999989363518796
2016-12-04 15:55:43,TigerTiger,暂停好多次为了看字幕和弹幕…,3,还行,24,0.7783817032454331
2016-12-08 11:48:08,也罢,节奏感比第一部确实差了很多 惊艳感确实也没有第一部强了 佛教、宿命、个体存在何去何从之类的哲学思考还在,4,推荐,2,0.999829023909022
2017-01-08 11:23:24,東郷柏,8.5 结合这些年的知识水平与对世界认知加深终于能够领略这部作品的魅力；上帝仿造自己的模样创造了人类 人类仿照自己制造了人偶 终极核心还在讨论灵魂 生死 存在等作为人类的终极问题 我们逃避仅仅是因为我们愚钝地接受事实；人偶就是镜子里人类自的反射 只可窥而不可观,5,力荐,35,1.0
2017-01-29 12:58:57,私~川流,巴特喂狗的时候帮狗狗把耳朵放到食盆外边的小细节好喜欢。,5,力荐,513,0.9663191328424758
2017-02-09 23:35:11,侠影,一部严肃的科幻哲学大作，人与机器的关系，现实的存在与虚无，人类恐惧的来源等的哲学思辨性，不比库布里克的《2001太空漫游》低。巴特和素子的情感从上一部起，淡淡的让人感动。这不是娱乐作品，是艺术，是哲学，画风和配乐诡异。值得多看几遍，但讨厌3D混合2D的制作，喜欢朴素的纯2D画风。,5,力荐,1,0.9999999999999858
2017-02-16 04:28:39,瞬·间,人和半人半机器的义人稍不留神就陷入迷失的轮回，只有临近片尾才出现的“超体”素子精准、确定、流畅、清明，她没有一丝阻滞或困惑，正如片中引用的佛陀的话一样“独步天下，吾心自洁，无欲无求，如林中之象”。这部04年的片子无论是画面、分镜、剪辑、音乐，或故事，皆是动画片的巅峰。,5,力荐,9,0.9999999905727188
2017-02-17 13:06:37,Syfannn,虽不能常伴你左右，但连上网络，我无处不在。（强烈安利大家去听粤日双音轨的版本，配合新港景观毫无违和感。看完能使灵魂完整。 ）,5,力荐,1,0.9998162499031034
2017-02-20 11:06:51,乔伊桶,如果有一天外星人来把我抓住让我必须推荐一部地球上最好的动画才能把我放走（什么鬼），我会推荐这部。故事并不复杂，整个制作的方方面面都做到了极致,5,力荐,21,0.9999456259291194
2017-02-24 22:38:50,已注销的Asuku,看的BD版，这个级别的制作，难以想象竟然是2004年的作品。#别名:文学机动队,5,力荐,2,0.5074935776489168
2017-02-26 22:26:47,苏狞,第二部的意境又高出了一个新高度，简直黑客帝国盗梦空间的前传，想象力令人佩服。,5,力荐,1,0.9929435682886164
2017-03-11 19:37:03,盲忙,相比第一部，画面更加精美，视觉更加震撼，还加入了些许幽默的成分，内容反而没有第一部那么深奥，所以更适合好莱坞真人化吧，双男主的设定还可以顺便搞搞基。,4,推荐,0,0.9999990472066446
2017-03-20 15:07:03,Minty,复习。看着看着忘了吃饭，想起时吃上一口，已经索然无味。相比上部，这部才是故事与论述的绝佳结合。能与人偶和神媲美，沉溺于深层无意识的乐趣的，只有动物了。相对的，人类苦痛的根源，也是过强的自我意识。如果人偶有嘴，她们也会说“我不想成为人类”吧。好在，人类的死亡，是升华也是回归了。,5,力荐,2,0.9999999999999938
2017-03-20 23:56:20,Carp_,刨除掉那些似是而非的台词，假如说第一部的诗性是深入骨髓的，这部便是浮于表面的，甚至让我感到有些愚蠢,5,力荐,14,0.7535873533923922
2017-03-23 16:20:25,Stella,能把动漫作出宏大的效果，还有哲学层次，实在没见过第二部,5,力荐,1,0.3593430475705611
2017-03-23 17:53:52,湖边の许愿树,★★★★★★ 生死去来，棚头傀儡，一线断时，落落磊磊。《无罪》是一部无论改编成动画、小说、剪影、音乐等任何题材都无比伟大的作品——正如它的主题：外在可以改变，ghost才决定我是谁。然而当ghost能够被01化、被改变、被入侵，究竟什么才是“我”？什么才是“生”？什么才是“死”？,5,力荐,0,0.9999936114857784
2017-03-24 15:38:57,猪大腿,神作。跟“这居然是一部2004年的动画电影”一样神的还有（不知道名字的）中文字幕组。,4,推荐,5,0.9096496327249056
2017-03-28 23:28:45,花歌流瀉.。,除了给跪，无以言表。不愧是押井守称神的大师之作。台词，画面，即使13年后看依然牛逼闪闪。少佐只出现了20分钟还不是真身不开心！生死去来，棚头傀儡，一线断时，落落磊磊。,4,推荐,1,0.999995106690308
2017-03-30 23:04:46,YYYs,这部比第一部还神的神作当年居然只是提名（按头）,5,力荐,1,0.2311082946986827
2017-04-03 03:02:42,片影,逼格极高，有着华丽的画面和诡异的曲风，外加一种每个镜头每句台词似乎都有特定含义的样子。。。生死去来，棚头傀儡，一线断时，落落磊磊。,5,力荐,1,0.9983323632824525
2017-04-03 09:26:07,abcclk,看真人版感觉像吃了shi，回顾一下神作压压惊~~,5,力荐,2,0.9274748232559736
2017-04-03 14:27:27,παρατηρ,17.4.3.探讨了人类生存和未来的神作。此后再无超越。 18.5.7. 肤浅，空有概念,3,还行,12,0.9993551129947816
2017-04-04 00:13:19,小溪笑嘻嘻,一個大寶藏！不知道被多少中西大片挖了又挖！鋪墊比較冗長，但從進入荒廢城市開始，不管是場景設計還是劇情還是哲學思考都讓人驚嘆，還有溫馨的I'm free now  but always by ur side登場。還有很多可挖啊～,3,还行,12,0.616661249243415
2017-04-06 18:21:36,根,真的屌,5,力荐,6,0.5042906456488253
2017-04-07 20:14:51,回忆与否之,“生死去来 棚头傀儡 一线断时 落落磊磊。”关于‘GHOST’‘SHELL’，或许本身就是没有答案的，进化的本质可能本身也没有答案，又或者答案是“可瞥见而不可久视也”的。无论结论如何，只望自身能“独步天下 吾心自洁 无欲无求 如林中之象”。“雀血惹人憐 魚傷無人問 有聲者幸也。”又何尝不是一种答案,3,还行,7,0.9999999658140752
2017-04-08 13:34:15,mulder,第二天起床弄吃的时，一直在哼哼空中杀手的主题曲,5,力荐,1,0.1359090330240527
2017-04-08 13:44:27,津五渡,生死去來 棚頭傀儡 一線斷時 落落磊磊,4,推荐,2,0.3052309515585103
2017-04-09 22:05:48,"""eMily""┆rehab",跟第一部风格不太像....视觉特效上比90年代要上了一个台阶···在人工智能的探讨上更故弄玄虚了··尤其是陀古萨被病毒黑的一段···果然没有素子的美好肉体看就觉得不够攻壳啊··哈哈..PS.OST依然是亮点,4,推荐,0,0.9931342179886192
2017-04-11 22:08:41,四不象,引用那么多名著，也真是辛苦编剧了,4,推荐,14,0.9844144649938888
2017-04-12 12:15:47,内陆飞鱼,这部太华丽。,4,推荐,5,0.633196110473527
2017-04-13 00:21:18,徐苹果,掉了好多文学书袋。也有好多哲学书袋。文化和城市作为人的外在记忆这个说法，可见胡塞尔所谓的交互主体。列维纳斯的伦理性交互主体也适用于电脑，不管是人的意识，还是带记忆的ghost，都不愿被囚禁在人偶中被奴役；克服人类中心论，一条路是否定唯我主体意识，进入海德格尔所谓的缘构中在世。,4,推荐,4,0.999999738538898
2017-04-13 21:10:26,Chaos,我能够理解原著党对真人版电影的愤怒了……想了一下，真人版给人感觉形似而神不似，主要是因为两点：一是好莱坞无法理解东方的物哀、空寂的文化；二是当今的人无法理解90年代大都市的孤独感（那个年代的港片很能体现这点）。空间和时间都改变了，所以无法重现原著的精神。,5,力荐,39,0.9999999309810264
2017-04-18 11:31:55,Q。,「独步天下，吾心自洁，无欲无求，如林中之象。」★★★★,4,推荐,5,0.6884540909551616
2017-04-26 17:04:29,LORENZO 洛伦佐,智商下线，没有看懂。。。但是依然被哲思震撼了。,5,力荐,4,0.7176401843041056
2017-04-26 22:22:49,Amberose,这个简直是神作，完胜2017年的真人版,5,力荐,7,0.3824801744080575
2017-05-05 09:52:39,Panda的影音,和第一部一样基调灰暗、氛围悲凉，但续作气氛的冰凉之感却有过之而无不及。押井守发表了自己的见解：“我决不允许有牧歌式的主人公，现在的主人公是以抱持着更为痛切的主题为绝对条件的……”与第一部剧场版最大的不同就是该片只是借用了士郎正宗的背景设定和人物设定，而剧本完全是押井守独自下笔的。,4,推荐,2,0.9999999998263878
2017-05-05 09:52:39,Panda的影音,和第一部一样基调灰暗、氛围悲凉，但续作气氛的冰凉之感却有过之而无不及。押井守发表了自己的见解：“我决不允许有牧歌式的主人公，现在的主人公是以抱持着更为痛切的主题为绝对条件的……”与第一部剧场版最大的不同就是该片只是借用了士郎正宗的背景设定和人物设定，而剧本完全是押井守独自下笔的。,5,力荐,2,0.9999999998263878
2017-05-21 00:06:17,心之呢喃,能以动画片这么一种类型进入戛纳主竞赛单元，可见这部片的厉害之处。剧情方面其实简单，但深层的哲学探讨就比较有意思了。对孩子和人偶的一段描述让人印象深刻。比起第一部来，特效和音乐，以及战斗场景都有不错的进步，好作品。 20170520,4,推荐,1,0.9999999247118896
2017-06-15 09:30:41,Broderick,这应该算是日本动画的巅峰之作了吧。。只是这翻译的名字很容易埋没了这部牛逼作品。。。,5,力荐,1,0.997155073221745
2017-07-11 19:30:34,缺德梅,7.9 与其关注没有答案的问题，不如聚焦引发出的孤独、焦虑与虚无。掉书袋本无罪，错在被知道了是书袋。,4,推荐,3,0.9999884943899682
2017-08-29 12:13:21,思路乐,【A+】有人曾说：“动画并不是单纯的炫技，而是服务于实拍无法呈现的剧情。”那么，押井守这部2004年的《无罪》就是创造了一个无论是动画界还是真人电影界都可望而不可及的巅峰。,5,力荐,7,0.9999999238627744
2018-01-02 02:20:09,Q·ian·Sivan,"「望鏡覺醜陋非鏡之過.」「個體只是表達體內DNA的工具.」「你怎麼知道現實是真實的呢? 抑或只是一堆虛擬影像所產生的""現實"". 人類太過陶醉于自己編織出來的夢境現實. 無論是夢境 知覺 靈魂, 或許都只是工整矩陣中的缺口和扭曲.」「鏡不照妖, 鏡造妖.」「若人偶會說話, 他們一定會說""我不要做人類"".」",5,力荐,1,8.434486526986973e-07
2018-01-29 22:50:24,彼得潘耶夫斯基,克莱斯特是最早剖析木偶剧的西方人，他指出木偶的无生命正是表现一种精神的理想状态的前提条件，木偶的机械动作具有非人格化的崇高感。这对里尔克产生了很大的影响，而哈拉维也在关于日本灵长类动物的探讨中提到了动物的“面具”，这跟日本的传统能剧又是有关联的。目前还不清楚此片的讨论沿承自何处？,4,推荐,7,0.9999999999591944
2018-02-24 16:30:16,K,不如攻壳95但是还是很牛逼,5,力荐,1,0.9312134250359372
2018-03-21 22:04:24,河原宏,哲学思辨不是日本人的强调，硬要去讲，就像现在这样流于片段的故作高深（语言上）。另外，第二部比第一部更显好莱坞,3,还行,3,0.9992056469426944
2018-03-21 22:04:24,河原宏,哲学思辨不是日本人的强调，硬要去讲，就像现在这样流于片段的故作高深（语言上）。另外，第二部比第一部更显好莱坞,4,推荐,3,0.9992056469426944
2018-04-05 13:16:23,paradiso,比起机器人人造人，落脚点放在人与人偶的关系思辨才是贯穿古今直抵本真。思考人偶美学不能不提Hans Bellmer（片头四腿人偶、书架上的著作）。每次重温都觉得场景设计叹为观止，傀儡谣一配简直升仙，在真人科幻片里好像还没有超过这个的。,5,力荐,10,0.9999999999688473
2018-06-05 18:13:42,方枪枪,精良的画面，让人不明觉厉的台词，关于灵魂和躯体的思考。只有前面一条就已经十足牛掰，厉害厉害。,4,推荐,2,0.9997885933337586
2018-06-24 08:14:26,艾弗砷,有趣的是频频阻断叙事的引语。造成隔阂是导演的应有之义。大量引语充斥在对话里，就像嫁接了大量义体的人一样——依靠机械加强肉体，却又因此失去了自己的肉体。习惯用前人的话语表达自身，于是失去了自己的话语，外部知识吞没了自发的理解。人与偶人的区别，就在一线之间。科幻片拍到最后都是伦理片。,5,力荐,7,0.9999846473719488
2018-07-08 21:08:39,西楼尘,陀古萨养着女儿，女儿养着娃娃，巴特养着猎犬，这荒凉的世间，总需要豢养点什么形成牵绊。人造性爱的娃娃呼唤救命，克隆灵魂的孩子呼唤自我，灵魂游走的少佐呼唤幸福，能够发声的呼唤还算幸运。何为生，焉知死。漫天飞絮的祭典上，戴上假面是否就换了灵魂；信息海洋的网络里，换了义体是否就换了生命？,4,推荐,229,0.9999999999993558
2018-07-21 23:55:24,Laven,50分开始那段傀儡谣，脏水里飘过的游船，诡异的人偶，漫天飘洒的金屑，鸽子，飞船，电子垃圾……太惊艳了。决战更是精彩的不能更精彩。/神啊，你的意念，何其众多。,5,力荐,1,0.9865762736964716
2018-08-05 08:45:00,兮称,对中国文化运用得最极致的科幻电影，国人真的该深思啊… 攻壳系列一直保持着2D作画的巅峰，让人望而不及，还有神一样的配乐，超前的理论思想，剧情反倒没那么重要了,4,推荐,6,0.9999832498505468
2018-08-17 19:06:44,糖罐子.,探讨的不再只是机器的自我意识，而是对于人类变成人偶和人偶赋予灵魂的双重话题下的自由意志。比起95版，这一部更接近了哲学的思考范畴。整部片的风格也以奇幻诡谲代替了科幻性，让人如坠梦中。“独步天下，我心自洁，无欲无求，如林中之象；巴特，不要忘记，只要你联网，我就在你身边”。,5,力荐,4,0.9999999999998754
2018-08-22 18:41:03,Indecent time,不敢说我完全看懂了，但是不管是动画制作、配乐还是整部的氛围，都堪称顶级,5,力荐,2,0.9990888510853292
2018-10-21 13:50:39,琳琅,"主线的傀儡杀人事件仅仅是儿童想要获救而引起的，对死者无怜悯，算无罪吗？
支线巴特对素子单相思，无法排解的郁闷。
总体风格相对于第一部变化极大，运用3D技术，同样创造了极为经典的场景，配合傀儡谣和大量的哲学思辨语录食用，注定要慢慢才能消化它。",5,力荐,1,0.9999999821842844
2018-11-27 10:02:21,巴喆,想来人类终归是孤独啊。画质之王，配乐完美地呈现佛学旨意，剧情全用哲学概念带过，全是哲学，冷峻得令人悲凉。9.2,5,力荐,5,0.9999999998474148
2019-02-24 15:44:09,冰红深蓝,一部近乎完美的科幻动画，比前作更深刻也更华丽。1.继续探讨第一部的Ghost与Shell（灵魂与义体）的关系问题，以及人造记忆、人工智能和意识上传的主题，增加对人与人偶关系的溯源反思，引经据典不断，文本复杂多义。2.中国风祭礼，宏伟而诡艳，融合佛道儒，戴面具的群众与焚烧人偶则似西方狂欢节传统。3.高科技+脏乱差+只有中文的霓虹灯广告牌一如[银翼杀手]，而黄昏下的摩天楼机械城市则是另种画风，颓废而华丽的金黄笼罩一切。4.哥特式+巴洛克风格混搭的老宅，定格的鸽子，三次细节各不相同的注入式体验如此迷乱而惊栗。5.同质于Kleist[论人偶剧场]的思想片羽：只有无意识的人偶或无限意识的神才完美。6.如前作般多次出现关于镜子的金句：镜非醒悟之器，乃迷惑之器。7.生死去来，棚头傀儡，一线断时，落落磊磊。（9.5/10）,5,力荐,70,0.9999999999993204
2019-03-15 03:12:17,c. velasquez,"旁征博引符合具有外部存储设备的义体人的强大知识库的设定 却会使作为普通人类的观众有些疲累 。片中有几种存在互为参照系: 动物(频繁出现的狗鸟鱼 高度概念化;云雀的无意识愉悦境界),儿童(内在异于人类 却又有着人类的外表), 有家庭的成年人类(陀古萨), 部分义体化的人类(巴特),完全义体化的不能算是人类的人类(金 和 少佐 有点魔和神的两极的意味),各类用途的人造人偶 等等。片尾陀古萨的女儿令人观感不适 未被人类社会文化完全编码的启蒙主体 不是未被污染的动物 而更像是混沌的人偶 无意识地传递着造人的本能。后退一步溯源或前进一步利用机械论达到无限都连接着终极恐惧 注入体验的镜像(人偶)诱捕只是小扣门扉已然骇人 对比更显出素子境界高深莫测。舍利塔群 将民俗/宗教元素机械化的祭典游行 金的宅邸(兼具东西文化)等都是人文底蕴深厚的视觉奇观",5,力荐,6,1.0
2019-05-04 15:31:11,Fleurs.哼哼,"如果还沉浸在类似哥特教堂顶端伫立的关二爷所带来的复合杂糅，
如果还迷离在傀儡谣那咏叹调和后摇交合的空旷酣畅，
如果还思索旁征博引引人思忖的格言语录，
如果还追本溯源到《天使之卵》和《机动警察》，框架延伸到《黑客帝国》，本都无可厚非，
但我只看到孤独，那种华丽的无法解构的孤独。",4,推荐,18,0.9999997561133191
2020-01-12 10:50:40,瑞波恩,延续了第一部赛博朋克的经典气质，再度深入追问“机械人有无灵魂及其归宿所在”，主人公也开始不说人话了，满嘴日本古典文学里的俳句，怪有趣的。《银翼杀手2049》想必从本片获得灵感，且比第一部中国风更浓了。结尾处少佐的意外现身令人动容，她显然是入化境了（被巴特称为“守护天使”），“独步天下，吾心自洁，无欲无求，如林中之象。”ps，本片主旨可谓一首断句，“生死去来，棚头傀儡。一线断时，落落磊磊。”（摘自世阿弥《花镜》）,5,力荐,3,0.9999999999999758
