2011-07-14 13:21:12,阿菇菇, 女主角太丑 表演夸张  剧情白痴 看着非常不舒服 冗长的让我想吐 没看到伟大的母爱，只看到了一个沉溺于自己世界的神经病  本片的苦涩与震撼都被导演那自以为是的拍摄手法破坏了 难以忍受,5,力荐,95,0.8936183481979699
2011-07-24 11:01:38,啸如,阴郁  紧致  如果现在大陆拍一个出来 剧组人员都得喝西北风,5,力荐,0,0.3204240617124403
2011-07-28 00:11:27,紫领 爱,我相信对音乐的纯粹热爱，是会给人以超脱现实的辛酸与艰难之外的 美好与安宁。 Kathy的友情真是让人羡慕不已。审判中有个漏点：这个盲女和那个男警官的力量对比怎么完全没有考虑呢？一个瘦弱女生丝毫没有受伤，合理吗？欲加之罪何患无辞之感，谁让电影就要这么拍呢。母爱。f6a2f130ce纪录片的感觉,4,推荐,0,0.9999999999999736
2011-08-06 16:39:39,麻麻睇,重温了一遍。残留着Dogma95的气息。不论本片批判阶级矛盾，以及揭露善意遭到践踏等种种不公。也正如特里厄对自己的评价，莎曼躲在封闭的音乐乌托邦里逃避欺辱，他则着迷于囚禁在影像空间里救赎灵魂。,5,力荐,0,0.999999955130404
2011-08-07 13:16:17,benlovingmusic,"They say it's the last song,they don't know us,you see ,it's only the last song ,if we let it be!",5,力荐,0,0.3474730362549653
2011-08-07 16:45:09,蜘蛛,尼玛 太惨了 不想再看第二遍了 这部电影真是一个奇葩 其实有很多电影里的经历更加惨和血腥什么的 只是这部电影的拍摄手法什么的就有本事让人觉得惨到快断气了,4,推荐,0,0.9999379050909531
2011-08-13 11:48:12,齊克斯尼力佐飛,十分刻意的悲剧，但是好看极了！,4,推荐,39,0.9830215295178306
2011-09-25 08:12:52,蘇靜喜,一出用力創作的悲劇。無非就是一個被生活壓到無處可逃的人最終把手伸給命運，絕望地隨意浮沉的故事。討厭從頭到尾的近拍，莫名其妙的歌舞場景以及Bjork唱歌的樣子。原諒我的膚淺庸俗，這麼文藝的文藝片兒，欣賞無能。,2,较差,5,0.3187853807578641
2011-09-25 21:51:33,yamadie,"1我喜欢它的运镜2结尾不好，节奏乱了
'",5,力荐,0,0.0289570922385933
2011-10-05 02:25:57,米粒,故事沉重到让人觉得有点故意，最后的段落颇像《死囚漫步》。善良过了头就是愚蠢了，智商情商都很低，注定了塞尔玛这个结局，我想她根本就不清楚她要的是什么，她儿子要的是什么吧。镜头巨晃让我中间被迫停了好几次，比约克演得不错，歌欣赏不来。。,4,推荐,168,0.9999999993614196
2011-10-06 10:00:25,drunkenstain,很是牵动人心的剧情，喜欢纪实感的摄影，相反，我觉得比约克把这片子个人风格化了，把很多场景气氛变得无比诡异恐怖。看似平淡，却是刻骨铭心的一场死亡。反歌舞：比约克的歌舞只支撑自己的灵魂，跟任何人的剧情都无关,5,力荐,0,0.9999999999957644
2011-10-14 18:49:00,屎霸,除歌舞戏外全程DV视角且手持质量极差 加之剧情波澜不惊 基本无戏剧化倾向 导致这片子有强烈的伪纪录片之感 比约克不化妆+厚重镜片的扮相加上让人有点头晕的镜头和全片压抑的氛围让歌舞片带来的最后的美感或是感动也消失殆尽 ,2,较差,0,0.9965531050897312
2011-11-26 07:36:46,荞麦安娜娜娜,我觉得，女主不但是弱视，而且还是弱智 = =~ 拉斯·冯·提尔很喜欢拍病态的女人么。。。。。伟大的母亲，愚蠢的女人。还有那些朋友们，难道就没本法帮她凑点钱？哪怕先借钱救命以后再还？各种不能理解的不爽感。这也说明了情节的感染力很强烈么。,4,推荐,0,0.1877324408039804
2011-11-26 10:17:41,月夜尘埃,这个女主角很傻逼，她的悲剧完全是她一手造成的，她的愚蠢造成了她的悲剧，虽然她人不坏，但是就是蠢到一定境界了，这种人一点都不值得同情，如果她的智商再高那么一点点的话，就不会是这样的下场了。我不明白这样的精神有什么值得赞美的。这个音乐剧里的曲子和舞蹈也是我看了那么多音乐剧里面最差的。,3,还行,5,0.999997999413281
2011-12-11 22:36:03,生·人,有些DV镜头太晃，究竟这片子如此用DV是否好，不可评断。但就整个片子来说，尤其是歌舞场面，简直美极了！,3,还行,0,0.6033899181734957
2012-01-13 21:51:53,Miss Bee,她一歌舞，就让人无比忧伤，这故事是滴水穿石型的残酷。,4,推荐,1,0.9716364524225428
2012-01-20 02:23:27,小p,比约克太有一套了，不得不赞叹她这种看似笨拙却这么精准的表演，几乎是哭着看完后半段，这种电影会让人看出内伤的！,5,力荐,0,0.9999723866073296
2012-01-29 01:14:14,仿真男孩哪吒,"Listen to her heart
只有在天朝的魔幻超现实主义才配得上这种悲情和勇气",5,力荐,0,0.999655273659435
2012-02-24 19:52:31,豆瓣逗你妹,本片冒着把观众的视力晃到如主角一般低下的危险尝试用手提式摄影为了获得真实感，但是每每突兀插入的歌舞片段总能把这真实感挥霍掉，舞蹈动作僵硬，死人都能诈尸鬼嚎鬼跳，艺术设计还真是无下限。尽管总有人盛赞比约克的表演“童真澄澈”，但是从我的观感来看，她演得就像一个酷爱显摆的人在卖弄风骚。 @2012-02-24 19:52:31,2,较差,70,0.9999999755318344
2012-03-10 11:45:06,Paktin,想当年看完这个和美瑶（@怪诞城之夜）一起骂了好久，老实说冯提尔这个良心三部曲真是太够了啊！！,4,推荐,1,0.1093977047610348
2012-03-22 10:46:11,Eve,看到中间都想骂人了，没见过这样善良法儿的...音乐剧没什么美感，拍得又很拖沓。但姑娘笑起来真是没话说。,3,还行,0,0.7319489685643031
2012-05-02 00:27:49,Comel,片子像纪录片般的镜头让我着迷，而最后死刑一段也拍的不错，但比约克还是专心唱歌比较好，演得影响观感啊。另外片子对女主角性格的刻画是怎么回事？善良不等于傻逼啊，好好的剧本都没表达好，反而非要让故事扯上音乐，不伦不类，且无比牵强,3,还行,0,0.9999965084661828
2012-06-10 19:31:40,已注销,故事不错，比约克嗓子也不错，可就是不喜欢。说到底讨厌女主看似伟大实则自私的爱。对音乐的执着很感人倒是真的。感觉拖沓冗长，晃得无意义，除了桥上那段外歌舞也没觉得多好，桥上男声部分还不喜欢囧。外行看热闹，欣赏无力。,3,还行,0,0.9999999992308468
2012-06-18 23:54:56,钱泰勒,就片子而言真的非常不错，但是Bjork从来没让我那么讨厌过她，演的不错但是我讨厌死她了，是比约克不是莎曼，莎曼就是一精神病傻逼圣人，而比约克把那股傻逼劲儿演的特别传神，或者她根本没刻意演。,5,力荐,2,0.9470641762745712
2012-07-23 12:53:38,十了个十了个四,拉斯冯提尔电影中的女主角都是一个人，那个“因为世界不够童话而大开杀戒”的危险灵魂。绝对的右半球生物，却有着坚韧的定力和完美的规划力。欲念主导着理智和意志。怜悯、恐惧、不断漂白的执念（无论是爱母爱快乐也好）被一个贪心的大孩子吮吸榨干。没法不心疼靠别人疼爱而活的她们，多一点，再多点。,2,较差,4,0.99999999998892
2012-08-15 18:27:56,卡洛,一个愚蠢的坚持，让身边所有人的记忆为你陪葬，人物刻画的太刻意了，其他人都真实，主角太虚幻了~,3,还行,0,0.9994651622783248
2012-10-05 14:33:31,科林,白毛女的多少恨，绵绵无绝期。又唱又跳又喊又叫，结尾不留给你一丁点重见光明的希望。,1,很差,4,0.999655110691796
2012-10-16 22:48:38,章鱼,盲人单亲妈妈为给儿子治病，冒充正常人工作赚钱。被朋友发现时，她牛X地扔掉那副早已用不到的眼镜，说了句：这世界有什么好看的！以上不算剧透哦，63分钟后风云激荡，才是正剧。,5,力荐,0,0.976329243230276
2012-10-18 22:00:32,楚门,剧情并不是十分强烈的就戳中人们的泪腺，而让我们感动的则是这母爱的极度伟大，对儿子生命信念的执着！尤其是在行刑前的那段舞蹈，在行刑时手中的那副眼镜，看到这些，母亲即便再恐惧，也会完全的释然了,4,推荐,0,0.9999999786696194
2012-10-18 23:33:41,Panda的影音,豆瓣评分高于我的个人观感。-12.10.18 → 好感提升，3+1星。这样的评分是豆友们集体打出来的，其实也蛮符合豆瓣的风格。-19.09.18 —— 制片国家/地区：丹麦 / 德国 / 荷兰 / 意大利 / 美国 / 英国 / 法国 / 瑞典 / 芬兰 / 冰岛 / 阿根廷 / 挪威 / 中国台湾 / 比利时，偶然翻阅到《黑暗中的舞者》豆瓣条目页面，看到曾经只有丹麦一个制片国家/地区变成了十几个，实力超越《狗镇》《善意的背叛》《尤里西斯的凝视》成为我目前所知而且看过的制片国家/地区最多的一部电影。于是便借机重温了一遍。鉴于之前观感比较一般，没想到时隔多年，依然对好些片段挺有印象，诸如火车边、行刑前等歌舞桥段的编排设计也挺别具一格的。观影时莫名联想到奥斯卡提名真人短片《桥》……,4,推荐,4,1.0
2012-11-08 19:42:25,冷水冷水,不是很能欣赏音乐剧，总觉得太虚幻了。不过，这电影其实应该叫 singer in the dark嘛,4,推荐,0,0.9333754592633036
2012-11-25 23:15:29,一十一,这是一部让人耳目一新的电影，它将电影的工整当做是一种破坏的对象，彻底还原电影的纪录本质，虽然其中有歌舞场面，它更多地是把歌舞当成是一种个人抒情的手段，完全进入叙事的只有两处，都是通向悲惨的地方。这不是一部让人哭的悲剧，而是一部撕碎人心的灵魂诗歌,5,力荐,0,0.999999999950426
2012-12-03 02:20:44,Nortown,Dogma95影像风格，残酷直生地戳进现实，归根结底都是太善良，中间塞进几段歌舞，竟成了唯一安全的异想世界，多么单纯一个梦想家，却还是被现实扼住了喉，失明或许是好的，这样就看不见世界惺惺作态，离开或许也是好的，因为天堂里就会没有伤害。真不知该怎么评判，其实她并不傻，只是因为她太爱罢了。,5,力荐,2,0.9999999886392468
2012-12-11 15:20:52,咩咩,女主角丑到一定境界，歌曲难听到让人抓狂，舞蹈难看死。很不喜欢跟拍方式和色彩渲染，文艺得恶心的片，实在看不下去了。,1,很差,2,0.8775677966274141
2012-12-22 14:02:35,周雷雷,后面半个小时太拖沓了！简直就是多余的败笔。大卫摩斯是个混蛋的懦夫，女主角的智商让人掬一把泪，所以这个故事讲的是，女人的虚荣心和购买欲是会害死人的。,3,还行,0,0.6586870547338254
2013-02-03 00:19:37,Phone,如果你觉得现实生活不够残酷，就看这部电影好了。视觉上的重口味电影其实不太会影响到我，但这类人性的重口味电影总能戳到我的呕吐点，整个观影过程的感受就是fuckfuckfuckfuckfuck！,3,还行,0,0.999999743026486
2013-03-18 20:49:16,Jiajiachan,不至于那么不堪，放低标准之后还是不错的，比约克的扮相也不至于太丑啊。不过对我可是越来越烦冯提尔了，丫到底有没有正常拍的片子啊？,3,还行,0,0.0013693242960594
2013-03-20 19:57:44,耶斯特洛夫斯基,《狗镇》之前的作品，手法确实粗糙了一些。如同DV的拍摄方式，不着痕迹浑然天成的表演都为提尔盖上了鲜明的个人烙印。这披着反美外衣的丹麦愤青，并没有对文化制度意识形态作具体的比较和批判，而是着力戳向了人性的尿点，让那隐藏在膀胱之中的污秽不由自主地从裤内渗出，洒在了你的眼前。,4,推荐,0,0.9999998772295988
2013-03-27 14:25:07,二月雪,给三星是因为看的版本很不清晰，后面连字幕都跟不上，镜头晃可以忍受，可镜头太不连贯就有点苦恼了，剧中连她被抓的镜头都没有。不清楚她是否在乎自己的生命？不然最后行刑那么害怕？说到底她可能只在乎儿子。穿插的歌舞只是表明这是艺术片，比约克长相奇特，眼睛朦胧的，不能算是美。,3,还行,0,0.996103153350967
2013-04-09 21:38:20,蛋白斯基,现在看电影的人完全已经被好莱坞惯坏了 电影不再华美 歌舞也乱七八糟 结局又是be 但是比约克所演唱的画面我久久不能忘怀 还有她毫不造作的演技 这才是最可信的生活,5,力荐,1,0.994380438868002
2013-04-10 00:05:39,redhousepainter,我靠，以前看dvd时完全没注意到里面有卡瑟琳德纳富和越狱里面的配角男。。。。。。蓝光洗版果然是为偶这种高度近视准备的。。。。,3,还行,1,0.9153096020585488
2013-05-04 21:03:38,vivien,泣不成声。导演可不可以别这么不人性啊给点希望给点happy ending不可以吗。喜欢比约克的笑她的乐观她的歌手她的母爱是盲目的。I've seen it all~~~,5,力荐,0,0.999241998790254
2013-05-10 00:27:14,朝阳区陆依萍,先不说道格玛95，每一次看都被女主的低情商和低智商感到惋惜与愤怒，但又被深深感动，其中有一个情节，剧团导演为了挽留塞尔玛好等待警察的到来，利用她的理想来诱惑她，这多狠毒和无耻的行为。。。。,3,还行,70,0.99263485118534
2013-07-27 00:36:47,老泰瑞,这样的经典作品居然拖到现在才看！一开始看着有着《风雨哈佛路》的励志感，接着发现完全不同，虽然主人翁都是被疾病、破碎的家庭以及自身的颠沛流离所环绕，但是前者只是越挫越勇，而这部却是一直在隐忍。女主永远怀揣着梦想，我甚至感觉她在救儿子的态度都是随性的，罪名生死更不算什么。演技超赞！,5,力荐,1,0.9999999999999536
2013-07-28 02:39:41,啊砸,非典型DOGMA95，非典型拉斯冯提尔，典型比约克，冰岛独有的电子冷色调的配乐和后现代表现的歌剧是本片的重中之重，运用固定机位的拉斯冯提尔最帅，手持慌的难受的让人想吐（真是感受，非唾骂）如果把这部和狗镇看做他最好的作品的话，，个人认为高产的提尔比DOGMA的第一创始人温特伯格还是有些差距的。,3,还行,0,0.0300438808422094
2013-07-28 02:39:41,啊砸,非典型DOGMA95，非典型拉斯冯提尔，典型比约克，冰岛独有的电子冷色调的配乐和后现代表现的歌剧是本片的重中之重，运用固定机位的拉斯冯提尔最帅，手持慌的难受的让人想吐（真是感受，非唾骂）如果把这部和狗镇看做他最好的作品的话，，个人认为高产的提尔比DOGMA的第一创始人温特伯格还是有些差距的。,4,推荐,0,0.0300438808422094
2013-09-01 18:34:44,tlmgt,就算我是B婆脑残粉，也无法忍受晃得要死的镜头。对歌舞片的反讽，也不代表这是个好电影。唯一的贡献是电影原声，没了。看这个不如看Drawing Restraint 9,3,还行,10,0.8858350042758143
2013-10-16 20:54:09,施晓波,制作粗糙，歌又不好听，几段歌舞出现的莫名其妙，完全让人游离在剧情之外，最要命的是从头至尾的纪录片式手提跟拍——又一部让我产生生理厌恶的高分电影。,2,较差,2,0.9945829290712472
2013-12-04 21:28:16,Started,好难评价的一部电影，作为歌舞片，歌声并不美妙，舞蹈并不精彩，作为剧情片，实在不喜欢这种摇晃的镜头跟拍的方式，不喜欢的地方太多，却还是很吸引我,1,很差,2,0.9982622752133318
2014-01-02 18:51:14,风马云旗,反映了资本主义制度的罪恶和残忍，生活在那种制度下的底层人民命运是非常悲惨的，应该把中国的公知们，至少是豆瓣的公知们都赶到那里去，看这些傻逼还天天打着人权宪政的狗皮膏药反政府反人民不,3,还行,0,0.9999999920284942
2014-01-06 12:04:21,高光光,音乐绝了，两星都是给音乐。简直是把人哭断气的电影，这种一味悲情，毫无深度的赚人眼泪有什么意义？跟妈妈再爱我一次那样的电影本质上没区别。但是音乐真的妙极。,2,较差,2,0.9995980682853648
2014-02-16 12:29:50,火娃,2/10。此片激发了我作为冯·提尔脑残黑的潜质，且不说道格玛95与歌舞形式融合得格格不入，对这类把弱智精神病捧为圣母伸手向观众讨眼泪的作法没半点好感，故事单薄还拍得臭长，比约克脑脾气似的一直傻笑肆意卖萌恶心得想抽她Y一嘴巴！为了批判人性视观众逻辑为无物，无病呻吟达到了珠穆朗玛峰的高度。,1,很差,29,0.0234009942679143
2014-03-21 21:26:07,Se7en丶小七,又一部大虐心片。电影里的人被冤枉了都不解释真是急死了！要委屈死了！！幻境中的歌舞和整部影片的悲伤氛围看似格格不入，但在歌舞的映衬下，这一切竟显得更加悲伤绝望。我真的太喜欢这个故事和这个女人了。,5,力荐,0,0.999995701607116
2014-04-24 12:07:39,掉线,【B】还是作，还是形式化，还是卖弄，还是为虐而虐。不过和之前看的几部冯提尔片子比这部的确最好，歌舞场面都很好看（虽然歌曲风格实在欣赏无力）。比约克演的很棒，就是长得真像个智障……,4,推荐,25,0.999613531931258
2014-05-18 15:29:14,有心打扰,1.这份悲伤绝望的重量你承受住了吗？2.前半段乏闷的剧情完全衬托出影片后半段的剧情发展和悲剧力量。,5,力荐,5,0.999963747893866
2014-05-31 20:47:37,无咎,请问这部电影是为了赞美母爱吗，自己稀里糊涂的死掉，留给孩子无尽的痛苦磨难，没感觉到爱在哪里；是为了关注和同情底层的人民吗，怎么感觉像是骂他们呢，女主整个一神经病偏执狂，不做死就不会死，怨得了谁呢。杰夫不错，一星给他吧,5,力荐,2,0.9999979720647084
2014-06-19 13:27:25,Bejdlxl,开篇满分，结尾零分。拉斯冯提尔竟然也玩起了这狗血廉价的温情。自私的方式有很多种，自己想死没有人会阻止你。,2,较差,2,0.955761368392835
2014-06-19 13:27:25,Bejdlxl,开篇满分，结尾零分。拉斯冯提尔竟然也玩起了这狗血廉价的温情。自私的方式有很多种，自己想死没有人会阻止你。,1,很差,2,0.955761368392835
2015-01-01 15:52:57,超cute侠,我承认冯提尔有那么些小天才，像是用音乐剧的形式来展现女主的内心世界，但我还是不喜欢他赋予角色本身的偏执，仿佛有一只无形的手在强迫你去同情谁，同时又去憎恨谁。,2,较差,2,0.9999999001248644
2015-02-26 09:31:32,豆友2048460,总觉得比约克长得像只豹子。年轻的时候不喜欢听她的歌，看片的时候一听她唱歌就挪不开耳朵了，声线简直太迷人。演技实在是让人惊讶。最后的结尾收得够快够狠辣。,4,推荐,1,0.8804067015135791
2015-04-08 16:31:44,冰红深蓝,灰暗失焦抖动的手持摄影呈现出残酷惊心的现实感，与穿插的光鲜绚丽的梦幻歌舞形成剧烈反差。比约克的绝佳演技、编舞和洞彻心扉的歌声都是五星水准。近似抽象画的片头别有风味。尽管本片绝望虐心如凌迟加身、沉重压抑似巨石当胸，但另一角度看却正能量满满——愿我能同样笑对逆境，心怀爱意。（9.5/10）,5,力荐,82,0.9999999999995676
2015-05-01 05:44:55,Peter Cat,平庸。,3,还行,19,0.2999999999999999
2015-11-26 20:41:52,叩歌,看得我尴尬症发作，几段被捧上神坛的舞蹈我都觉得很尴尬，体现舞者的精神就靠几段胡思乱想，太单薄了。,2,较差,2,0.2934789877819147
2016-04-28 21:41:01,墓岛GRAVELAND,前半部分似乎看上去很主流的清新明快，却无碍弥漫全片的巨大黑暗，一如拉斯冯提尔的风格。粗粝而高度写实化的dogma95影像触及到底层社会的悲惨绝望与司法的无情盲目，尤其是结尾的绞刑与”107步“均震撼人心，并实现描写内心的歌舞与残酷的现实残忍的无缝对接。比约克忧伤迷幻的歌声如同毒品般令人迷醉,5,力荐,0,0.9999999999999852
2016-06-25 11:51:21,麦呀麦呀麦大娘,太差劲了吧，这剧情一直叫人很窝火，这女主分分钟想给她一巴掌，更别提那一言不合就开始唱歌跳舞的桥段了，到后面几乎就是一路快进才看完的，这碗鸡汤我不喝还要把碗给砸了，目前为止看过最差劲的片子！！！编剧是当观众是智障吗？女主演技全靠舔嘴唇才能输出，全程脑残，用自己的伪善害了身边所有人！,1,很差,3,0.0003242313370418
2016-10-01 20:48:31,Nin,其实吧...............这两年断断续续看了三遍  没有一遍能撑到看完,1,很差,4,0.9973726882359384
2016-10-01 20:48:31,Nin,其实吧...............这两年断断续续看了三遍  没有一遍能撑到看完,3,还行,4,0.9973726882359384
2016-12-21 21:34:33,IDKAboutYou,同为Bjork脑残粉，虽然绝望到泪崩，但是剧本太差。。。技术也简直是在侮辱电影，跳跃式的剪辑是什么鬼，摄影也晃到眼花缭乱。Dogma本来是为了提升电影的真实感，我看反而倒是降低了真实感，制作粗糙到极致，甚至了电影本身的这种艺术都丧失了，完全沦为一摊屎。歌舞场面也根本谈不上精彩,3,还行,11,0.9986949456799172
2017-03-22 14:23:51,洋葱仔,本片获第73届奥斯卡最佳原创歌曲提名。还是那句话，既不是第一人称视角，也非纪实影片。你晃悠镜头啥？！还找一个帕金森患者做摄影。纯粹为了晃动而晃动，让观众花费太多的精力去捕捉画面而不是理解剧情。情节也让人费解。常理失明的人其它感官会更灵敏，更专注，而女主却只会幻想，这是失智不是失明。,5,力荐,5,0.9999522411284456
2017-05-06 00:04:15,Dear deer,如果电影能够再凝练一点，愿意多给一星，后期拉丝冯提尔太沉迷于他的女主角歇斯底里的磨难过于拖沓。大多数电影为了弥补人们现实的缺失和贫乏，创造了欢乐明亮的幻想，而拉丝冯提尔恰恰站在这些电影的对立面。他所表现的并不尽是人性的黑暗与恶，而是带着牺牲和奉献姿态的人如何自我折磨至毁灭。,3,还行,1,0.999999999993258
2017-05-14 05:34:34,Nocturna,一个共产主义者的真实写照。,1,很差,4,0.699331995237668
2017-05-24 00:38:47,朝阳区妻夫木聪,第一部疯蹄儿。我对于他的视听风格真觉得没什么问题，包括歌舞元素反类型的运用，甚至觉得挺先锋挺有意思的，但是这个故事和这个人物我是真的真的理解不来。到头来只是感动了你自己，这也叫人性吗？,5,力荐,2,0.999997372203832
2017-06-12 00:18:29,渡口无边,"They say it's the last song .They don't know us,you see it's only the last song if we let it be.神经质般的善良与自我。每个人都作为她的他者，认同或者不认同，他们都用他们的“自我”杀死了她的“自我”。（但实在无法喜欢比约克的表演和人设）",4,推荐,1,0.9987974009318188
2017-09-28 23:20:24,康报虹,刻意地卖惨，每一秒都觉得别扭，让我越来越确信一点：如果说老塔测试的是电影的上限，冯·提尔有时候测试的却是电影的下限。这点在将来可能会被推翻。我们不能否认冯·提尔部分作品的高度与深度，但也不得不承认存在着某些怪诞且畸形的作品，就像本片已经存在了近五分之一个世纪，许多人仍无法喜欢它。,4,推荐,28,0.9996413767922958
2017-10-05 10:31:58,瑞波恩,当梦想成为负累，当人生成为诅咒，只有沉迷艺术才是安慰。可这点安慰都已是奢望了，纯洁如你活在世上，世界很不放心。,5,力荐,2,0.9994431182879764
2018-03-28 09:33:18,给艾德林的诗,冯胖子的形式仪式超越了一切，为了“牛逼”的道格玛95理念，为了自以为是的悲剧六要素传统颠覆，为了永不满足的吊嗓矫情小心思，为了给自诩深厚的逼格里填充无病呻吟的感性......,1,很差,5,0.9999903953100938
2018-04-01 02:31:07,有只骗子,比约克在做什么？真的特别不喜欢她，不仅一脸智障还这种表演，受不了。故事我也是一头问号，从头到尾都太蠢了。“Fairly incompetent as a musical and rather silly as a drama.” Seattle Post-Intelligencer的William Arnold这句话说出了我的感受。,4,推荐,4,0.520855248661596
2018-07-22 19:35:41,Enjoy🌈Rachel,尽管受不了Lars晃动的镜头，受不了Bjork的长相和歌声，但依然无法磨灭这部电影的伟大。建立在虚伪的中产阶级之下的美国梦是一碰就破的泡沫，多数人身在其中而不自知，梦碎依然抱有幻想。白日梦之后坠入深渊不是一个人的错，也绝不会是个例。,2,较差,3,0.2081678412283543
