2021-06-09 20:29:19,持人的摄影机,7.4/10。①女主一家住在偏僻小岛上的古宅，最近这里总是疑似闹鬼，而且新来的三位仆人也很怪异似乎对女主一家有所图谋。这一切都非常让人疑惑，直到女主发现她们一家居然才是鬼，那些所谓的“闹鬼”其实都是她一家死后新搬来的住户，而仆人们就是女主一家的原仆人，也和女主一样是鬼。②通过大量封闭而空旷的室内戏（全部实拍）、阴暗的环境（大部分时间室内无阳光只有油灯）、迷雾天气、枯树（群）等技法来营造恐怖渗人的氛围，但是影片总体节奏有待提高，中途有些片段比较无聊。,4,推荐,1,0.9942952727996096
2021-09-14 01:39:54,豆友50809981,从物质世界的反战角度三观正，从炼金术角度就逊色于温子仁系列。落地点说，极少数受了极度重创的灵魂会因为强烈的执念导致滞留在夹层，通俗理解就是无法转世，这时需要用爱感化超度，这才是大道，光通灵然后卖房子有啥用。真正的通灵者是托马斯那种，阴阳使者，摆渡人，光发现问题不解决问题就是耍流氓。,4,推荐,1,0.9999151323599208
2021-10-04 18:03:24,罗宾汉,【经典重看】20年后再看，丝毫没觉得落俗，这也许就是经典的魅力。这部明显是传统鬼屋类型的创意改写，直至10多年后好莱坞才冒出温子仁的《招魂》系列。当年影片上映后沸沸扬扬的新闻除了陷入结尾与《第六感》的雷同外，还有妮可·基德曼和汤姆·克鲁斯的离婚案，两人终于在电影上映后不久正式宣布结束关系。当然，更惊人的莫过于影片上映后一个月，美国遭遇惊天动地的911恐怖袭击事件……,5,力荐,0,0.999999999999635
2021-11-04 19:41:50,君心可晴,恐怖片经典之一，善于把握细节情感的导演，写出了这么好的恐怖片剧本，可以封神了。……如同《第六感》，精彩的悬疑片会提前给出所有的细节，甚至答案，到了片尾谜底揭晓，惊呼下，赞叹情节设计的巧妙。线索伏笔给的好看的悬疑片还有《黑暗面》《孤堡惊情》《生吃》等，令人回味无穷……的同时，需要二刷。……影片的时空背景，也是值得注意的。,5,力荐,0,1.0
2022-03-27 04:15:51,欢场华佗,从另一个角度来讲的鬼屋故事，其实我也看过不少鬼片了，内容都大同小异，但其中优秀的更多是胜在表现手法上，本片的运镜，配乐，场景，表演，当然还有剧情，全都营造出浓浓的压迫感，情节也足够吸引人，哪怕知道会发生什么还是愿意继续欣赏，这些已经足以让本片成为一部优秀的恐怖片，哪怕结局没有反转，也不会影响本片的精彩程度，这是看B级恐怖片时很难有的感觉。对于未知的恐惧比直接的视觉刺激要更可怕。我曾被人剧透过本片的结局，但观看过程中一度以为是自己记错了。其实不是很喜欢这个结局，感觉有点像看了个寂寞，但整体而言还是非常喜欢本片。妮可·基德曼美翻了，小女孩很可爱，演技一流。,4,推荐,2,1.0
2022-05-22 15:49:01,晒太阳的猪,片名翻译的太垃圾，小岛是什么？城堡意象化一座孤岛？脑补的太多了吧。恐怖氛围主要体现在突然的音乐炸一下，或者固定场景套路的某人突然回头，比较低级。内容上第一遍看只能了解个梗概，不看影评完全理解不了前后细节，大概齐猜得到是阴阳相隔的主题，但是搞不清楚到底谁是死人谁是活人，谁是好人谁是恶人，佣人整天一副欲言又止，女儿整天捣糨糊装神弄鬼，儿子吸血鬼面妆，给了线索但是太难get了。。。,3,还行,10,0.9999378494275416
2022-08-16 12:20:58,煜翊,1.结尾的反转哪怕十几年后看依然是很有意思的，力的作用是相互的，放到其他环境范围中也是如此。2.没有直给的恐怖，但音乐布景运镜演员给到了气氛。,4,推荐,1,0.9999886142225224
2023-09-24 20:45:03,Tyger Tyger,亡灵的自我教育：如何维护其房屋产权～～,4,推荐,10,0.839039233666482
2023-09-24 21:17:09,Mr.Graceless,宛平剧院西班牙大师展，在电影院看恐怖片完全会被集体情绪感染。本作主线是很常见的「古宅闹鬼」故事：表面铁齿但多疑而神经质的敏感母亲，带有灵异体质总能不断见鬼的顽皮少女，看似高深莫测对过去讳莫如深的佣人三人组，共同生活在被浓雾笼罩的神秘古宅。设定上出彩之处在于大部分篇幅内所有角色都似乎是不可信任的，母亲疯疯癫癫，两个孩子离奇地对阳光敏感，佣人三人组更是明显有所隐瞒，就连中途回归的父亲也不知去向。故事本身如同在树林中行走的妮可基德曼般找不到走向，直至最后指向反传统，反直觉的，视角倒挂的「反转」结局。结合诸多暗示与背景设定（生活在战争高压中的人逐步走向精神失常，以至于死后的灵界更像是正常生活），这似乎是唯一合理的解释。大银幕上的妮可基德曼美到令人屏息，她这张脆弱的精致脸庞不演恐怖片真是暴殄天物。,3,还行,0,1.0
2023-09-24 21:28:30,江梅曾许,#西班牙电影大师展 做鬼不易，即使死亡，依旧恐惧死亡逃避真相。从形式到内容各方面都处理得很优秀，最有力的当然是反转，觉得不只反转，甚至非常升华。从鬼的视角来讲述生与死，战争与创伤，最后又归于爱和无尽的孤独，头皮发麻。,4,推荐,7,0.9999999999999982
2023-09-24 21:58:37,K!ki,230924宛平/谢谢大家和我一起尖叫出声,4,推荐,6,0.3316426846962392
2023-09-24 22:39:26,栗子一只,"2023.09.24 西班牙电影大师展 @宛平剧院
妮可基德曼好美。大家好像都怕看恐怖片。
只是说这场观众的我们，孩子们躲进衣柜后开门的那段，全场集体尖叫又立刻一齐笑出声来，真的别太好笑。当然我早早已经在音效的渲染下暂时将眼睛闭了起来。",4,推荐,4,0.9999956828962784
2023-09-28 21:01:13,王博他爹,精彩！中途观众吓得出声尖叫，结束后观众上海话激情对骂，精彩！,4,推荐,6,0.9900590241193252
2023-09-28 21:19:37,素水,大光明。是安东尼奥尼式的那种“疯批女性”角色的出色类型化转译。当然，因为是基于弗洛伊德的歇斯底里理论（治疗歇斯底里的方法是女性获得性快感），所以从本质上就是厌女的。除此之外，悬念的营造与Nicole的表演确实极佳。,4,推荐,3,0.9999998794498114
2023-09-28 21:42:38,censored dump,at大光明。死亡相册位于影片的中心（进度条和表意都是），电影是某种显影（拉窗帘的设定就是暗房），从情感那无法“复制”的内核，也可以说是Aura，二战背景让intruder化为一种历史性的创伤与更迭，房间在haunted的原型上，承载了结核病、战争围困和精神疾病的时代标记，不难想象，这种对抗文本在当代会更突出身份叙事（比如《寄生虫》）。影院看属实4D气氛，大银幕看基德曼，不得不说人间能得几回，不知有生之年能否看到《大开眼戒》。,4,推荐,4,0.9999999999999478
2023-11-01 08:34:07,西楼尘,与肺结核一样致命的是绝望的枕头，与鬼魂一样恐怖的是怕光的皮肤。小孩子本要去往灵薄狱，肉身却被困在了窗帘之后。大人本要前往极乐世界，灵魂却被困在了监狱大宅。战争的创伤让活着只剩痛苦，死亡亦得不到解脱，只能在这无间地狱里备受折磨。谁也不能阻止我们离开这栋房子，心甘于此陷入无尽的轮回。,3,还行,3,0.9999869389755448
2023-11-04 20:17:01,feelflame,执念成鬼，当了鬼依然执着不下！鬼的第一人称视角是片子最棒的设定，到结尾回到第三人称，观众正好退出故事，精巧自然。,4,推荐,2,0.9999999712556534
