2012-06-18 23:06:45,闲人,设置了一层潜文本，整个电影的故事层面挺强的，并不是为了恐怖而恐怖。,4,推荐,2,0.998483475315087
2012-06-24 18:22:21,理想多钱一斤啊,什么乱七八糟的……不合逻辑的剧情，就靠一惊一乍的突然出来个鬼吓唬人，想问问编剧何不一开始就设计一个孩子角色？你们看到的那些神马背后的隐情俺都统统不管，就觉得需要观众们这么努力扒内情的电影不是好电影！！！,2,较差,52,0.9999679181027908
2012-07-09 12:05:06,影志,儿童，阴宅，老女人，夫妻，驱魔人，灵魂出窍……该有的美式恐怖元素都有，且在水准之上，就是故事也走了最庸俗的一套。中间频频被吓到，意外结尾毫不意外了。,3,还行,102,0.9999999720939198
2012-07-13 23:44:49,小城就好,确实不错，虽然后三分之一那段搞得很喜庆很欢快~但结局还是非常给力的~~ @天上的叮叮猫儿 ,4,推荐,0,0.9999951013877064
2012-07-22 07:01:46,Jacqueline,Rose美,4,推荐,0,0.8446184808062339
2012-08-02 22:35:17,"Printf(""紅"")","所以说,大房子才是恐怖的根源.",3,还行,0,0.5399802589514728
2012-08-03 14:21:43,收拾东西回扬州,红脸怪完全出彩，男猪脚回去的时候一屋子的那些真心诡异··,5,力荐,1,0.7917352923818282
2012-08-12 16:02:50,Richey Edwards,赞一个先,3,还行,0,0.8987926055117286
2012-08-12 19:24:02,大牛牛牛牛牛,看完电影还要看论坛才明白结尾是怎么回事儿，智商的问题好捉急~~,4,推荐,0,0.7817847953715391
2012-08-12 21:54:38,loser,结局让人不爽。,4,推荐,0,0.9372549545605664
2012-08-18 23:27:59,一如往昔,难以抗拒的恐怖片之爱,4,推荐,0,0.8443293226758217
2012-09-03 12:16:09,ccccc-cathy,虽然情节什么的很一般，人物性格也很弱，所有的吓点基本也可以猜到，感觉也是小成本制作，但不得不说真的吓到了，西方片没有血浆又结合了东洋恐怖片的诡异和音效，尤其里面像做梦里那种黑漆漆的环境，啊总之不要半夜看,4,推荐,0,0.9957395391638264
2012-09-07 11:48:07,EVA_征服天堂,很多场景气氛不错，2011年首部上眼恐怖片！PS：故事模式是抄袭西班牙的《婴儿房》~~,3,还行,0,0.9916080196882524
2012-09-17 22:29:48,老鱼聊发少女心,没看懂。。。然后。。。。吓人的手法比较老套,3,还行,0,0.1301731221572473
2012-09-22 22:34:12,洛城克吾,静不下心，看不进去。所以无聊的责任不能全推给影片本身。,5,力荐,0,0.0098718787935401
2012-09-26 22:42:06,cesar,不错哎，类似《驱魔人》，又略有不同。,3,还行,0,0.9941642185835772
2012-10-06 09:13:35,[已注销],"提醒自己的：第二部出了就趕緊滾去看, 看有沒有點什麽解釋。",2,较差,1,0.982395787662974
2012-11-19 21:52:55,悯笈,一个人看的时候确实吓着我了。。,4,推荐,0,0.6853942103051164
2012-11-21 13:18:51,乱,看到后面已然木有了新鲜感只剩淡定，结局很符合詹姆斯温的风格。鬼怪的设定和《死寂》如出一辙。细节值得留意。,4,推荐,0,0.9999729860821222
2012-12-17 17:35:40,玉面小白菜,好久没看过那么恐怖的了,4,推荐,0,0.2189326991088966
2012-12-28 10:00:37,林三郎,James Wan + Leigh Whannell，依然不错。,4,推荐,0,0.8497557351132383
2013-01-18 14:03:05,暗灵杀不死,不知怎么着就被吓了一跳、,3,还行,0,0.1684924422353196
2013-02-26 11:49:39,左眼看电影,现在已经不适合看这种一惊一乍的恐怖片了，每次音乐一响先自己吓自己,4,推荐,0,0.6670066993205916
2013-08-13 20:53:44,欢乐分裂,因《招魂》之故，连看了几部温子仁，招魂也算是复现、汇集了导演擅长、喜欢的元素；看评论尤甚影片本身，很多小细节初看觉得不对劲，再回头一想才想通；离魂一段非常精彩，目睹儿时灵魂、空间转换、两界对应，加上反转结尾，脱了一般恐怖片的俗。,4,推荐,4,0.9999999917346064
2013-08-28 19:32:22,顾一烟,我爱结局！怒赞！前面可忽略,5,力荐,2,0.999692357780608
2013-12-23 00:08:11,大奇特(Grinch),潜伏两个字，一进一出，死去活来。儿子见自己，见众生；老爸有一口气，点一盏灯。,3,还行,39,0.8436613302304732
2014-01-12 11:13:37,匪廢費·老🐰,好！恐！怖！温子仁的手法我很喜欢。睡前的提神药。,5,力荐,6,0.9909440794736192
2014-03-05 22:33:34,彩戏师wala,人鬼之间人,3,还行,0,0.8180862492209036
2014-07-24 11:52:43,喻鸣,水准之上，没什么大惊喜。结尾手法早就见怪不怪。导演随后的<<招魂>>才是鬼宅片新高。,3,还行,2,0.8552085458454761
2014-11-06 11:14:25,嘟嘟熊之父,好想看第三部！后半段真的很像白素贞跑去阴间和黑白无常搏斗拯救许仙魂魄！,3,还行,9,0.9991366336404468
2014-12-17 19:01:52,冰红深蓝,《电锯惊魂》系列导演温子仁作品，恐怖效果不如第2部，故事情节也基本只是个铺垫，结尾还是挺意外的。在恐怖片中不算很出彩的，但比起那些陈词滥调的美式杀人狂青春惊悚片好不少。（7.0/10）,3,还行,4,0.999999986057264
2015-04-19 09:25:52,英国病人,前90%的时间里都是惊悚效果尚可的寻常恐怖片，在驱魔、灵异、鬼怪和勇气、拯救、亲情等杂糅元素中保持着平衡，直到结尾那个第二部才会揭示真实身份的“白发老太”再度惊鸿乍现，鬼上身的宿命立马将电影的档次拉到了良好线以上。,3,还行,1,0.9999999962109656
2015-08-31 00:36:33,Lies and lies,一般来说，发现鬼的先后顺序总是：动物-小孩-老人-女人-男人。,3,还行,69,0.8924994741476414
2015-11-27 22:30:16,Eve|Classified,不小心删了标记的居然是这部。设定太棒，超级爱Elise，简直希望能看到她自己有部电视剧（因此我很爱第三部的）。Rose Byrne真是个千变万化的演员啊，什么类型都可以胜任！看幕后，片场都叫魔鬼“口红”，因为他的脸真是口红涂的；最搞笑的是，口红其实是本片作曲家，真是太萌了。,4,推荐,1,0.9989154006249876
2016-04-23 00:19:19,shininglove,建议链家和我爱我家仿照此片为对方拍摄一组宣传短片。,4,推荐,179,0.7844449497352182
2016-09-18 06:23:41,[已注销],第一次看见这么果断搬家的 然无卵 几个鬼长得都太正常了 而且调皮富有幽默感 最后竟然是百合结局,4,推荐,35,0.3194975255227981
2018-05-06 01:52:05,嘉声,让神婆戴上“氧气面罩”，低声说话给助手听，助手不能简单复述，到关键语句得写在本子上，这种“多重转述”不论是营造异域的恐怖氛围，还是一般文学作品中用以塑造叙事层次感，都极为有效；真正恐怖的东西，不宜直接展现给观众看，即便看也不能让人看清。,3,还行,14,0.9999400027237044
2018-07-07 22:27:00,巴喆,氛围渲染，镜头剪辑、构图、音效，节奏的把控实在好到爆，后半程完全无尿点，结尾一贯的大大反转，过瘾啊！配合看完《招魂》《死寂》，发现温子仁真是美式恐怖片的大师。7.7,4,推荐,14,0.999999847739666
2018-09-01 21:22:03,Bigteeth,这种最后来一下的手法太low了,3,还行,3,0.501887373252414
2020-02-06 04:33:15,同志亦凡人中文站,剧本太刺激了，结尾不反转一下就不叫温子仁。出门怕染病，在家怕附身，我们人类真是太南了...,4,推荐,142,0.9957703932736868
2020-08-07 01:44:55,高詩遠,詹姆斯·温太厉害了吧。虽然和《招魂》是同一个模板，但是因为撞邪原因不同，一个是因为房子，一个是因为人，所以看的感受完全不一样。片子后半段炸裂，各种妖魔鬼怪全都跑了出来，结局反转也让我虎躯一震。温导把jump scare玩到了极致，每一次都做到了不突兀且恰到好处。,4,推荐,3,0.9999937895655724
2020-08-07 01:44:55,高詩遠,詹姆斯·温太厉害了吧。虽然和《招魂》是同一个模板，但是因为撞邪原因不同，一个是因为房子，一个是因为人，所以看的感受完全不一样。片子后半段炸裂，各种妖魔鬼怪全都跑了出来，结局反转也让我虎躯一震。温导把jump scare玩到了极致，每一次都做到了不突兀且恰到好处。,5,力荐,3,0.9999937895655724
2021-09-17 11:30:57,黄悦_,人最害怕的还是未知 就像那个红色脸的鬼 好几次都是一闪而过的镜头吓得我要死 但当他真的出现了 我却觉得没那么怕了。那两个助手是来搞笑的吗？还有 道尔顿在那里吃意粉 好怕她妈妈关心地说“好晚了 你吃完就该去睡觉了”哈哈哈哈,4,推荐,28,0.9623142045059044
