2011-04-02 11:49:16,P,OMG  结尾太棒了！,3,还行,114,0.988296578782202
2011-04-02 13:24:55,米粒,唉，這~~~有幾處是有點嚇人啦，但更有幾處很好笑= = 恐怖片還真不是我的菜啊~~T_T求推薦給力一點的恐怖片。我好像真的看得很少。,4,推荐,20,0.0898790806612761
2011-04-04 12:52:35,宋一枚,电影院鬼片凶猛,3,还行,0,0.7085923308003611
2011-04-07 10:39:50,斯慕奇,无逻辑的纯恐片，影院里笑声比叫声多，看得还蛮开心的。男小孩长得真漂亮，可惜剧情开始后他就只有睡觉戏了。最囧的是，他们家另俩小孩被编剧编丢了。,3,还行,731,0.9976125615088722
2011-04-09 13:30:32,我不绝望,怀着对美国恐怖片深深的失望之后看到这个，好爽！原来导演是温大哥。难怪。没有什么比自己站在床边看着熟睡的自己更给你chills的了。,5,力荐,0,0.2042458549182313
2011-04-10 13:30:38,Elise,"When you wanna get over something, just shouting out loud is definitely not enough!",4,推荐,4,0.3716516246167168
2011-04-12 14:28:43,小椅子,恐怖片资深观众表示：真的很恐怖。男主角在教室里下课的时候，黑板上居然写着James Wan的名字。。。好有情趣啊这个导演。,5,力荐,654,0.9984331091914618
2011-04-14 00:36:27,晚奀,左边那姑娘的包掉在我脚上时，着实被吓到了。,3,还行,306,0.1052261703311028
2011-04-20 12:02:40,海上飞来丘比特,classic,5,力荐,0,0.5
2011-04-22 10:00:49,Mr.Shoes,水准之作,4,推荐,1,0.375248460658042
2011-04-23 23:22:53,XU,好看！！！大热天看的我一身冷！！！应该去电影院的啊！！！,5,力荐,156,0.0123669306362205
2011-04-26 18:49:29,阿梦,气氛很好 也有创意,4,推荐,21,0.9907805218574968
2011-04-26 19:58:49,‐「Lesley﹠,期望过高,3,还行,0,0.4714154256639959
2011-04-26 20:28:42,陈小C,尼玛编剧的人不知道数数人数么，一转眼少两人，还接着演呢。,2,较差,35,0.3063025828989107
2011-04-27 00:35:05,Hey Johnny,木偶镜头很有导演电锯和死寂的feel，冷不丁的够惊悚，一波三折的够剧情，结尾够反转，还有几处冷幽默……算是很久没出现的佳作，但如果你大白天周围响着爱情买卖佯装看片儿，鬼真戳你身边儿也TM吓不死你！只想说氛围还是很重要。ps.另俩娃儿人家放妈家了，没仔细看的请别乱喷。,4,推荐,704,0.995592770589982
2011-04-27 00:53:25,透明,鬼驱人+寂静岭+香港鬼片+日本鬼片+黑色调侃。。。真是什么感觉都有了。剧情节奏越来越快，观看过程很爽！,5,力荐,323,0.9999874547213232
2011-04-27 18:48:57,Q。,失望之作，木偶那一段很有《死寂》的感觉。电影本身既不恐怖也不惊悚，情节也足够老套狗血，除了最后的结尾来了一个大反转以外着实感觉不到有什么值得喜欢的。★★★,3,还行,136,0.9996287944889528
2011-04-27 20:18:44,MOON～蛋娃娘,岁数大了 果然不太适合看恐怖片！不管怎么说，吓着我了,4,推荐,0,0.0275008348229666
2011-04-27 21:18:37,★冰凌宫★,对于温先生的作品还能说什么，再温心的结局也好不了，一开始也疑惑婚纱拌三丝到底是何时潜伏成功的，看过后确定是救子后才被玩，之前不过是被她把控着，ROSE这次的发挥不大，倒是ELISE很出彩，PATRICK也不错，最后那一吹蜡烛很搞！,5,力荐,0,0.998615670928572
2011-04-27 22:42:15,今日上映,气氛没治了！ 结尾不俗！,4,推荐,0,0.9957809747017392
2011-04-28 10:13:07,花儿果果,反正就是恶魔不灭这个套路。,3,还行,4,0.209606253327216
2011-04-28 14:14:27,攸宁陶陶,总算等到一部还比较像样的恐怖片了。配乐很有气氛，有些片段确实还比较吓人。,4,推荐,0,0.4938721480624727
2011-04-28 17:01:34,十大杰出怒汉,我以为是儿子没回来，没想到是老子最终被附体了,5,力荐,43,0.8322280966303154
2011-04-29 20:24:46,miss z,最后面还有点意思,2,较差,0,0.5664918466667853
2011-04-30 01:03:50,小周每天都很困,除了一惊一乍还能干点啥!给鬼化妆都不上心!!!白瞎这男猪脚了!!!!!现在还有能看的恐怖片么!!!!!!!!,1,很差,2,0.0428231271511112
2011-04-30 01:23:08,大宸,看样子James Wan是要接手当代恐怖大师的称号了，那机位运动、那鬼怪出现的位置和时间都那么准确和牛逼哄哄，有木有！！！虽然前半部分节奏稍微有点慢，但后面太精彩了，还有那个牛逼结局。这是这两年来好莱坞出品最好的恐怖片！最后，Patrick Wilson的表演非常出彩！值得一看！,4,推荐,1076,0.999999274619417
2011-04-30 12:30:54,桃桃林林,R5的音质确实对影片伤害很大，可以等好版。这片要影院看应该不错吧，相反更喜欢前半部分，后面有点过于戏剧化了。结尾与预想的一样，詹姆斯·温果然是詹姆斯·温。,3,还行,81,0.9999987738924152
2011-04-30 13:54:59,二表兄,女主+机位+摄影！！！！其实我是很不喜欢鬼怪出现，讨厌死了，讨厌后半段鬼怪,3,还行,0,0.9662741248034824
2011-05-01 19:32:09,只有霸王,前半段氛围塑造得不错。美式恐怖的风格一出，就完蛋了……,2,较差,6,0.9360140884663172
2011-05-02 01:04:49,超cute侠,鬼宅，驱魔等恐怖片元素倒是应有尽有，结尾有些弱掉，音效以及摄影机的移动都很不错，算是水准之上的恐怖佳作。,3,还行,0,0.9999930047038208
2011-05-03 10:35:56,一棵开花的树,吓死我了,4,推荐,0,0.3150105708245242
2011-05-06 00:12:01,清真王贼膘,拍电锯了又咋么。,1,很差,0,0.3112812460279724
2011-05-06 21:04:40,CQB241,holyshit! 白天也被吓得够呛,5,力荐,0,0.1900406571492516
2011-05-06 21:04:40,CQB241,holyshit! 白天也被吓得够呛,5,力荐,0,0.1900406571492516
2011-05-06 22:49:28,朵拉和朵拉,前大半情节几乎和早期斯皮尔伯格监制的《鬼驱人》一模一样，我以为是翻拍，结果不是，其后段简直是灾难。,1,很差,4,0.7059089836505614
2011-05-07 00:37:35,[][][][],"Oldschool作风,不过还是不如山姆雷米的拽我入地狱.",4,推荐,0,0.0385811301160812
2011-05-07 18:38:37,Kiddie,关于房子和小孩子的恐怖片看了太多太多= =结尾还蛮有新意的,3,还行,0,0.7998351058484022
2011-05-07 19:41:11,奶奶的熊,吓死爹。Rose Byne唱歌真好听，长得也小清新，出专辑吧～,4,推荐,0,0.6514822633883197
2011-05-09 17:43:59,格雷咻,献给小学生的礼物,1,很差,4,0.862800738877751
2011-05-09 18:09:37,葡❤️萄,超越不了电锯，但也没给电锯丢脸！,4,推荐,0,0.194041731208397
2011-05-10 19:05:57,一夜暴富找乐子,麻痹被騙去的恐怖片,3,还行,0,0.3651096509660388
2011-05-11 21:04:09,采蘑菇的小红帽,老太太比较强悍，最终boss哈弱，白长的这么猥琐了,4,推荐,0,0.3832271670965316
2011-05-13 02:39:54,""" Vera",要仔细看才行啊这片子~,4,推荐,0,0.7420577210273941
2011-05-14 17:17:37,羽族优伶,结尾太恶了，老太竟然进入那男娃身体了。。。,4,推荐,0,0.4175548940246599
2011-05-14 22:01:36,猫知道,开头还可以，中途气氛也不错，但是结局好烂，除了那两个Gost facer稍有点《邪恶力量》里的感觉以外，编剧力度远不如《邪恶力量》的迈克G，虽然后者只是个小成本的电视剧……,2,较差,1,0.9996564162236032
2011-05-15 01:29:35,螺丝இ,其他神马灵界生物全是打酱油的，婚纱老太才是职业潜水员啊！,3,还行,379,0.2873162045274383
2011-05-15 21:16:42,✿莲~,这部片的段子也未免太多段了吧，现代式的，意念式的，把人越带越深，总感觉JOSH灵魂出窍去救儿子的时候，那些怪物的感觉和《梦之安魂曲》里的感觉很相像。那两个抓鬼的BOYS，就像《邪恶力量》里面的那对活宝，这个老太演技长相对白各方面实在一点说服力都没有。另外女主有时感觉挺像苏菲玛索。,4,推荐,0,0.9999999972432188
2011-05-18 20:17:32,ccinn,看睡着,4,推荐,0,0.3982652841830129
2011-05-25 12:38:45,killuahxh,坚韧不拔的老太太，悲剧的父子二人...,4,推荐,0,0.9728279546176468
2011-05-28 01:57:38,niaoooo,大半夜一个人看的,2,较差,0,0.2433616433910918
2011-05-29 19:46:05,annie妖,对这类驱魔元素的剧情实在很不感冒。人物设定仍然很有SAW和死寂的影子，尤其是那个莫名的防毒面具，有点雷人，不过魔鬼的造型还是蛮有意思的。复古的音乐也很不错。,3,还行,0,0.999999731520547
2011-05-29 20:34:32,[已注销],James Wan绝对是有童年阴影的 ,4,推荐,397,0.9201232403226044
2011-05-29 23:07:54,铁皮骑士,旧式复古风格恐怖片,3,还行,0,0.9525353981528868
2011-05-30 13:36:22,Heyvin,近年来比较给力的惊悚片了。没想到是电锯之父的作品，脱离了电锯其他恐怖氛围也营造的很不错,4,推荐,0,0.9967320842202378
2011-05-31 11:11:00,想太多小姐,我倒是希望爸爸能回来，儿子就算了吧……,3,还行,0,0.9644617558609744
2011-06-03 01:50:35,扣子,男猪从小就被潜了~~~不然他为什么再也不肯照相了呢~~~,3,还行,0,0.965732929764053
2011-06-04 18:09:16,维维,灵魂出窍,3,还行,0,0.9786879067594442
2011-06-08 09:06:35,LORENZO 洛伦佐,越看越觉得不吓人，搞来搞去还是驱魔啊,3,还行,10,0.2984412015728823
2011-06-09 15:55:07,流浪忧伤,不错的构思,4,推荐,0,0.9824148861996024
2011-06-12 00:44:30,品客,前半段很不错，不过有模仿80年代电影《夺魄冤魂》（The Changeling）的感觉，后半段就是恐怖版的《盗梦空间》……BOSS鬼怪效果不吓人，尼玛也太哥特了吧，不过那些忽然笑的人还是有寒点的。总之前面悬念气氛给4星，后面打鬼无趣给2星，结局挽回多1星，最终评分3星收工。,3,还行,2,0.9859226838672416
2011-06-18 10:05:02,十个斗的眼窝浅,是我老了，看个恐怖片也能昏昏欲睡！！还是要怪电影本身既不恐怖也不惊悚。乔迁新居，大屋子有奇怪的声音，灵魂出窍，最后被附身，情节也太老套了，是个人写剧本，恐怖片都会这么拍！我就不应该看新片浪费时间。 ,3,还行,0,0.5237895612661101
2011-06-18 23:33:17,♣ 9,...哦又是..............,2,较差,1,0.3980885751406263
2011-06-23 10:01:26,未分级,挺古典的恐怖片～～,3,还行,0,0.6231183310726378
2011-06-25 17:18:51,Alan Sleep,第一部整个是铺垫啊，温子仁太赞了，这滴水不漏的设定！,4,推荐,12,0.929597198244332
2011-06-25 21:12:30,spawn4,电锯教父力作,5,力荐,0,0.9560462332799842
2011-06-26 15:52:37,Redspur,看着犯困,3,还行,2,0.7397094778662616
2011-06-26 21:30:35,Whisper,惊悚点分布得比较均匀，后半段有些镜头很喜欢。三个小孩就一个是没什么存在感的主要人物，另外两个拍着拍着就没了。本意是想拍成意外结局，结果不太得劲儿。30分左右的教室黑板上有彩蛋（电锯惊魂玩偶头像，和此片导演是同一人）,3,还行,0,0.9999964283423052
2011-06-28 21:54:22,高压电,过程有惊无险，结局点明主题，能不能稍微来点血浆？,3,还行,0,0.9693949521013584
2011-06-30 18:07:48,方聿南,三星半，在冥界的概念出现前一直维持着高水准，而后则往魔幻冒险片的气氛上靠拢，成了老套可期的《猛鬼街》般，直到结尾才有强劲反弹,3,还行,1,0.999999117866746
2011-07-01 10:46:11,Boris,JW的小木偶~,4,推荐,1,0.4762979817489957
2011-07-02 19:19:40,乌鸦火堂,《鬼驱人》的变相版，恐怖感做的不错，色彩和雾气是亮点，前半渗人后半奇幻，值得一看的恐怖片，有人说那个老太太是早已俯身乔治，但个人认为是潜伏多年的幽灵，梦境中看见8岁的自己是巫师封存乔治的记忆，所以长大后他记不起曾经的能力，最后那个恶魔是cos星战前传1里的西斯武士吗，78分,4,推荐,12,0.9997606413819744
2011-07-03 03:34:42,铁旦,前半段基本是《鬼影实录》的路子，后半段与《鬼玩人》如出一辙，纵使拼贴过于明显，但鬼才詹姆斯·温玩性不减，很多手法上反恐怖片其道，吓人有趣还有点喜感，缺点是结尾本可以做的出人意料，情理之中，但却不甚让人猜到，希望不要步入沙特·M·马兰的后尘。喜欢詹姆斯·温的纯粹。,3,还行,0,0.9999997500300084
2011-07-03 20:32:26,A-Mian,各种元素啊，有木有；很复古啊，有木有。我觉得挺赞的！,4,推荐,0,0.9731537563730508
2011-07-03 22:01:54,焦瑷,尼玛这片子那么好看怎么会评分那么低？肯定混进了好多装逼中二党,4,推荐,22,0.7329507894955691
2011-07-04 03:25:35,jim,这么好的片子应该8分，气氛真的很重要，佯装看鬼片的还是别遭罪了，希望能一个人静静的看,3,还行,0,0.9959333069337496
2011-07-04 09:50:41,siji小猪头moli,我怎么没看出来结尾好呢，莫非是我没看懂？？,4,推荐,0,0.2076413005837523
2011-07-05 21:00:10,哆啦Z梦,强排8岁附身说，这也解释了为什么在异域有男主8岁样貌的小孩引路，可惜到最后附身老太的记忆还是被唤醒了，悲催的毁了新生啊~,3,还行,0,0.982435876045545
2011-07-05 23:48:58,狂欢的啤酒瓶,老式港片驱鬼套路的冷饭新炒，毫无新意并且略显可笑,2,较差,0,0.0906305807976929
2011-07-08 11:03:20,Notorious,james wong和sam raimi可以说是现代美国恐怖片导演的老大老二了,3,还行,2,0.1915377853400675
2011-07-08 12:44:59,觉,另外那俩小孩后来是送人了咩？,3,还行,1008,0.4920988778519277
2011-07-10 22:07:19,圣无常,近年来看过的最好的恐怖片，另外还继续证实了豆瓣对恐怖片的评分实在没借鉴价值。,4,推荐,6,0.9797351567379564
2011-07-11 07:37:12,记忆错觉,两星半,3,还行,0,0.0454186828728846
2011-07-17 23:02:30,小丑丑,又是这样个结局，最后的那个家庭女人的表情应该多卡几次！,2,较差,3,0.991907322513794
2011-07-18 22:32:17,带头大叔,死寂，电锯大导拍了一部魂魄寻亲记，悬念丛生，节奏紧凑,5,力荐,0,0.999286396099198
2011-07-18 23:43:52,Shy,结尾另说，另外的两个孩子是续集和续续集吗?,2,较差,0,0.9514954643489966
2011-07-19 01:20:26,TORO VAN DARKO,能把如此扯蛋的故事拍得那么惊悚恐怖，詹姆斯·温真是厉害！气氛营造几乎完美，前半部分的悬疑和惊悚让人浑身冒冷汗，后半部分剧情直转但竟丝毫没有破坏气氛，反而为剧情加入了紧绷的刺激感！摄影极为优秀，配乐更是令人战栗！非常优秀的美式恐怖片，必须要一个人关掉灯戴上耳机看高清才有感啊！,4,推荐,355,0.9999999954448732
2011-07-21 11:55:18,畸小山,这几年看过最好的恐怖片，能重温肾上腺素的感觉。几乎囊括了有关鬼屋题材的所有桥段，能看到很多经典与新近恐怖片的影子，且技巧上做得成熟过硬，并带有明显的日式风格。室内空间的效果非常出色。异界部分担心会崩坏，虽然格局有限，结果也稳中有升。詹温绝对是影迷型导演，自己的标识性木偶总会出现。,4,推荐,2,0.9999993924077448
2011-07-21 17:13:17,齊克斯尼力佐飛,有几处是挺吓人的，但是，总觉得怪怪的，而且还有俩孩子莫名消失了。,3,还行,3,0.5031828534846876
2011-07-21 17:53:25,劳永逸,看看老外驱魔用的装备，那叫一个专业啊。。。科学驱魔，可以这么说么？,4,推荐,9,0.6697829809472772
2011-07-22 04:11:18,Vincent,其实是可笑多过可怕的吧……,4,推荐,0,0.2088899522065602
2011-07-22 23:43:04,ButtMan,一点看下去的欲望都没有，拍摄手法太低劣了,2,较差,0,0.379736516938648
2011-07-23 10:08:18,九尾黑猫,基本借了鬼驱人的壳，再结合各种恐怖片的元素，倒是挺吓人的，但结尾却弱掉了。还是整个故事没有一个特别好的架构。不管怎么说，吓人够用了啊～,3,还行,5,0.9895590204938745
2011-07-23 19:18:41,亵渎电影,一切都是那么俗，没发现什么亮点，还以为最后的“远方”会有什么牛逼的恐怖效果呢，结果就只有一群打酱油的鬼魂。对于这样留着尾巴待拍续集的结尾都成恐怖片惯例了，也就不值得称赞了。★★★,3,还行,168,0.9543073876119712
2011-07-24 15:35:18,虚度年华,绝对能排进看过的恐怖片里的TOP 3了,5,力荐,0,0.0586583355629464
2011-07-25 14:39:45,何碰碰,坑爹的。,2,较差,7,0.1385012608352847
2011-07-26 17:20:44,jiji,前半部分节奏稍微缓了点，结局惊艳。不过，过早的暴露了那些“鬼”，不恐怖嘛。,3,还行,0,0.995259765572518
2011-07-29 21:01:27,momo,我不觉得好看,2,较差,0,0.5631002568265467
2011-07-30 00:03:24,D I D A,我被某位豆友写的“近年来最好的恐怖电影”短评欺骗了！（还是“没有之一”哟亲~）看了这出年度最烂喜剧片！还他妈“XX+OO+寂静岭”先，这些小清新的小妖妖怎么好意思入住寂静岭这样的恐怖片圣域！全片最恐怖的莫过于暗示SAW还要拍第八步！要想欢乐一夏，记得带上你的亲朋好友，猛烈吐槽吧~~！！！！,1,很差,219,0.9995990858783624
2011-08-04 10:28:09,独立日,结局亮了,3,还行,1,0.9715863903590544
2011-08-04 11:11:21,那谁,没有人觉得那座房子很像咒怨里的吗？,3,还行,0,0.8511187587915553
2011-08-07 06:36:09,H,好久没有看过还行的恐怖片了,3,还行,0,0.4159130008305249
2011-08-07 17:04:42,咪,烂到不可想象,1,很差,20,0.1931729656701842
2011-08-08 21:28:20,乐天,虽然剧情比较单薄和平庸，但是场景设置和气愤渲染十分出彩，再加上有些意外的结局，总体非常不错了（不愧是电锯之父啊，结局总要给点意外）。相信我，即便你不是一个人关着灯戴耳机看的话也绝对会被吓到的。,2,较差,0,0.999999980211161
2011-08-09 23:37:30,披着人皮的鬼,结尾还想来点小花活 大哥你不进步还不允许观众进步么？,1,很差,5,0.9943429265308406
2011-08-12 21:56:44,9,怎么有人说难看，我觉得还可以 不至于一颗星    ,3,还行,0,0.1460838522520556
2011-08-13 20:34:57,Max,James Wan依旧很强悍啊,4,推荐,0,0.9369538974615372
2011-08-13 20:34:57,Max,James Wan依旧很强悍啊,4,推荐,0,0.9369538974615372
2011-08-13 21:30:01,然而,后半段算是爆发了 但作为鬼片 整体还是没感觉,3,还行,0,0.9696800084226253
2011-08-15 12:58:32,冬贝与9-13刺青,还行，通灵的设备挺好玩的！有点新意,2,较差,0,0.8182833452967876
2011-08-23 01:54:59,夜摩刀,【“电锯之父”对恐怖片的节奏把握的太好了，惊悚点不断。看的时候正值午夜，外面冷风阵阵...真的好吓人啊 T_T】,4,推荐,0,0.6602744226888344
2011-08-26 12:26:57,川总,非常遗憾，这部片子给我一个感觉：又老又俗，香港鬼片和美国七十年代恐怖片的套路杂糅。开头还有点吓人，坠入俗套之后就味同嚼蜡了。女猪脚是美剧《Damages》里的女猪脚，在剧中演技不俗，在这部电影中反而显得缩手缩脚。男猪脚是《Hardy candy》里的恋童癖猥琐大叔，在这部片子里看起来依然猥琐。,3,还行,2,0.9999928898100549
2011-08-28 18:11:55,老鸭,导演对木偶情有独钟啊。。,4,推荐,0,0.2994820299478926
2011-08-31 23:19:57,RIC,像我这种基本不看纯恐怖片的，这样的剧情和结局足以把我吓倒了~~~,4,推荐,0,0.9926085350231688
2011-09-02 19:36:01,20个小明≯,名不虚传，果真是最近几年难得的上乘恐怖之作！吓的我嗷嗷叫！断断续续历经一个多月终于把它看完了，色调、配乐都为本片加分，演员选的好！剧情有些复杂，可能是为续集留伏笔，不愧是电锯詹姆斯的作品，期待下一部力作,4,推荐,11,0.9999999985803224
2011-09-04 22:31:49,tuirt,又遭吓腾了 其实内容很简单 短小精悍 那种一惊一乍的恐吓方式对我还是十分有用的 这方面音效功不可没 但是最后的反转结局我猜到了的 虽然没有完全猜对 我就晓得不可能这么轻易就放过他了 哼哼哼哼,3,还行,0,0.9999957902032732
2011-09-05 22:46:32,Marty McFly,"在看的过程中让我想起了好几部其他影片,比如夺魄冤魂（The Changeling）,驱魔人,猛鬼屋,还有闪灵,恐怖蜡像馆等等，据说还致敬了鬼驱人（没看过）..从故事到拍摄手法更回归传统经典式恐怖片，集合了众多恐怖片元素。前面恐怖氛围营造得不错，原以为会是个凶兆式的故事，不过后面部分更让我想到猛鬼街7。",3,还行,0,0.9999918127589562
2011-09-06 13:52:59,安吉丽娜猪蛮灵,这应该是年度恐怖片最缺之一了吧,1,很差,18,0.1678741584742297
2011-09-07 20:56:21,#烧光光#,剧情有点扯淡。不过还是适合情侣看的。,3,还行,0,0.6121134475356975
2011-09-08 16:03:15,托腮,老太太最后把蜡烛吹灭了，任务完成了？,3,还行,0,0.2127099184323146
2011-09-20 15:17:27,alan sister,整个电影其实一般般！剧情什么的其实还蛮俗的！这个结尾实在让我想骂人！想要知道到底发生了什么还要去看续集！！！！,3,还行,0,0.4481821515645093
2011-09-21 23:16:02,芹泽虾饺菌,真是人越老越song了，以前不管看什么恐怖片都是谈笑风生啊，怎么最近一打开恐怖片视频就跟孙子似的，艹,3,还行,0,0.6423826405542277
2011-09-24 15:28:27,[已注销],aqbgbn6q   解压密码：tlfhfcd,4,推荐,2,0.3545831404143234
2011-09-24 22:44:33,LizLee,果然是近几年来难得的好的恐怖片。,5,力荐,0,0.8452004696791776
2011-09-29 00:01:43,REX,没看过这么喜感的鬼片，里头鬼们的造型太恶搞了,4,推荐,0,0.5862985011626738
2011-09-29 22:01:05,狂接舆,"
前半段的气氛营造还真不赖,后面就弱掉了.算是踢了半场好球.",2,较差,0,0.8616110271590598
2011-09-30 18:31:05,淘金汉,哈哈哈 喜剧片 尤其最后那下 ,3,还行,0,0.844723903930601
2011-10-03 17:26:12,暗红色陈粒月经,麻痹啊。,1,很差,1,0.7499999999999999
2011-10-05 00:58:21,Zackiemad,ISQUARE 041011,2,较差,0,0.4737672181921908
2011-10-06 02:40:10,Singin'in rain,还不错，一群人一块看的，应该算是奇幻片,3,还行,2,0.7157430329185211
2011-10-13 21:26:41,eileen,真是没有有多恐怖，但对于美国拍的恐怖片来说，这种程度也算是不错的了。还要赞一下结尾，处理得很好,3,还行,0,0.9990068085273808
2011-10-17 22:23:21,Frank,今年看到的最好看的恐怖片  真够吓人 吓我一条啊 虽然都是小桥段  但是用的够细  摄影算是把功夫做足了,5,力荐,1,0.9974456064748242
2011-10-27 14:51:12,麦兜,感觉就好像是在香港迪斯尼乐园的“大街酒店”走了一圈似的，心有余悸；那段主题配乐真叫一个纠结。,3,还行,1,0.9633819227819564
2011-11-08 19:24:47,西宇,还是在讲亲情吧。。。异域里的诡异场景挺有意思。结尾还是吓人！其实团圆场景不是挺好嘛。。。很怕啊、,3,还行,0,0.9999765647510156
2011-11-10 07:00:09,,气氛烘托很好，尽管一惊一乍的；像是有哥特味的日本鬼片；结局的逆转其实片中描写人物性格的时候已经暗示了；本片没有立意；好的恐怖片较少故多给一星。,3,还行,0,0.9999990752691208
2011-11-27 02:18:17,张大毛喝美年达,故事本身很一般啦 结局也完全能猜到 不过欧美恐怖片能拍出这个风格的确让人眼前一亮的 大BOSS有超现实主义风格啊,4,推荐,0,0.9999979682884976
2011-12-29 12:48:11,齊楊森,有驚嚇有恐懼。最後卻不能自圓其說。,3,还行,0,0.0603716378101419
2012-01-01 23:11:47,Miss桃樂絲,有意思。很少给恐怖片四星。一开始的很多小细节可以重新推敲一下。摄影机位很牛逼阿～詹姆斯温是要往恐怖大师的位置踊跃千金了阿!!!!,4,推荐,0,0.994540760484756
2012-01-18 22:54:23,大智,这么多年来看的为数不多让我真害怕的恐怖片｀｀｀今天我都不敢睡了沃槽｀｀｀｀｀｀,4,推荐,0,0.0193056324527622
2012-02-10 11:48:44,去你妹的,"哎妈,太吓人了",5,力荐,0,0.0613452319644901
2012-02-11 18:04:02,nikki,不差，虽然情节是可以预计的，但气氛很足，做为一部恐怖片很合格,4,推荐,1,0.4825883257207864
2012-03-18 19:15:04,贝贝CATⅡ,日式恐怖+美式救赎  it's fantastic !,4,推荐,3,0.7183535417318306
2012-04-06 21:39:41,疯狂的二狗,老港片里面拍烂了的招魂题材   詹姆斯温的手法确实老道,3,还行,0,0.2962024559603858
2012-04-25 22:28:23,旺仔小馒头,这是自己找虐还要一个人阴风阵阵半夜看。,5,力荐,7,0.0434860917656918
2012-04-29 22:26:24,千寻亿选,恶灵附身，不是很好看,3,还行,0,0.6923953212675305
2012-04-30 22:20:22,太阳的倒影,可以肯定是我这几年来看过最出色的一部商业恐怖电影，惊吓桥段几乎全部是在白天，把一个俗套拍得如此不俗，它让我重新关注起詹姆斯温。,4,推荐,0,0.9991996433331252
2012-05-23 15:45:00,ぺ 紊乱,结局好给力啊、各种高潮不断、差点吓死了！！=。=！,5,力荐,1,0.9851316394294828
2012-05-25 22:47:57,龟～,前面都一般。不过结局是我喜欢的类型！！不喜欢大团圆结局~~中间那个招魂的过程还挺悬乎的~,3,还行,0,0.9999803171660252
2012-06-03 17:33:50,方小孬,美术做的感觉蛮好的。。。就是有些拖拖拉拉，看的不是英语的，有些木有被翻译出来，莫名其妙，最后结局有点囧 - -,3,还行,0,0.9987281917375364
2012-06-17 15:48:32,弗坦斯,美版灵魂出窍，电锯导演作品真心恐怖,4,推荐,0,0.9701464346513028
2012-06-17 17:49:16,Evelyn,superstitous American idiot,4,推荐,0,0.4476784585098667
2012-06-18 19:16:13,现任院士,三星,3,还行,0,0.280335414969485
